b'MS-443 Blue/Gray/Ivory Swatch',00-443,,b'MS-443 Blue/Gray/Ivory \n100% Natural Jute\nSold Individually \nExtremely Durable\n2 Sizes Available \n ',,,,,,,1,$ 5.00,,,,,1,Cap 400,Cap 160, //www.earthrugs.com/cdn/shop/files/MS-443-Blue-Gray-Ivory-10x15-Oval-OnWood_900x.jpg?v=1703803710 900w,MS-443-Blue-Gray-Ivory-10x15-Oval-OnWood_900x.jpg?v=1703803710 900w,,,Cap 800,MS-443-Blue-Gray-Ivory-10x15-Oval-OnWood_900x.jpg?v=1703803710 900w,
b'MS-890 Gray/Sand/Ivory Swatch',00-890,,b'MS-890 Gray/Sand/Ivory \n100% Natural Jute\nSold Individually \nExtremely Durable\n2 Sizes Available \n ',,,,,,,1,$ 5.00,,,,,1,Cap 400,Cap 160, //www.earthrugs.com/cdn/shop/files/MS-890-Gray-Sand-Ivory-10x15-Oval-OnWood_900x.jpg?v=1703803734 900w,MS-890-Gray-Sand-Ivory-10x15-Oval-OnWood_900x.jpg?v=1703803734 900w,,,Cap 800,MS-890-Gray-Sand-Ivory-10x15-Oval-OnWood_900x.jpg?v=1703803734 900w,
b'MS-895 Brown/Tan/Ivory Swatch',00-895,,b'MS-895 Brown/Tan/Ivory \n100% Natural Jute\nSold Individually \nExtremely Durable\n2 Sizes Available \n ',,,,,,,1,$ 5.00,,,,,1,Cap 400,Cap 160, //www.earthrugs.com/cdn/shop/files/MS-895-Brown-Tan-Ivory-10x15-Oval-OnWood_900x.jpg?v=1703803751 900w,MS-895-Brown-Tan-Ivory-10x15-Oval-OnWood_900x.jpg?v=1703803751 900w,,,Cap 800,MS-895-Brown-Tan-Ivory-10x15-Oval-OnWood_900x.jpg?v=1703803751 900w,
b'MS-896 Burgundy/Tan/Ivory Swatch',00-896,,b'MS-896 Burgundy/Tan/Ivory \n100% Natural Jute\nSold Individually \nExtremely Durable\n2 Sizes Available \n ',,,,,,,1,$ 5.00,,,,,1,Cap 400,Cap 160, //www.earthrugs.com/cdn/shop/files/00-896_900x.jpg?v=1703873046 900w,00-896_900x.jpg?v=1703873046 900w,,,Cap 800,00-896_900x.jpg?v=1703873046 900w,
b'MS-903 Charcoal/Gray/Ivory Swatch',00-903,,b'MS-903 Charcoal/Gray/Ivory \n100% Natural Jute\nSold Individually \nExtremely Durable\n2 Sizes Available \n ',,,,,,,1,$ 5.00,,,,,1,Cap 400,Cap 160, //www.earthrugs.com/cdn/shop/files/MS-903-Charcoal-Gray-Ivory-10x15-Oval-OnWood_900x.jpg?v=1703803769 900w,MS-903-Charcoal-Gray-Ivory-10x15-Oval-OnWood_900x.jpg?v=1703803769 900w,,,Cap 800,MS-903-Charcoal-Gray-Ivory-10x15-Oval-OnWood_900x.jpg?v=1703803769 900w,
b'MS-904 Navy/Mid-Blue/Ivory Swatch',00-904,,b'MS-904 Navy/Mid-Blue/Ivory \n100% Natural Jute\nSold Individually \nExtremely Durable\n2 Sizes Available \n ',,,,,,,1,$ 5.00,,,,,1,Cap 400,Cap 160, //www.earthrugs.com/cdn/shop/files/MS-904-Navy-Mid-Blue-Ivory-10x15-Oval-OnWood_900x.jpg?v=1703803789 900w,MS-904-Navy-Mid-Blue-Ivory-10x15-Oval-OnWood_900x.jpg?v=1703803789 900w,,,Cap 800,MS-904-Navy-Mid-Blue-Ivory-10x15-Oval-OnWood_900x.jpg?v=1703803789 900w,
b'MS-9-099 Sandstone Sage Swatch',00-9-099,,b'MS-9-099 Sandstone Sage \n100% Natural Jute\nSold Individually \nExtremely Durable\n2 Sizes Available \n ',,,,,,,1,$ 5.00,,,,,1,Cap 400,Cap 160, //www.earthrugs.com/cdn/shop/files/00-9-0992024_900x.jpg?v=1704215047 900w,00-9-0992024_900x.jpg?v=1704215047 900w,,,Cap 800,00-9-0992024_900x.jpg?v=1704215047 900w,
b'C-443 Blue/Gray/Ivory Braided Rug',02-443,,,,,,,,,1,$ 12.59,,,,,1,Cap 400,Cap 160, //www.earthrugs.com/cdn/shop/files/02-443_900x.jpg?v=1703872773 900w,02-443_900x.jpg?v=1703872773 900w,,,Cap 800,02-443_900x.jpg?v=1703872773 900w,
b'C-890 Gray/Sand/Ivory Braided Rug',02-890,,,,,,,,,1,$ 12.59,,,,,1,Cap 400,Cap 160, //www.earthrugs.com/cdn/shop/files/02-890_900x.jpg?v=1703872798 900w,02-890_900x.jpg?v=1703872798 900w,,,Cap 800,02-890_900x.jpg?v=1703872798 900w,
b'C-895 Brown/Tan/Ivory Braided Rug',02-895,,,,,,,,,1,$ 12.59,,,,,1,Cap 400,Cap 160, //www.earthrugs.com/cdn/shop/files/02-895_900x.jpg?v=1703872812 900w,02-895_900x.jpg?v=1703872812 900w,,,Cap 800,02-895_900x.jpg?v=1703872812 900w,
b'C-896 Burgundy/Tan/Ivory Braided Rug',02-896,,,,,,,,,1,$ 12.59,,,,,1,Cap 400,Cap 160, //www.earthrugs.com/cdn/shop/files/02-896_900x.jpg?v=1703872825 900w,02-896_900x.jpg?v=1703872825 900w,,,Cap 800,02-896_900x.jpg?v=1703872825 900w,
b'C-903 Charcoal/Gray/Ivory Braided Rug',02-903,,,,,,,,,1,$ 12.59,,,,,1,Cap 400,Cap 160, //www.earthrugs.com/cdn/shop/files/02-903_900x.jpg?v=1703872880 900w,02-903_900x.jpg?v=1703872880 900w,,,Cap 800,02-903_900x.jpg?v=1703872880 900w,
b'C-904 Navy/Mid-Blue/Ivory Braided Rug',02-904,,,,,,,,,1,$ 12.59,,,,,1,Cap 400,Cap 160, //www.earthrugs.com/cdn/shop/files/02-904_900x.jpg?v=1703872891 900w,02-904_900x.jpg?v=1703872891 900w,,,Cap 800,02-904_900x.jpg?v=1703872891 900w,
b'C-787 Dark Brown/Taupe/Terracotta Braided Rug',03-787,,,,,,,,,1,$ 14.52,,,,,1,Cap 400,Cap 160, //www.earthrugs.com/cdn/shop/products/03-787_900x.jpg?v=1577999746 900w,03-787_900x.jpg?v=1577999746 900w,,,Cap 800,03-787_900x.jpg?v=1577999746 900w,
b'CNB-025 Holly Cardinal Coaster Set',29-CB025HC,,"b'5"" Round Jute Coasters With Hand Stenciled Holly Cardinal Design\n100% Natural Jute\n4 Coasters With Matching Basket \nExtremely Durable\nRed, Green, and Natural\nArt by Suzanne Pienta'",,,,,,,1,$ 8.54,,,,,1,Cap 400,Cap 160, //www.earthrugs.com/cdn/shop/files/CNB-025-HollyCardinal-5_-OnWood_900x.jpg?v=1703802815 900w,CNB-025-HollyCardinal-5_-OnWood_900x.jpg?v=1703802815 900w,,,Cap 800,CNB-025-HollyCardinal-5_-OnWood_900x.jpg?v=1703802815 900w,
b'CNB-043 Loon Coaster Set',29-CB043L,,"b'5"" Round Jute Coasters With Hand Stenciled Loon Design\n100% Natural Jute\n4 Coasters With Matching Basket \nExtremely Durable\nBurgundy, Black and Gold\nArt by Harry W. Smith'",,,,,,,1,$ 8.54,,,,,1,Cap 400,Cap 160, //www.earthrugs.com/cdn/shop/files/CNB-043-Loon-5_-OnWood_900x.jpg?v=1703802825 900w,CNB-043-Loon-5_-OnWood_900x.jpg?v=1703802825 900w,,,Cap 800,CNB-043-Loon-5_-OnWood_900x.jpg?v=1703802825 900w,
b'CNB-081 Snowman in Top Hat Coaster Set',29-CB081STH,,"b'5"" Round Jute Coasters With Hand Stenciled Snowman in Top Hat Design\n100% Natural Jute\n4 Coasters With Matching Basket \nExtremely Durable\nBurgundy, Black and Sage'",,,,,,,1,$ 8.54,,,,,1,Cap 400,Cap 160, //www.earthrugs.com/cdn/shop/files/CNB-081-SnowmanTopHat-5_-OnWood_900x.jpg?v=1703802837 900w,CNB-081-SnowmanTopHat-5_-OnWood_900x.jpg?v=1703802837 900w,,,Cap 800,CNB-081-SnowmanTopHat-5_-OnWood_900x.jpg?v=1703802837 900w,
b'CNB-116 Tall Timbers Coaster Set',29-CB116TT,,"b'5"" Round Jute Coasters With Hand Stenciled Tall Timbers Design\n100% Natural Jute\n4 Coasters With Matching Basket \nExtremely Durable\nBlack and Sage\nArt by Jan Harless'",,,,,,,1,$ 8.54,,,,,1,Cap 400,Cap 160, //www.earthrugs.com/cdn/shop/files/CNB-116-TallTimber-5_-OnWood_900x.jpg?v=1703802848 900w,CNB-116-TallTimber-5_-OnWood_900x.jpg?v=1703802848 900w,,,Cap 800,CNB-116-TallTimber-5_-OnWood_900x.jpg?v=1703802848 900w,
b'IC-9-870 Rustic A Coaster',30-9-870A,,"b'5"" Round Hand Stenciled Coaster with Rustic A Monogram Design \n100% Natural Jute\nSold Individually \nExtremely Durable\nDark Brown and Light Brown '",,,,,,,1,$ 1.25,,,,,1,Cap 400,Cap 160, //www.earthrugs.com/cdn/shop/files/30-9-870A_900x.jpg?v=1702416841 900w,30-9-870A_900x.jpg?v=1702416841 900w,,,Cap 800,30-9-870A_900x.jpg?v=1702416841 900w,
b'IC-9-870 Rustic B Coaster',30-9-870B,,"b'5"" Round Hand Stenciled Coaster with Rustic B Monogram Design \n100% Natural Jute\nSold Individually \nExtremely Durable\nDark Brown and Light Brown '",,,,,,,1,$ 1.25,,,,,1,Cap 400,Cap 160, //www.earthrugs.com/cdn/shop/files/30-9-870B_900x.jpg?v=1702416849 900w,30-9-870B_900x.jpg?v=1702416849 900w,,,Cap 800,30-9-870B_900x.jpg?v=1702416849 900w,
b'IC-9-870 Rustic C Coaster',30-9-870C,,"b'5"" Round Hand Stenciled Coaster with Rustic C Monogram Design \n100% Natural Jute\nSold Individually \nExtremely Durable\nDark Brown and Light Brown '",,,,,,,1,$ 1.25,,,,,1,Cap 400,Cap 160, //www.earthrugs.com/cdn/shop/files/30-9-870C_900x.jpg?v=1702416856 900w,30-9-870C_900x.jpg?v=1702416856 900w,,,Cap 800,30-9-870C_900x.jpg?v=1702416856 900w,
b'IC-9-870 Rustic D Coaster',30-9-870D,,"b'5"" Round Hand Stenciled Coaster with Rustic D Monogram Design \n100% Natural Jute\nSold Individually \nExtremely Durable\nDark Brown and Light Brown '",,,,,,,1,$ 1.25,,,,,1,Cap 400,Cap 160, //www.earthrugs.com/cdn/shop/files/30-9-870D_900x.jpg?v=1702416860 900w,30-9-870D_900x.jpg?v=1702416860 900w,,,Cap 800,30-9-870D_900x.jpg?v=1702416860 900w,
b'IC-9-870 Rustic E Coaster',30-9-870E,,"b'5"" Round Hand Stenciled Coaster with Rustic E Monogram Design \n100% Natural Jute\nSold Individually \nExtremely Durable\nDark Brown and Light Brown '",,,,,,,1,$ 1.25,,,,,1,Cap 400,Cap 160, //www.earthrugs.com/cdn/shop/files/30-9-870E_900x.jpg?v=1702416866 900w,30-9-870E_900x.jpg?v=1702416866 900w,,,Cap 800,30-9-870E_900x.jpg?v=1702416866 900w,
b'IC-9-870 Rustic F Coaster',30-9-870F,,"b'5"" Round Hand Stenciled Coaster with Rustic F Monogram Design \n100% Natural Jute\nSold Individually \nExtremely Durable\nDark Brown and Light Brown '",,,,,,,1,$ 1.25,,,,,1,Cap 400,Cap 160, //www.earthrugs.com/cdn/shop/files/30-9-870F_900x.jpg?v=1702416871 900w,30-9-870F_900x.jpg?v=1702416871 900w,,,Cap 800,30-9-870F_900x.jpg?v=1702416871 900w,
b'IC-9-870 Rustic G Coaster',30-9-870G,,"b'5"" Round Hand Stenciled Coaster with Rustic G Monogram Design \n100% Natural Jute\nSold Individually \nExtremely Durable\nDark Brown and Light Brown '",,,,,,,1,$ 1.25,,,,,1,Cap 400,Cap 160, //www.earthrugs.com/cdn/shop/files/30-9-870G_900x.jpg?v=1702416877 900w,30-9-870G_900x.jpg?v=1702416877 900w,,,Cap 800,30-9-870G_900x.jpg?v=1702416877 900w,
b'IC-9-870 Rustic H Coaster',30-9-870H,,"b'5"" Round Hand Stenciled Coaster with Rustic H Monogram Design \n100% Natural Jute\nSold Individually \nExtremely Durable\nDark Brown and Light Brown '",,,,,,,1,$ 1.25,,,,,1,Cap 400,Cap 160, //www.earthrugs.com/cdn/shop/files/30-9-870H_900x.jpg?v=1702416882 900w,30-9-870H_900x.jpg?v=1702416882 900w,,,Cap 800,30-9-870H_900x.jpg?v=1702416882 900w,
b'IC-9-870 Rustic I Coaster',30-9-870I,,"b'5"" Round Hand Stenciled Coaster with Rustic I Monogram Design \n100% Natural Jute\nSold Individually \nExtremely Durable\nDark Brown and Light Brown '",,,,,,,1,$ 1.25,,,,,1,Cap 400,Cap 160, //www.earthrugs.com/cdn/shop/files/30-9-870I_900x.jpg?v=1702416886 900w,30-9-870I_900x.jpg?v=1702416886 900w,,,Cap 800,30-9-870I_900x.jpg?v=1702416886 900w,
b'IC-9-870 Rustic J Coaster',30-9-870J,,"b'5"" Round Hand Stenciled Coaster with Rustic J Monogram Design \n100% Natural Jute\nSold Individually \nExtremely Durable\nDark Brown and Light Brown '",,,,,,,1,$ 1.25,,,,,1,Cap 400,Cap 160, //www.earthrugs.com/cdn/shop/files/30-9-870J_900x.jpg?v=1702416890 900w,30-9-870J_900x.jpg?v=1702416890 900w,,,Cap 800,30-9-870J_900x.jpg?v=1702416890 900w,
b'IC-9-870 Rustic K Coaster',30-9-870K,,"b'5"" Round Hand Stenciled Coaster with Rustic K Monogram Design \n100% Natural Jute\nSold Individually \nExtremely Durable\nDark Brown and Light Brown '",,,,,,,1,$ 1.25,,,,,1,Cap 400,Cap 160, //www.earthrugs.com/cdn/shop/files/30-9-870K_900x.jpg?v=1702416895 900w,30-9-870K_900x.jpg?v=1702416895 900w,,,Cap 800,30-9-870K_900x.jpg?v=1702416895 900w,
b'IC-9-870 Rustic L Coaster',30-9-870L,,"b'5"" Round Hand Stenciled Coaster with Rustic L Monogram Design \n100% Natural Jute\nSold Individually \nExtremely Durable\nDark Brown and Light Brown '",,,,,,,1,$ 1.25,,,,,1,Cap 400,Cap 160, //www.earthrugs.com/cdn/shop/files/30-9-870L_900x.jpg?v=1702416900 900w,30-9-870L_900x.jpg?v=1702416900 900w,,,Cap 800,30-9-870L_900x.jpg?v=1702416900 900w,
b'IC-9-870 Rustic M Coaster',30-9-870M,,"b'5"" Round Hand Stenciled Coaster with Rustic M Monogram Design \n100% Natural Jute\nSold Individually \nExtremely Durable\nDark Brown and Light Brown '",,,,,,,1,$ 1.25,,,,,1,Cap 400,Cap 160, //www.earthrugs.com/cdn/shop/files/30-9-870M_900x.jpg?v=1702416906 900w,30-9-870M_900x.jpg?v=1702416906 900w,,,Cap 800,30-9-870M_900x.jpg?v=1702416906 900w,
b'IC-9-870 Rustic N Coaster',30-9-870N,,"b'5"" Round Hand Stenciled Coaster with Rustic N Monogram Design \n100% Natural Jute\nSold Individually \nExtremely Durable\nDark Brown and Light Brown '",,,,,,,1,$ 1.25,,,,,1,Cap 400,Cap 160, //www.earthrugs.com/cdn/shop/files/30-9-870N_900x.jpg?v=1702416911 900w,30-9-870N_900x.jpg?v=1702416911 900w,,,Cap 800,30-9-870N_900x.jpg?v=1702416911 900w,
b'IC-9-870 Rustic O Coaster',30-9-870O,,"b'5"" Round Hand Stenciled Coaster with Rustic O Monogram Design \n100% Natural Jute\nSold Individually \nExtremely Durable\nDark Brown and Light Brown'",,,,,,,1,$ 1.25,,,,,1,Cap 400,Cap 160, //www.earthrugs.com/cdn/shop/files/30-9-870O_900x.jpg?v=1702416915 900w,30-9-870O_900x.jpg?v=1702416915 900w,,,Cap 800,30-9-870O_900x.jpg?v=1702416915 900w,
b'IC-9-870 Rustic P Coaster',30-9-870P,,"b'5"" Round Hand Stenciled Coaster with Rustic P Monogram Design \n100% Natural Jute\nSold Individually \nExtremely Durable\nDark Brown and Light Brown'",,,,,,,1,$ 1.25,,,,,1,Cap 400,Cap 160, //www.earthrugs.com/cdn/shop/files/30-9-870P_900x.jpg?v=1702416920 900w,30-9-870P_900x.jpg?v=1702416920 900w,,,Cap 800,30-9-870P_900x.jpg?v=1702416920 900w,
b'IC-9-870 Rustic Q Coaster',30-9-870Q,,"b'5"" Round Hand Stenciled Coaster with Rustic Q Monogram Design \n100% Natural Jute\nSold Individually \nExtremely Durable\nDark Brown and Light Brown'",,,,,,,1,$ 1.25,,,,,1,Cap 400,Cap 160, //www.earthrugs.com/cdn/shop/files/30-9-870Q_900x.jpg?v=1702416924 900w,30-9-870Q_900x.jpg?v=1702416924 900w,,,Cap 800,30-9-870Q_900x.jpg?v=1702416924 900w,
b'IC-9-870 Rustic R Coaster',30-9-870R,,"b'5"" Round Hand Stenciled Coaster with Rustic R Monogram Design \n100% Natural Jute\nSold Individually \nExtremely Durable\nDark Brown and Light Brown'",,,,,,,1,$ 1.25,,,,,1,Cap 400,Cap 160, //www.earthrugs.com/cdn/shop/files/30-9-870R_900x.jpg?v=1702416929 900w,30-9-870R_900x.jpg?v=1702416929 900w,,,Cap 800,30-9-870R_900x.jpg?v=1702416929 900w,
b'IC-9-870 Rustic S Coaster',30-9-870S,,"b'5"" Round Hand Stenciled Coaster with Rustic S Monogram Design \n100% Natural Jute\nSold Individually \nExtremely Durable\nDark Brown and Light Brown'",,,,,,,1,$ 1.25,,,,,1,Cap 400,Cap 160, //www.earthrugs.com/cdn/shop/files/30-9-870S_900x.jpg?v=1702416933 900w,30-9-870S_900x.jpg?v=1702416933 900w,,,Cap 800,30-9-870S_900x.jpg?v=1702416933 900w,
b'IC-9-870 Rustic T Coaster',30-9-870T,,"b'5"" Round Hand Stenciled Coaster with Rustic T Monogram Design \n100% Natural Jute\nSold Individually \nExtremely Durable\nDark Brown and Light Brown'",,,,,,,1,$ 1.25,,,,,1,Cap 400,Cap 160, //www.earthrugs.com/cdn/shop/files/30-9-870T_900x.jpg?v=1702416937 900w,30-9-870T_900x.jpg?v=1702416937 900w,,,Cap 800,30-9-870T_900x.jpg?v=1702416937 900w,
b'IC-9-870 Rustic U Coaster',30-9-870U,,"b'5"" Round Hand Stenciled Coaster with Rustic U Monogram Design \n100% Natural Jute\nSold Individually \nExtremely Durable\nDark Brown and Light Brown'",,,,,,,1,$ 1.25,,,,,1,Cap 400,Cap 160, //www.earthrugs.com/cdn/shop/files/30-9-870U_900x.jpg?v=1702416942 900w,30-9-870U_900x.jpg?v=1702416942 900w,,,Cap 800,30-9-870U_900x.jpg?v=1702416942 900w,
b'IC-9-870 Rustic V Coaster',30-9-870V,,"b'5"" Round Hand Stenciled Coaster with Rustic V Monogram Design \n100% Natural Jute\nSold Individually \nExtremely Durable\nDark Brown and Light Brown'",,,,,,,1,$ 1.25,,,,,1,Cap 400,Cap 160, //www.earthrugs.com/cdn/shop/files/30-9-870V_900x.jpg?v=1702416947 900w,30-9-870V_900x.jpg?v=1702416947 900w,,,Cap 800,30-9-870V_900x.jpg?v=1702416947 900w,
b'IC-9-870 Rustic W Coaster',30-9-870W,,"b'5"" Round Hand Stenciled Coaster with Rustic W Monogram Design \n100% Natural Jute\nSold Individually \nExtremely Durable\nDark Brown and Light Brown'",,,,,,,1,$ 1.25,,,,,1,Cap 400,Cap 160, //www.earthrugs.com/cdn/shop/files/30-9-870W_900x.jpg?v=1702416951 900w,30-9-870W_900x.jpg?v=1702416951 900w,,,Cap 800,30-9-870W_900x.jpg?v=1702416951 900w,
b'IC-9-870 Rustic X Coaster',30-9-870X,,"b'5"" Round Hand Stenciled Coaster with Rustic X Monogram Design \n100% Natural Jute\nSold Individually \nExtremely Durable\nDark Brown and Light Brown'",,,,,,,1,$ 1.25,,,,,1,Cap 400,Cap 160, //www.earthrugs.com/cdn/shop/files/30-9-870X_900x.jpg?v=1702416955 900w,30-9-870X_900x.jpg?v=1702416955 900w,,,Cap 800,30-9-870X_900x.jpg?v=1702416955 900w,
b'IC-9-870 Rustic Y Coaster',30-9-870Y,,"b'5"" Round Hand Stenciled Coaster with Rustic Y Monogram Design \n100% Natural Jute\nSold Individually \nExtremely Durable\nDark Brown and Light Brown'",,,,,,,1,$ 1.25,,,,,1,Cap 400,Cap 160, //www.earthrugs.com/cdn/shop/files/30-9-870Y_900x.jpg?v=1702416961 900w,30-9-870Y_900x.jpg?v=1702416961 900w,,,Cap 800,30-9-870Y_900x.jpg?v=1702416961 900w,
b'IC-9-870 Rustic Z Coaster',30-9-870Z,,"b'5"" Round Hand Stenciled Coaster with Rustic Z Monogram Design \n100% Natural Jute\nSold Individually \nExtremely Durable\nDark Brown and Light Brown'",,,,,,,1,$ 1.25,,,,,1,Cap 400,Cap 160, //www.earthrugs.com/cdn/shop/files/30-9-870Z_900x.jpg?v=1702416965 900w,30-9-870Z_900x.jpg?v=1702416965 900w,,,Cap 800,30-9-870Z_900x.jpg?v=1702416965 900w,
b'IC-001 Puppy Face Coaster',31-IC001PF,,"b'5"" Round Hand Stenciled Coaster with Puppy Face Design \n100% Natural Jute\nSold Individually \nExtremely Durable\nBlack'",,,,,,,1,$ 1.25,,,,,1,Cap 400,Cap 160, //www.earthrugs.com/cdn/shop/files/IC-001-Puppy-Face-5_-Round-OnWood_900x.jpg?v=1702486307 900w,IC-001-Puppy-Face-5_-Round-OnWood_900x.jpg?v=1702486307 900w,,,Cap 800,IC-001-Puppy-Face-5_-Round-OnWood_900x.jpg?v=1702486307 900w,
b'IC-025 Santa Coaster',31-IC025S,,"b'5"" Round Hand Stenciled Coaster with Santa Design \n100% Natural Jute\nSold Individually \nExtremely Durable\nRed & Green\nArtwork by Susan Burd'",,,,,,,1,$ 1.25,,,,,1,Cap 400,Cap 160, //www.earthrugs.com/cdn/shop/files/IC-025-Santa-5Round-Modified-OnWood_900x.jpg?v=1702486667 900w,IC-025-Santa-5Round-Modified-OnWood_900x.jpg?v=1702486667 900w,,,Cap 800,IC-025-Santa-5Round-Modified-OnWood_900x.jpg?v=1702486667 900w,
b'IC-042 George Washington Coaster',31-IC042GW,,"b'5"" Round Hand Stenciled Coaster with George Washington Design \n100% Natural Jute\nSold Individually \nExtremely Durable\nBlue & Navy'",,,,,,,1,$ 1.25,,,,,1,Cap 400,Cap 160, //www.earthrugs.com/cdn/shop/files/IC-042-GeorgeWashington-5_-Round-OnWood_900x.jpg?v=1702487579 900w,IC-042-GeorgeWashington-5_-Round-OnWood_900x.jpg?v=1702487579 900w,,,Cap 800,IC-042-GeorgeWashington-5_-Round-OnWood_900x.jpg?v=1702487579 900w,
b'IC-043 Horse Silhouette Coaster',31-IC043HS,,b'Round Hand Stenciled Coaster with Horse Silhouette Design \n100% Natural Jute\n2 Sizes Available \nExtremely Durable\nBurgundy and Pink',,,,,,,1,$ 1.25,,,,,1,Cap 400,Cap 160, //www.earthrugs.com/cdn/shop/files/IC-043-Horse-Silhoette-5_-Round-OnWood_900x.jpg?v=1702488652 900w,IC-043-Horse-Silhoette-5_-Round-OnWood_900x.jpg?v=1702488652 900w,,,Cap 800,IC-043-Horse-Silhoette-5_-Round-OnWood_900x.jpg?v=1702488652 900w,
b'IC-222 Pumpkin Crow Coaster',31-IC222PC,,"b'5"" Round Hand Stenciled Coaster with Pumpkin Crow Design \n100% Natural Jute\nSold Individually \nExtremely Durable\nBlack & Orange\nArtwork by Suzanne Pienta'",,,,,,,1,$ 1.25,,,,,1,Cap 400,Cap 160, //www.earthrugs.com/cdn/shop/files/IC-222-PumpkinCrow-5_-Round-OnWood_900x.jpg?v=1702486407 900w,IC-222-PumpkinCrow-5_-Round-OnWood_900x.jpg?v=1702486407 900w,,,Cap 800,IC-222-PumpkinCrow-5_-Round-OnWood_900x.jpg?v=1702486407 900w,
b'IC-238 Alaska Coaster',31-IC238AK,,"b'5"" Round Hand Stenciled Coaster with Alaska Design \n100% Natural Jute\nSold Individually \nExtremely Durable\nBlack & Gray\nArtwork by Harry W. Smith'",,,,,,,1,$ 1.25,,,,,1,Cap 400,Cap 160, //www.earthrugs.com/cdn/shop/files/IC-238-Alaska-5_Round-OnWood_900x.jpg?v=1702486502 900w,IC-238-Alaska-5_Round-OnWood_900x.jpg?v=1702486502 900w,,,Cap 800,IC-238-Alaska-5_Round-OnWood_900x.jpg?v=1702486502 900w,
b'IC-238 Lincoln Coaster',31-IC238L,,"b'5"" Round Hand Stenciled Coaster with Lincoln Design \n100% Natural Jute\nSold Individually \nExtremely Durable\nBlack & Gray'",,,,,,,1,$ 1.25,,,,,1,Cap 400,Cap 160, //www.earthrugs.com/cdn/shop/files/IC-238-Lincoln-5_-Round-OnWood_900x.jpg?v=1702486593 900w,IC-238-Lincoln-5_-Round-OnWood_900x.jpg?v=1702486593 900w,,,Cap 800,IC-238-Lincoln-5_-Round-OnWood_900x.jpg?v=1702486593 900w,
b'IC-238 Shark Coaster',31-IC238S,,b'Round Hand Stenciled Coaster with Shark Design \n100% Natural Jute\n2 Sizes Available \nExtremely Durable\nBlack & Gray',,,,,,,1,$ 1.25,,,,,1,Cap 400,Cap 160, //www.earthrugs.com/cdn/shop/files/IC-238-Shark-5_Round-OnWood_900x.jpg?v=1702486633 900w,IC-238-Shark-5_Round-OnWood_900x.jpg?v=1702486633 900w,,,Cap 800,IC-238-Shark-5_Round-OnWood_900x.jpg?v=1702486633 900w,
b'IC-417 Autumn Maple Coaster',31-IC417AM,,b'Round Hand Stenciled Coaster with Autumn Maple Design \n100% Natural Jute\nSold Individually\nExtremely Durable\nBrown & Red\nArtwork by Sandy Clough',,,,,,,1,$ 1.25,,,,,1,Cap 400,Cap 160, //www.earthrugs.com/cdn/shop/files/IC-417-AutumnMaple-5_-Round-OnWood_900x.jpg?v=1702487755 900w,IC-417-AutumnMaple-5_-Round-OnWood_900x.jpg?v=1702487755 900w,,,Cap 800,IC-417-AutumnMaple-5_-Round-OnWood_900x.jpg?v=1702487755 900w,
b'IC-417 Holly Berries Coaster',31-IC417HOB,,b'Round Hand Stenciled Coaster with Holly Berries Design \n100% Natural Jute\nSold Individually \nExtremely Durable\nBrown & Red',,,,,,,1,$ 1.25,,,,,1,Cap 400,Cap 160, //www.earthrugs.com/cdn/shop/files/IC-417-Holly-berries-5_-Round-OnWood_900x.jpg?v=1702487833 900w,IC-417-Holly-berries-5_-Round-OnWood_900x.jpg?v=1702487833 900w,,,Cap 800,IC-417-Holly-berries-5_-Round-OnWood_900x.jpg?v=1702487833 900w,
b'IC-417 Red Adirondack Chair Coaster',31-IC417RAC,,"b'5""Round Hand Stenciled Coaster with Red Adirondack Chair Design \n100% Natural Jute\nSold Individually \nExtremely Durable\nBrown & Red\nArt by Harry W. Smith'",,,,,,,1,$ 1.25,,,,,1,Cap 400,Cap 160, //www.earthrugs.com/cdn/shop/files/IC-417-RedAdirondackChair-5_-Round-OnWood_900x.jpg?v=1702487900 900w,IC-417-RedAdirondackChair-5_-Round-OnWood_900x.jpg?v=1702487900 900w,,,Cap 800,IC-417-RedAdirondackChair-5_-Round-OnWood_900x.jpg?v=1702487900 900w,
b'IC-417 Red Bicycle Coaster',31-IC417RB,,"b'5"" Round Hand Stenciled Coaster with Red Bicycle Design \n100% Natural Jute\nSold Individually \nExtremely Durable\nBrown & Red\nArtwork by Sandy Clough'",,,,,,,1,$ 1.25,,,,,1,Cap 400,Cap 160, //www.earthrugs.com/cdn/shop/files/IC-417-RedBicycle-5_Round-OnWood_900x.jpg?v=1702487961 900w,IC-417-RedBicycle-5_Round-OnWood_900x.jpg?v=1702487961 900w,,,Cap 800,IC-417-RedBicycle-5_Round-OnWood_900x.jpg?v=1702487961 900w,
b'IC-430 Bear Mountain Coaster',31-IC430BM,,b'Round Hand Stenciled Coaster with Bear Mountain Design \n100% Natural Jute\n2 Sizes Available \nExtremely Durable\nBlack and White',,,,,,,1,$ 1.25,,,,,1,Cap 400,Cap 160, //www.earthrugs.com/cdn/shop/files/31-IC430BM_900x.jpg?v=1702490777 900w,31-IC430BM_900x.jpg?v=1702490777 900w,,,Cap 800,31-IC430BM_900x.jpg?v=1702490777 900w,
b'IC-443 Dolphin Coaster',31-IC443D,,"b'5"" Round Hand Stenciled Coaster with Dolphin Design \n100% Natural Jute\nSold Individually \nExtremely Durable\nBlack & Blue'",,,,,,,1,$ 1.25,,,,,1,Cap 400,Cap 160, //www.earthrugs.com/cdn/shop/files/IC-443-Dolphin-5_Round-OnWood_900x.jpg?v=1702487992 900w,IC-443-Dolphin-5_Round-OnWood_900x.jpg?v=1702487992 900w,,,Cap 800,IC-443-Dolphin-5_Round-OnWood_900x.jpg?v=1702487992 900w,
b'IC-443 Nautical Anchor Coaster',31-IC443NAN,,b'Round Hand Stenciled Coaster with Nautical Anchor Design \n100% Natural Jute\n2 Sizes Available \nExtremely Durable\nBlue and Black\nArt by Phyllis Stevens',,,,,,,1,$ 1.25,,,,,1,Cap 400,Cap 160, //www.earthrugs.com/cdn/shop/files/31-IC443NAN_900x.jpg?v=1702491060 900w,31-IC443NAN_900x.jpg?v=1702491060 900w,,,Cap 800,31-IC443NAN_900x.jpg?v=1702491060 900w,
b'IC-443 Nautical Lifebuoy Coaster',31-IC443NL,,b'Round Hand Stenciled Coaster with Nautical Lifebuoy Design \n100% Natural Jute\n2 Sizes Available \nExtremely Durable\nBlack and Blue\nArt by Phyllis Stevens',,,,,,,1,$ 1.25,,,,,1,Cap 400,Cap 160, //www.earthrugs.com/cdn/shop/files/31-IC443NL_900x.jpg?v=1702491386 900w,31-IC443NL_900x.jpg?v=1702491386 900w,,,Cap 800,31-IC443NL_900x.jpg?v=1702491386 900w,
b'IC-443 Nautical Sun Coaster',31-IC443NS,,b'Round Hand Stenciled Coaster with Nautical Sun Design \n100% Natural Jute\n2 Sizes Available \nExtremely Durable\nBlack and Blue\nArtwork by Phyllis Stevens',,,,,,,1,$ 1.25,,,,,1,Cap 400,Cap 160, //www.earthrugs.com/cdn/shop/files/31-IC443NS_900x.jpg?v=1702491573 900w,31-IC443NS_900x.jpg?v=1702491573 900w,,,Cap 800,31-IC443NS_900x.jpg?v=1702491573 900w,
b'IC-443 Nautical Ship Wheel Coaster',31-IC443NSW,,b'Round Hand Stenciled Coaster with Nautical Ship Wheel Design \n100% Natural Jute\n2 Sizes Available \nExtremely Durable\nBlack and Blue\nArt by Phyllis Stevens ',,,,,,,1,$ 1.25,,,,,1,Cap 400,Cap 160, //www.earthrugs.com/cdn/shop/files/31-IC443NSW_900x.jpg?v=1702491482 900w,31-IC443NSW_900x.jpg?v=1702491482 900w,,,Cap 800,31-IC443NSW_900x.jpg?v=1702491482 900w,
b'IC-503 Kitty Face Coaster',31-IC503KF,,"b'5"" Round Hand Stenciled Coaster with Kitty Face Design \n100% Natural Jute\nSold Individually \nExtremely Durable\nBlack & Orange'",,,,,,,1,$ 1.25,,,,,1,Cap 400,Cap 160, //www.earthrugs.com/cdn/shop/files/IC-503-KittyFace-5_Round-OnWood_900x.jpg?v=1702488098 900w,IC-503-KittyFace-5_Round-OnWood_900x.jpg?v=1702488098 900w,,,Cap 800,IC-503-KittyFace-5_Round-OnWood_900x.jpg?v=1702488098 900w,
b'IC-505 Tree Line Grizzly Coaster',31-IC505TLG,,b'Round Hand Stenciled Coaster with Tree Line Grizzly Design \n100% Natural Jute\n2 Sizes Available \nExtremely Durable\nGreen and White',,,,,,,1,$ 1.25,,,,,1,Cap 400,Cap 160, //www.earthrugs.com/cdn/shop/files/31-IC505TLG_900x.jpg?v=1702492023 900w,31-IC505TLG_900x.jpg?v=1702492023 900w,,,Cap 800,31-IC505TLG_900x.jpg?v=1702492023 900w,
b'IC-660 Mushroom Coaster',31-IC660M,,"b'5"" Round Hand Stenciled Coaster with Mushroom Design \n100% Natural Jute\nSold Individually \nExtremely Durable\nBrown & White\nArt by Harry W. Smith'",,,,,,,1,$ 1.25,,,,,1,Cap 400,Cap 160, //www.earthrugs.com/cdn/shop/files/IC-660-Mushroom-5_Round-OnWood_900x.jpg?v=1702488154 900w,IC-660-Mushroom-5_Round-OnWood_900x.jpg?v=1702488154 900w,,,Cap 800,IC-660-Mushroom-5_Round-OnWood_900x.jpg?v=1702488154 900w,
