b'IC-864 Red Plaid Deer Coaster',31-IC864RPD,,"b'5"" Round Hand Stenciled Coaster with Red Plaid Deer Design \n100% Natural Jute\nSold Individually \nExtremely Durable\nBurgundy and Black\nArt by Harry W. Smith'",,,,,,,1,$ 1.25,,,,,1,Cap 400,Cap 160, //www.earthrugs.com/cdn/shop/files/IC-864-RedPlaidDeer-5_-Round-OnWood_900x.jpg?v=1702488233 900w,IC-864-RedPlaidDeer-5_-Round-OnWood_900x.jpg?v=1702488233 900w,,,Cap 800,IC-864-RedPlaidDeer-5_-Round-OnWood_900x.jpg?v=1702488233 900w,
b'IC-864 Red Plaid Moose Coaster',31-IC864RPM,,b'Round Hand Stenciled Coaster with Red Plaid Moose Design \n100% Natural Jute\n2 Sizes Available \nExtremely Durable\nRed and Black\nArtwork by Harry W. Smith',,,,,,,1,$ 1.25,,,,,1,Cap 400,Cap 160, //www.earthrugs.com/cdn/shop/files/31-IC864RPM_900x.jpg?v=1702492163 900w,31-IC864RPM_900x.jpg?v=1702492163 900w,,,Cap 800,31-IC864RPM_900x.jpg?v=1702492163 900w,
b'IC-864 Red Plaid Rabbit Coaster',31-IC864RPR,,"b'5"" Round Hand Stenciled Coaster with Red Plaid Rabbit Design \n100% Natural Jute\nSold Individually \nExtremely Durable\nBurgundy and Black\nArtwork by Harry W. Smith'",,,,,,,1,$ 1.25,,,,,1,Cap 400,Cap 160, //www.earthrugs.com/cdn/shop/files/IC-864-RedPlaidRabbit-5_Round-OnWood_900x.jpg?v=1702488292 900w,IC-864-RedPlaidRabbit-5_Round-OnWood_900x.jpg?v=1702488292 900w,,,Cap 800,IC-864-RedPlaidRabbit-5_Round-OnWood_900x.jpg?v=1702488292 900w,
b'IC-865 Desert Frog Coaster',31-IC865DF,,b'Round Hand Stenciled Coaster with Desert Frog Design \n100% Natural Jute\n2 Sizes Available \nExtremely Durable\nGreen and Gold\nArtwork by Phyllis Stevens',,,,,,,1,$ 1.25,,,,,1,Cap 400,Cap 160, //www.earthrugs.com/cdn/shop/files/31-IC865DF_900x.jpg?v=1702495071 900w,31-IC865DF_900x.jpg?v=1702495071 900w,,,Cap 800,31-IC865DF_900x.jpg?v=1702495071 900w,
b'IC-865 Desert Gecko Coaster',31-IC865DG,,b'Round Hand Stenciled Coaster with Desert Gecko Design \n100% Natural Jute\n2 Sizes Available\nExtremely Durable\nGreen and Gold\nArtwork by Phyllis Stevens',,,,,,,1,$ 1.25,,,,,1,Cap 400,Cap 160, //www.earthrugs.com/cdn/shop/files/31-IC865DG_900x.jpg?v=1702495354 900w,31-IC865DG_900x.jpg?v=1702495354 900w,,,Cap 800,31-IC865DG_900x.jpg?v=1702495354 900w,
b'IC-865 Desert Iguana Coaster',31-IC865DI,,b'Round Hand Stenciled Coaster with Desert Iguana Design \n100% Natural Jute\n2 Sizes Available\nExtremely Durable\nGreen and Gold\nArtwork by Phyllis Stevens',,,,,,,1,$ 1.25,,,,,1,Cap 400,Cap 160, //www.earthrugs.com/cdn/shop/files/31-IC865DI_900x.jpg?v=1702495429 900w,31-IC865DI_900x.jpg?v=1702495429 900w,,,Cap 800,31-IC865DI_900x.jpg?v=1702495429 900w,
b'IC-865 Desert Lizard Coaster',31-IC865DL,,b'Round Hand Stenciled Coaster with Desert Iguana Design \n100% Natural Jute\n2 Sizes Available\nExtremely Durable\nGreen and Gold\nArtwork by Phyllis Stevens',,,,,,,1,$ 1.25,,,,,1,Cap 400,Cap 160, //www.earthrugs.com/cdn/shop/files/31-IC865DL_900x.jpg?v=1702495478 900w,31-IC865DL_900x.jpg?v=1702495478 900w,,,Cap 800,31-IC865DL_900x.jpg?v=1702495478 900w,
b'IC-865 Desert Snake Coaster',31-IC865DS,,b'Round Hand Stenciled Coaster with Desert Iguana Design \n100% Natural Jute\n2 Sizes Available\nExtremely Durable\nGreen and Gold\nArtwork by Phyllis Stevens',,,,,,,1,$ 1.25,,,,,1,Cap 400,Cap 160, //www.earthrugs.com/cdn/shop/files/31-IC865DS_900x.jpg?v=1702495566 900w,31-IC865DS_900x.jpg?v=1702495566 900w,,,Cap 800,31-IC865DS_900x.jpg?v=1702495566 900w,
b'IC-865 Desert Tortoise Coaster',31-IC865DT,,b'Round Hand Stenciled Coaster with Desert Tortoise Design \n100% Natural Jute\n2 Sizes Available\nExtremely Durable\nGreen and Gold\nArtwork by Phyllis Stevens',,,,,,,1,$ 1.25,,,,,1,Cap 400,Cap 160, //www.earthrugs.com/cdn/shop/files/31-IC865DT_900x.jpg?v=1702495611 900w,31-IC865DT_900x.jpg?v=1702495611 900w,,,Cap 800,31-IC865DT_900x.jpg?v=1702495611 900w,
b'IC-865 Native American Buffalo Coaster',31-IC865NAB,,b'Round Hand Stenciled Coaster with Native American Buffalo Design \n100% Natural Jute\n2 Sizes Available\nExtremely Durable\nGreen and Gold\nArtwork by Phyllis Stevens',,,,,,,1,$ 1.25,,,,,1,Cap 400,Cap 160, //www.earthrugs.com/cdn/shop/files/31-IC865NAB_900x.jpg?v=1702495657 900w,31-IC865NAB_900x.jpg?v=1702495657 900w,,,Cap 800,31-IC865NAB_900x.jpg?v=1702495657 900w,
b'IC-866 Pencil Starfish Coaster',31-IC866PS,,b'Round Hand Stenciled Coaster with Pencil Starfish Design \n100% Natural Jute\n2 Sizes Available\nExtremely Durable\nBlue and Teal \nArt by Harry W. Smith ',,,,,,,1,$ 1.25,,,,,1,Cap 400,Cap 160, //www.earthrugs.com/cdn/shop/files/31-IC866PS_900x.jpg?v=1702500017 900w,31-IC866PS_900x.jpg?v=1702500017 900w,,,Cap 800,31-IC866PS_900x.jpg?v=1702500017 900w,
b'IC-867 American Boot Coaster',31-IC867AB,,b'Round Hand Stenciled Coaster with American Boot Design \n100% Natural Jute\n2 Sizes Available \nExtremely Durable\nBlue and Red\nArtwork by Suzanne Pienta',,,,,,,1,$ 1.25,,,,,1,Cap 400,Cap 160, //www.earthrugs.com/cdn/shop/files/31-IC867AB_900x.jpg?v=1702500102 900w,31-IC867AB_900x.jpg?v=1702500102 900w,,,Cap 800,31-IC867AB_900x.jpg?v=1702500102 900w,
b'IC-868 Whale Tail Coaster',31-IC868WT,,b'Round Hand Stenciled Coaster with Whale Tail Design \n100% Natural Jute\n2 Sizes Available\nExtremely Durable\nBlue and Navy',,,,,,,1,$ 1.25,,,,,1,Cap 400,Cap 160, //www.earthrugs.com/cdn/shop/files/31-IC868WT_900x.jpg?v=1702500191 900w,31-IC868WT_900x.jpg?v=1702500191 900w,,,Cap 800,31-IC868WT_900x.jpg?v=1702500191 900w,
b'IC-869 Orca Coaster',31-IC869O,,b'Round Hand Stenciled Coaster with Orca Design \n100% Natural Jute\n2 Sizes Available\nExtremely Durable\nBlue and Navy',,,,,,,1,$ 1.25,,,,,1,Cap 400,Cap 160, //www.earthrugs.com/cdn/shop/files/31-IC869O_900x.jpg?v=1702500279 900w,31-IC869O_900x.jpg?v=1702500279 900w,,,Cap 800,31-IC869O_900x.jpg?v=1702500279 900w,
b'IC-869 Sea Otters Coaster',31-IC869SO,,b'Round Hand Stenciled Coaster with Sea Otters Design \n100% Natural Jute\n2 Sizes Available \nExtremely Durable\nBlue and Navy',,,,,,,1,$ 1.25,,,,,1,Cap 400,Cap 160, //www.earthrugs.com/cdn/shop/files/31-IC869SO_900x.jpg?v=1702503084 900w,31-IC869SO_900x.jpg?v=1702503084 900w,,,Cap 800,31-IC869SO_900x.jpg?v=1702503084 900w,
b'IC-873 Purple Egg Coaster',31-IC873PE,,b'Round Hand Stenciled Coaster with Purple Egg Design \n100% Natural Jute\n2 Sizes Available\nExtremely Durable\nPink and Purple\nArt by Suzanne Pienta',,,,,,,1,$ 1.25,,,,,1,Cap 400,Cap 160, //www.earthrugs.com/cdn/shop/files/79-873PE_900x.jpg?v=1702503314 900w,79-873PE_900x.jpg?v=1702503314 900w,,,Cap 800,79-873PE_900x.jpg?v=1702503314 900w,
b'IC-874 Green Egg Coaster',31-IC874GE,,b'Round Hand Stenciled Coaster with Green Egg Design \n100% Natural Jute\n2 Sizes Available\nExtremely Durable\nRed and Green\nArt by Suzanne Pienta',,,,,,,1,$ 1.25,,,,,1,Cap 400,Cap 160, //www.earthrugs.com/cdn/shop/files/31-IC874GE_900x.jpg?v=1702503437 900w,31-IC874GE_900x.jpg?v=1702503437 900w,,,Cap 800,31-IC874GE_900x.jpg?v=1702503437 900w,
b'IC-874 Tulips Coaster',31-IC874T,,b'Round Hand Stenciled Coaster with Tulips Design \n100% Natural Jute\n2 Sizes Available \nExtremely Durable\nRed and Green',,,,,,,1,$ 1.25,,,,,1,Cap 400,Cap 160, //www.earthrugs.com/cdn/shop/files/31-IC874T_900x.jpg?v=1702503553 900w,31-IC874T_900x.jpg?v=1702503553 900w,,,Cap 800,31-IC874T_900x.jpg?v=1702503553 900w,
b'IC-875 Green Mitten Coaster',31-IC875GM,,b'Round Hand Stenciled Coaster with Green Mitten Design \n100% Natural Jute\n2 Sizes Available\nExtremely Durable\nBurgundy and Green\nArt by Suzanne Pienta',,,,,,,1,$ 1.25,,,,,1,Cap 400,Cap 160, //www.earthrugs.com/cdn/shop/files/31-IC875GM_900x.jpg?v=1702503857 900w,31-IC875GM_900x.jpg?v=1702503857 900w,,,Cap 800,31-IC875GM_900x.jpg?v=1702503857 900w,
b'IC-876 Sweet Coaster',31-IC876S,,"b'5"" Round Hand Stenciled Coaster with Sweet Design \n100% Natural Jute\nSold Individually \nExtremely Durable\nPink\nArtwork by Suzanne Pienta'",,,,,,,1,$ 1.25,,,,,1,Cap 400,Cap 160, //www.earthrugs.com/cdn/shop/files/IC-876-Sweet-5_-Round-OnWood_900x.jpg?v=1702488360 900w,IC-876-Sweet-5_-Round-OnWood_900x.jpg?v=1702488360 900w,,,Cap 800,IC-876-Sweet-5_-Round-OnWood_900x.jpg?v=1702488360 900w,
b'IC-876 Yours Coaster',31-IC876Y,,"b'5"" Round Hand Stenciled Coaster with Yours Design \n100% Natural Jute\nSold Individually  \nExtremely Durable\nPink\nArt by Suzanne Pienta'",,,,,,,1,$ 1.25,,,,,1,Cap 400,Cap 160, //www.earthrugs.com/cdn/shop/files/IC-876-Yours-5_-Round-OnWood_900x.jpg?v=1702488404 900w,IC-876-Yours-5_-Round-OnWood_900x.jpg?v=1702488404 900w,,,Cap 800,IC-876-Yours-5_-Round-OnWood_900x.jpg?v=1702488404 900w,
b'IC-877 Yellow Egg Coaster',31-IC877YE,,b'Round Hand Stenciled Coaster with Yellow Egg Design \n100% Natural Jute\n2 Sizes Available \nExtremely Durable\nYellow and Red\nArt by Suzanne Pienta',,,,,,,1,$ 1.25,,,,,1,Cap 400,Cap 160, //www.earthrugs.com/cdn/shop/files/31-IC877YE_900x.jpg?v=1702503971 900w,31-IC877YE_900x.jpg?v=1702503971 900w,,,Cap 800,31-IC877YE_900x.jpg?v=1702503971 900w,
b'IC-878 Pink Egg Coaster',31-IC878PE,,b'Round Hand Stenciled Coaster with Pink Egg Design \n100% Natural Jute\n2 Sizes Available \nExtremely Durable\nPink and White\nArtwork by Suzanne Pienta',,,,,,,1,$ 1.25,,,,,1,Cap 400,Cap 160, //www.earthrugs.com/cdn/shop/files/31-IC878PE_900x.jpg?v=1702504084 900w,31-IC878PE_900x.jpg?v=1702504084 900w,,,Cap 800,31-IC878PE_900x.jpg?v=1702504084 900w,
b'IC-879 Blue Egg Coaster',31-IC879BE,,b'Round Hand Stenciled Coaster with Blue Egg Design \n100% Natural Jute\n2 Sizes Available \nExtremely Durable\nBlue and Natural \nArt by Suzanne Pienta',,,,,,,1,$ 1.25,,,,,1,Cap 400,Cap 160, //www.earthrugs.com/cdn/shop/files/31-IC879BE_900x.jpg?v=1702504201 900w,31-IC879BE_900x.jpg?v=1702504201 900w,,,Cap 800,31-IC879BE_900x.jpg?v=1702504201 900w,
b'IC-880 Bee Happy Coaster',31-IC880BH,,b'Round Hand Stenciled Coaster with Bee Happy Design \n100% Natural Jute\n2 Sizes Available\nExtremely Durable\nYellow and White\nArtwork by Suzanne Pienta',,,,,,,1,$ 1.25,,,,,1,Cap 400,Cap 160, //www.earthrugs.com/cdn/shop/files/31-IC880BH_900x.jpg?v=1702504301 900w,31-IC880BH_900x.jpg?v=1702504301 900w,,,Cap 800,31-IC880BH_900x.jpg?v=1702504301 900w,
b'IC-881 Colorado Flag Coaster',31-IC881CF,,b'Round Hand Stenciled Coaster with Colorado Design \n100% Natural Jute\n2 Sizes Available\nExtremely Durable\nNavy and Natural',,,,,,,1,$ 1.25,,,,,1,Cap 400,Cap 160, //www.earthrugs.com/cdn/shop/files/31-IC881CF_900x.jpg?v=1702505190 900w,31-IC881CF_900x.jpg?v=1702505190 900w,,,Cap 800,31-IC881CF_900x.jpg?v=1702505190 900w,
b'IC-882 Tree of Life Coaster',31-IC882TL,,b'Round Hand Stenciled Coaster with Tree of Life Design \n100% Natural Jute\n2 Sizes Available\nExtremely Durable\nRed and Gray',,,,,,,1,$ 1.25,,,,,1,Cap 400,Cap 160, //www.earthrugs.com/cdn/shop/files/31-IC882TL_900x.jpg?v=1702505294 900w,31-IC882TL_900x.jpg?v=1702505294 900w,,,Cap 800,31-IC882TL_900x.jpg?v=1702505294 900w,
b'IC-890 Black Star Coaster',31-IC890BS,,b'Round Hand Stenciled Coaster with Tall Timbers Design \n100% Natural Jute\n2 Sizes Available \nExtremely Durable\nLight Gray and Dark Gray',,,,,,,1,$ 1.25,,,,,1,Cap 400,Cap 160, //www.earthrugs.com/cdn/shop/files/31-IC890BS_900x.jpg?v=1702505360 900w,31-IC890BS_900x.jpg?v=1702505360 900w,,,Cap 800,31-IC890BS_900x.jpg?v=1702505360 900w,
b'IC-9-93 Cowboy Boot Coaster',31-IC9-093CB,,b'Round Hand Stenciled Coaster with Boot Design \n100% Natural Jute\n2 Sizes Available \nExtremely Durable\nBlack and Natural \nArt by Suzanne Pienta',,,,,,,1,$ 1.25,,,,,1,Cap 400,Cap 160, //www.earthrugs.com/cdn/shop/files/31-IC9-093CB_900x.jpg?v=1702505486 900w,31-IC9-093CB_900x.jpg?v=1702505486 900w,,,Cap 800,31-IC9-093CB_900x.jpg?v=1702505486 900w,
b'IC-9-93 Galloping Horse Coaster',31-IC9-093GH,,b'Round Hand Stenciled Coaster with Galloping Horse Design \n100% Natural Jute\n2 Sizes Available\nExtremely Durable\nBlack and Natural \nArt by Suzanne Pienta',,,,,,,1,$ 1.25,,,,,1,Cap 400,Cap 160, //www.earthrugs.com/cdn/shop/files/31-IC9-093GH_900x.jpg?v=1702505599 900w,31-IC9-093GH_900x.jpg?v=1702505599 900w,,,Cap 800,31-IC9-093GH_900x.jpg?v=1702505599 900w,
b'IC-9-93 Tan Cowboy Hat Coaster',31-IC9-093TCH,,b'Round Hand Stenciled Coaster with Tan Cowboy Hat Design \n100% Natural Jute\n2 Sizes Available\nExtremely Durable\nBlack and Natural \nArt by Suzanne Pienta',,,,,,,1,$ 1.25,,,,,1,Cap 400,Cap 160, //www.earthrugs.com/cdn/shop/files/31-IC9-093TCH_900x.jpg?v=1702505674 900w,31-IC9-093TCH_900x.jpg?v=1702505674 900w,,,Cap 800,31-IC9-093TCH_900x.jpg?v=1702505674 900w,
b'SCP-319 Burgundy Mama Bear Baby Bear Slice',32-319BMB,,"b'18""x29"" Hand Printed Slice Rug'",,,,,,,1,$ 16.77,,,,,1,Cap 400,Cap 160, //www.earthrugs.com/cdn/shop/files/SCP-319-MamaBearBabyBear-18x29slice-OnWood_900x.jpg?v=1703862697 900w,SCP-319-MamaBearBabyBear-18x29slice-OnWood_900x.jpg?v=1703862697 900w,,,Cap 800,SCP-319-MamaBearBabyBear-18x29slice-OnWood_900x.jpg?v=1703862697 900w,
b'SCP-419 Holiday Village Trees Slice',32-419HVT,,"b'18""x29"" Hand Printed Slice Rug'",,,,,,,1,$ 16.77,,,,,1,Cap 400,Cap 160, //www.earthrugs.com/cdn/shop/files/SCP-419-HolidayVillageTrees-18x29Slice-OnWood_900x.jpg?v=1703862708 900w,SCP-419-HolidayVillageTrees-18x29Slice-OnWood_900x.jpg?v=1703862708 900w,,,Cap 800,SCP-419-HolidayVillageTrees-18x29Slice-OnWood_900x.jpg?v=1703862708 900w,
b'HB-362 Breezy Blue/Taupe/Ivory Heart Shaped Basket',35-HBSM362,,b'3 Sizes Available',,,,,,,1,$ 6.25,,,,,1,Cap 400,Cap 160, //www.earthrugs.com/cdn/shop/files/HB-362-HeartShapeBasket-Group-OnWood_900x.jpg?v=1703803361 900w,HB-362-HeartShapeBasket-Group-OnWood_900x.jpg?v=1703803361 900w,,,Cap 800,HB-362-HeartShapeBasket-Group-OnWood_900x.jpg?v=1703803361 900w,
b'HB-413 Buttermilk/Cranberry Heart Shaped Basket',35-HBSM413,,b'3 Sizes Available',,,,,,,1,$ 6.25,,,,,1,Cap 400,Cap 160, //www.earthrugs.com/cdn/shop/files/HB-413-HeartShapeBasket-Group-OnWood_900x.jpg?v=1703803479 900w,HB-413-HeartShapeBasket-Group-OnWood_900x.jpg?v=1703803479 900w,,,Cap 800,HB-413-HeartShapeBasket-Group-OnWood_900x.jpg?v=1703803479 900w,
b'HB-776 Natural Heart Shaped Basket',35-HBSM776,,b'3 Sizes Available',,,,,,,1,$ 6.25,,,,,1,Cap 400,Cap 160, //www.earthrugs.com/cdn/shop/files/HB-776-HeartShapeBasket-Group-OnWood_900x.jpg?v=1703803522 900w,HB-776-HeartShapeBasket-Group-OnWood_900x.jpg?v=1703803522 900w,,,Cap 800,HB-776-HeartShapeBasket-Group-OnWood_900x.jpg?v=1703803522 900w,
b'HB-9-908 Crimson Heart Shaped Basket',35-HBSM9-908,,b'3 Sizes Available',,,,,,,1,$ 6.25,,,,,1,Cap 400,Cap 160, //www.earthrugs.com/cdn/shop/files/HB-9-908-HeartShapeBasket-Group-OnWood_900x.jpg?v=1703803563 900w,HB-9-908-HeartShapeBasket-Group-OnWood_900x.jpg?v=1703803563 900w,,,Cap 800,HB-9-908-HeartShapeBasket-Group-OnWood_900x.jpg?v=1703803563 900w,
b'CBP-910 Mama & Baby Bear Casserole Basket',36-CBP910MB,,"b'8""x3"" Round Casserole Basket\nArtwork by Jan Harless'",,,,,,,1,$ 8.50,,,,,1,Cap 400,Cap 160, //www.earthrugs.com/cdn/shop/files/CBP-910-MamaBearBabyBear-8_x3_Round-CasseroleBasket-OnWood_900x.jpg?v=1703802741 900w,CBP-910-MamaBearBabyBear-8_x3_Round-CasseroleBasket-OnWood_900x.jpg?v=1703802741 900w,,,Cap 800,CBP-910-MamaBearBabyBear-8_x3_Round-CasseroleBasket-OnWood_900x.jpg?v=1703802741 900w,
b'CBP-910 Pinecone Casserole Basket',36-CBP910P,,"b'8""x3"" Round Casserole Basket\nArtwork by Sandy Clough'",,,,,,,1,$ 8.50,,,,,1,Cap 400,Cap 160, //www.earthrugs.com/cdn/shop/files/CBP-910-Pinecone-8_x3_Round-CasseroleBasket-OnWood_900x.jpg?v=1703802753 900w,CBP-910-Pinecone-8_x3_Round-CasseroleBasket-OnWood_900x.jpg?v=1703802753 900w,,,Cap 800,CBP-910-Pinecone-8_x3_Round-CasseroleBasket-OnWood_900x.jpg?v=1703802753 900w,
b'OP-443 Anchor',65-443A,,b'Hand Stenciled Oval Patch Braided Rug\nArtwork by Harry W. Smith',,,,,,,1,$ 107.53,,,,,1,Cap 400,Cap 160, //www.earthrugs.com/cdn/shop/products/65-443A_2019_900x.jpg?v=1571272974 900w,65-443A_2019_900x.jpg?v=1571272974 900w,,,Cap 800,65-443A_2019_900x.jpg?v=1571272974 900w,
b'CH-880 Bee Happy Chair Pad',49-CH880BH,,"b'Hand Stenciled Jute Chair Pad With Bee Happy Design\n15.5"" Round\nSold Individually \nColor Matching Ties Attached\nYellow and Natural\nArt by Suazanne Pineta '",,,,,,,1,$ 7.53,,,,,1,Cap 400,Cap 160, //www.earthrugs.com/cdn/shop/files/CH-880-Bee-Happy-15.5-Round-OnWood_900x.jpg?v=1703802786 900w,CH-880-Bee-Happy-15.5-Round-OnWood_900x.jpg?v=1703802786 900w,,,Cap 800,CH-880-Bee-Happy-15.5-Round-OnWood_900x.jpg?v=1703802786 900w,
b'ST-OP-081 Moon & Star Snowman Stair Tread',49-ST081MSS,,"b'Hand Stenciled Oval Stair Tread with Moon & Star Snowman Design \n8.25""x27"" Oval\nSold Individually \n100% Natural Jute\nBurgundy, Black and Sage\nArtwork by Susan Burd'",,,,,,,1,$ 6.65,,,,,1,Cap 400,Cap 160, //www.earthrugs.com/cdn/shop/files/ST-OP-081-MoonandStarSnowman-8.25_x27_Oval-OnWood_900x.jpg?v=1703862770 900w,ST-OP-081-MoonandStarSnowman-8.25_x27_Oval-OnWood_900x.jpg?v=1703862770 900w,,,Cap 800,ST-OP-081-MoonandStarSnowman-8.25_x27_Oval-OnWood_900x.jpg?v=1703862770 900w,
b'ST-OP-081 Snowman with Top Hat Stair Tread',49-ST081STH,,"b'Hand Stenciled Oval Stair Tread with Snowman with Top Hat Design \n8.25""x27"" Oval\nSold Individually \n100% Natural Jute\nBurgundy, Black and Sage'",,,,,,,1,$ 6.65,,,,,1,Cap 400,Cap 160, //www.earthrugs.com/cdn/shop/files/ST-OP-81-SnowmanWithTopHat-8.25_x27_-Oval-OnWood_900x.jpg?v=1703862780 900w,ST-OP-81-SnowmanWithTopHat-8.25_x27_-Oval-OnWood_900x.jpg?v=1703862780 900w,,,Cap 800,ST-OP-81-SnowmanWithTopHat-8.25_x27_-Oval-OnWood_900x.jpg?v=1703862780 900w,
b'ST-OP-116 Fish Stair Tread',49-ST116F,,"b'Hand Stenciled Oval Stair Tread with Snowman with Top Hat Design \n8.25""x27"" Oval\nSold Individually \n100% Natural Jute\nBlack, Sage and Cream'",,,,,,,1,$ 6.65,,,,,1,Cap 400,Cap 160, //www.earthrugs.com/cdn/shop/files/ST-OP-116-Fish-8.25_x27_-Oval-OnWood_900x.jpg?v=1703862790 900w,ST-OP-116-Fish-8.25_x27_-Oval-OnWood_900x.jpg?v=1703862790 900w,,,Cap 800,ST-OP-116-Fish-8.25_x27_-Oval-OnWood_900x.jpg?v=1703862790 900w,
b'ST-OP-222 Pumpkin Crow Stair Tread',49-ST222PC,,"b'Hand Stenciled Oval Stair Tread with Pumpkin Crow Design \n8.25""x27"" Oval\nSold Individually \n100% Natural Jute\nBlack, Orange and Natural\nArtwork by Suzanne Pienta'",,,,,,,1,$ 6.65,,,,,1,Cap 400,Cap 160, //www.earthrugs.com/cdn/shop/files/ST-OP-222-PumpkinCrow-8.25_x27_-Oval-OnWood_900x.jpg?v=1703862801 900w,ST-OP-222-PumpkinCrow-8.25_x27_-Oval-OnWood_900x.jpg?v=1703862801 900w,,,Cap 800,ST-OP-222-PumpkinCrow-8.25_x27_-Oval-OnWood_900x.jpg?v=1703862801 900w,
b'ST-OP-396 Flannel Bear Stair Tread',49-ST396FB,,"b'Hand Stenciled Oval Stair Tread with Flannel Bear Design \n8.25""x27"" Oval\nSold Individually \n100% Natural Jute\nRed and Black\nArtwork by Sandy Clough'",,,,,,,1,$ 6.65,,,,,1,Cap 400,Cap 160, //www.earthrugs.com/cdn/shop/files/ST-OP-396-Flannel-Bear-8.25x27-OnWood_900x.jpg?v=1703862815 900w,ST-OP-396-Flannel-Bear-8.25x27-OnWood_900x.jpg?v=1703862815 900w,,,Cap 800,ST-OP-396-Flannel-Bear-8.25x27-OnWood_900x.jpg?v=1703862815 900w,
b'ST-OP-417 Red Plaid Deer Stair Tread',49-ST417RPD,,"b'Hand Stenciled Oval Stair Tread with Red Plaid Deer Design \n8.25""x27"" Oval\nSold Individually \n100% Natural Jute\nRed, White and Burgundy'",,,,,,,1,$ 6.65,,,,,1,Cap 400,Cap 160, //www.earthrugs.com/cdn/shop/files/ST-OP-417-Red-Plaid-Deer-8.25x27-OnWood_900x.jpg?v=1703862825 900w,ST-OP-417-Red-Plaid-Deer-8.25x27-OnWood_900x.jpg?v=1703862825 900w,,,Cap 800,ST-OP-417-Red-Plaid-Deer-8.25x27-OnWood_900x.jpg?v=1703862825 900w,
b'ST-OP-419 Holiday Village Trees Stair Tread',49-ST419HVT,,"b'Hand Stenciled Oval Stair Tread with Holiday Village Trees Design \n8.25""x27"" Oval\nSold Individually \n100% Natural Jute\nSage, Ivory and Blue\nArtwork by Sandy Clough'",,,,,,,1,$ 6.65,,,,,1,Cap 400,Cap 160, //www.earthrugs.com/cdn/shop/files/ST-OP-419-HolidayVillageTrees-8.25_x27_Oval-OnWood_900x.jpg?v=1703862833 900w,ST-OP-419-HolidayVillageTrees-8.25_x27_Oval-OnWood_900x.jpg?v=1703862833 900w,,,Cap 800,ST-OP-419-HolidayVillageTrees-8.25_x27_Oval-OnWood_900x.jpg?v=1703862833 900w,
b'ST-OP-602 Lab Pickup Stair Tread',49-ST602LP,,"b'Hand Stenciled Oval Stair Tread with Lab Pickup Design \n8.25""x27"" Oval\nSold Individually \n100% Natural Jute\nBurgundy, Black and Natural\nArtwork by Harry W. Smith'",,,,,,,1,$ 6.65,,,,,1,Cap 400,Cap 160, //www.earthrugs.com/cdn/shop/files/ST-OP-602-LabPickup-8.25_x27_-Oval-OnWood_900x.jpg?v=1703862843 900w,ST-OP-602-LabPickup-8.25_x27_-Oval-OnWood_900x.jpg?v=1703862843 900w,,,Cap 800,ST-OP-602-LabPickup-8.25_x27_-Oval-OnWood_900x.jpg?v=1703862843 900w,
b'ST-OP-701 Winter Gnome Stair Tread',49-ST701WG,,"b'Hand Stenciled Oval Stair Tread with Winter Gnome Design \n8.25""x27"" Oval\nSold Individually \n100% Natural Jute\nBlack & Light Blue\nArtwork by Harry W. Smith'",,,,,,,1,$ 6.65,,,,,1,Cap 400,Cap 160, //www.earthrugs.com/cdn/shop/files/ST-OP-701-WinterGnome-8.25_x27_Oval-OnWood_900x.jpg?v=1703862854 900w,ST-OP-701-WinterGnome-8.25_x27_Oval-OnWood_900x.jpg?v=1703862854 900w,,,Cap 800,ST-OP-701-WinterGnome-8.25_x27_Oval-OnWood_900x.jpg?v=1703862854 900w,
b'ST-OP-890 Black Star Stair Tread',49-ST890BS,,"b'Hand Stenciled Oval Stair Tread with Black Star Design \n8.25""x27"" Oval\nSold Individually \n100% Natural Jute\nLight Gray and Dark Gray'",,,,,,,1,$ 6.65,,,,,1,Cap 400,Cap 160, //www.earthrugs.com/cdn/shop/files/ST-OP-890-BlackStar-8.25_x27_-Oval-OnWood_900x.jpg?v=1703862868 900w,ST-OP-890-BlackStar-8.25_x27_-Oval-OnWood_900x.jpg?v=1703862868 900w,,,Cap 800,ST-OP-890-BlackStar-8.25_x27_-Oval-OnWood_900x.jpg?v=1703862868 900w,
b'ST-OP-891 Bloom Stair Tread',49-ST891B,,"b'Hand Stenciled Oval Stair Tread with Bloom Design \n8.25""x27"" Oval\nSold Individually \n100% Natural Jute\nPurple and Yellow'",,,,,,,1,$ 6.65,,,,,1,Cap 400,Cap 160, //www.earthrugs.com/cdn/shop/files/ST-OP-891-Bloom-8.25_x27_-Oval-OnWood_900x.jpg?v=1703862874 900w,ST-OP-891-Bloom-8.25_x27_-Oval-OnWood_900x.jpg?v=1703862874 900w,,,Cap 800,ST-OP-891-Bloom-8.25_x27_-Oval-OnWood_900x.jpg?v=1703862874 900w,
b'CTP-443 Fish',63-CP443F,,"b'14.5""x19.5"" Jute Braided Cat Shaped Rug\nArtwork by Susan Burd'",,,,,,,1,$ 7.65,,,,,1,Cap 400,Cap 160, //www.earthrugs.com/cdn/shop/files/CTP-443-Fish-CatShape-OnWood_900x.jpg?v=1703802940 900w,CTP-443-Fish-CatShape-OnWood_900x.jpg?v=1703802940 900w,,,Cap 800,CTP-443-Fish-CatShape-OnWood_900x.jpg?v=1703802940 900w,
b'CTB-890 Cat Bed',63-CTB890,,"b'14""x6"" Jute Braided Cat Bed\nLight Gray and Dark Gray'",,,,,,,1,$ 26.95,,,,,1,Cap 400,Cap 160, //www.earthrugs.com/cdn/shop/files/CTB-890-CatBasket-14_x6_Round-OnWood_900x.jpg?v=1703802898 900w,CTB-890-CatBasket-14_x6_Round-OnWood_900x.jpg?v=1703802898 900w,,,Cap 800,CTB-890-CatBasket-14_x6_Round-OnWood_900x.jpg?v=1703802898 900w,
b'DBP-890 Black Star',63-P890BS,,"b' Hand Stenciled Dog Bone Rug with Black Star Design \n18""x28""\nSold Individually \n100% Natural Jute\nLight Gray and Dark Gray'",,,,,,,1,$ 15.12,,,,,1,Cap 400,Cap 160, //www.earthrugs.com/cdn/shop/files/DBP-890-BlackStar-18_x28_-DogBone-OnWood_900x.jpg?v=1703803279 900w,DBP-890-BlackStar-18_x28_-DogBone-OnWood_900x.jpg?v=1703803279 900w,,,Cap 800,DBP-890-BlackStar-18_x28_-DogBone-OnWood_900x.jpg?v=1703803279 900w,
b'DBP-116 Life is Better',63-PSM116LB,,"b' Hand Stenciled Dog Bone Rug with Life is Better Design \n2 Sizes Available\nSold Individually \n100% Natural Jute\nCharcoal, Mustard & Natural '",,,,,,,1,$ 6.48,,,,,1,Cap 400,Cap 160, //www.earthrugs.com/cdn/shop/products/63-P116LB_900x.jpg?v=1672337306 900w,63-P116LB_900x.jpg?v=1672337306 900w,,,Cap 800,63-P116LB_900x.jpg?v=1672337306 900w,
b'DBP-222 Harvest Border',63-PSM222HB,,"b' Hand Stenciled Dog Bone Rug with Harvest Border Design \n2 Sizes Available\nSold Individually \n100% Natural Jute\nHarvest Orange, Brownstone & Wheat\nArt by Susan Burd '",,,,,,,1,$ 6.48,,,,,1,Cap 400,Cap 160, //www.earthrugs.com/cdn/shop/products/63-P222HB_900x.jpg?v=1672337702 900w,63-P222HB_900x.jpg?v=1672337702 900w,,,Cap 800,63-P222HB_900x.jpg?v=1672337702 900w,
b'DBP-313 Good Boy',63-PSM313GB,,b' Hand Stenciled Dog Bone Rug with Good Boy Design \n2 Sizes Available\nSold Individually \n100% Natural Jute\nMocha Frappuccino ',,,,,,,1,$ 6.48,,,,,1,Cap 400,Cap 160, //www.earthrugs.com/cdn/shop/products/63-P313GB_900x.jpg?v=1672337358 900w,63-P313GB_900x.jpg?v=1672337358 900w,,,Cap 800,63-P313GB_900x.jpg?v=1672337358 900w,
b'DBP-371 Good Girl',63-PSM371GG,,"b' Hand Stenciled Dog Bone Rug with Good Girl Design \n2 Sizes Available\nSold Individually \n100% Natural Jute\nBlack Cherry, Chocolate & Cream '",,,,,,,1,$ 6.48,,,,,1,Cap 400,Cap 160, //www.earthrugs.com/cdn/shop/products/63-P371GG_900x.jpg?v=1672337395 900w,63-P371GG_900x.jpg?v=1672337395 900w,,,Cap 800,63-P371GG_900x.jpg?v=1672337395 900w,
b'DBP-419 I Heart You',63-PSM419IHY,,"b' Hand Stenciled Dog Bone Rug with I Heart You Design \n2 Sizes Available \nSold Individually \n100% Natural Jute\nSage, Ivory & Settlers Blue'",,,,,,,1,$ 6.48,,,,,1,Cap 400,Cap 160, //www.earthrugs.com/cdn/shop/products/63-P419IHY_900x.jpg?v=1672337431 900w,63-P419IHY_900x.jpg?v=1672337431 900w,,,Cap 800,63-P419IHY_900x.jpg?v=1672337431 900w,
b'DBP-430 Graphic Moose',63-PSM430GM,,"b' Hand Stenciled Dog Bone Rug with Graphic Moose Design \n2 Sizes Available \nSold Individually \n100% Natural Jute\nBlack, White & Natural'",,,,,,,1,$ 6.48,,,,,1,Cap 400,Cap 160, //www.earthrugs.com/cdn/shop/products/63-P430GM_900x.jpg?v=1672337468 900w,63-P430GM_900x.jpg?v=1672337468 900w,,,Cap 800,63-P430GM_900x.jpg?v=1672337468 900w,
b'DBP-503 Olive Border',63-PSM503OB,,b' Hand Stenciled Dog Bone Rug with Olive Border Design \n2 Sizes Available\nSold Individually \n100% Natural Jute\nBlueberries & Cream ',,,,,,,1,$ 6.48,,,,,1,Cap 400,Cap 160, //www.earthrugs.com/cdn/shop/products/63-P503OB_900x.jpg?v=1672337497 900w,63-P503OB_900x.jpg?v=1672337497 900w,,,Cap 800,63-P503OB_900x.jpg?v=1672337497 900w,
