b'DBP-770 Hungry Dog',63-PSM770HD,,b' Hand Stenciled Dog Bone Rug with Hungry Dog Design \n2 Sizes Available \nSold Individually \n100% Natural Jute\nTan',,,,,,,1,$ 6.48,,,,,1,Cap 400,Cap 160, //www.earthrugs.com/cdn/shop/products/63-P770HD_900x.jpg?v=1672337545 900w,63-P770HD_900x.jpg?v=1672337545 900w,,,Cap 800,63-P770HD_900x.jpg?v=1672337545 900w,
b'OP-062 Bluebonnet',65-062B,,"b'20""x30"" Hand Stenciled Oval Patch Braided Rug\nArtwork by Harry W. Smith'",,,,,,,1,$ 18.92,,,,,1,Cap 400,Cap 160, //www.earthrugs.com/cdn/shop/files/OP-062-Bluebonnet-20_x30_Oval-OnWood_900x.jpg?v=1703862347 900w,OP-062-Bluebonnet-20_x30_Oval-OnWood_900x.jpg?v=1703862347 900w,,,Cap 800,OP-062-Bluebonnet-20_x30_Oval-OnWood_900x.jpg?v=1703862347 900w,
b'OP-319 Burgundy Mama Bear Baby Bear',65-319BMB,,"b'20""x30"" Hand Stenciled Oval Patch Braided Rug\nArtwork by Jan Harless'",,,,,,,1,$ 18.92,,,,,1,Cap 400,Cap 160, //www.earthrugs.com/cdn/shop/files/OP-319-MamaBearBabyBear-20_x30_Oval-OnWood_900x.jpg?v=1703862360 900w,OP-319-MamaBearBabyBear-20_x30_Oval-OnWood_900x.jpg?v=1703862360 900w,,,Cap 800,OP-319-MamaBearBabyBear-20_x30_Oval-OnWood_900x.jpg?v=1703862360 900w,
b'OP-319 Moose and Tree',65-319MT,,"b'20""x30"" Hand Stenciled Oval Patch Braided Rug'",,,,,,,1,$ 18.92,,,,,1,Cap 400,Cap 160, //www.earthrugs.com/cdn/shop/files/OP-319-MooseandTree-20_x30_Oval_GreenPlaidMoose_-OnWood_900x.jpg?v=1703862369 900w,OP-319-MooseandTree-20_x30_Oval_GreenPlaidMoose_-OnWood_900x.jpg?v=1703862369 900w,,,Cap 800,OP-319-MooseandTree-20_x30_Oval_GreenPlaidMoose_-OnWood_900x.jpg?v=1703862369 900w,
b'OP-395 Cabin Bear 2',65-395CB2,,"b'20""x30"" Hand Stenciled Oval Patch Braided Rug\nArtwork by Sandy Clough'",,,,,,,1,$ 18.92,,,,,1,Cap 400,Cap 160, //www.earthrugs.com/cdn/shop/files/OP-395-Cabin-Bear2-20x30-Oval-OnWood_900x.jpg?v=1703862381 900w,OP-395-Cabin-Bear2-20x30-Oval-OnWood_900x.jpg?v=1703862381 900w,,,Cap 800,OP-395-Cabin-Bear2-20x30-Oval-OnWood_900x.jpg?v=1703862381 900w,
b'OP-871 Native American',65-871NA,,"b'20""x30"" Hand Stenciled Oval Patch Braided Rug\nArtwork by Phyllis Stevens'",,,,,,,1,$ 18.92,,,,,1,Cap 400,Cap 160, //www.earthrugs.com/cdn/shop/files/OP-871-NativeAmerican-20_x30_-Oval-OnWood_900x.jpg?v=1703862392 900w,OP-871-NativeAmerican-20_x30_-Oval-OnWood_900x.jpg?v=1703862392 900w,,,Cap 800,OP-871-NativeAmerican-20_x30_-Oval-OnWood_900x.jpg?v=1703862392 900w,
b'OP-872 Desert Dwellers',65-872DD,,"b'20""x30"" Hand Stenciled Oval Patch Braided Rug\nArtwork by Phyllis Stevens'",,,,,,,1,$ 18.92,,,,,1,Cap 400,Cap 160, //www.earthrugs.com/cdn/shop/files/OP-872-DesertDwellers-20_x30_-Oval-OnWood_900x.jpg?v=1703862454 900w,OP-872-DesertDwellers-20_x30_-Oval-OnWood_900x.jpg?v=1703862454 900w,,,Cap 800,OP-872-DesertDwellers-20_x30_-Oval-OnWood_900x.jpg?v=1703862454 900w,
b'OP-890 Black Stars',65-890BS,,"b'20""x30"" Hand Stenciled Oval Patch Braided Rug'",,,,,,,1,$ 18.92,,,,,1,Cap 400,Cap 160, //www.earthrugs.com/cdn/shop/files/OP-890-BlackStar-20_x30_Oval-OnWood_900x.jpg?v=1703862465 900w,OP-890-BlackStar-20_x30_Oval-OnWood_900x.jpg?v=1703862465 900w,,,Cap 800,OP-890-BlackStar-20_x30_Oval-OnWood_900x.jpg?v=1703862465 900w,
b'RP-430 Bear Scene',66-430BS,,"b'27""x27"" Hand Stenciled Round Patch Rug'",,,,,,,1,$ 21.45,,,,,1,Cap 400,Cap 160, //www.earthrugs.com/cdn/shop/files/RP-430-BearScene-27Round-OnWood_900x.jpg?v=1703862652 900w,RP-430-BearScene-27Round-OnWood_900x.jpg?v=1703862652 900w,,,Cap 800,RP-430-BearScene-27Round-OnWood_900x.jpg?v=1703862652 900w,
b'RP-880 Welcome Home',66-880WH,,"b'27""x27"" Hand Stenciled Round Patch Rug\nArtwork by Suzanne Pienta'",,,,,,,1,$ 21.45,,,,,1,Cap 400,Cap 160, //www.earthrugs.com/cdn/shop/files/RP-880-WelcomeHome-27-Round-OnWood_1_900x.jpg?v=1703862661 900w,RP-880-WelcomeHome-27-Round-OnWood_1_900x.jpg?v=1703862661 900w,,,Cap 800,RP-880-WelcomeHome-27-Round-OnWood_1_900x.jpg?v=1703862661 900w,
b'PP-116 Fish',67-116F,,"b'20""x30"" Hand Stenciled Oblong Print Patch Rug'",,,,,,,1,$ 21.45,,,,,1,Cap 400,Cap 160, //www.earthrugs.com/cdn/shop/files/PP-116-Fish-20_x30_-Rectangle-OnWood_900x.jpg?v=1703862585 900w,PP-116-Fish-20_x30_-Rectangle-OnWood_900x.jpg?v=1703862585 900w,,,Cap 800,PP-116-Fish-20_x30_-Rectangle-OnWood_900x.jpg?v=1703862585 900w,
b'PP-319 Burgundy Mama Bear Baby Bear',67-319BMB,,"b'20""x30"" Hand Stenciled Oblong Print Patch Rug\nArtwork by Jan Harless'",,,,,,,1,$ 21.45,,,,,1,Cap 400,Cap 160, //www.earthrugs.com/cdn/shop/files/PP-319-Burgundy-MamaBearBabyBear-20_x30_Rect-OnWood_900x.jpg?v=1703862595 900w,PP-319-Burgundy-MamaBearBabyBear-20_x30_Rect-OnWood_900x.jpg?v=1703862595 900w,,,Cap 800,PP-319-Burgundy-MamaBearBabyBear-20_x30_Rect-OnWood_900x.jpg?v=1703862595 900w,
b'PP-319 Moose and Tree',67-319MT,,"b'20""x30"" Hand Stenciled Oblong Print Patch Rug'",,,,,,,1,$ 21.45,,,,,1,Cap 400,Cap 160, //www.earthrugs.com/cdn/shop/files/PP-319-MooseandTree-20_x30_Rect_GreenPlaidMoose_-OnWood_900x.jpg?v=1703862601 900w,PP-319-MooseandTree-20_x30_Rect_GreenPlaidMoose_-OnWood_900x.jpg?v=1703862601 900w,,,Cap 800,PP-319-MooseandTree-20_x30_Rect_GreenPlaidMoose_-OnWood_900x.jpg?v=1703862601 900w,
"b'OP-890 Black Stars 13""x36""'",68-890BS,,"b'Hand Stenciled Oval Table Runner with Black Stars Design \n13""x36"" Oval \nSold Individually \n100% Natural Jute\nMocha Frappuccino '",,,,,,,1,$ 13.86,,,,,1,Cap 400,Cap 160, //www.earthrugs.com/cdn/shop/files/OP-890-BlackStar-13x36-Oval-OnWood_900x.jpg?v=1703862283 900w,OP-890-BlackStar-13x36-Oval-OnWood_900x.jpg?v=1703862283 900w,,,Cap 800,OP-890-BlackStar-13x36-Oval-OnWood_900x.jpg?v=1703862283 900w,
b'LC-001 Howling Wolf Large Coaster',79-001HW,,"b'7"" Round Hand Stenciled Coaster with Howling Wolf Design \n100% Natural Jute\nExtremely Durable\nBlack'",,,,,,,1,$ 2.73,,,,,1,Cap 400,Cap 160, //www.earthrugs.com/cdn/shop/files/79-001HW_900x.jpg?v=1702677708 900w,79-001HW_900x.jpg?v=1702677708 900w,,,Cap 800,79-001HW_900x.jpg?v=1702677708 900w,
b'IC-081 Pinecone Coaster',31-IC081P,,"b'5"" Round Hand Stenciled Coaster with Pinecone Design \n100% Natural Jute\nSold Individually \nExtremely Durable\nBurgundy, Black and Sage\nArt by Sandy Clough '",,,,,,,1,$ 2.73,,,,,1,Cap 400,Cap 160, //www.earthrugs.com/cdn/shop/products/31-IC081P_900x.jpg?v=1571272938 900w,31-IC081P_900x.jpg?v=1571272938 900w,,,Cap 800,31-IC081P_900x.jpg?v=1571272938 900w,
b'IC-081 Plant Kindness Coaster',31-IC081PK,,"b'Round Hand Stenciled Coaster with Plant Kindness Design \n100% Natural Jute\n2 Sizes Available \nExtremely Durable\nBurgundy, Black and Sage\nArt by Susan Burd'",,,,,,,1,$ 2.73,,,,,1,Cap 400,Cap 160, //www.earthrugs.com/cdn/shop/products/31-IC081PK_900x.jpg?v=1672258330 900w,31-IC081PK_900x.jpg?v=1672258330 900w,,,Cap 800,31-IC081PK_900x.jpg?v=1672258330 900w,
b'LC-129 Caribou Large Coaster',79-129C,,"b'7"" Round Hand Stenciled Coaster with Caribou Design \n100% Natural Jute\nExtremely Durable\nBrown and Natural'",,,,,,,1,$ 2.73,,,,,1,Cap 400,Cap 160, //www.earthrugs.com/cdn/shop/files/79-129C_900x.jpg?v=1702677912 900w,79-129C_900x.jpg?v=1702677912 900w,,,Cap 800,79-129C_900x.jpg?v=1702677912 900w,
b'LC-129 Sloth Large Coaster',79-129S,,"b'7"" Round Hand Stenciled Coaster with Sloth Design \n100% Natural Jute\nExtremely Durable\nBrown and Natural'",,,,,,,1,$ 2.73,,,,,1,Cap 400,Cap 160, //www.earthrugs.com/cdn/shop/files/79-129S_900x.jpg?v=1702678000 900w,79-129S_900x.jpg?v=1702678000 900w,,,Cap 800,79-129S_900x.jpg?v=1702678000 900w,
b'IC-238 Cape Cod Coaster',31-IC238CC,,b'Round Hand Stenciled Coaster with Cape Cod Design \n100% Natural Jute\n2 Sizes Available \nExtremely Durable\nGray and Black\nArt by Harry W. Smith ',,,,,,,1,$ 1.36,,,,,1,Cap 400,Cap 160, //www.earthrugs.com/cdn/shop/products/31-IC238CC_900x.jpg?v=1612219989 900w,31-IC238CC_900x.jpg?v=1612219989 900w,,,Cap 800,31-IC238CC_900x.jpg?v=1612219989 900w,
b'LC-417 Flower Power Large Coaster',79-417FP,,"b'7"" Round Hand Stenciled Coaster with Flower Power Design \n100% Natural Jute\nExtremely Durable\nRed, White and Burgundy\nArtwork by Suzanne Pienta'",,,,,,,1,$ 2.73,,,,,1,Cap 400,Cap 160, //www.earthrugs.com/cdn/shop/files/79-417FP_900x.jpg?v=1702678305 900w,79-417FP_900x.jpg?v=1702678305 900w,,,Cap 800,79-417FP_900x.jpg?v=1702678305 900w,
b'LC-417 Holly Berries Large Coaster',79-417HB,,"b'7"" Round Hand Stenciled Coaster with Holly Berries Design \n100% Natural Jute\nExtremely Durable\nRed, White and Burgundy'",,,,,,,1,$ 2.73,,,,,1,Cap 400,Cap 160, //www.earthrugs.com/cdn/shop/files/79-417HB_900x.jpg?v=1702678369 900w,79-417HB_900x.jpg?v=1702678369 900w,,,Cap 800,79-417HB_900x.jpg?v=1702678369 900w,
b'LC-430 Bear Scene Large Coaster',79-430BS,,"b'7"" Round Hand Stenciled Coaster with Bear Scene Design \n100% Natural Jute\nExtremely Durable\nBlack and White'",,,,,,,1,$ 2.73,,,,,1,Cap 400,Cap 160, //www.earthrugs.com/cdn/shop/files/79-430BS_900x.jpg?v=1702678422 900w,79-430BS_900x.jpg?v=1702678422 900w,,,Cap 800,79-430BS_900x.jpg?v=1702678422 900w,
b'LC-430 Pelican Large Coaster',79-430PE,,"b'7"" Round Hand Stenciled Coaster with Pelican Design \n100% Natural Jute\nExtremely Durable\nBlack and Cream'",,,,,,,1,$ 2.73,,,,,1,Cap 400,Cap 160, //www.earthrugs.com/cdn/shop/products/79-430PE_900x.jpg?v=1672349080 900w,79-430PE_900x.jpg?v=1672349080 900w,,,Cap 800,79-430PE_900x.jpg?v=1672349080 900w,
b'LC-508 Red Poinsettias Large Coaster',79-508RP,,"b'7"" Round Hand Stenciled Coaster with Red Poinsettias Design \n100% Natural Jute\nExtremely Durable\nGreen and Red\nArtwork by Suzanne Pienta'",,,,,,,1,$ 2.73,,,,,1,Cap 400,Cap 160, //www.earthrugs.com/cdn/shop/files/79-508RP_900x.jpg?v=1702678777 900w,79-508RP_900x.jpg?v=1702678777 900w,,,Cap 800,79-508RP_900x.jpg?v=1702678777 900w,
b'LC-717 Wildlife Bluebird Large Coaster',79-717WB,,"b'7"" Round Hand Stenciled Coaster with Wildlife Bluebird Design \n100% Natural Jute\nExtremely Durable\nRed and Burgundy\nArtwork by Phyllis Stevens'",,,,,,,1,$ 2.73,,,,,1,Cap 400,Cap 160, //www.earthrugs.com/cdn/shop/files/79-717WB_900x.jpg?v=1702678938 900w,79-717WB_900x.jpg?v=1702678938 900w,,,Cap 800,79-717WB_900x.jpg?v=1702678938 900w,
b'LC-717 Wildlife Cardinal Large Coaster',79-717WC,,"b'7"" Round Hand Stenciled Coaster with Wildlife Cardinal Design \n100% Natural Jute\nExtremely Durable\nRed and Burgundy\nArtwork by Phyllis Stevens'",,,,,,,1,$ 2.73,,,,,1,Cap 400,Cap 160, //www.earthrugs.com/cdn/shop/files/79-717WC_900x.jpg?v=1702679083 900w,79-717WC_900x.jpg?v=1702679083 900w,,,Cap 800,79-717WC_900x.jpg?v=1702679083 900w,
b'LC-717 Wildlife Chickadee Large Coaster',79-717WCH,,"b'7"" Round Hand Stenciled Coaster with Wildlife Chickadee Design \n100% Natural Jute\nExtremely Durable\nRed and Burgundy\nArtwork by Phyllis Stevens'",,,,,,,1,$ 2.73,,,,,1,Cap 400,Cap 160, //www.earthrugs.com/cdn/shop/files/79-717WCH_900x.jpg?v=1702679121 900w,79-717WCH_900x.jpg?v=1702679121 900w,,,Cap 800,79-717WCH_900x.jpg?v=1702679121 900w,
b'LC-717 Wildlife Hummingbird Large Coaster',79-717WH,,"b'7"" Round Hand Stenciled Coaster with Wildlife Hummingbird Design \n100% Natural Jute\nExtremely Durable\nRed and Burgundy\nArtwork by Phyllis Stevens'",,,,,,,1,$ 2.73,,,,,1,Cap 400,Cap 160, //www.earthrugs.com/cdn/shop/files/79-717WH_900x.jpg?v=1702679155 900w,79-717WH_900x.jpg?v=1702679155 900w,,,Cap 800,79-717WH_900x.jpg?v=1702679155 900w,
b'LC-717 Wildlife Oriole Large Coaster',79-717WO,,"b'7"" Round Hand Stenciled Coaster with Wildlife Oriole Design \n100% Natural Jute\nExtremely Durable\nRed and Burgundy\nArtwork by Phyllis Stevens'",,,,,,,1,$ 2.73,,,,,1,Cap 400,Cap 160, //www.earthrugs.com/cdn/shop/files/79-717WO_900x.jpg?v=1702679239 900w,79-717WO_900x.jpg?v=1702679239 900w,,,Cap 800,79-717WO_900x.jpg?v=1702679239 900w,
b'LC-717 Wildlife Robin Large Coaster',79-717WR,,"b'7"" Round Hand Stenciled Coaster with Wildlife Robin Design \n100% Natural Jute\nExtremely Durable\nRed and Burgundy\nArtwork by Phyllis Stevens'",,,,,,,1,$ 2.73,,,,,1,Cap 400,Cap 160, //www.earthrugs.com/cdn/shop/files/79-717WR_900x.jpg?v=1702679269 900w,79-717WR_900x.jpg?v=1702679269 900w,,,Cap 800,79-717WR_900x.jpg?v=1702679269 900w,
b'LC-717 Wildlife Woodpecker Large Coaster',79-717WW,,"b'7"" Round Hand Stenciled Coaster with Wildlife Woodpecker Design \n100% Natural Jute\nExtremely Durable\nRed and Burgundy\nArtwork by Phyllis Stevens'",,,,,,,1,$ 2.73,,,,,1,Cap 400,Cap 160, //www.earthrugs.com/cdn/shop/files/79-717WW_900x.jpg?v=1702679300 900w,79-717WW_900x.jpg?v=1702679300 900w,,,Cap 800,79-717WW_900x.jpg?v=1702679300 900w,
b'LC-865 Ruby Throated Hummingbird Large Coaster',79-865RTH,,"b'7"" Round Hand Stenciled Coaster with Ruby Throated Hummingbird Design \n100% Natural Jute\nExtremely Durable\nGreen and Taupe'",,,,,,,1,$ 2.73,,,,,1,Cap 400,Cap 160, //www.earthrugs.com/cdn/shop/files/79-865RTH_900x.jpg?v=1702679611 900w,79-865RTH_900x.jpg?v=1702679611 900w,,,Cap 800,79-865RTH_900x.jpg?v=1702679611 900w,
b'LC-868 Blue Whale Large Coaster',79-868BW,,"b'7"" Round Hand Stenciled Coaster with Blue Whale Design \n100% Natural Jute\nExtremely Durable\nBlue and White'",,,,,,,1,$ 2.73,,,,,1,Cap 400,Cap 160, //www.earthrugs.com/cdn/shop/files/79-868BW_900x.jpg?v=1702679803 900w,79-868BW_900x.jpg?v=1702679803 900w,,,Cap 800,79-868BW_900x.jpg?v=1702679803 900w,
b'LC-874 Dahlia Large Coaster',79-874D,,"b'7"" Round Hand Stenciled Coaster with Dahlia Design \n100% Natural Jute\nExtremely Durable\nRed and White'",,,,,,,1,$ 2.73,,,,,1,Cap 400,Cap 160, //www.earthrugs.com/cdn/shop/files/79-874D_900x.jpg?v=1702679886 900w,79-874D_900x.jpg?v=1702679886 900w,,,Cap 800,79-874D_900x.jpg?v=1702679886 900w,
b'LC-875 Candy Cane Mitten Large Coaster',79-875CCM,,"b'7"" Round Hand Stenciled Coaster with Candy Cane Mitten Design \n100% Natural Jute\nExtremely Durable\nRed and Green\nArtwork by Suzanne Pienta'",,,,,,,1,$ 2.73,,,,,1,Cap 400,Cap 160, //www.earthrugs.com/cdn/shop/files/79-875CCM_900x.jpg?v=1702679946 900w,79-875CCM_900x.jpg?v=1702679946 900w,,,Cap 800,79-875CCM_900x.jpg?v=1702679946 900w,
b'LC-875 Red Mitten Large Coaster',79-875RM,,"b'7"" Round Hand Stenciled Coaster with Red Mitten Design \n100% Natural Jute\nExtremely Durable\nRed and Green\nArtwork by Suzanne Pienta'",,,,,,,1,$ 2.73,,,,,1,Cap 400,Cap 160, //www.earthrugs.com/cdn/shop/files/79-875RM_900x.jpg?v=1702680027 900w,79-875RM_900x.jpg?v=1702680027 900w,,,Cap 800,79-875RM_900x.jpg?v=1702680027 900w,
b'LC-875 Snowman Mitten Large Coaster',79-875SM,,"b'7"" Round Hand Stenciled Coaster with Red Mitten Design \n100% Natural Jute\nExtremely Durable\nRed and Green\nArtwork by Suzanne Pienta'",,,,,,,1,$ 2.73,,,,,1,Cap 400,Cap 160, //www.earthrugs.com/cdn/shop/files/79-875SM_900x.jpg?v=1702680054 900w,79-875SM_900x.jpg?v=1702680054 900w,,,Cap 800,79-875SM_900x.jpg?v=1702680054 900w,
b'LC-880 Let It Bee Large Coaster',79-880LB,,"b'7"" Round Hand Stenciled Coaster with Let It Bee Design \n100% Natural Jute\nExtremely Durable\nYellow and White\nArtwork by Suzanne Pienta'",,,,,,,1,$ 2.73,,,,,1,Cap 400,Cap 160, //www.earthrugs.com/cdn/shop/files/79-880LB_900x.jpg?v=1702680098 900w,79-880LB_900x.jpg?v=1702680098 900w,,,Cap 800,79-880LB_900x.jpg?v=1702680098 900w,
b'LC-882 Sunflower In Pot Large Coaster',79-882SP,,"b'7"" Round Hand Stenciled Coaster with Sunflower In Pot Design \n100% Natural Jute\nExtremely Durable\nRed and Gray\nArtwork by Suzanne Pienta'",,,,,,,1,$ 2.73,,,,,1,Cap 400,Cap 160, //www.earthrugs.com/cdn/shop/files/79-882SP_900x.jpg?v=1702680161 900w,79-882SP_900x.jpg?v=1702680161 900w,,,Cap 800,79-882SP_900x.jpg?v=1702680161 900w,
b'LC-883 Pink Flowers In Pot Large Coaster',79-883PF,,"b'7"" Round Hand Stenciled Coaster with Pink Flowers In Pot Design \n100% Natural Jute\nExtremely Durable\nPink and Yellow\nArtwork by Suzanne Pienta'",,,,,,,1,$ 2.73,,,,,1,Cap 400,Cap 160, //www.earthrugs.com/cdn/shop/files/79-883PF_900x.jpg?v=1702680240 900w,79-883PF_900x.jpg?v=1702680240 900w,,,Cap 800,79-883PF_900x.jpg?v=1702680240 900w,
b'LC-884 Pumpkin Large Coaster',79-884P,,"b'7"" Round Hand Stenciled Coaster with Pumpkin Design \n100% Natural Jute\nExtremely Durable\nBrown and Orange'",,,,,,,1,$ 2.73,,,,,1,Cap 400,Cap 160, //www.earthrugs.com/cdn/shop/files/79-884P_900x.jpg?v=1702680291 900w,79-884P_900x.jpg?v=1702680291 900w,,,Cap 800,79-884P_900x.jpg?v=1702680291 900w,
b'LC-885 Dolphin Large Coaster',79-885D,,"b'7"" Round Hand Stenciled Coaster with Dolphin Design \n100% Natural Jute\nExtremely Durable\nLight Blue and Dark Blue'",,,,,,,1,$ 2.73,,,,,1,Cap 400,Cap 160, //www.earthrugs.com/cdn/shop/files/79-885D_900x.jpg?v=1702680352 900w,79-885D_900x.jpg?v=1702680352 900w,,,Cap 800,79-885D_900x.jpg?v=1702680352 900w,
b'LC-9-093 Bucking Cowboy Large Coaster',79-9-093BC,,"b'7"" Round Hand Stenciled Coaster with Bucking Cowboy Design \n100% Natural Jute\nExtremely Durable\nBlack and Gray\nArtwork by Suzanne Pienta'",,,,,,,1,$ 2.73,,,,,1,Cap 400,Cap 160, //www.earthrugs.com/cdn/shop/files/79-9-093BC_900x.jpg?v=1702680458 900w,79-9-093BC_900x.jpg?v=1702680458 900w,,,Cap 800,79-9-093BC_900x.jpg?v=1702680458 900w,
b'MSPR-001 Howling Wolf Trivet',80-001HW,,"b'10"" Round Printed Trivet with Howling Wolf Design \n100% Natural Jute\nSold Individually \nBlack'",,,,,,,1,$ 3.99,,,,,1,Cap 400,Cap 160, //www.earthrugs.com/cdn/shop/files/MSPR-001-FullMoonWolf-10_Round-OnWood_900x.jpg?v=1703861509 900w,MSPR-001-FullMoonWolf-10_Round-OnWood_900x.jpg?v=1703861509 900w,,,Cap 800,MSPR-001-FullMoonWolf-10_Round-OnWood_900x.jpg?v=1703861509 900w,
b'MSPR-015 American Saddle Trivet',80-015AMS,,"b'10"" Round Printed Trivet with American Saddle Design \n100% Natural Jute\nSold Individually \nRed, White and Blue\nArt by Suzanne Pienta'",,,,,,,1,$ 3.99,,,,,1,Cap 400,Cap 160, //www.earthrugs.com/cdn/shop/files/MSPR-015-AmericanSaddle-10_-Round-OnWood_900x.jpg?v=1703861521 900w,MSPR-015-AmericanSaddle-10_-Round-OnWood_900x.jpg?v=1703861521 900w,,,Cap 800,MSPR-015-AmericanSaddle-10_-Round-OnWood_900x.jpg?v=1703861521 900w,
b'MSPR-043 Horse Silhouette Trivet',80-043HS,,"b'10"" Round Printed Trivet with Horse Silhouette Design \n100% Natural Jute\nSold Individually \nBlack, Gold and Natural '",,,,,,,1,$ 3.99,,,,,1,Cap 400,Cap 160, //www.earthrugs.com/cdn/shop/files/MSPR-043-HorseSilhoette-10_-Round-OnWood_900x.jpg?v=1703861536 900w,MSPR-043-HorseSilhoette-10_-Round-OnWood_900x.jpg?v=1703861536 900w,,,Cap 800,MSPR-043-HorseSilhoette-10_-Round-OnWood_900x.jpg?v=1703861536 900w,
b'MSPR-081 Holiday Floral Trivet',80-081HF,,"b'10"" Round Printed Trivet with Holiday Floral Design \n100% Natural Jute\nSold Individually\nBurgundy, Black and Sage\nArtwork by Phyllis Stevens'",,,,,,,1,$ 3.99,,,,,1,Cap 400,Cap 160, //www.earthrugs.com/cdn/shop/files/MSPR-81-Holiday-Floral-10_-OnWood_900x.jpg?v=1703861554 900w,MSPR-81-Holiday-Floral-10_-OnWood_900x.jpg?v=1703861554 900w,,,Cap 800,MSPR-81-Holiday-Floral-10_-OnWood_900x.jpg?v=1703861554 900w,
b'MSPR-081 Labs in Canoe Trivet',80-081LC,,"b'10"" Round Printed Trivet with Labs in Canoe Design \n100% Natural Jute\nSold Individually\nBurgundy, Black and Sage\nArtwork by Harry W. Smith'",,,,,,,1,$ 3.99,,,,,1,Cap 400,Cap 160, //www.earthrugs.com/cdn/shop/files/MSPR-81-LabsinCanoe-10_-Round-OnWood_900x.jpg?v=1703861563 900w,MSPR-81-LabsinCanoe-10_-Round-OnWood_900x.jpg?v=1703861563 900w,,,Cap 800,MSPR-81-LabsinCanoe-10_-Round-OnWood_900x.jpg?v=1703861563 900w,
b'MSPR-116 Green Plaid Bear Trivet',80-116GPB,,"b'10"" Round Printed Trivet with Green Plaid Bear Design \n100% Natural Jute\nSold Individually \nBlack, Sage and Cream'",,,,,,,1,$ 3.99,,,,,1,Cap 400,Cap 160, //www.earthrugs.com/cdn/shop/files/80-116GPB_900x.jpg?v=1703873449 900w,80-116GPB_900x.jpg?v=1703873449 900w,,,Cap 800,80-116GPB_900x.jpg?v=1703873449 900w,
b'MSPR-116 Green Plaid Moose Trivet',80-116GPM,,"b'10"" Round Printed Trivet with Green Plaid Moose Design \n100% Natural Jute\nSold Individually \nBlack, Sage and Cream'",,,,,,,1,$ 3.99,,,,,1,Cap 400,Cap 160, //www.earthrugs.com/cdn/shop/files/80-116GPM_900x.jpg?v=1703873412 900w,80-116GPM_900x.jpg?v=1703873412 900w,,,Cap 800,80-116GPM_900x.jpg?v=1703873412 900w,
b'MSPR-129 Caribou Trivet',80-129C,,"b'10"" Round Printed Trivet with Caribou Design \n100% Natural Jute\nSold Individually\nBrown and Natural'",,,,,,,1,$ 3.99,,,,,1,Cap 400,Cap 160, //www.earthrugs.com/cdn/shop/files/MSPR-129-Caribou-10_-Round-OnWood_900x.jpg?v=1703861602 900w,MSPR-129-Caribou-10_-Round-OnWood_900x.jpg?v=1703861602 900w,,,Cap 800,MSPR-129-Caribou-10_-Round-OnWood_900x.jpg?v=1703861602 900w,
b'MSPR-129 Grizzly Bear Trivet',80-129GB,,"b'10"" Round Printed Trivet with Grizzly Bear Design \n100% Natural Jute\nSold Individually\nBrown and Natural'",,,,,,,1,$ 3.99,,,,,1,Cap 400,Cap 160, //www.earthrugs.com/cdn/shop/files/MSPR-129-GrizzlyBear-10_Round-OnWood_900x.jpg?v=1703861613 900w,MSPR-129-GrizzlyBear-10_Round-OnWood_900x.jpg?v=1703861613 900w,,,Cap 800,MSPR-129-GrizzlyBear-10_Round-OnWood_900x.jpg?v=1703861613 900w,
b'MSPR-129 Sloth Trivet',80-129S,,"b'10"" Round Printed Trivet with Sloth Design \n100% Natural Jute\nSold Individually\nBrown and Natural'",,,,,,,1,$ 3.99,,,,,1,Cap 400,Cap 160, //www.earthrugs.com/cdn/shop/files/MSPR-129-Sloth-10_-Round-OnWood_900x.jpg?v=1703861623 900w,MSPR-129-Sloth-10_-Round-OnWood_900x.jpg?v=1703861623 900w,,,Cap 800,MSPR-129-Sloth-10_-Round-OnWood_900x.jpg?v=1703861623 900w,
b'MSPR-328 Amaryllis Trivet',80-328A,,"b'10"" Round Printed Trivet with Amaryllis Design \n100% Natural Jute\nSold Individually \nMulti Color \nArt by Harry W. Smith '",,,,,,,1,$ 3.99,,,,,1,Cap 400,Cap 160, //www.earthrugs.com/cdn/shop/files/MSPR-328-Amarylliustrivet-10_-Round-OnWood_900x.jpg?v=1703861649 900w,MSPR-328-Amarylliustrivet-10_-Round-OnWood_900x.jpg?v=1703861649 900w,,,Cap 800,MSPR-328-Amarylliustrivet-10_-Round-OnWood_900x.jpg?v=1703861649 900w,
b'MSPR-395 Camper Trivet',80-395CA,,"b'10"" Round Printed Trivet with Camper Design \n100% Natural Jute\nSold Individually \nBurgundy and Black\nArt by Harry W. Smith'",,,,,,,1,$ 3.99,,,,,1,Cap 400,Cap 160, //www.earthrugs.com/cdn/shop/files/MSPR-395-Camper-10_-Round-OnWood_900x.jpg?v=1703861664 900w,MSPR-395-Camper-10_-Round-OnWood_900x.jpg?v=1703861664 900w,,,Cap 800,MSPR-395-Camper-10_-Round-OnWood_900x.jpg?v=1703861664 900w,
b'MSPR-396 Flannel Bear Trivet',80-396FB,,"b'10"" Round Printed Trivet with Flannel Bear Design \n100% Natural Jute\nSold Individually \nRed and Black\nArtwork by Sandy Clough'",,,,,,,1,$ 3.99,,,,,1,Cap 400,Cap 160, //www.earthrugs.com/cdn/shop/files/80-396FB_900x.jpg?v=1703873464 900w,80-396FB_900x.jpg?v=1703873464 900w,,,Cap 800,80-396FB_900x.jpg?v=1703873464 900w,
b'MSPR-417 Covered Bridge Trivet',80-417CB,,"b'10"" Round Printed Trivet with Covered Bridge Design \n100% Natural Jute\nSold Individually \nRed, White and Burgundy\nArt by Harry W. Smith'",,,,,,,1,$ 3.99,,,,,1,Cap 400,Cap 160, //www.earthrugs.com/cdn/shop/files/MSPR-417-Covered-Bridge-10_-OnWood_900x.jpg?v=1703861679 900w,MSPR-417-Covered-Bridge-10_-OnWood_900x.jpg?v=1703861679 900w,,,Cap 800,MSPR-417-Covered-Bridge-10_-OnWood_900x.jpg?v=1703861679 900w,
b'MSPR-417 Flower Power Trivet',80-417FP,,"b'10"" Round Printed Trivet with Flower Power Design \n100% Natural Jute\nSold Individually \nRed, White and Burgundy\nArt by Suzanne Pienta'",,,,,,,1,$ 3.99,,,,,1,Cap 400,Cap 160, //www.earthrugs.com/cdn/shop/files/MSPR-417-FlowerPower-10_-Round-OnWood_900x.jpg?v=1703861690 900w,MSPR-417-FlowerPower-10_-Round-OnWood_900x.jpg?v=1703861690 900w,,,Cap 800,MSPR-417-FlowerPower-10_-Round-OnWood_900x.jpg?v=1703861690 900w,
b'MSPR-417 Holly Berries Trivet',80-417HOB,,"b'10"" Round Printed Trivet with Holly Berries Design \n100% Natural Jute\nSold Individually \nRed, White and Burgundy'",,,,,,,1,$ 3.99,,,,,1,Cap 400,Cap 160, //www.earthrugs.com/cdn/shop/files/MSPR-417-Hollyberries-10_Round-OnWood_900x.jpg?v=1703861778 900w,MSPR-417-Hollyberries-10_Round-OnWood_900x.jpg?v=1703861778 900w,,,Cap 800,MSPR-417-Hollyberries-10_Round-OnWood_900x.jpg?v=1703861778 900w,
b'MSPR-417 Red Adirondack Chair Trivet',80-417RAC,,"b'10"" Round Printed Trivet with Red Adirondack Chair Design \n100% Natural Jute\nSold Individually \nRed, White and Burgundy'",,,,,,,1,$ 3.99,,,,,1,Cap 400,Cap 160, //www.earthrugs.com/cdn/shop/files/80-417RAC_900x.jpg?v=1703873743 900w,80-417RAC_900x.jpg?v=1703873743 900w,,,Cap 800,80-417RAC_900x.jpg?v=1703873743 900w,
b'MSPR-417 Red Plaid Deer Trivet',80-417RPD,,"b'10"" Round Printed Trivet with Red Plaid Deer Design \n100% Natural Jute\nSold Individually \nRed, Black & Natural '",,,,,,,1,$ 3.99,,,,,1,Cap 400,Cap 160, //www.earthrugs.com/cdn/shop/files/MSPR-417-Red-Plaid-Deer-10_-OnWood_900x.jpg?v=1703861815 900w,MSPR-417-Red-Plaid-Deer-10_-OnWood_900x.jpg?v=1703861815 900w,,,Cap 800,MSPR-417-Red-Plaid-Deer-10_-OnWood_900x.jpg?v=1703861815 900w,
b'MSPR-419 Holiday Village Trees Trivet',80-419HVT,,"b'10"" Round Printed Trivet with Holiday Village Trees Design \n100% Natural Jute\nSold Individually \nSage, Ivory and Blue\nArt by Sandy Clough'",,,,,,,1,$ 3.99,,,,,1,Cap 400,Cap 160, //www.earthrugs.com/cdn/shop/files/MSPR-419-HolidayVillageTrees-10_Round-OnWood_900x.jpg?v=1703861841 900w,MSPR-419-HolidayVillageTrees-10_Round-OnWood_900x.jpg?v=1703861841 900w,,,Cap 800,MSPR-419-HolidayVillageTrees-10_Round-OnWood_900x.jpg?v=1703861841 900w,
b'MSPR-430 Bear Mountain Trivet',80-430BM,,"b'10"" Round Printed Trivet with Bear Mountain Design \n100% Natural Jute\nSold Individually\nBlack and Cream'",,,,,,,1,$ 3.99,,,,,1,Cap 400,Cap 160, //www.earthrugs.com/cdn/shop/files/MSPR-430-BearMountain-10_-Round-OnWood_900x.jpg?v=1703861850 900w,MSPR-430-BearMountain-10_-Round-OnWood_900x.jpg?v=1703861850 900w,,,Cap 800,MSPR-430-BearMountain-10_-Round-OnWood_900x.jpg?v=1703861850 900w,
