b'MSPR-430 Bear Scene Trivet',80-430BS,,"b'10"" Round Printed Trivet with Bear Scene Design \n100% Natural Jute\nSold Individually\nBlack and Cream'",,,,,,,1,$ 3.99,,,,,1,Cap 400,Cap 160, //www.earthrugs.com/cdn/shop/files/MSPR-430-BearScene-10_-Round-OnWood_900x.jpg?v=1703861861 900w,MSPR-430-BearScene-10_-Round-OnWood_900x.jpg?v=1703861861 900w,,,Cap 800,MSPR-430-BearScene-10_-Round-OnWood_900x.jpg?v=1703861861 900w,
b'MSPR-443 Nautical Trivet',80-443N,,"b'10"" Round Printed Trivet with Nautical Design \n100% Natural Jute\nSold Individually \nBlue, White and Natural\nArt by Phyllis Stevens'",,,,,,,1,$ 3.99,,,,,1,Cap 400,Cap 160, //www.earthrugs.com/cdn/shop/files/MSPR-443-Nautical-10_-Round-OnWood_900x.jpg?v=1703861886 900w,MSPR-443-Nautical-10_-Round-OnWood_900x.jpg?v=1703861886 900w,,,Cap 800,MSPR-443-Nautical-10_-Round-OnWood_900x.jpg?v=1703861886 900w,
b'MSPR-443 Navy Anchor Trivet',80-443NA,,"b'10"" Round Printed Trivet with Navy Anchor Design \n100% Natural Jute\nSold Individually \nBlue and Natural \nArt by Harry W. Smith '",,,,,,,1,$ 3.99,,,,,1,Cap 400,Cap 160, //www.earthrugs.com/cdn/shop/products/ZpHkevrw_900x.jpg?v=1646406606 900w,ZpHkevrw_900x.jpg?v=1646406606 900w,,,Cap 800,ZpHkevrw_900x.jpg?v=1646406606 900w,
b'MSPR-443 Sailboat Trivet',80-443SA,,"b'10"" Round Printed Trivet with Sailboat Design \n100% Natural Jute\nSold Individually \nBlue and Cream\nArt by Harry W. Smith '",,,,,,,1,$ 3.99,,,,,1,Cap 400,Cap 160, //www.earthrugs.com/cdn/shop/files/MSPR-443-Sailboat-10_-Round-OnWood_900x.jpg?v=1703861899 900w,MSPR-443-Sailboat-10_-Round-OnWood_900x.jpg?v=1703861899 900w,,,Cap 800,MSPR-443-Sailboat-10_-Round-OnWood_900x.jpg?v=1703861899 900w,
b'MSPR-508 Northeastern Robin Trivet',80-508NR,,"b'10"" Round Printed Trivet with Northeastern Robin Design \n100% Natural Jute\nSold Individually \nRed, Green and Natural'",,,,,,,1,$ 3.99,,,,,1,Cap 400,Cap 160, //www.earthrugs.com/cdn/shop/files/MSPR-508-NortheasternRobin-10_-Round-OnWood_900x.jpg?v=1703861914 900w,MSPR-508-NortheasternRobin-10_-Round-OnWood_900x.jpg?v=1703861914 900w,,,Cap 800,MSPR-508-NortheasternRobin-10_-Round-OnWood_900x.jpg?v=1703861914 900w,
b'MSPR-508 Tufted Winter Bird Trivet',80-508TWB,,"b'10"" Round Printed Trivet with Tufted Winter Bird Design \n100% Natural Jute\nSold Individually \nRed, Green and Natural \nArt by Suzanne Pienta '",,,,,,,1,$ 3.99,,,,,1,Cap 400,Cap 160, //www.earthrugs.com/cdn/shop/files/MSPR-508-TuftedWinterBird-10_-Round-OnWood_900x.jpg?v=1703861925 900w,MSPR-508-TuftedWinterBird-10_-Round-OnWood_900x.jpg?v=1703861925 900w,,,Cap 800,MSPR-508-TuftedWinterBird-10_-Round-OnWood_900x.jpg?v=1703861925 900w,
b'MSPR-518 Stag Trivet',80-518S,,"b'10"" Round Printed Trivet with Stag Design \n100% Natural Jute\nSold Individually \nBrown, Cream and Natural'",,,,,,,1,$ 3.99,,,,,1,Cap 400,Cap 160, //www.earthrugs.com/cdn/shop/files/MSPR-518-Stag-10_-Round-OnWood_900x.jpg?v=1703861937 900w,MSPR-518-Stag-10_-Round-OnWood_900x.jpg?v=1703861937 900w,,,Cap 800,MSPR-518-Stag-10_-Round-OnWood_900x.jpg?v=1703861937 900w,
b'MSPR-717 Wildlife Bluebird Trivet',80-717WB,,"b'10"" Round Printed Trivet with Wildlife Bluebird Design \n100% Natural Jute\nSold Individually \nRed and Burgundy \nArt by Phyllis Stevens '",,,,,,,1,$ 3.99,,,,,1,Cap 400,Cap 160, //www.earthrugs.com/cdn/shop/files/MSPR-717-WildlifeBluebird-10_-Round-OnWood_900x.jpg?v=1703861961 900w,MSPR-717-WildlifeBluebird-10_-Round-OnWood_900x.jpg?v=1703861961 900w,,,Cap 800,MSPR-717-WildlifeBluebird-10_-Round-OnWood_900x.jpg?v=1703861961 900w,
b'MSPR-717 Wildlife Cardinal Trivet',80-717WC,,"b'10"" Round Printed Trivet with Wildlife Cardinal Design \n100% Natural Jute\nSold Individually \nRed and Burgundy\nArt by Phyllis Stevens'",,,,,,,1,$ 3.99,,,,,1,Cap 400,Cap 160, //www.earthrugs.com/cdn/shop/files/MSPR-717-WildlifeCardinal-10_-Round-OnWood_900x.jpg?v=1703861969 900w,MSPR-717-WildlifeCardinal-10_-Round-OnWood_900x.jpg?v=1703861969 900w,,,Cap 800,MSPR-717-WildlifeCardinal-10_-Round-OnWood_900x.jpg?v=1703861969 900w,
b'MSPR-717 Wildlife Chickadee Trivet',80-717WCH,,"b'10"" Round Printed Trivet with Wildlife Chickadee Design \n100% Natural Jute\nSold Individually \nRed and Burgundy\nArt by Phyllis Stevens'",,,,,,,1,$ 3.99,,,,,1,Cap 400,Cap 160, //www.earthrugs.com/cdn/shop/files/MSPR-717-WildlifeChickadee-10_-Round-OnWood_900x.jpg?v=1703861976 900w,MSPR-717-WildlifeChickadee-10_-Round-OnWood_900x.jpg?v=1703861976 900w,,,Cap 800,MSPR-717-WildlifeChickadee-10_-Round-OnWood_900x.jpg?v=1703861976 900w,
b'MSPR-717 Wildlife Hummingbird Trivet',80-717WH,,"b'10"" Round Printed Trivet with Wildlife Hummingbird Design \n100% Natural Jute\nSold Individually \nRed and Burgundy \nArt by Phyllis Stevens '",,,,,,,1,$ 3.99,,,,,1,Cap 400,Cap 160, //www.earthrugs.com/cdn/shop/files/MSPR-717-WildlifeHummingBird-10_-Round-OnWood_900x.jpg?v=1703861983 900w,MSPR-717-WildlifeHummingBird-10_-Round-OnWood_900x.jpg?v=1703861983 900w,,,Cap 800,MSPR-717-WildlifeHummingBird-10_-Round-OnWood_900x.jpg?v=1703861983 900w,
b'MSPR-717 Wildlife Oriole Trivet',80-717WO,,"b'10"" Round Printed Trivet with Wildlife Oriole Design \n100% Natural Jute\nSold Individually \nRed and Burgundy \nArt by Phyllis Stevens '",,,,,,,1,$ 3.99,,,,,1,Cap 400,Cap 160, //www.earthrugs.com/cdn/shop/files/MSPR-717-WildlifeOriole-10_-Round-OnWood_900x.jpg?v=1703861991 900w,MSPR-717-WildlifeOriole-10_-Round-OnWood_900x.jpg?v=1703861991 900w,,,Cap 800,MSPR-717-WildlifeOriole-10_-Round-OnWood_900x.jpg?v=1703861991 900w,
b'MSPR-717 Wildlife Robin Trivet',80-717WR,,"b'10"" Round Printed Trivet with Wildlife Robin Design \n100% Natural Jute\nSold Individually \nRed and Burgundy \nArt by Phyllis Stevens '",,,,,,,1,$ 3.99,,,,,1,Cap 400,Cap 160, //www.earthrugs.com/cdn/shop/files/MSPR-717-WildlifeRobin-10_-Round-OnWood_900x.jpg?v=1703861999 900w,MSPR-717-WildlifeRobin-10_-Round-OnWood_900x.jpg?v=1703861999 900w,,,Cap 800,MSPR-717-WildlifeRobin-10_-Round-OnWood_900x.jpg?v=1703861999 900w,
b'MSPR-717 Wildlife Woodpecker Trivet',80-717WW,,"b'10"" Round Printed Trivet with Wildlife Woodpecker Design \n100% Natural Jute\nSold Individually \nRed and Burgundyl \nArt by Phyllis Stevens '",,,,,,,1,$ 3.99,,,,,1,Cap 400,Cap 160, //www.earthrugs.com/cdn/shop/files/MSPR-717-Woodpecker-10_-Round-OnWood_900x.jpg?v=1703862010 900w,MSPR-717-Woodpecker-10_-Round-OnWood_900x.jpg?v=1703862010 900w,,,Cap 800,MSPR-717-Woodpecker-10_-Round-OnWood_900x.jpg?v=1703862010 900w,
b'MSPR-783 Red Breasted Nut Hatch Trivet',80-783RBNH,,"b'10"" Round Printed Trivet with Red Breasted Nut Hatch \n100% Natural Jute\nSold Individually \nBlack, Tan and Terracotta'",,,,,,,1,$ 3.99,,,,,1,Cap 400,Cap 160, //www.earthrugs.com/cdn/shop/files/MSPR-783-RedBreastedNutHatch-10_-Round-OnWood_900x.jpg?v=1703862031 900w,MSPR-783-RedBreastedNutHatch-10_-Round-OnWood_900x.jpg?v=1703862031 900w,,,Cap 800,MSPR-783-RedBreastedNutHatch-10_-Round-OnWood_900x.jpg?v=1703862031 900w,
b'MSPR-864 Red Plaid Moose Trivet',80-864RPM,,"b'10"" Round Printed Trivet with Red Plaid Moose Design \n100% Natural Jute\nSold Individually \nBurgundy and Black'",,,,,,,1,$ 3.99,,,,,1,Cap 400,Cap 160, //www.earthrugs.com/cdn/shop/files/MSPR-864-RedPlaidMoose-10_-Round-OnWood_900x.jpg?v=1703862045 900w,MSPR-864-RedPlaidMoose-10_-Round-OnWood_900x.jpg?v=1703862045 900w,,,Cap 800,MSPR-864-RedPlaidMoose-10_-Round-OnWood_900x.jpg?v=1703862045 900w,
b'MSPR-864 Red Plaid Rabbit Trivet',80-864RPR,,"b'10"" Round Printed Trivet with Red Plaid Rabbit Design \n100% Natural Jute\nSold Individually\nBurgundy and Black\nArt by Harry W. Smith '",,,,,,,1,$ 3.99,,,,,1,Cap 400,Cap 160, //www.earthrugs.com/cdn/shop/files/MSPR-864-RedPlaidRabbit-10_-Round-OnWood_900x.jpg?v=1703862055 900w,MSPR-864-RedPlaidRabbit-10_-Round-OnWood_900x.jpg?v=1703862055 900w,,,Cap 800,MSPR-864-RedPlaidRabbit-10_-Round-OnWood_900x.jpg?v=1703862055 900w,
b'MSPR-866 Pencil Starfish Trivet',80-866PS,,"b'10"" Round Printed Trivet with Pencil Starfish Design \n100% Natural Jute\nSold Individually\nBlue and Teal \nArt by Harry W. Smith '",,,,,,,1,$ 3.99,,,,,1,Cap 400,Cap 160, //www.earthrugs.com/cdn/shop/files/MSPR-866-PencilStarfish-10_-Round-OnWood_900x.jpg?v=1703862064 900w,MSPR-866-PencilStarfish-10_-Round-OnWood_900x.jpg?v=1703862064 900w,,,Cap 800,MSPR-866-PencilStarfish-10_-Round-OnWood_900x.jpg?v=1703862064 900w,
b'MSPR-867 American Boot Trivet',80-867AB,,"b'10"" Round Printed Trivet with American Boot Design \n100% Natural Jute\nSold Individually \nBlue and Red \nArt by Suzanne Pienta '",,,,,,,1,$ 3.99,,,,,1,Cap 400,Cap 160, //www.earthrugs.com/cdn/shop/files/MSPR-867-American-Boot-10-Round-OnWood_900x.jpg?v=1703862072 900w,MSPR-867-American-Boot-10-Round-OnWood_900x.jpg?v=1703862072 900w,,,Cap 800,MSPR-867-American-Boot-10-Round-OnWood_900x.jpg?v=1703862072 900w,
b'MSPR-868 Blue Whale Trivet',80-868BW,,"b'10"" Round Printed Trivet with Blue Whale Design \n100% Natural Jute\nSold Individually \nBlue and Navy'",,,,,,,1,$ 3.99,,,,,1,Cap 400,Cap 160, //www.earthrugs.com/cdn/shop/files/MSPR-868-BlueWhale-10_-Round-OnWood_900x.jpg?v=1703862081 900w,MSPR-868-BlueWhale-10_-Round-OnWood_900x.jpg?v=1703862081 900w,,,Cap 800,MSPR-868-BlueWhale-10_-Round-OnWood_900x.jpg?v=1703862081 900w,
b'MSPR-868 Whale Tail Trivet',80-868WT,,"b'10"" Round Printed Trivet with Whale Tail Design \n100% Natural Jute\nSold Individually \nBlue and Navy'",,,,,,,1,$ 3.99,,,,,1,Cap 400,Cap 160, //www.earthrugs.com/cdn/shop/files/MSPR-868-WhaleTail-10_-Round-OnWood_900x.jpg?v=1703862088 900w,MSPR-868-WhaleTail-10_-Round-OnWood_900x.jpg?v=1703862088 900w,,,Cap 800,MSPR-868-WhaleTail-10_-Round-OnWood_900x.jpg?v=1703862088 900w,
b'MSPR-869 Orca Trivet',80-869O,,"b'10"" Round Printed Trivet with Orca Design \n100% Natural Jute\nSold Individually\nBlue and Navy'",,,,,,,1,$ 3.99,,,,,1,Cap 400,Cap 160, //www.earthrugs.com/cdn/shop/files/MSPR-869-Orca-10_Round-OnWood_900x.jpg?v=1703862094 900w,MSPR-869-Orca-10_Round-OnWood_900x.jpg?v=1703862094 900w,,,Cap 800,MSPR-869-Orca-10_Round-OnWood_900x.jpg?v=1703862094 900w,
b'MSPR-869 Sea Otters Trivet',80-869SO,,"b'10"" Round Printed Trivet with Sea Otters Design \n100% Natural Jute\nSold Individually\nBlue and Navy'",,,,,,,1,$ 3.99,,,,,1,Cap 400,Cap 160, //www.earthrugs.com/cdn/shop/files/MSPR-869-SeaOtters-10_Round-OnWood_900x.jpg?v=1703862100 900w,MSPR-869-SeaOtters-10_Round-OnWood_900x.jpg?v=1703862100 900w,,,Cap 800,MSPR-869-SeaOtters-10_Round-OnWood_900x.jpg?v=1703862100 900w,
b'MSPR-880 Bee Happy Trivet',80-880BH,,"b'10"" Round Printed Trivet with Bee Happy Design \n100% Natural Jute\nSold Individually\nYellow and White\nArt by Suzanne Pienta'",,,,,,,1,$ 3.99,,,,,1,Cap 400,Cap 160, //www.earthrugs.com/cdn/shop/files/MSPR-880-Bee_Happy-10_-Round-OnWood_900x.jpg?v=1703862107 900w,MSPR-880-Bee_Happy-10_-Round-OnWood_900x.jpg?v=1703862107 900w,,,Cap 800,MSPR-880-Bee_Happy-10_-Round-OnWood_900x.jpg?v=1703862107 900w,
b'MSPR-880 Daffodil Trivet',80-880D,,"b'10"" Round Printed Trivet with Daffodil Design \n100% Natural Jute\nSold Individually \nYellow and White\nArt by Harry W. Smith '",,,,,,,1,$ 3.99,,,,,1,Cap 400,Cap 160, //www.earthrugs.com/cdn/shop/files/MSPR-880-Daffodiltrivet-10_-Round-OnWood_900x.jpg?v=1703862116 900w,MSPR-880-Daffodiltrivet-10_-Round-OnWood_900x.jpg?v=1703862116 900w,,,Cap 800,MSPR-880-Daffodiltrivet-10_-Round-OnWood_900x.jpg?v=1703862116 900w,
b'MSPR-880 Daisy Clay Pot Trivet',80-880DCP,,"b'10"" Round Printed Trivet with Daisy Clay Pot Design \n100% Natural Jute\nSold Individually \nYellow and White\nArt by Suzanne Pienta'",,,,,,,1,$ 3.99,,,,,1,Cap 400,Cap 160, //www.earthrugs.com/cdn/shop/files/MSPR-880-DaisyClayPot-10_-Round-OnWood_900x.jpg?v=1703862123 900w,MSPR-880-DaisyClayPot-10_-Round-OnWood_900x.jpg?v=1703862123 900w,,,Cap 800,MSPR-880-DaisyClayPot-10_-Round-OnWood_900x.jpg?v=1703862123 900w,
b'MSPR-880 Let It Bee Trivet',80-880LB,,"b'10"" Round Printed Trivet with Let It Bee Design \n100% Natural Jute\nSold Individually \nYellow and White\nArt by Suzanne Pienta'",,,,,,,1,$ 3.99,,,,,1,Cap 400,Cap 160, //www.earthrugs.com/cdn/shop/files/MSPR-880-LetitBee-10_-Round-OnWood_900x.jpg?v=1703862131 900w,MSPR-880-LetitBee-10_-Round-OnWood_900x.jpg?v=1703862131 900w,,,Cap 800,MSPR-880-LetitBee-10_-Round-OnWood_900x.jpg?v=1703862131 900w,
b'MSPR-881 Colorado Flag Trivet',80-881CF,,"b'10"" Round Printed Trivet with Colorado Flag Design \n100% Natural Jute\nSold Individually\nNavy and Natural'",,,,,,,1,$ 3.99,,,,,1,Cap 400,Cap 160, //www.earthrugs.com/cdn/shop/files/MSPR-881-ColoradoFlag-10_Round-OnWood_900x.jpg?v=1703862138 900w,MSPR-881-ColoradoFlag-10_Round-OnWood_900x.jpg?v=1703862138 900w,,,Cap 800,MSPR-881-ColoradoFlag-10_Round-OnWood_900x.jpg?v=1703862138 900w,
b'MSPR-882 Tree Of Life Trivet',80-882TL,,"b'10"" Round Printed Trivet with Tree Of Life Design \n100% Natural Jute\nSold Individually\nRed and Gray'",,,,,,,1,$ 3.99,,,,,1,Cap 400,Cap 160, //www.earthrugs.com/cdn/shop/files/MSPR-882-TreeofLife-10_-Round-OnWood_900x.jpg?v=1703862144 900w,MSPR-882-TreeofLife-10_-Round-OnWood_900x.jpg?v=1703862144 900w,,,Cap 800,MSPR-882-TreeofLife-10_-Round-OnWood_900x.jpg?v=1703862144 900w,
b'MSPR-884 Fall Welcome Trivet',80-884FW,,"b'10"" Round Printed Trivet with Fall Welcome Design \n100% Natural Jute\nSold Individually\nBrown and Orange'",,,,,,,1,$ 3.99,,,,,1,Cap 400,Cap 160, //www.earthrugs.com/cdn/shop/files/MSPR-884-FallWelcome-10_-Round-OnWood_900x.jpg?v=1703862151 900w,MSPR-884-FallWelcome-10_-Round-OnWood_900x.jpg?v=1703862151 900w,,,Cap 800,MSPR-884-FallWelcome-10_-Round-OnWood_900x.jpg?v=1703862151 900w,
b'MSPR-886 Hyacinth Trivet',80-886H,,"b'10"" Round Printed Trivet with Hyacinth Design \n100% Natural Jute\nSold Individually \nYellow and Natural\nArt by Harry W. Smith '",,,,,,,1,$ 3.99,,,,,1,Cap 400,Cap 160, //www.earthrugs.com/cdn/shop/files/MSPR-886-Hyacinth-10_-Round-OnWood_900x.jpg?v=1703862158 900w,MSPR-886-Hyacinth-10_-Round-OnWood_900x.jpg?v=1703862158 900w,,,Cap 800,MSPR-886-Hyacinth-10_-Round-OnWood_900x.jpg?v=1703862158 900w,
b'MSPR-887 Crocus Trivet',80-887C,,"b'10"" Round Printed Trivet with Crocus Design \n100% Natural Jute\nSold Individually\nGray and Natural\nArt by Harry W. Smith'",,,,,,,1,$ 3.99,,,,,1,Cap 400,Cap 160, //www.earthrugs.com/cdn/shop/files/MSPR-887-Crocus-10_-Round-OnWood_900x.jpg?v=1703862165 900w,MSPR-887-Crocus-10_-Round-OnWood_900x.jpg?v=1703862165 900w,,,Cap 800,MSPR-887-Crocus-10_-Round-OnWood_900x.jpg?v=1703862165 900w,
b'MSPR-890 Black Star Trivet',80-890BS,,"b'10"" Round Printed Trivet with Black Star Design \n100% Natural Jute\nSold Individually \nLight Gray and Dark Gray'",,,,,,,1,$ 3.99,,,,,1,Cap 400,Cap 160, //www.earthrugs.com/cdn/shop/files/MSPR-890-BlackStar-10_-Round-OnWood_900x.jpg?v=1703862173 900w,MSPR-890-BlackStar-10_-Round-OnWood_900x.jpg?v=1703862173 900w,,,Cap 800,MSPR-890-BlackStar-10_-Round-OnWood_900x.jpg?v=1703862173 900w,
b'MSPR-9-093 Bucking Cowboy Trivet',80-9-093BC,,"b'10"" Round Printed Trivet with Bucking Cowboy Design \n100% Natural Jute\nSold Individually \nBlack, White and Natural \nArt by Suzanne Pienta '",,,,,,,1,$ 3.99,,,,,1,Cap 400,Cap 160, //www.earthrugs.com/cdn/shop/files/MSPR-9-93-BuckingCowboy-10_-Round-OnWood_900x.jpg?v=1703862188 900w,MSPR-9-93-BuckingCowboy-10_-Round-OnWood_900x.jpg?v=1703862188 900w,,,Cap 800,MSPR-9-93-BuckingCowboy-10_-Round-OnWood_900x.jpg?v=1703862188 900w,
b'MSPR-9-093 Cowboy Hat & Boot Trivet',80-9-093CH,,"b'10"" Round Printed Trivet with Cowboy Hat & Boot Design \n100% Natural Jute\nSold Individually \nBlack, White and Natural \nArt by Suzanne Pienta '",,,,,,,1,$ 3.99,,,,,1,Cap 400,Cap 160, //www.earthrugs.com/cdn/shop/files/MSPR-9-93-CowboyHat_Boot-10_-Round-OnWood_900x.jpg?v=1703862195 900w,MSPR-9-93-CowboyHat_Boot-10_-Round-OnWood_900x.jpg?v=1703862195 900w,,,Cap 800,MSPR-9-93-CowboyHat_Boot-10_-Round-OnWood_900x.jpg?v=1703862195 900w,
b'MSPR-9-093 Galloping Horse Trivet',80-9-093GH,,"b'10"" Round Printed Trivet with Galloping Horse Design \n100% Natural Jute\nSold Individually\nBlack, White and Natural\nArt by Suzanne Pienta'",,,,,,,1,$ 3.99,,,,,1,Cap 400,Cap 160, //www.earthrugs.com/cdn/shop/files/MSPR-9-93-GallopingHorse-10_-Round-OnWood_900x.jpg?v=1703862202 900w,MSPR-9-93-GallopingHorse-10_-Round-OnWood_900x.jpg?v=1703862202 900w,,,Cap 800,MSPR-9-93-GallopingHorse-10_-Round-OnWood_900x.jpg?v=1703862202 900w,
b'MSPR-9-093 Tan Cowboy Hat Trivet',80-9-093TCH,,"b'10"" Round Printed Trivet with Tan Cowboy Hat Design \n100% Natural Jute\nSold Individually\nBlack, White and Natural\nArt by Suzanne Pienta'",,,,,,,1,$ 3.99,,,,,1,Cap 400,Cap 160, //www.earthrugs.com/cdn/shop/files/MSPR-9-93-TanCowboyHat-10_-Round-OnWood_900x.jpg?v=1703862218 900w,MSPR-9-93-TanCowboyHat-10_-Round-OnWood_900x.jpg?v=1703862218 900w,,,Cap 800,MSPR-9-93-TanCowboyHat-10_-Round-OnWood_900x.jpg?v=1703862218 900w,
b'MSPR-9-870 Saddle Trivet',80-9-870S,,"b'10"" Round Printed Trivet with Saddle Design \n100% Natural Jute\nSold Individually\nBrown and Natural\nArt by Suzanne Pienta'",,,,,,,1,$ 3.99,,,,,1,Cap 400,Cap 160, //www.earthrugs.com/cdn/shop/files/MSPR-9-870-Saddle-10_-Round-OnWood_900x.jpg?v=1703862242 900w,MSPR-9-870-Saddle-10_-Round-OnWood_900x.jpg?v=1703862242 900w,,,Cap 800,MSPR-9-870-Saddle-10_-Round-OnWood_900x.jpg?v=1703862242 900w,
b'MSP-025 Holly Cardinal Swatch',81-025HC,,"b'Hand Stenciled Oval Swatch with Holly Cardinal Design\n10""x15"" Oval\n100% Natural Jute\nSold Individually\nBurgundy, Black and Sage\nArt by Suzanne Pienta'",,,,,,,1,$ 5.69,,,,,1,Cap 400,Cap 160, //www.earthrugs.com/cdn/shop/files/MSP-25-HollyCardinal-10_x15_-Oval-OnWood_900x.jpg?v=1703861048 900w,MSP-25-HollyCardinal-10_x15_-Oval-OnWood_900x.jpg?v=1703861048 900w,,,Cap 800,MSP-25-HollyCardinal-10_x15_-Oval-OnWood_900x.jpg?v=1703861048 900w,
b'MSP-025 Santa Swatch',81-025S,,"b'Hand Stenciled Oval Swatch with Santa Design \n10""x15"" Oval\nSold Individually\n100% Natural Jute\nBurgundy, Black and Sage \nArt by Susan Burd'",,,,,,,1,$ 5.69,,,,,1,Cap 400,Cap 160, //www.earthrugs.com/cdn/shop/files/MSP-25-Santa-10_x15_-Oval-OnWood_900x.jpg?v=1703861057 900w,MSP-25-Santa-10_x15_-Oval-OnWood_900x.jpg?v=1703861057 900w,,,Cap 800,MSP-25-Santa-10_x15_-Oval-OnWood_900x.jpg?v=1703861057 900w,
b'MSP-081 Snowman in Top Hat Swatch',81-081STH,,"b'Hand Stenciled Oval Swatch with Snowman in Top Hat Design \n10""x15"" Oval \nSold Individually \n100% Natural Jute\nBurgundy, Black and Sage'",,,,,,,1,$ 5.69,,,,,1,Cap 400,Cap 160, //www.earthrugs.com/cdn/shop/files/MSP-81-SnowmanwithTopHat-10_x15_-Oval-OnWood_900x.jpg?v=1703861077 900w,MSP-81-SnowmanwithTopHat-10_x15_-Oval-OnWood_900x.jpg?v=1703861077 900w,,,Cap 800,MSP-81-SnowmanwithTopHat-10_x15_-Oval-OnWood_900x.jpg?v=1703861077 900w,
b'MSP-116 Fish Swatch',81-116F,,"b'Hand Stenciled Oval Swatch with Fish Design \n10""x15"" Oval \nSold Individually \n100% Natural Jute\nBlack, Sage and Natural'",,,,,,,1,$ 5.69,,,,,1,Cap 400,Cap 160, //www.earthrugs.com/cdn/shop/files/MSP-116-Fish-10_x15_-Oval-2-OnWood_900x.jpg?v=1703861121 900w,MSP-116-Fish-10_x15_-Oval-2-OnWood_900x.jpg?v=1703861121 900w,,,Cap 800,MSP-116-Fish-10_x15_-Oval-2-OnWood_900x.jpg?v=1703861121 900w,
b'MSP-116 Green Plaid Bear Swatch',81-116GPB,,"b'Hand Stenciled Oval Swatch with Green Plaid Bear Design \n10""x15"" Oval \nSold Individually \n100% Natural Jute\nBlack, Sage and Natural'",,,,,,,1,$ 5.69,,,,,1,Cap 400,Cap 160, //www.earthrugs.com/cdn/shop/files/81-116GPB_900x.jpg?v=1703873204 900w,81-116GPB_900x.jpg?v=1703873204 900w,,,Cap 800,81-116GPB_900x.jpg?v=1703873204 900w,
b'MSP-116 Green Plaid Moose Swatch',81-116GPM,,"b'Hand Stenciled Oval Swatch with Green Plaid Moose Design \n10""x15"" Oval \nSold Individually \n100% Natural Jute\nBlack, Sage and Natural '",,,,,,,1,$ 5.69,,,,,1,Cap 400,Cap 160, //www.earthrugs.com/cdn/shop/files/81-116GPM_900x.jpg?v=1703873229 900w,81-116GPM_900x.jpg?v=1703873229 900w,,,Cap 800,81-116GPM_900x.jpg?v=1703873229 900w,
b'MSP-129 Caribou Swatch',81-129C,,"b'Hand Stenciled Oval Swatch with Caribou Design \n10""x15"" Oval \nSold Individually \n100% Natural Jute\nBrown and Natural'",,,,,,,1,$ 5.69,,,,,1,Cap 400,Cap 160, //www.earthrugs.com/cdn/shop/files/MSP-129-Caribou-10_x15_-Oval-OnWood_900x.jpg?v=1703861139 900w,MSP-129-Caribou-10_x15_-Oval-OnWood_900x.jpg?v=1703861139 900w,,,Cap 800,MSP-129-Caribou-10_x15_-Oval-OnWood_900x.jpg?v=1703861139 900w,
b'MSP-222 Pumpkin Crow Swatch',81-222PC,,"b'Hand Stenciled Oval Swatch with Pumpkin Crow Design \n10""x15"" Oval\nSold Individually\n100% Natural Jute\nOrange and Wheat\nArt by Suzanne Pienta'",,,,,,,1,$ 5.69,,,,,1,Cap 400,Cap 160, //www.earthrugs.com/cdn/shop/files/MSP-222-PumpkinCrow-10_x15_-Oval-OnWood_900x.jpg?v=1703861182 900w,MSP-222-PumpkinCrow-10_x15_-Oval-OnWood_900x.jpg?v=1703861182 900w,,,Cap 800,MSP-222-PumpkinCrow-10_x15_-Oval-OnWood_900x.jpg?v=1703861182 900w,
b'MSP-375 Pineapple Swatch',81-375P,,"b'Hand Stenciled Oval Swatch with Pineapple Design \n10""x15"" Oval \nSold Individually \n100% Natural Jute\nSage, White and Natural\nArt by Susan Burd '",,,,,,,1,$ 5.69,,,,,1,Cap 400,Cap 160, //www.earthrugs.com/cdn/shop/files/MSP-375-Pineapple-10_x15_-Oval-OnWood_900x.jpg?v=1703861200 900w,MSP-375-Pineapple-10_x15_-Oval-OnWood_900x.jpg?v=1703861200 900w,,,Cap 800,MSP-375-Pineapple-10_x15_-Oval-OnWood_900x.jpg?v=1703861200 900w,
b'MSP-396 Flannel Bear Swatch',81-396FB,,"b'Hand Stenciled Oval Swatch with Flannel Bear Design \n10""x15"" Oval \nSold Individually \n100% Natural Jute\nRed, Black and Natural\nArtwork by Sandy Clough'",,,,,,,1,$ 5.69,,,,,1,Cap 400,Cap 160, //www.earthrugs.com/cdn/shop/files/81-396FB_900x.jpg?v=1703873262 900w,81-396FB_900x.jpg?v=1703873262 900w,,,Cap 800,81-396FB_900x.jpg?v=1703873262 900w,
b'MSP-396 Ladybug Swatch',81-396L,,"b'Hand Stenciled Oval Swatch with Ladybug Design \n10""x15"" Oval\nSold Individually\n100% Natural Jute\nRed and Black \nArt by Susan Burd'",,,,,,,1,$ 5.69,,,,,1,Cap 400,Cap 160, //www.earthrugs.com/cdn/shop/files/MSP-396-Ladybug-10_x15_-Oval-OnWood_900x.jpg?v=1703861213 900w,MSP-396-Ladybug-10_x15_-Oval-OnWood_900x.jpg?v=1703861213 900w,,,Cap 800,MSP-396-Ladybug-10_x15_-Oval-OnWood_900x.jpg?v=1703861213 900w,
b'MSP-417 Red Plaid Deer Swatch',81-417RPD,,"b'Hand Stenciled Oval Swatch with Red Plaid Deer Design \n10""x15"" Oval \nSold Individually \n100% Natural Jute\nRed, Black and Natural '",,,,,,,1,$ 5.69,,,,,1,Cap 400,Cap 160, //www.earthrugs.com/cdn/shop/files/81-417RPD_900x.jpg?v=1703873278 900w,81-417RPD_900x.jpg?v=1703873278 900w,,,Cap 800,81-417RPD_900x.jpg?v=1703873278 900w,
b'MSP-701 Winter Gnome Swatch',81-701WG,,"b'Hand Stenciled Oval Swatch with Winter Gnome Design \n10""x15"" Oval \nSold Individually \n100% Natural Jute\nBlack & Light Blue \nArt by Harry W. Smith '",,,,,,,1,$ 5.69,,,,,1,Cap 400,Cap 160, //www.earthrugs.com/cdn/shop/files/MSP-701-WinterGnome-10_x15_-Oval-OnWood_900x.jpg?v=1703861232 900w,MSP-701-WinterGnome-10_x15_-Oval-OnWood_900x.jpg?v=1703861232 900w,,,Cap 800,MSP-701-WinterGnome-10_x15_-Oval-OnWood_900x.jpg?v=1703861232 900w,
b'MSP-890 Black Star Swatch',81-890BS,,"b'Hand Stenciled Oval Swatch with Black Star Design \n10""x15"" Oval\nSold Individually\n100% Natural Jute\nLight Gray and Dark Gray'",,,,,,,1,$ 5.69,,,,,1,Cap 400,Cap 160, //www.earthrugs.com/cdn/shop/files/MSP-890-BlackStar-10_x15_-Oval-OnWood_900x.jpg?v=1703861304 900w,MSP-890-BlackStar-10_x15_-Oval-OnWood_900x.jpg?v=1703861304 900w,,,Cap 800,MSP-890-BlackStar-10_x15_-Oval-OnWood_900x.jpg?v=1703861304 900w,
b'TSP-419 Holiday Village Trees Tree Skirt',97-419HVT,,"b'30"" Round Braided Printed Tree Skirt with Slit\nArtwork by Sandy Clough'",,,,,,,1,$ 26.51,,,,,1,Cap 400,Cap 160, //www.earthrugs.com/cdn/shop/files/TSP-419-HolidayVillageTrees-30x30Round-TreeSkirt-OnWood_900x.jpg?v=1703862910 900w,TSP-419-HolidayVillageTrees-30x30Round-TreeSkirt-OnWood_900x.jpg?v=1703862910 900w,,,Cap 800,TSP-419-HolidayVillageTrees-30x30Round-TreeSkirt-OnWood_900x.jpg?v=1703862910 900w,
