AMERICAN FLAG RIBBON,258326,(All) 25% Off Products,$10.88 ,2,$14.50 ,258326.jpg
AMERICAN FLAG RIBBON,258329,(All) 25% Off Products,$14.63 ,2,$19.50 ,258329.jpg
MEDIUM DECORATIVE BEE HIVE,BH190M,(All) 25% Off Products,$3.26 ,5,$4.35 ,BH190M.jpg
SMALL DECORATIVE BEE HIVE,BH190S,(All) 25% Off Products,$2.44 ,6,$3.25 ,BH190S.jpg
FOAM BRICKS,FB3,(All) 25% Off Products,$1.94 ,4,$2.59 ,FB3.jpg
DECORATIVE WORK TOOS,GS2006A,(All) 25% Off Products,$0.98 ,6,$1.31 ,GS2006A.jpg
DECORATIVE RUSTY WORK TOOLS,GS9537LA,(All) 25% Off Products,$11.52 ,2,$15.36 ,GS9537LA.jpg
IRON STAR,IS005,(All) 25% Off Products,$2.23 ,6,$2.97 ,IS005.jpg
IRON STAR,IS547,(All) 25% Off Products,$5.15 ,3,$6.86 ,IS547.jpg
RUSTY DECORATIVE HEART BIRD HOSUE,KB1307,(All) 25% Off Products,$1.72 ,12,$2.29 ,KB1307.jpg
RUSTY BIRD BICK,KB1747A,(All) 25% Off Products,$1.13 ,12,$1.50 ,KB1747A.jpg
RUSTY BIRD HOSUE PICK,KB4547,(All) 25% Off Products,$1.13 ,12,$1.50 ,KB4547.jpg
RUSTY CAT CANDLE HOLDER,KC3001A,(All) 25% Off Products,$4.17 ,4,$5.56 ,KC3001A.jpg
DISTRESSED BABY BLUE THIN OVAL BUCKET,KD1694BB-3,(All) 25% Off Products,$16.46 ,4,$21.95 ,KD1694BB-3.jpg
DISTRESSED ORANGE THIN OVAL BUCKET,KD1694OR-3,(All) 25% Off Products,$16.46 ,4,$21.95 ,KD1694OR-3.jpg
LARGE DISTRESSED WHITE OLIVE BUCKET,KD8850L-W,(All) 25% Off Products,$11.21 ,4,$14.95 ,KD8850L-W.jpg
SMALL DISTRESSED LIME GREEN OLIVE BUCKET,KD8850S-LI,(All) 25% Off Products,$8.21 ,4,$10.95 ,KD8850S-LI.jpg
SMALL DISTRESSED WHITE OLIVE BUCKET,KD8850S-W,(All) 25% Off Products,$8.21 ,4,$10.95 ,KD8850S-W.jpg
LARGE DISTRESSED BABY BLUE LAMP SHADE,KD8876L-BB,(All) 25% Off Products,$13.88 ,4,$18.50 ,KD8876L-BB.jpg
LARGE DISTRESSED LIME GREEN LAMP SHADE,KD8876L-LI,(All) 25% Off Products,$13.88 ,4,$18.50 ,KD8876L-LI.jpg
LARGE DISTRESSED ORANGE LAMP SHADE,KD8876L-OR,(All) 25% Off Products,$13.88 ,4,$18.50 ,KD8876L-OR.jpg
LARGE DISTRESSED WHITE LAME SHADE,KD8876L-W,(All) 25% Off Products,$13.88 ,4,$18.50 ,KD8876L-W.jpg
RED COAL BUCKETS SET OF 2,KE1078BR-2,(All) 25% Off Products,$15.04 ,2,$20.05 ,KE1078BR-2.jpg
ORANGE COAL BUCKETS SET OF 2,KE1078OR-2,(All) 25% Off Products,$15.04 ,2,$20.05 ,KE1078OR-2.jpg
PINK COAL BUCKETS SET OF 2,KE1078P-2,(All) 25% Off Products,$15.04 ,2,$20.05 ,KE1078P-2.jpg
WHITE COAL BUCKETS SET OF 2,KE1078W-2,(All) 25% Off Products,$15.04 ,2,$20.05 ,KE1078W-2.jpg
BROWN PUMPKIN PLANTER,KE2320BR,(All) 25% Off Products,$12.41 ,2,$16.55 ,KE2320BR.jpg
PINK WALL POCKET,KE2605P,(All) 25% Off Products,$3.19 ,4,$4.25 ,KE2605P.jpg
AQUA TIN CUP,KE4463AQ,(All) 25% Off Products,$2.44 ,6,$3.25 ,KE4463AQ.jpg
RED TIN CUP,KE4463R,(All) 25% Off Products,$2.44 ,6,$3.25 ,KE4463R.jpg
12,KE4990SG,(All) 25% Off Products,$5.78 ,4,$7.70 ,KE4990SG.jpg
WHITE WITH RED TRIM SOAP DISH,KE5187WR,(All) 25% Off Products,$3.86 ,4,$5.15 ,KE5187WR.jpg
BROWN ICE BUCKET WITH SCOOP,KE5229LBR-SCOOP,(All) 25% Off Products,$10.69 ,3,$14.25 ,KE5229LBR-SCOOP.jpg
PINK ICE BUCKET WITH SCOOP,KE5229LP-SCOOP,(All) 25% Off Products,$10.69 ,3,$14.25 ,KE5229LP-SCOOP.jpg
RED ICE BUCKET WITH SCOOP,KE5229LR-SCOOP,(All) 25% Off Products,$10.69 ,3,$14.25 ,KE5229LR-SCOOP.jpg
WHITE ICE BUCKET WITH SCOOP,KE5229LW-SCOOP,(All) 25% Off Products,$10.69 ,3,$14.25 ,KE5229LW-SCOOP.jpg
PINK TIN MUG WITH LID,KE5230B-P,(All) 25% Off Products,$3.75 ,4,$5.00 ,KE5230B-P.jpg
YELLOW POTS WITH LIDS S/4,KE5233Y-4,(All) 25% Off Products,$14.81 ,2,$19.75 ,KE5233Y-4.jpg
RED MILK CAN,KE5247LR,(All) 25% Off Products,$7.01 ,2,$9.35 ,KE5247LR.jpg
ROUND WHITE TRAYS SET/2,KE5713W-2,(All) 25% Off Products,$18.56 ,2,$24.75 ,KE5713W-2.jpg
PINK DECORATIVE WATERING CAN,KE5786P,(All) 25% Off Products,$7.61 ,2,$10.15 ,KE5786P.jpg
RED DECORATIVE WATERING CAN,KE5786R,(All) 25% Off Products,$7.61 ,2,$10.15 ,KE5786R.jpg
WHITE DECORATIVE WATERING CAN,KE5786W,(All) 25% Off Products,$7.61 ,2,$10.15 ,KE5786W.jpg
AQUA WATERING CAN PLANTER,KE5788AQ,(All) 25% Off Products,$5.21 ,4,$6.95 ,KE5788AQ.jpg
BROWN TISSUE BOX COVER,KE5879BR,(All) 25% Off Products,$5.78 ,3,$7.70 ,KE5879BR.jpg
ORANGE TISSUE BOX COVER,KE5879OR,(All) 25% Off Products,$5.78 ,3,$7.70 ,KE5879OR.jpg
AQUA HALF DRINK DISPENSER,KE5921-AQ,(All) 25% Off Products,$19.61 ,2,$26.15 ,KE5921-AQ.jpg
PINK HALF DRINK DISPENSER,KE5921-P,(All) 25% Off Products,$19.61 ,2,$26.15 ,KE5921-P.jpg
RED HALF DRINK DISPENSER,KE5921-R,(All) 25% Off Products,$19.61 ,2,$26.15 ,KE5921-R.jpg
WHITE HALF DRINK DISPENCER,KE5921-W,(All) 25% Off Products,$19.61 ,2,$26.15 ,KE5921-W.jpg
AQUA FULL DRINK DISPENSER,KE5921AQ-FULL,(All) 25% Off Products,$24.56 ,1,$32.75 ,KE5921AQ-FULL.jpg
PINK FULL DRINK DISPENSER,KE5921P-FULL,(All) 25% Off Products,$24.56 ,1,$32.75 ,KE5921P-FULL.jpg
RED FULL DRINK DISPENSER,KE5921R-FULL,(All) 25% Off Products,$24.56 ,1,$32.75 ,KE5921R-FULL.jpg
WHITE FULL DRINK DISPENSER,KE5921W-FULL,(All) 25% Off Products,$24.56 ,1,$32.75 ,KE5921W-FULL.jpg
BROWN TISSUE AND TOILET PAPER HOLDER,KE5925BR,(All) 25% Off Products,$12.34 ,2,$16.45 ,KE5925BR.jpg
RED TISSUE AND TOILET PAPER HOLDER,KE5925R,(All) 25% Off Products,$12.34 ,2,$16.45 ,KE5925R.jpg
SMALL AQUA SCALLOPED SQUARE TRAY,KE5958S-AQ,(All) 25% Off Products,$5.33 ,4,$7.10 ,KE5958S-AQ.jpg
SMALL BLACK SCALLOPED SQUARE TRAY,KE5958S-BK,(All) 25% Off Products,$5.33 ,4,$7.10 ,KE5958S-BK.jpg
SMALL BROWN SCALLOPED SQUARE TRAY,KE5958S-BR,(All) 25% Off Products,$5.33 ,4,$7.10 ,KE5958S-BR.jpg
SMALL FUCHSIA SCALLOPED SQUARE TRAY,KE5958S-FU,(All) 25% Off Products,$5.33 ,4,$7.10 ,KE5958S-FU.jpg
SMALL LIME GREEN SCALLOPED SQUARE TRAY,KE5958S-LI,(All) 25% Off Products,$5.33 ,4,$7.10 ,KE5958S-LI.jpg
SMALL PINK SCALLOPED SQUARE TRAY,KE5958S-P,(All) 25% Off Products,$5.33 ,4,$7.10 ,KE5958S-P.jpg
SMALL RED SCALLOPED SQUARE TRAY,KE5958S-R,(All) 25% Off Products,$5.33 ,4,$7.10 ,KE5958S-R.jpg
SMALL SKY BLUE SCALLOPED SQUARE TRAY,KE5958S-SK,(All) 25% Off Products,$5.33 ,4,$7.10 ,KE5958S-SK.jpg
SMALL YELLOW SCALLOPED SQUARE TRAY,KE5958S-YE,(All) 25% Off Products,$5.33 ,4,$7.10 ,KE5958S-YE.jpg
AQUA WHEELBARROW,KE6005L-AQ,(All) 25% Off Products,$2.44 ,4,$3.25 ,KE6005L-AQ.jpg
FUCHSIA WHEELBARROW,KE6005L-FU,(All) 25% Off Products,$2.44 ,4,$3.25 ,KE6005L-FU.jpg
PINK WHEELBARROW,KE6005L-P,(All) 25% Off Products,$2.44 ,4,$3.25 ,KE6005L-P.jpg
AQUA FLOWER BASKETS SET OF 2,KE7028AQ-2,(All) 25% Off Products,$5.21 ,3,$6.95 ,KE7028AQ-2.jpg
PINK FLOWER BASKETS SET OF 2,KE7028P-2,(All) 25% Off Products,$5.21 ,3,$6.95 ,KE7028P-2.jpg
RED FLOWER BASKETS SET OF 2,KE7028R-2,(All) 25% Off Products,$5.21 ,3,$6.95 ,KE7028R-2.jpg
BROWN PICTURE BOOK,KE7099BR,(All) 25% Off Products,$8.21 ,2,$10.95 ,KE7099BR.jpg
BROWN HANGING MAGNETIC BOARD WITH STAR CUT OUTS,KE8159BR,(All) 25% Off Products,$5.36 ,36,$7.15 ,KE8159BR.jpg
ORANGE HANGING MAGNETIC BOARD WITH STAR CUT OUTS,KE8159OR,(All) 25% Off Products,$5.36 ,36,$7.15 ,KE8159OR.jpg
AQUA CAN WITH LID,KE8162AQ,(All) 25% Off Products,$2.66 ,4,$3.55 ,KE8162AQ.jpg
BABY BLUE CAN WITH LID,KE8162BB,(All) 25% Off Products,$2.66 ,4,$3.55 ,KE8162BB.jpg
BLACK CAN WITH LID,KE8162BK,(All) 25% Off Products,$2.66 ,4,$3.55 ,KE8162BK.jpg
BROWN CAN WITH LID,KE8162BR,(All) 25% Off Products,$2.66 ,4,$3.55 ,KE8162BR.jpg
FUCHSIA CAN WITH LID,KE8162FU,(All) 25% Off Products,$2.66 ,4,$3.55 ,KE8162FU.jpg
LIME GREEN CAN WITH LID,KE8162LI,(All) 25% Off Products,$2.66 ,4,$3.55 ,KE8162LI.jpg
ORANGE CAN WITH LID,KE8162OR,(All) 25% Off Products,$2.66 ,4,$3.55 ,KE8162OR.jpg
PINK CAN WITH LID,KE8162P,(All) 25% Off Products,$2.66 ,4,$3.55 ,KE8162P.jpg
RED CAN WITH LID,KE8162R,(All) 25% Off Products,$2.66 ,4,$3.55 ,KE8162R.jpg
SKY BLUE CAN WITH LID,KE8162SK,(All) 25% Off Products,$2.66 ,4,$3.55 ,KE8162SK.jpg
WHITE CAN WITH LID,KE8162W,(All) 25% Off Products,$2.66 ,4,$3.55 ,KE8162W.jpg
YELLOW CAN WITH LID,KE8162YE,(All) 25% Off Products,$2.66 ,4,$3.55 ,KE8162YE.jpg
RED 3 TIERED SERVING STAND,KE8230R,(All) 25% Off Products,$24.71 ,1,$32.95 ,KE8230R.jpg
LARGE BROWN MAGNETIC BOARD,KE8231BR,(All) 25% Off Products,$12.26 ,2,$16.35 ,KE8231BR.jpg
LARGE BROWN MAGNETIC BOARD,KE8231BR,(All) 25% Off Products,$12.26 ,2,$16.35 ,KE8231BR.jpg
LARGE ORANGE MAGNETIC BOARD,KE8231OR,(All) 25% Off Products,$12.26 ,2,$16.35 ,KE8231OR.jpg
LARGE PURPLE MAGNETIC BOARD,KE8231PUR,(All) 25% Off Products,$12.26 ,2,$16.35 ,KE8231PUR.jpg
LARGE TURQUOISE MAGNETIC BOARD,KE8231T,(All) 25% Off Products,$12.26 ,2,$16.35 ,KE8231T.jpg
BROWN WALL COAT HOOK,KE8234BR,(All) 25% Off Products,$6.79 ,3,$9.05 ,KE8234BR.jpg
ORANGE WALL COAT HOOK,KE8234OR,(All) 25% Off Products,$6.79 ,3,$9.05 ,KE8234OR.jpg
YELLOW WALL COAT HOOK,KE8234YE,(All) 25% Off Products,$6.79 ,3,$9.05 ,KE8234YE.jpg
AQUA CAKE STAND,KE8437S-AQ,(All) 25% Off Products,$10.69 ,2,$14.25 ,KE8437S-AQ.jpg
BABY BLUE CAKE STAND,KE8437S-BB,(All) 25% Off Products,$10.69 ,2,$14.25 ,KE8437S-BB.jpg
BLACK CAKE STAND,KE8437S-BK,(All) 25% Off Products,$10.69 ,2,$14.25 ,KE8437S-BK.jpg
BROWN CAKE STAND,KE8437S-BR,(All) 25% Off Products,$10.69 ,2,$14.25 ,KE8437S-BR.jpg
FUCHSIA CAKE STAND,KE8437S-FU,(All) 25% Off Products,$10.69 ,2,$14.25 ,KE8437S-FU.jpg
LIME GREEN CAKE STAND,KE8437S-LI,(All) 25% Off Products,$10.69 ,2,$14.25 ,KE8437S-LI.jpg
NAVY BLUE CAKE STAND,KE8437S-NB,(All) 25% Off Products,$10.69 ,2,$14.25 ,KE8437S-NB.jpg
ORANGE CAKE STAND,KE8437S-OR,(All) 25% Off Products,$10.69 ,2,$14.25 ,KE8437S-OR.jpg
PINK CAKE STAND,KE8437S-P,(All) 25% Off Products,$10.69 ,2,$14.25 ,KE8437S-P.jpg
WHITE CAKE STAND,KE8437S-W,(All) 25% Off Products,$10.69 ,2,$14.25 ,KE8437S-W.jpg
YELLOW CAKE STAND,KE8437S-YE,(All) 25% Off Products,$10.69 ,2,$14.25 ,KE8437S-YE.jpg
FUCHSIA MAGNETIC LICENCE PLATE,KE8517-FU,(All) 25% Off Products,$2.44 ,6,$3.25 ,KE8517-FU.jpg
YELLOW MAGNETIC LICENCE PLATE,KE8517-YE,(All) 25% Off Products,$2.44 ,6,$3.25 ,KE8517-YE.jpg
AQUA MESSAGE BOARD WITH CUT OUTS,KE8877AQ,(All) 25% Off Products,$4.24 ,3,$5.65 ,KE8877AQ.jpg
BABY BLUE MESSAGE BOARD WITH CUT OUTS,KE8877BB,(All) 25% Off Products,$4.24 ,3,$5.65 ,KE8877BB.jpg
BLACK MESSAGE BOARD WITH CUT OUTS,KE8877BK,(All) 25% Off Products,$4.24 ,3,$5.65 ,KE8877BK.jpg
BROWN MESSAGE BOARD WITH CUT OUTS,KE8877BR,(All) 25% Off Products,$4.24 ,3,$5.65 ,KE8877BR.jpg
FUCHSIA MESSAGE BOARD WITH CUT OUTS,KE8877FU,(All) 25% Off Products,$4.24 ,3,$5.65 ,KE8877FU.jpg
LIME GREEN MESSAGE BOARD WITH CUT OUTS,KE8877LI,(All) 25% Off Products,$4.24 ,3,$5.65 ,KE8877LI.jpg
NAVY BLUE MESSAGE BOARD WITH CUT OUTS,KE8877NB,(All) 25% Off Products,$4.24 ,3,$5.65 ,KE8877NB.jpg
ORANGE MESSAGE BOARD WITH CUT OUTS,KE8877OR,(All) 25% Off Products,$4.24 ,3,$5.65 ,KE8877OR.jpg
PINK MESSAGE BOARD WITH CUT OUTS,KE8877P,(All) 25% Off Products,$4.24 ,3,$5.65 ,KE8877P.jpg
RED MESSAGE BOARD WITH CUT OUTS,KE8877R,(All) 25% Off Products,$4.24 ,3,$5.65 ,KE8877R.jpg
SKY BLUE MESSAGE BOARD WITH CUT OUTS,KE8877SK,(All) 25% Off Products,$4.24 ,3,$5.65 ,KE8877SK.jpg
TURQUOISE MESSAGE BOARD WITH CUT OUTS,KE8877T,(All) 25% Off Products,$4.24 ,3,$5.65 ,KE8877T.jpg
WHITE MESSAGE BOARD WITH CUT OUTS,KE8877W,(All) 25% Off Products,$4.24 ,3,$5.65 ,KE8877W.jpg
YELLOW MESSAGE BOARD WITH CUT OUTS,KE8877YE,(All) 25% Off Products,$4.24 ,3,$5.65 ,KE8877YE.jpg
HORIZONTAL AQUA PICTURE FRAME WITH CUTOUTS,KE8879AQ,(All) 25% Off Products,$4.46 ,3,$5.95 ,KE8879AQ.jpg
HORIZONTAL BABY BLUE PICTURE FRAME WITH CUTOUTS,KE8879BB,(All) 25% Off Products,$4.46 ,3,$5.95 ,KE8879BB.jpg
HORIZONTAL BROWN PICTURE FRAME WITH CUTOUTS,KE8879BR,(All) 25% Off Products,$4.46 ,3,$5.95 ,KE8879BR.jpg
HORIZONTAL FUCHSIA PICTURE FRAME WITH CUTOUTS,KE8879FU,(All) 25% Off Products,$4.46 ,3,$5.95 ,KE8879FU.jpg
HORIZONTAL NAVY BLUE PICTURE FRAME WITH CUTOUTS,KE8879NB,(All) 25% Off Products,$4.46 ,3,$5.95 ,KE8879NB.jpg
HORIZONTAL ORANGE PICTURE FRAME WITH CUTOUTS,KE8879OR,(All) 25% Off Products,$4.46 ,3,$5.95 ,KE8879OR.jpg
HORIZONTAL PINK PICTURE FRAME WITH CUTOUTS,KE8879P,(All) 25% Off Products,$4.46 ,3,$5.95 ,KE8879P.jpg
HORIZONTAL RED PICTURE FRAME WITH CUTOUTS,KE8879R,(All) 25% Off Products,$4.46 ,3,$5.95 ,KE8879R.jpg
HORIZONTAL SKY BLUE PICTURE FRAME WITH CUTOUTS,KE8879SK,(All) 25% Off Products,$4.46 ,3,$5.95 ,KE8879SK.jpg
HORIZONTAL TURQUOISE PICTURE FRAME WITH CUTOUTS,KE8879T,(All) 25% Off Products,$4.46 ,3,$5.95 ,KE8879T.jpg
HORIZONTAL WHITE PICTURE FRAME WITH CUTOUTS,KE8879W,(All) 25% Off Products,$4.46 ,3,$5.95 ,KE8879W.jpg
HORIZONTAL YELLOW PICTURE FRAME WITH CUTOUTS,KE8879YE,(All) 25% Off Products,$4.46 ,3,$5.95 ,KE8879YE.jpg
VERTICAL AQUA PICTURE FRAME WITH CUTOUTS,KE8880AQ,(All) 25% Off Products,$4.31 ,3,$5.75 ,KE8880AQ.jpg
VERTICAL BABY BLUE PICTURE FRAME WITH CUTOUTS,KE8880BB,(All) 25% Off Products,$4.31 ,3,$5.75 ,KE8880BB.jpg
VERTICAL BLACK PICTURE FRAME WITH CUTOUTS,KE8880BK,(All) 25% Off Products,$4.31 ,3,$5.75 ,KE8880BK.jpg
VERTICAL BROWN PICTURE FRAME WITH CUTOUTS,KE8880BR,(All) 25% Off Products,$4.31 ,3,$5.75 ,KE8880BR.jpg
VERTICAL FUCHSIA PICTURE FRAME WITH CUTOUTS,KE8880FU,(All) 25% Off Products,$4.31 ,3,$5.75 ,KE8880FU.jpg
VERTICAL LIME GREEN PICTURE FRAME WITH CUTOUTS,KE8880LI,(All) 25% Off Products,$4.31 ,3,$5.75 ,KE8880LI.jpg
VERTICAL NAVY BLUE PICTURE FRAME WITH CUTOUTS,KE8880NB,(All) 25% Off Products,$4.31 ,3,$5.75 ,KE8880NB.jpg
VERTICAL ORANGE PICTURE FRAME WITH CUTOUTS,KE8880OR,(All) 25% Off Products,$4.31 ,3,$5.75 ,KE8880OR.jpg
VERTICAL PINK PICTURE FRAME WITH CUTOUTS,KE8880P,(All) 25% Off Products,$4.31 ,3,$5.75 ,KE8880P.jpg
VERTICAL RED PICTURE FRAME WITH CUTOUTS,KE8880R,(All) 25% Off Products,$4.31 ,3,$5.75 ,KE8880R.jpg
VERTICAL SKY BLUE PICTURE FRAME WITH CUTOUTS,KE8880SK,(All) 25% Off Products,$4.31 ,3,$5.75 ,KE8880SK.jpg
VERTICAL TURQUOISE PICTURE FRAME WITH CUTOUTS,KE8880T,(All) 25% Off Products,$4.31 ,3,$5.75 ,KE8880T.jpg
VERTICAL WHITE PICTURE FRAME WITH CUTOUTS,KE8880W,(All) 25% Off Products,$4.31 ,3,$5.75 ,KE8880W.jpg
VERTICAL YELLOW PICTURE FRAME WITH CUTOUTS,KE8880YE,(All) 25% Off Products,$4.31 ,3,$5.75 ,KE8880YE.jpg
GRAY IRON 6X8 PICTURE FRAME,KF12A079-557L,(All) 25% Off Products,$11.21 ,2,$14.95 ,KF12A079-557L.jpg
GRAY IRON 5X7 PICTURE FRAME,KF12A079-557M,(All) 25% Off Products,$10.13 ,2,$13.50 ,KF12A079-557M.jpg
GRAY IRON 4X6 PICTURE FRAME,KF12A079-557S,(All) 25% Off Products,$8.21 ,2,$10.95 ,KF12A079-557S.jpg
DISTRESSED HORIZONTAL PICTURE FRAME,KF12A100-106,(All) 25% Off Products,$8.21 ,2,$10.95 ,KF12A100-106.jpg
DISTRESSED GRAY VINTAGE ROUND PICTURE FRAME,KF12A100-108,(All) 25% Off Products,$9.71 ,2,$12.95 ,KF12A100-108.jpg
DISTRESSED GRAY VINTAGE OVAL PICTURE FRAME,KF12A100-109,(All) 25% Off Products,$10.46 ,2,$13.95 ,KF12A100-109.jpg
DISTRESSED BIRD CAGE MULTIPLE TEALIGHT CANDLE HOLDER,KF55192,(All) 25% Off Products,$20.21 ,1,$26.95 ,KF55192.jpg
FUCHSIA MAGNETIC FLOWER,KF8840-FU,(All) 25% Off Products,$2.44 ,6,$3.25 ,KF8840-FU.jpg
LIME GREEN MAGNETIC FLOWER,KF8840-LI,(All) 25% Off Products,$2.44 ,6,$3.25 ,KF8840-LI.jpg
5,KG2608C-BK,(All) 25% Off Products,$0.94 ,12,$1.25 ,KG2608C-BK.jpg
7,KG2608E-BK,(All) 25% Off Products,$1.61 ,6,$2.15 ,KG2608E-BK.jpg
RUSTY JINGLE BELL,KJ4945A-1.75,(All) 25% Off Products,$0.34 ,12,$0.45 ,KJ4945A-1.75.jpg
FLAT BLACK 7,KK1009SB,(All) 25% Off Products,$3.19 ,6,$4.25 ,KK1009SB.jpg
GALVANIZED TUBS S/3,KK1060N-3,(All) 25% Off Products,$11.70 ,1,$15.60 ,KK1060N-3.jpg
RUSTY WATER PITCHER,KK1142A,(All) 25% Off Products,$7.39 ,2,$9.85 ,KK1142A.jpg
RUSTY MOOSE,KK1854A,(All) 25% Off Products,$3.19 ,4,$4.25 ,KK1854A.jpg
RUSTY DECORATIVE POT,KK1994MA,(All) 25% Off Products,$4.84 ,4,$6.45 ,KK1994MA.jpg
RUSTY PICK,KK2011A,(All) 25% Off Products,$0.86 ,6,$1.15 ,KK2011A.jpg
RUSTY TEA POT PICK,KK2014A,(All) 25% Off Products,$0.86 ,6,$1.15 ,KK2014A.jpg
HANGING POCKET CHALKBOARD,KK2159-B,(All) 25% Off Products,$2.44 ,6,$3.25 ,KK2159-B.jpg
RUSTY TIN CLIP,KK2323A,(All) 25% Off Products,$0.49 ,12,$0.65 ,KK2323A.jpg
RUSTY HANGING JEAN POCKET,KK2853A,(All) 25% Off Products,$3.41 ,4,$4.55 ,KK2853A.jpg
RUST WALL CONE,KK2854A,(All) 25% Off Products,$5.29 ,3,$7.05 ,KK2854A.jpg
RUSTY HALF TABLE,KK2863A,(All) 25% Off Products,$32.29 ,1,$43.05 ,KK2863A.jpg
SMALL RUSTY DESKTOP TRASH PAIL,KK2988D-A,(All) 25% Off Products,$4.50 ,4,$6.00 ,KK2988D-A.jpg
SMALL BACK DESKTOP TRASH PAIL,KK2988D-B,(All) 25% Off Products,$4.84 ,4,$6.45 ,KK2988D-B.jpg
RUSTY EMBOSSED SQUARE PANEL,KK4118A,(All) 25% Off Products,$3.86 ,3,$5.15 ,KK4118A.jpg
BLACK STAR VOTIVE HOLDER,KK5153B,(All) 25% Off Products,$1.24 ,12,$1.65 ,KK5153B.jpg
RUSTY HANGING JEAN POCKET,KK5482A,(All) 25% Off Products,$2.06 ,4,$2.75 ,KK5482A.jpg
ANTIQUE BLACK LUNCH PAIL WITH TRAY,KK5497SB,(All) 25% Off Products,$14.21 ,2,$18.95 ,KK5497SB.jpg
ANTIQUE BLACK FLOWER BASKETS SET OF 2,KK7028B-2,(All) 25% Off Products,$5.21 ,3,$6.95 ,KK7028B-2.jpg
12,KK7249BK-12,(All) 25% Off Products,$4.91 ,4,$6.55 ,KK7249BK-12.jpg
16,KK7249BK-16,(All) 25% Off Products,$7.39 ,3,$9.85 ,KK7249BK-16.jpg
20,KK7249BK-20,(All) 25% Off Products,$10.31 ,2,$13.75 ,KK7249BK-20.jpg
12,KK7249OR-12,(All) 25% Off Products,$4.91 ,4,$6.55 ,KK7249OR-12.jpg
16' OLD RED STAR POCKET,KK7249OR-16,(All) 25% Off Products,$7.39 ,3,$9.85 ,KK7249OR-16.jpg
20,KK7249OR-20,(All) 25% Off Products,$10.31 ,2,$13.75 ,KK7249OR-20.jpg
COPPER GREEN PLANTERS SET OF 3,KK7335CG,(All) 25% Off Products,$14.44 ,6,$19.25 ,KK7335CG.jpg
12,KK7454OY-12,(All) 25% Off Products,$2.89 ,4,$3.85 ,KK7454OY-12.jpg
18,KK7454OY-18,(All) 25% Off Products,$6.19 ,3,$8.25 ,KK7454OY-18.jpg
24,KK7454OY-24,(All) 25% Off Products,$7.95 ,2,$10.60 ,KK7454OY-24.jpg
RUSTY EMBOSSED HANGIGN PLAQUE,KK7646-AB,(All) 25% Off Products,$2.21 ,6,$2.95 ,KK7646-AB.jpg
MEDIUM RUSTY ANGEL,KK8014MA,(All) 25% Off Products,$3.79 ,3,$5.05 ,KK8014MA.jpg
SMALL RUSTY ANGEL,KK8014SA,(All) 25% Off Products,$1.91 ,6,$2.55 ,KK8014SA.jpg
RUSTY CAN WITH LID,KK8162A,(All) 25% Off Products,$2.44 ,4,$3.25 ,KK8162A.jpg
FUCHSIA CHRYSANTHEMUM PICK,KK8522-FU,(All) 25% Off Products,$4.54 ,4,$6.05 ,KK8522-FU.jpg
WHITE CHRYSANTHEMUM PICK,KK8522-W,(All) 25% Off Products,$4.54 ,4,$6.05 ,KK8522-W.jpg
YELLOW CHRYSANTHEMUM PICK,KK8522-YE,(All) 25% Off Products,$4.54 ,4,$6.05 ,KK8522-YE.jpg
13,KK8620-MG-8-13,(All) 25% Off Products,$9.49 ,4,$12.65 ,KK8620-MG-8-13.jpg
15,KK8620-MG-8-15,(All) 25% Off Products,$13.61 ,4,$18.15 ,KK8620-MG-8-15.jpg
FLAT LAVENDER MESSAGE BOARD,KK8701-LAV,(All) 25% Off Products,$2.44 ,4,$3.25 ,KK8701-LAV.jpg
FLAT ORANGE MESSAGE BOARD,KK8701-OR,(All) 25% Off Products,$2.44 ,4,$3.25 ,KK8701-OR.jpg
FLAT YELLOW MESSAGE BOARD,KK8701-YE,(All) 25% Off Products,$2.44 ,4,$3.25 ,KK8701-YE.jpg
DISTRESSED ORANGE WATERING CAN,KK8767OR,(All) 25% Off Products,$13.16 ,4,$17.55 ,KK8767OR.jpg
DISTRESSED RED MAGNETIC LETTER A,KK8843S-A-R,(All) 25% Off Products,$1.69 ,6,$2.25 ,KK8843S-A-R.jpg
DISTRESSED WHITE MAGNETIC LETTER A,KK8843S-A-W,(All) 25% Off Products,$1.69 ,6,$2.25 ,KK8843S-A-W.jpg
DISTRESSED WHITE MAGNETIC LETTER B,KK8843S-B-W,(All) 25% Off Products,$1.69 ,6,$2.25 ,KK8843S-B-W.jpg
DISTRESSED WHITE MAGNETIC LETTER C,KK8843S-C-W,(All) 25% Off Products,$1.69 ,6,$2.25 ,KK8843S-C-W.jpg
DISTRESSED WHITE MAGNETIC LETTER D,KK8843S-D-W,(All) 25% Off Products,$1.69 ,6,$2.25 ,KK8843S-D-W.jpg
DISTRESSED MOSS GREEN MANGETIC LETTER E,KK8843S-E-MG,(All) 25% Off Products,$1.69 ,6,$2.25 ,KK8843S-E-MG.jpg
DISTRESSED RED MAGNETIC LETTER E,KK8843S-E-R,(All) 25% Off Products,$1.69 ,6,$2.25 ,KK8843S-E-R.jpg
DISTRESSED WHITE MAGNETIC LETTER E,KK8843S-E-W,(All) 25% Off Products,$1.69 ,6,$2.25 ,KK8843S-E-W.jpg
DISTRESSED WHITE MAGNETIC LETTER F,KK8843S-F-W,(All) 25% Off Products,$1.69 ,6,$2.25 ,KK8843S-F-W.jpg
DISTRESSED BABY BLUE MAGNETIC LETTER G,KK8843S-G-BB,(All) 25% Off Products,$1.69 ,6,$2.25 ,KK8843S-G-BB.jpg
DISTRESSED WHITE MAGNETIC LETTER G,KK8843S-G-W,(All) 25% Off Products,$1.69 ,6,$2.25 ,KK8843S-G-W.jpg
DISTRESSED ORANGE MAGNETIC LETTER H,KK8843S-H-OR,(All) 25% Off Products,$1.69 ,6,$2.25 ,KK8843S-H-OR.jpg
DISTRESSED WHITE MAGNETIC LETTER H,KK8843S-H-W,(All) 25% Off Products,$1.69 ,6,$2.25 ,KK8843S-H-W.jpg
DISTRESSED LIME GREEN MAGNETIC LETTER I,KK8843S-I-LI,(All) 25% Off Products,$1.69 ,6,$2.25 ,KK8843S-I-LI.jpg
DISTRESSED MOSS GREEN MANGETIC LETTER I,KK8843S-I-MG,(All) 25% Off Products,$1.69 ,6,$2.25 ,KK8843S-I-MG.jpg
DISTRESSED WHITE MAGNETIC LETTER I,KK8843S-I-W,(All) 25% Off Products,$1.69 ,6,$2.25 ,KK8843S-I-W.jpg
DISTRESSED RED MANGETIC LETTER J,KK8843S-J-R,(All) 25% Off Products,$1.69 ,6,$2.25 ,KK8843S-J-R.jpg
DISTRESSED WHITE MAGNETIC LETTER J,KK8843S-J-W,(All) 25% Off Products,$1.69 ,6,$2.25 ,KK8843S-J-W.jpg
DISTRESSED WHITE MAGNETIC LETTER K,KK8843S-K-W,(All) 25% Off Products,$1.69 ,6,$2.25 ,KK8843S-K-W.jpg
DISTRESSED BABY BLUE MAGNETIC LETTER L,KK8843S-L-BB,(All) 25% Off Products,$1.69 ,6,$2.25 ,KK8843S-L-BB.jpg
DISTRESSED WHITE MAGNETIC LETTER L,KK8843S-L-W,(All) 25% Off Products,$1.69 ,6,$2.25 ,KK8843S-L-W.jpg
DISTRESSED ORANGE MAGNETIC LETTER M,KK8843S-M-OR,(All) 25% Off Products,$1.69 ,6,$2.25 ,KK8843S-M-OR.jpg
DISTRESSED WHITE MAGNETIC LETTER M,KK8843S-M-W,(All) 25% Off Products,$1.69 ,6,$2.25 ,KK8843S-M-W.jpg
DISTRESSED LIME GREEN MAGNETIC LETTER N,KK8843S-N-LI,(All) 25% Off Products,$1.69 ,6,$2.25 ,KK8843S-N-LI.jpg
DISTRESSED WHITE MAGNETIC LETTER N,KK8843S-N-W,(All) 25% Off Products,$1.69 ,6,$2.25 ,KK8843S-N-W.jpg
DISTRESSED MOSS GREEN MANGETIC LETTER O,KK8843S-O-MG,(All) 25% Off Products,$1.69 ,6,$2.25 ,KK8843S-O-MG.jpg
DISTRESSED WHITE MAGNETIC LETTER O,KK8843S-O-W,(All) 25% Off Products,$1.69 ,6,$2.25 ,KK8843S-O-W.jpg
DISTRESSED WHITE MAGNETIC LETTER P,KK8843S-P-W,(All) 25% Off Products,$1.69 ,6,$2.25 ,KK8843S-P-W.jpg
DISTRESSED WHITE MAGNETIC LETTER Q,KK8843S-Q-W,(All) 25% Off Products,$1.69 ,6,$2.25 ,KK8843S-Q-W.jpg
DISTRESSED BABY BLUE MAGNETIC LETTER R,KK8843S-R-BB,(All) 25% Off Products,$1.69 ,6,$2.25 ,KK8843S-R-BB.jpg
DISTRESSED WHITE MAGNETIC LETTER R,KK8843S-R-W,(All) 25% Off Products,$1.69 ,6,$2.25 ,KK8843S-R-W.jpg
DISTRESSED ORANGE MAGNETIC LETTER S,KK8843S-S-OR,(All) 25% Off Products,$1.69 ,6,$2.25 ,KK8843S-S-OR.jpg
DISTRESSED WHITE MAGNETIC LETTER S,KK8843S-S-W,(All) 25% Off Products,$1.69 ,6,$2.25 ,KK8843S-S-W.jpg
DISTRESSED WHITE MAGNETIC LETTER T,KK8843S-T-W,(All) 25% Off Products,$1.69 ,6,$2.25 ,KK8843S-T-W.jpg
DISTRESSED MOSS GREEN MANGETIC LETTER U,KK8843S-U-MG,(All) 25% Off Products,$1.69 ,6,$2.25 ,KK8843S-U-MG.jpg
DISTRESSED WHITE MAGNETIC LETTER U,KK8843S-U-W,(All) 25% Off Products,$1.69 ,6,$2.25 ,KK8843S-U-W.jpg
DISTRESSED RED MANGETIC LETTER R,KK8843S-V-R,(All) 25% Off Products,$1.69 ,6,$2.25 ,KK8843S-V-R.jpg
DISTRESSED WHITE MAGNETIC LETTER V,KK8843S-V-W,(All) 25% Off Products,$1.69 ,6,$2.25 ,KK8843S-V-W.jpg
DISTRESSED WHITE MAGNETIC LETTER W,KK8843S-W-W,(All) 25% Off Products,$1.69 ,6,$2.25 ,KK8843S-W-W.jpg
DISTRESSED BABY BLUE MAGNETIC LETTER X,KK8843S-X-BB,(All) 25% Off Products,$1.69 ,6,$2.25 ,KK8843S-X-BB.jpg
DISTRESSED WHITE MAGNETIC LETTER X,KK8843S-X-W,(All) 25% Off Products,$1.69 ,6,$2.25 ,KK8843S-X-W.jpg
DISTRESSED ORANGE MAGNETIC LETTER Y,KK8843S-Y-OR,(All) 25% Off Products,$1.69 ,6,$2.25 ,KK8843S-Y-OR.jpg
DISTRESSED WHITE MAGNETIC LETTER Y,KK8843S-Y-W,(All) 25% Off Products,$1.69 ,6,$2.25 ,KK8843S-Y-W.jpg
DISTRESSED LIME GREEN MAGNETIC LETTER Z,KK8843S-Z-LI,(All) 25% Off Products,$1.69 ,6,$2.25 ,KK8843S-Z-LI.jpg
DISTRESSED WHITE MAGNETIC LETTER Z,KK8843S-Z-W,(All) 25% Off Products,$1.69 ,6,$2.25 ,KK8843S-Z-W.jpg
12,KK8860BK-12,(All) 25% Off Products,$2.36 ,4,$3.15 ,KK8860BK-12.jpg
20,KK8860BK-20,(All) 25% Off Products,$5.63 ,3,$7.50 ,KK8860BK-20.jpg
6,KK8860BK-6,(All) 25% Off Products,$1.24 ,6,$1.65 ,KK8860BK-6.jpg
RUSTY MESSAGE BOARD WITH CUT OUTS,KK8877A,(All) 25% Off Products,$3.86 ,3,$5.15 ,KK8877A.jpg
HORIZONTAL RUSTY PICTURE FRAME WITH CUTOUTS,KK8879A,(All) 25% Off Products,$4.01 ,3,$5.35 ,KK8879A.jpg
VERTICAL RUSTY PICTURE FRAME WITH CUTOUTS,KK8880A,(All) 25% Off Products,$3.94 ,3,$5.25 ,KK8880A.jpg
BLACK AND SILVER MAGNETIC EIFFEL TOWER,KK8881,(All) 25% Off Products,$1.46 ,6,$1.95 ,KK8881.jpg
RUSTY DRAGONFLY CUT OUT,KK8887A,(All) 25% Off Products,$0.38 ,12,$0.50 ,KK8887A.jpg
GRAY ZINC SQUARE BOX WITH LID,KK9064-GB,(All) 25% Off Products,$13.13 ,2,$17.50 ,KK9064-GB.jpg
MINIATURE WATER PITCHER,KKFL119A,(All) 25% Off Products,$1.01 ,6,$1.35 ,KKFL119A.jpg
RUSTY BIRD HOUSE PICKS S/3,KKFL180PA,(All) 25% Off Products,$4.84 ,2,$6.45 ,KKFL180PA.jpg
3.25,KL2382B,(All) 25% Off Products,$1.24 ,6,$1.65 ,KL2382B.jpg
2.75,KS2968SA,(All) 25% Off Products,$0.65 ,12,$0.86 ,KS2968SA.jpg
RUSTY IRON STAR,KS4827A,(All) 25% Off Products,$1.91 ,4,$2.55 ,KS4827A.jpg
RUSTY JINGLE BELL,KT9661A,(All) 25% Off Products,$1.24 ,6,$1.65 ,KT9661A.jpg
LARGE WHITE WASHED VOTIVE CHANDELIER,KV4712LW,(All) 25% Off Products,$14.96 ,1,$19.95 ,KV4712LW.jpg
WHITE WASHED VOTIVE CHANDELIER,KV4712SW,(All) 25% Off Products,$11.96 ,2,$15.95 ,KV4712SW.jpg
WHITE WASHED SMALL SHOPPING CART,KV4821W,(All) 25% Off Products,$7.35 ,2,$9.80 ,KV4821W.jpg
WHTIE WASHED HANGING FLOWER BASKET,KV7028S-W,(All) 25% Off Products,$4.84 ,3,$6.45 ,KV7028S-W.jpg
WHITE WASHED EMBOSSED HANGING PLAQUE,KV7646W,(All) 25% Off Products,$2.44 ,4,$3.25 ,KV7646W.jpg
WHTIE WASHED PAN,KV995LW,(All) 25% Off Products,$1.91 ,6,$2.55 ,KV995LW.jpg
LARGE GALVANIZED TUB WITH JUTE ROPE HANDLES,KW009,(All) 25% Off Products,$8.63 ,2,$11.50 ,KW009.jpg
WEATHERED LOOK CANDLE SHADE WITH HEART CUT OUTS,KW4360-HEART,(All) 25% Off Products,$2.29 ,4,$3.05 ,KW4360-HEART.jpg
WEATHERED LOOK CANDLE SHADE WITH STAR CUT OUTS,KW4360-STAR,(All) 25% Off Products,$2.29 ,4,$3.05 ,KW4360-STAR.jpg
WEATHERED LOOK MAIL HOLDER,KW5062,(All) 25% Off Products,$13.46 ,2,$17.95 ,KW5062.jpg
10,KW8483-10,(All) 25% Off Products,$5.89 ,3,$7.85 ,KW8483-10.jpg
13,KW8483-13,(All) 25% Off Products,$7.39 ,2,$9.85 ,KW8483-13.jpg
16,KW8483-16,(All) 25% Off Products,$9.60 ,2,$12.80 ,KW8483-16.jpg
WEATHERED LOOK WATERING CAN PLANTER WITH DRAIN HOLES,KW9467,(All) 25% Off Products,$5.63 ,4,$7.50 ,KW9467.jpg
FULL SET OF MAGNETIC LETTERS WITH DISPLAY BOX - 96 LETTERS,PDQ1-LETTERS,(All) 25% Off Products,$165.00 ,2,$220.00 ,PDQ1-LETTERS.jpg
FULL SET OF MANGETIC FLOWERS WITH DISPLAY BOX - 48 FLOWERS,PDQ2-FLOWERS,(All) 25% Off Products,$86.25 ,2,$115.00 ,PDQ2-FLOWERS.jpg
RED HAT PICTURE FRAME,RH4300,(All) 25% Off Products,$5.39 ,3,$7.18 ,RH4300.jpg
GALVANIZED WIRE SOAP DISH,WB4220N,(All) 25% Off Products,$2.21 ,4,$2.95 ,WB4220N.jpg
MINI RUSTY TAPERED PAIL PICK,WB582A,(All) 25% Off Products,$1.31 ,12,$1.75 ,WB582A.jpg
