MINI RUSTY TAPERED PAIL,WB582A-1,(All) 25% Off Products,$1.28 ,12,$1.70 ,WB582A-1.jpg
MINI RUSTY WATER PITCHER PICK,WB584A,(All) 25% Off Products,$1.31 ,12,$1.75 ,WB584A.jpg
MINI RUSTY DUST PAN PICK,WB585A,(All) 25% Off Products,$0.94 ,12,$1.25 ,WB585A.jpg
MINI RUSTY DUST PAN,WB585A-1,(All) 25% Off Products,$0.86 ,12,$1.15 ,WB585A-1.jpg
MINI RUSY PAIL PICK,WB586A,(All) 25% Off Products,$1.13 ,12,$1.50 ,WB586A.jpg
MINI RUSTY PAIL,WB586A-1,(All) 25% Off Products,$1.05 ,12,$1.40 ,WB586A-1.jpg
MINI SQUARE BIRD HOSUE GARDEN DOME,WB595A,(All) 25% Off Products,$4.13 ,4,$5.50 ,WB595A.jpg
MINI ROUND BIRD HOUSE GARDEN DOME,WB598A,(All) 25% Off Products,$3.71 ,4,$4.95 ,WB598A.jpg
MINI WIRE 2 PERSON BENCH,WB599A,(All) 25% Off Products,$2.63 ,4,$3.50 ,WB599A.jpg
MINI WIRE 1 PERSON BENCH,WB600A,(All) 25% Off Products,$2.06 ,4,$2.75 ,WB600A.jpg
MINI WIRE ROUND TABLE,WB603A,(All) 25% Off Products,$2.74 ,4,$3.65 ,WB603A.jpg
BLACK MINI TRICYCLE,WB605B,(All) 25% Off Products,$3.38 ,3,$4.50 ,WB605B.jpg
WHITE MINI TRICYCLE,WB605W,(All) 25% Off Products,$3.38 ,3,$4.50 ,WB605W.jpg
MINI WIRE CHAIR,WB614A,(All) 25% Off Products,$1.76 ,6,$2.35 ,WB614A.jpg
MINI WIRE WHEELBARROW,WB615A,(All) 25% Off Products,$2.96 ,4,$3.95 ,WB615A.jpg
BLACK WIRE WALL BASKET,WB636B,(All) 25% Off Products,$5.63 ,3,$7.50 ,WB636B.jpg
RUSTY WIRE FLOWER BASKET,WB639A,(All) 25% Off Products,$2.96 ,4,$3.95 ,WB639A.jpg
GALVANIZED WIRE FLOWER BASKET,WB639N,(All) 25% Off Products,$2.96 ,4,$3.95 ,WB639N.jpg
BLACK PAPER ROPE ORGANIZER,WB646B,(All) 25% Off Products,$1.88 ,6,$2.50 ,WB646B.jpg
WHITE PAPER ROPE ORGANZIER,WB646W,(All) 25% Off Products,$1.88 ,6,$2.50 ,WB646W.jpg
BLACK WIRE LAMP - SHADE NOT INCLUDED,WB647BK,(All) 25% Off Products,$22.46 ,1,$29.95 ,WB647BK.jpg
LIME GREEN WIRE LAMP - SHADE NOT INCLUDED,WB647LI,(All) 25% Off Products,$22.46 ,1,$29.95 ,WB647LI.jpg
RUSTY ZINC BIRD HOUSE CANDLE HOLDER WITH ROSE,WB659-AG,(All) 25% Off Products,$4.13 ,3,$5.50 ,WB659-AG.jpg
RUSTY ZINC BIRD HOUSE CANDLE HOLDER,WB668-AG,(All) 25% Off Products,$3.94 ,2,$5.25 ,WB668-AG.jpg
RUSTY IRON SOAP DISH,WB681A,(All) 25% Off Products,$7.46 ,2,$9.95 ,WB681A.jpg
WHTIE IRON SOAP DISH,WB681W,(All) 25% Off Products,$7.46 ,2,$9.95 ,WB681W.jpg
RUSTY FRENCH DESIGN CLOCK,WB682A,(All) 25% Off Products,$10.88 ,2,$14.50 ,WB682A.jpg
BLACK WIRE BASKET,WB688B,(All) 25% Off Products,$6.71 ,3,$8.95 ,WB688B.jpg
DECORATIVE BLCK WIRE BIRD HOUSE ON STAND,WB690B,(All) 25% Off Products,$3.64 ,4,$4.85 ,WB690B.jpg
RUSTY IRON FRENCH FLEUR WALL HOOK,WB692A,(All) 25% Off Products,$2.81 ,4,$3.75 ,WB692A.jpg
BLACK IRON FRENCH FLEUR WALL HOOK,WB692B,(All) 25% Off Products,$2.81 ,4,$3.75 ,WB692B.jpg
FRENCH FLEUR WALL COAT HOOK,WB694A,(All) 25% Off Products,$2.63 ,4,$3.50 ,WB694A.jpg
AMERICAN FLAG RIBBON,WPS0901,(All) 25% Off Products,$13.13 ,2,$17.50 ,WPS0901.jpg
GOLD WIRE RIBBON,X7552,(All) 25% Off Products,$4.46 ,4,$5.95 ,X7552.jpg
AMERICAN FLAG RIBBON,258326,(All) 50% Off Products,$7.25 ,48,$14.50 ,258326.jpg
AMERICAN FLAG RIBBON,258329,(All) 50% Off Products,$9.75 ,24,$19.50 ,258329.jpg
MEDIUM DECORATIVE BEE HIVE,BH190M,(All) 50% Off Products,$2.18 ,60,$4.35 ,BH190M.jpg
SMALL DECORATIVE BEE HIVE,BH190S,(All) 50% Off Products,$1.63 ,60,$3.25 ,BH190S.jpg
FOAM BRICKS,FB3,(All) 50% Off Products,$1.30 ,12,$2.59 ,FB3.jpg
DECORATIVE WORK TOOS,GS2006A,(All) 50% Off Products,$0.66 ,360,$1.31 ,GS2006A.jpg
DECORATIVE RUSTY WORK TOOLS,GS9537LA,(All) 50% Off Products,$7.68 ,24,$15.36 ,GS9537LA.jpg
IRON STAR,IS005,(All) 50% Off Products,$1.49 ,144,$2.97 ,IS005.jpg
IRON STAR,IS547,(All) 50% Off Products,$3.43 ,25,$6.86 ,IS547.jpg
RUSTY DECORATIVE HEART BIRD HOSUE,KB1307,(All) 50% Off Products,$1.15 ,120,$2.29 ,KB1307.jpg
RUSTY BIRD BICK,KB1747A,(All) 50% Off Products,$0.75 ,288,$1.50 ,KB1747A.jpg
RUSTY BIRD HOSUE PICK,KB4547,(All) 50% Off Products,$0.75 ,288,$1.50 ,KB4547.jpg
RUSTY CAT CANDLE HOLDER,KC3001A,(All) 50% Off Products,$2.78 ,60,$5.56 ,KC3001A.jpg
DISTRESSED BABY BLUE THIN OVAL BUCKET,KD1694BB-3,(All) 50% Off Products,$10.98 ,12,$21.95 ,KD1694BB-3.jpg
DISTRESSED ORANGE THIN OVAL BUCKET,KD1694OR-3,(All) 50% Off Products,$10.98 ,12,$21.95 ,KD1694OR-3.jpg
LARGE DISTRESSED WHITE OLIVE BUCKET,KD8850L-W,(All) 50% Off Products,$7.48 ,24,$14.95 ,KD8850L-W.jpg
SMALL DISTRESSED LIME GREEN OLIVE BUCKET,KD8850S-LI,(All) 50% Off Products,$5.48 ,24,$10.95 ,KD8850S-LI.jpg
SMALL DISTRESSED WHITE OLIVE BUCKET,KD8850S-W,(All) 50% Off Products,$5.48 ,24,$10.95 ,KD8850S-W.jpg
LARGE DISTRESSED BABY BLUE LAMP SHADE,KD8876L-BB,(All) 50% Off Products,$9.25 ,12,$18.50 ,KD8876L-BB.jpg
LARGE DISTRESSED LIME GREEN LAMP SHADE,KD8876L-LI,(All) 50% Off Products,$9.25 ,12,$18.50 ,KD8876L-LI.jpg
LARGE DISTRESSED ORANGE LAMP SHADE,KD8876L-OR,(All) 50% Off Products,$9.25 ,12,$18.50 ,KD8876L-OR.jpg
LARGE DISTRESSED WHITE LAME SHADE,KD8876L-W,(All) 50% Off Products,$9.25 ,12,$18.50 ,KD8876L-W.jpg
RED COAL BUCKETS SET OF 2,KE1078BR-2,(All) 50% Off Products,$10.03 ,12,$20.05 ,KE1078BR-2.jpg
ORANGE COAL BUCKETS SET OF 2,KE1078OR-2,(All) 50% Off Products,$10.03 ,12,$20.05 ,KE1078OR-2.jpg
PINK COAL BUCKETS SET OF 2,KE1078P-2,(All) 50% Off Products,$10.03 ,12,$20.05 ,KE1078P-2.jpg
WHITE FLOWER BASKETS SET OF 2,KE1078W-2,(All) 50% Off Products,$3.48 ,36,$6.95 ,KE1078W-2.jpg
BROWN PUMPKIN PLANTER,KE2320BR,(All) 50% Off Products,$8.28 ,12,$16.55 ,KE2320BR.jpg
PINK WALL POCKET,KE2605P,(All) 50% Off Products,$2.13 ,48,$4.25 ,KE2605P.jpg
AQUA TIN CUP,KE4463AQ,(All) 50% Off Products,$1.63 ,96,$3.25 ,KE4463AQ.jpg
RED TIN CUP,KE4463R,(All) 50% Off Products,$1.63 ,96,$3.25 ,KE4463R.jpg
12,KE4990SG,(All) 50% Off Products,$3.85 ,24,$7.70 ,KE4990SG.jpg
WHITE WITH RED TRIM SOAP DISH,KE5187WR,(All) 50% Off Products,$2.58 ,72,$5.15 ,KE5187WR.jpg
BROWN ICE BUCKET WITH SCOOP,KE5229LBR-SCOOP,(All) 50% Off Products,$7.13 ,18,$14.25 ,KE5229LBR-SCOOP.jpg
PINK ICE BUCKET WITH SCOOP,KE5229LP-SCOOP,(All) 50% Off Products,$7.13 ,18,$14.25 ,KE5229LP-SCOOP.jpg
RED ICE BUCKET WITH SCOOP,KE5229LR-SCOOP,(All) 50% Off Products,$7.13 ,18,$14.25 ,KE5229LR-SCOOP.jpg
WHITE ICE BUCKET WITH SCOOP,KE5229LW-SCOOP,(All) 50% Off Products,$7.13 ,18,$14.25 ,KE5229LW-SCOOP.jpg
PINK TIN MUG WITH LID,KE5230B-P,(All) 50% Off Products,$2.50 ,36,$5.00 ,KE5230B-P.jpg
YELLOW POTS WITH LIDS S/4,KE5233Y-4,(All) 50% Off Products,$9.88 ,12,$19.75 ,KE5233Y-4.jpg
RED MILK CAN,KE5247LR,(All) 50% Off Products,$4.68 ,12,$9.35 ,KE5247LR.jpg
ROUND WHITE TRAYS SET/2,KE5713W-2,(All) 50% Off Products,$12.38 ,12,$24.75 ,KE5713W-2.jpg
PINK DECORATIVE WATERING CAN,KE5786P,(All) 50% Off Products,$5.08 ,12,$10.15 ,KE5786P.jpg
RED DECORATIVE WATERING CAN,KE5786R,(All) 50% Off Products,$5.08 ,12,$10.15 ,KE5786R.jpg
WHITE DECORATIVE WATERING CAN,KE5786W,(All) 50% Off Products,$5.08 ,12,$10.15 ,KE5786W.jpg
AQUA WATERING CAN PLANTER,KE5788AQ,(All) 50% Off Products,$3.48 ,24,$6.95 ,KE5788AQ.jpg
BROWN TISSUE BOX COVER,KE5879BR,(All) 50% Off Products,$3.85 ,24,$7.70 ,KE5879BR.jpg
ORANGE TISSUE BOX COVER,KE5879OR,(All) 50% Off Products,$3.85 ,24,$7.70 ,KE5879OR.jpg
AQUA HALF DRINK DISPENSER,KE5921-AQ,(All) 50% Off Products,$13.08 ,8,$26.15 ,KE5921-AQ.jpg
PINK HALF DRINK DISPENSER,KE5921-P,(All) 50% Off Products,$13.08 ,8,$26.15 ,KE5921-P.jpg
RED HALF DRINK DISPENSER,KE5921-R,(All) 50% Off Products,$13.08 ,8,$26.15 ,KE5921-R.jpg
WHITE HALF DRINK DISPENCER,KE5921-W,(All) 50% Off Products,$13.08 ,8,$26.15 ,KE5921-W.jpg
AQUA FULL DRINK DISPENSER,KE5921AQ-FULL,(All) 50% Off Products,$16.38 ,8,$32.75 ,KE5921AQ-FULL.jpg
PINK FULL DRINK DISPENSER,KE5921P-FULL,(All) 50% Off Products,$16.38 ,8,$32.75 ,KE5921P-FULL.jpg
RED FULL DRINK DISPENSER,KE5921R-FULL,(All) 50% Off Products,$16.38 ,8,$32.75 ,KE5921R-FULL.jpg
WHITE FULL DRINK DISPENSER,KE5921W-FULL,(All) 50% Off Products,$16.38 ,8,$32.75 ,KE5921W-FULL.jpg
BROWN TISSUE AND TOILET PAPER HOLDER,KE5925BR,(All) 50% Off Products,$8.23 ,12,$16.45 ,KE5925BR.jpg
RED TISSUE AND TOILET PAPER HOLDER,KE5925R,(All) 50% Off Products,$8.23 ,12,$16.45 ,KE5925R.jpg
SMALL AQUA SCALLOPED SQUARE TRAY,KE5958S-AQ,(All) 50% Off Products,$3.55 ,48,$7.10 ,KE5958S-AQ.jpg
SMALL BLACK SCALLOPED SQUARE TRAY,KE5958S-BK,(All) 50% Off Products,$3.55 ,48,$7.10 ,KE5958S-BK.jpg
SMALL BROWN SCALLOPED SQUARE TRAY,KE5958S-BR,(All) 50% Off Products,$3.55 ,48,$7.10 ,KE5958S-BR.jpg
SMALL FUCHSIA SCALLOPED SQUARE TRAY,KE5958S-FU,(All) 50% Off Products,$3.55 ,48,$7.10 ,KE5958S-FU.jpg
SMALL LIME GREEN SCALLOPED SQUARE TRAY,KE5958S-LI,(All) 50% Off Products,$3.55 ,48,$7.10 ,KE5958S-LI.jpg
SMALL PINK SCALLOPED SQUARE TRAY,KE5958S-P,(All) 50% Off Products,$3.55 ,48,$7.10 ,KE5958S-P.jpg
SMALL RED SCALLOPED SQUARE TRAY,KE5958S-R,(All) 50% Off Products,$3.55 ,48,$7.10 ,KE5958S-R.jpg
SMALL SKY BLUE SCALLOPED SQUARE TRAY,KE5958S-SK,(All) 50% Off Products,$3.55 ,48,$7.10 ,KE5958S-SK.jpg
SMALL YELLOW SCALLOPED SQUARE TRAY,KE5958S-YE,(All) 50% Off Products,$3.55 ,48,$7.10 ,KE5958S-YE.jpg
AQUA WHEELBARROW,KE6005L-AQ,(All) 50% Off Products,$1.63 ,48,$3.25 ,KE6005L-AQ.jpg
FUCHSIA WHEELBARROW,KE6005L-FU,(All) 50% Off Products,$1.63 ,48,$3.25 ,KE6005L-FU.jpg
PINK WHEELBARROW,KE6005L-P,(All) 50% Off Products,$1.63 ,48,$3.25 ,KE6005L-P.jpg
AQUA FLOWER BASKETS SET OF 2,KE7028AQ-2,(All) 50% Off Products,$3.48 ,36,$6.95 ,KE7028AQ-2.jpg
PINK FLOWER BASKETS SET OF 2,KE7028P-2,(All) 50% Off Products,$3.48 ,36,$6.95 ,KE7028P-2.jpg
RED FLOWER BASKETS SET OF 2,KE7028R-2,(All) 50% Off Products,$3.48 ,36,$6.95 ,KE7028R-2.jpg
BROWN PICTURE BOOK,KE7099BR,(All) 50% Off Products,$5.48 ,24,$10.95 ,KE7099BR.jpg
BROWN HANGING MAGNETIC BOARD WITH STAR CUT OUTS,KE8159BR,(All) 50% Off Products,$3.58 ,36,$7.15 ,KE8159BR.jpg
ORANGE HANGING MAGNETIC BOARD WITH STAR CUT OUTS,KE8159OR,(All) 50% Off Products,$3.58 ,36,$7.15 ,KE8159OR.jpg
AQUA CAN WITH LID,KE8162AQ,(All) 50% Off Products,$1.78 ,72,$3.55 ,KE8162AQ.jpg
BABY BLUE CAN WITH LID,KE8162BB,(All) 50% Off Products,$1.78 ,72,$3.55 ,KE8162BB.jpg
BLACK CAN WITH LID,KE8162BK,(All) 50% Off Products,$1.78 ,72,$3.55 ,KE8162BK.jpg
BROWN CAN WITH LID,KE8162BR,(All) 50% Off Products,$1.78 ,72,$3.55 ,KE8162BR.jpg
FUCHSIA CAN WITH LID,KE8162FU,(All) 50% Off Products,$1.78 ,72,$3.55 ,KE8162FU.jpg
LIME GREEN CAN WITH LID,KE8162LI,(All) 50% Off Products,$1.78 ,72,$3.55 ,KE8162LI.jpg
ORANGE CAN WITH LID,KE8162OR,(All) 50% Off Products,$1.78 ,72,$3.55 ,KE8162OR.jpg
PINK CAN WITH LID,KE8162P,(All) 50% Off Products,$1.78 ,72,$3.55 ,KE8162P.jpg
RED CAN WITH LID,KE8162R,(All) 50% Off Products,$1.78 ,72,$3.55 ,KE8162R.jpg
SKY BLUE CAN WITH LID,KE8162SK,(All) 50% Off Products,$1.78 ,72,$3.55 ,KE8162SK.jpg
WHITE CAN WITH LID,KE8162W,(All) 50% Off Products,$1.78 ,72,$3.55 ,KE8162W.jpg
YELLOW CAN WITH LID,KE8162YE,(All) 50% Off Products,$1.78 ,72,$3.55 ,KE8162YE.jpg
RED 3 TIERED SERVING STAND,KE8230R,(All) 50% Off Products,$16.48 ,6,$32.95 ,KE8230R.jpg
LARGE BROWN MAGNETIC BOARD,KE8231BR,(All) 50% Off Products,$8.18 ,12,$16.35 ,KE8231BR.jpg
LARGE BROWN MAGNETIC BOARD,KE8231BR,(All) 50% Off Products,$8.18 ,12,$16.35 ,KE8231BR.jpg
LARGE ORANGE MAGNETIC BOARD,KE8231OR,(All) 50% Off Products,$8.18 ,12,$16.35 ,KE8231OR.jpg
LARGE PURPLE MAGNETIC BOARD,KE8231PUR,(All) 50% Off Products,$8.18 ,12,$16.35 ,KE8231PUR.jpg
LARGE TURQUOISE MAGNETIC BOARD,KE8231T,(All) 50% Off Products,$8.18 ,12,$16.35 ,KE8231T.jpg
BROWN WALL COAT HOOK,KE8234BR,(All) 50% Off Products,$4.53 ,24,$9.05 ,KE8234BR.jpg
ORANGE WALL COAT HOOK,KE8234OR,(All) 50% Off Products,$4.53 ,24,$9.05 ,KE8234OR.jpg
YELLOW WALL COAT HOOK,KE8234YE,(All) 50% Off Products,$4.53 ,24,$9.05 ,KE8234YE.jpg
AQUA CAKE STAND,KE8437S-AQ,(All) 50% Off Products,$7.13 ,12,$14.25 ,KE8437S-AQ.jpg
BABY BLUE CAKE STAND,KE8437S-BB,(All) 50% Off Products,$7.13 ,12,$14.25 ,KE8437S-BB.jpg
BLACK CAKE STAND,KE8437S-BK,(All) 50% Off Products,$7.13 ,12,$14.25 ,KE8437S-BK.jpg
BROWN CAKE STAND,KE8437S-BR,(All) 50% Off Products,$7.13 ,12,$14.25 ,KE8437S-BR.jpg
FUCHSIA CAKE STAND,KE8437S-FU,(All) 50% Off Products,$7.13 ,12,$14.25 ,KE8437S-FU.jpg
LIME GREEN CAKE STAND,KE8437S-LI,(All) 50% Off Products,$7.13 ,12,$14.25 ,KE8437S-LI.jpg
NAVY BLUE CAKE STAND,KE8437S-NB,(All) 50% Off Products,$7.13 ,12,$14.25 ,KE8437S-NB.jpg
ORANGE CAKE STAND,KE8437S-OR,(All) 50% Off Products,$7.13 ,12,$14.25 ,KE8437S-OR.jpg
PINK CAKE STAND,KE8437S-P,(All) 50% Off Products,$7.13 ,12,$14.25 ,KE8437S-P.jpg
WHITE CAKE STAND,KE8437S-W,(All) 50% Off Products,$7.13 ,12,$14.25 ,KE8437S-W.jpg
YELLOW CAKE STAND,KE8437S-YE,(All) 50% Off Products,$7.13 ,12,$14.25 ,KE8437S-YE.jpg
FUCHSIA MAGNETIC LICENCE PLATE,KE8517-FU,(All) 50% Off Products,$1.63 ,12,$3.25 ,KE8517-FU.jpg
YELLOW MAGNETIC LICENCE PLATE,KE8517-YE,(All) 50% Off Products,$1.63 ,12,$3.25 ,KE8517-YE.jpg
AQUA MESSAGE BOARD WITH CUT OUTS,KE8877AQ,(All) 50% Off Products,$2.83 ,72,$5.65 ,KE8877AQ.jpg
BABY BLUE MESSAGE BOARD WITH CUT OUTS,KE8877BB,(All) 50% Off Products,$2.83 ,72,$5.65 ,KE8877BB.jpg
BLACK MESSAGE BOARD WITH CUT OUTS,KE8877BK,(All) 50% Off Products,$2.83 ,72,$5.65 ,KE8877BK.jpg
BROWN MESSAGE BOARD WITH CUT OUTS,KE8877BR,(All) 50% Off Products,$2.83 ,72,$5.65 ,KE8877BR.jpg
FUCHSIA MESSAGE BOARD WITH CUT OUTS,KE8877FU,(All) 50% Off Products,$2.83 ,72,$5.65 ,KE8877FU.jpg
LIME GREEN MESSAGE BOARD WITH CUT OUTS,KE8877LI,(All) 50% Off Products,$2.83 ,72,$5.65 ,KE8877LI.jpg
NAVY BLUE MESSAGE BOARD WITH CUT OUTS,KE8877NB,(All) 50% Off Products,$2.83 ,72,$5.65 ,KE8877NB.jpg
ORANGE MESSAGE BOARD WITH CUT OUTS,KE8877OR,(All) 50% Off Products,$2.83 ,72,$5.65 ,KE8877OR.jpg
PINK MESSAGE BOARD WITH CUT OUTS,KE8877P,(All) 50% Off Products,$2.83 ,72,$5.65 ,KE8877P.jpg
RED MESSAGE BOARD WITH CUT OUTS,KE8877R,(All) 50% Off Products,$2.83 ,72,$5.65 ,KE8877R.jpg
SKY BLUE MESSAGE BOARD WITH CUT OUTS,KE8877SK,(All) 50% Off Products,$2.83 ,72,$5.65 ,KE8877SK.jpg
TURQUOISE MESSAGE BOARD WITH CUT OUTS,KE8877T,(All) 50% Off Products,$2.83 ,72,$5.65 ,KE8877T.jpg
WHITE MESSAGE BOARD WITH CUT OUTS,KE8877W,(All) 50% Off Products,$2.83 ,72,$5.65 ,KE8877W.jpg
YELLOW MESSAGE BOARD WITH CUT OUTS,KE8877YE,(All) 50% Off Products,$2.83 ,72,$5.65 ,KE8877YE.jpg
HORIZONTAL AQUA PICTURE FRAME WITH CUTOUTS,KE8879AQ,(All) 50% Off Products,$2.98 ,48,$5.95 ,KE8879AQ.jpg
HORIZONTAL BABY BLUE PICTURE FRAME WITH CUTOUTS,KE8879BB,(All) 50% Off Products,$2.98 ,48,$5.95 ,KE8879BB.jpg
HORIZONTAL BROWN PICTURE FRAME WITH CUTOUTS,KE8879BR,(All) 50% Off Products,$2.98 ,48,$5.95 ,KE8879BR.jpg
HORIZONTAL FUCHSIA PICTURE FRAME WITH CUTOUTS,KE8879FU,(All) 50% Off Products,$2.98 ,48,$5.95 ,KE8879FU.jpg
HORIZONTAL NAVY BLUE PICTURE FRAME WITH CUTOUTS,KE8879NB,(All) 50% Off Products,$2.98 ,48,$5.95 ,KE8879NB.jpg
HORIZONTAL ORANGE PICTURE FRAME WITH CUTOUTS,KE8879OR,(All) 50% Off Products,$2.98 ,48,$5.95 ,KE8879OR.jpg
HORIZONTAL PINK PICTURE FRAME WITH CUTOUTS,KE8879P,(All) 50% Off Products,$2.98 ,48,$5.95 ,KE8879P.jpg
HORIZONTAL RED PICTURE FRAME WITH CUTOUTS,KE8879R,(All) 50% Off Products,$2.98 ,48,$5.95 ,KE8879R.jpg
HORIZONTAL SKY BLUE PICTURE FRAME WITH CUTOUTS,KE8879SK,(All) 50% Off Products,$2.98 ,48,$5.95 ,KE8879SK.jpg
HORIZONTAL TURQUOISE PICTURE FRAME WITH CUTOUTS,KE8879T,(All) 50% Off Products,$2.98 ,48,$5.95 ,KE8879T.jpg
HORIZONTAL WHITE PICTURE FRAME WITH CUTOUTS,KE8879W,(All) 50% Off Products,$2.98 ,48,$5.95 ,KE8879W.jpg
HORIZONTAL YELLOW PICTURE FRAME WITH CUTOUTS,KE8879YE,(All) 50% Off Products,$2.98 ,48,$5.95 ,KE8879YE.jpg
VERTICAL AQUA PICTURE FRAME WITH CUTOUTS,KE8880AQ,(All) 50% Off Products,$2.88 ,48,$5.75 ,KE8880AQ.jpg
VERTICAL BABY BLUE PICTURE FRAME WITH CUTOUTS,KE8880BB,(All) 50% Off Products,$2.88 ,48,$5.75 ,KE8880BB.jpg
VERTICAL BLACK PICTURE FRAME WITH CUTOUTS,KE8880BK,(All) 50% Off Products,$2.88 ,48,$5.75 ,KE8880BK.jpg
VERTICAL BROWN PICTURE FRAME WITH CUTOUTS,KE8880BR,(All) 50% Off Products,$2.88 ,48,$5.75 ,KE8880BR.jpg
VERTICAL FUCHSIA PICTURE FRAME WITH CUTOUTS,KE8880FU,(All) 50% Off Products,$2.88 ,48,$5.75 ,KE8880FU.jpg
VERTICAL LIME GREEN PICTURE FRAME WITH CUTOUTS,KE8880LI,(All) 50% Off Products,$2.88 ,48,$5.75 ,KE8880LI.jpg
VERTICAL NAVY BLUE PICTURE FRAME WITH CUTOUTS,KE8880NB,(All) 50% Off Products,$2.88 ,48,$5.75 ,KE8880NB.jpg
VERTICAL ORANGE PICTURE FRAME WITH CUTOUTS,KE8880OR,(All) 50% Off Products,$2.88 ,48,$5.75 ,KE8880OR.jpg
VERTICAL PINK PICTURE FRAME WITH CUTOUTS,KE8880P,(All) 50% Off Products,$2.88 ,48,$5.75 ,KE8880P.jpg
VERTICAL RED PICTURE FRAME WITH CUTOUTS,KE8880R,(All) 50% Off Products,$2.88 ,48,$5.75 ,KE8880R.jpg
VERTICAL SKY BLUE PICTURE FRAME WITH CUTOUTS,KE8880SK,(All) 50% Off Products,$2.88 ,48,$5.75 ,KE8880SK.jpg
VERTICAL TURQUOISE PICTURE FRAME WITH CUTOUTS,KE8880T,(All) 50% Off Products,$2.88 ,48,$5.75 ,KE8880T.jpg
VERTICAL WHITE PICTURE FRAME WITH CUTOUTS,KE8880W,(All) 50% Off Products,$2.88 ,48,$5.75 ,KE8880W.jpg
VERTICAL YELLOW PICTURE FRAME WITH CUTOUTS,KE8880YE,(All) 50% Off Products,$2.88 ,48,$5.75 ,KE8880YE.jpg
GRAY IRON 6X8 PICTURE FRAME,KF12A079-557L,(All) 50% Off Products,$7.48 ,50,$14.95 ,KF12A079-557L.jpg
GRAY IRON 5X7 PICTURE FRAME,KF12A079-557M,(All) 50% Off Products,$6.75 ,50,$13.50 ,KF12A079-557M.jpg
GRAY IRON 4X6 PICTURE FRAME,KF12A079-557S,(All) 50% Off Products,$5.48 ,50,$10.95 ,KF12A079-557S.jpg
DISTRESSED HORIZONTAL PICTURE FRAME,KF12A100-106,(All) 50% Off Products,$5.48 ,60,$10.95 ,KF12A100-106.jpg
DISTRESSED GRAY VINTAGE ROUND PICTURE FRAME,KF12A100-108,(All) 50% Off Products,$6.48 ,12,$12.95 ,KF12A100-108.jpg
DISTRESSED GRAY VINTAGE OVAL PICTURE FRAME,KF12A100-109,(All) 50% Off Products,$6.98 ,12,$13.95 ,KF12A100-109.jpg
DISTRESSED BIRD CAGE MULTIPLE TEALIGHT CANDLE HOLDER,KF55192,(All) 50% Off Products,$13.48 ,4,$26.95 ,KF55192.jpg
FUCHSIA MAGNETIC FLOWER,KF8840-FU,(All) 50% Off Products,$1.63 ,288,$3.25 ,KF8840-FU.jpg
LIME GREEN MAGNETIC FLOWER,KF8840-LI,(All) 50% Off Products,$1.63 ,288,$3.25 ,KF8840-LI.jpg
5,KG2608C-BK,(All) 50% Off Products,$0.63 ,120,$1.25 ,KG2608C-BK.jpg
7,KG2608E-BK,(All) 50% Off Products,$1.08 ,240,$2.15 ,KG2608E-BK.jpg
RUSTY JINGLE BELL,KJ4945A-1.75,(All) 50% Off Products,$0.23 ,288,$0.45 ,KJ4945A-1.75.jpg
FLAT BLACK 7,KK1009SB,(All) 50% Off Products,$2.13 ,60,$4.25 ,KK1009SB.jpg
GALVANIZED TUBS S/3,KK1060N-3,(All) 50% Off Products,$7.80 ,16,$15.60 ,KK1060N-3.jpg
RUSTY WATER PITCHER,KK1142A,(All) 50% Off Products,$4.93 ,12,$9.85 ,KK1142A.jpg
RUSTY MOOSE,KK1854A,(All) 50% Off Products,$2.13 ,36,$4.25 ,KK1854A.jpg
RUSTY DECORATIVE POT,KK1994MA,(All) 50% Off Products,$3.23 ,48,$6.45 ,KK1994MA.jpg
RUSTY PICK,KK2011A,(All) 50% Off Products,$0.58 ,288,$1.15 ,KK2011A.jpg
RUSTY TEA POT PICK,KK2014A,(All) 50% Off Products,$0.58 ,288,$1.15 ,KK2014A.jpg
HANGING POCKET CHALKBOARD,KK2159-B,(All) 50% Off Products,$1.63 ,48,$3.25 ,KK2159-B.jpg
RUSTY TIN CLIP,KK2323A,(All) 50% Off Products,$0.33 ,288,$0.65 ,KK2323A.jpg
RUSTY HANGING JEAN POCKET,KK2853A,(All) 50% Off Products,$2.28 ,48,$4.55 ,KK2853A.jpg
RUST WALL CONE,KK2854A,(All) 50% Off Products,$3.53 ,36,$7.05 ,KK2854A.jpg
RUSTY HALF TABLE,KK2863A,(All) 50% Off Products,$21.53 ,4,$43.05 ,KK2863A.jpg
SMALL RUSTY DESKTOP TRASH PAIL,KK2988D-A,(All) 50% Off Products,$3.00 ,24,$6.00 ,KK2988D-A.jpg
SMALL BACK DESKTOP TRASH PAIL,KK2988D-B,(All) 50% Off Products,$3.23 ,24,$6.45 ,KK2988D-B.jpg
RUSTY EMBOSSED SQUARE PANEL,KK4118A,(All) 50% Off Products,$2.58 ,48,$5.15 ,KK4118A.jpg
BLACK STAR VOTIVE HOLDER,KK5153B,(All) 50% Off Products,$0.83 ,480,$1.65 ,KK5153B.jpg
RUSTY HANGING JEAN POCKET,KK5482A,(All) 50% Off Products,$1.38 ,144,$2.75 ,KK5482A.jpg
ANTIQUE BLACK LUNCH PAIL WITH TRAY,KK5497SB,(All) 50% Off Products,$9.48 ,8,$18.95 ,KK5497SB.jpg
ANTIQUE BLACK FLOWER BASKETS SET OF 2,KK7028B-2,(All) 50% Off Products,$3.48 ,36,$6.95 ,KK7028B-2.jpg
12,KK7249BK-12,(All) 50% Off Products,$3.28 ,24,$6.55 ,KK7249BK-12.jpg
16,KK7249BK-16,(All) 50% Off Products,$4.93 ,12,$9.85 ,KK7249BK-16.jpg
20,KK7249BK-20,(All) 50% Off Products,$6.88 ,12,$13.75 ,KK7249BK-20.jpg
12,KK7249OR-12,(All) 50% Off Products,$3.28 ,24,$6.55 ,KK7249OR-12.jpg
16' OLD RED STAR POCKET,KK7249OR-16,(All) 50% Off Products,$4.93 ,12,$9.85 ,KK7249OR-16.jpg
20,KK7249OR-20,(All) 50% Off Products,$6.88 ,12,$13.75 ,KK7249OR-20.jpg
COPPER GREEN PLANTERS SET OF 3,KK7335CG,(All) 50% Off Products,$9.63 ,24,$19.25 ,KK7335CG.jpg
12,KK7454OY-12,(All) 50% Off Products,$1.93 ,72,$3.85 ,KK7454OY-12.jpg
18,KK7454OY-18,(All) 50% Off Products,$4.13 ,48,$8.25 ,KK7454OY-18.jpg
24,KK7454OY-24,(All) 50% Off Products,$5.30 ,24,$10.60 ,KK7454OY-24.jpg
RUSTY EMBOSSED HANGIGN PLAQUE,KK7646-AB,(All) 50% Off Products,$1.48 ,144,$2.95 ,KK7646-AB.jpg
MEDIUM RUSTY ANGEL,KK8014MA,(All) 50% Off Products,$2.53 ,72,$5.05 ,KK8014MA.jpg
SMALL RUSTY ANGEL,KK8014SA,(All) 50% Off Products,$1.28 ,240,$2.55 ,KK8014SA.jpg
RUSTY CAN WITH LID,KK8162A,(All) 50% Off Products,$1.63 ,72,$3.25 ,KK8162A.jpg
FUCHSIA CHRYSANTHEMUM PICK,KK8522-FU,(All) 50% Off Products,$3.03 ,24,$6.05 ,KK8522-FU.jpg
WHITE CHRYSANTHEMUM PICK,KK8522-W,(All) 50% Off Products,$3.03 ,24,$6.05 ,KK8522-W.jpg
YELLOW CHRYSANTHEMUM PICK,KK8522-YE,(All) 50% Off Products,$3.03 ,24,$6.05 ,KK8522-YE.jpg
13,KK8620-MG-8-13,(All) 50% Off Products,$6.33 ,24,$12.65 ,KK8620-MG-8-13.jpg
15,KK8620-MG-8-15,(All) 50% Off Products,$9.08 ,12,$18.15 ,KK8620-MG-8-15.jpg
FLAT LAVENDER MESSAGE BOARD,KK8701-LAV,(All) 50% Off Products,$1.63 ,48,$3.25 ,KK8701-LAV.jpg
FLAT ORANGE MESSAGE BOARD,KK8701-OR,(All) 50% Off Products,$1.63 ,48,$3.25 ,KK8701-OR.jpg
FLAT YELLOW MESSAGE BOARD,KK8701-YE,(All) 50% Off Products,$1.63 ,48,$3.25 ,KK8701-YE.jpg
DISTRESSED ORANGE WATERING CAN,KK8767OR,(All) 50% Off Products,$8.78 ,12,$17.55 ,KK8767OR.jpg
DISTRESSED RED MAGNETIC LETTER A,KK8843S-A-R,(All) 50% Off Products,$1.13 ,864,$2.25 ,KK8843S-A-R.jpg
DISTRESSED WHITE MAGNETIC LETTER A,KK8843S-A-W,(All) 50% Off Products,$1.13 ,864,$2.25 ,KK8843S-A-W.jpg
DISTRESSED WHITE MAGNETIC LETTER B,KK8843S-B-W,(All) 50% Off Products,$1.13 ,864,$2.25 ,KK8843S-B-W.jpg
DISTRESSED WHITE MAGNETIC LETTER C,KK8843S-C-W,(All) 50% Off Products,$1.13 ,864,$2.25 ,KK8843S-C-W.jpg
DISTRESSED WHITE MAGNETIC LETTER D,KK8843S-D-W,(All) 50% Off Products,$1.13 ,864,$2.25 ,KK8843S-D-W.jpg
DISTRESSED MOSS GREEN MANGETIC LETTER E,KK8843S-E-MG,(All) 50% Off Products,$1.13 ,864,$2.25 ,KK8843S-E-MG.jpg
DISTRESSED RED MAGNETIC LETTER E,KK8843S-E-R,(All) 50% Off Products,$1.13 ,864,$2.25 ,KK8843S-E-R.jpg
DISTRESSED WHITE MAGNETIC LETTER E,KK8843S-E-W,(All) 50% Off Products,$1.13 ,864,$2.25 ,KK8843S-E-W.jpg
DISTRESSED WHITE MAGNETIC LETTER F,KK8843S-F-W,(All) 50% Off Products,$1.13 ,864,$2.25 ,KK8843S-F-W.jpg
DISTRESSED BABY BLUE MAGNETIC LETTER G,KK8843S-G-BB,(All) 50% Off Products,$1.13 ,864,$2.25 ,KK8843S-G-BB.jpg
DISTRESSED WHITE MAGNETIC LETTER G,KK8843S-G-W,(All) 50% Off Products,$1.13 ,864,$2.25 ,KK8843S-G-W.jpg
DISTRESSED ORANGE MAGNETIC LETTER H,KK8843S-H-OR,(All) 50% Off Products,$1.13 ,864,$2.25 ,KK8843S-H-OR.jpg
DISTRESSED WHITE MAGNETIC LETTER H,KK8843S-H-W,(All) 50% Off Products,$1.13 ,864,$2.25 ,KK8843S-H-W.jpg
DISTRESSED LIME GREEN MAGNETIC LETTER I,KK8843S-I-LI,(All) 50% Off Products,$1.13 ,864,$2.25 ,KK8843S-I-LI.jpg
DISTRESSED MOSS GREEN MANGETIC LETTER I,KK8843S-I-MG,(All) 50% Off Products,$1.13 ,864,$2.25 ,KK8843S-I-MG.jpg
DISTRESSED WHITE MAGNETIC LETTER I,KK8843S-I-W,(All) 50% Off Products,$1.13 ,864,$2.25 ,KK8843S-I-W.jpg
DISTRESSED RED MANGETIC LETTER J,KK8843S-J-R,(All) 50% Off Products,$1.13 ,864,$2.25 ,KK8843S-J-R.jpg
DISTRESSED WHITE MAGNETIC LETTER J,KK8843S-J-W,(All) 50% Off Products,$1.13 ,864,$2.25 ,KK8843S-J-W.jpg
DISTRESSED WHITE MAGNETIC LETTER K,KK8843S-K-W,(All) 50% Off Products,$1.13 ,864,$2.25 ,KK8843S-K-W.jpg
DISTRESSED BABY BLUE MAGNETIC LETTER L,KK8843S-L-BB,(All) 50% Off Products,$1.13 ,864,$2.25 ,KK8843S-L-BB.jpg
DISTRESSED WHITE MAGNETIC LETTER L,KK8843S-L-W,(All) 50% Off Products,$1.13 ,864,$2.25 ,KK8843S-L-W.jpg
DISTRESSED ORANGE MAGNETIC LETTER M,KK8843S-M-OR,(All) 50% Off Products,$1.13 ,864,$2.25 ,KK8843S-M-OR.jpg
DISTRESSED WHITE MAGNETIC LETTER M,KK8843S-M-W,(All) 50% Off Products,$1.13 ,864,$2.25 ,KK8843S-M-W.jpg
DISTRESSED LIME GREEN MAGNETIC LETTER N,KK8843S-N-LI,(All) 50% Off Products,$1.13 ,864,$2.25 ,KK8843S-N-LI.jpg
DISTRESSED WHITE MAGNETIC LETTER N,KK8843S-N-W,(All) 50% Off Products,$1.13 ,864,$2.25 ,KK8843S-N-W.jpg
DISTRESSED MOSS GREEN MANGETIC LETTER O,KK8843S-O-MG,(All) 50% Off Products,$1.13 ,864,$2.25 ,KK8843S-O-MG.jpg
DISTRESSED WHITE MAGNETIC LETTER O,KK8843S-O-W,(All) 50% Off Products,$1.13 ,864,$2.25 ,KK8843S-O-W.jpg
DISTRESSED WHITE MAGNETIC LETTER P,KK8843S-P-W,(All) 50% Off Products,$1.13 ,864,$2.25 ,KK8843S-P-W.jpg
DISTRESSED WHITE MAGNETIC LETTER Q,KK8843S-Q-W,(All) 50% Off Products,$1.13 ,864,$2.25 ,KK8843S-Q-W.jpg
DISTRESSED BABY BLUE MAGNETIC LETTER R,KK8843S-R-BB,(All) 50% Off Products,$1.13 ,864,$2.25 ,KK8843S-R-BB.jpg
DISTRESSED WHITE MAGNETIC LETTER R,KK8843S-R-W,(All) 50% Off Products,$1.13 ,864,$2.25 ,KK8843S-R-W.jpg
DISTRESSED ORANGE MAGNETIC LETTER S,KK8843S-S-OR,(All) 50% Off Products,$1.13 ,864,$2.25 ,KK8843S-S-OR.jpg
DISTRESSED WHITE MAGNETIC LETTER S,KK8843S-S-W,(All) 50% Off Products,$1.13 ,864,$2.25 ,KK8843S-S-W.jpg
DISTRESSED WHITE MAGNETIC LETTER T,KK8843S-T-W,(All) 50% Off Products,$1.13 ,864,$2.25 ,KK8843S-T-W.jpg
DISTRESSED MOSS GREEN MANGETIC LETTER U,KK8843S-U-MG,(All) 50% Off Products,$1.13 ,864,$2.25 ,KK8843S-U-MG.jpg
DISTRESSED WHITE MAGNETIC LETTER U,KK8843S-U-W,(All) 50% Off Products,$1.13 ,864,$2.25 ,KK8843S-U-W.jpg
DISTRESSED RED MANGETIC LETTER R,KK8843S-V-R,(All) 50% Off Products,$1.13 ,864,$2.25 ,KK8843S-V-R.jpg
DISTRESSED WHITE MAGNETIC LETTER V,KK8843S-V-W,(All) 50% Off Products,$1.13 ,864,$2.25 ,KK8843S-V-W.jpg
DISTRESSED WHITE MAGNETIC LETTER W,KK8843S-W-W,(All) 50% Off Products,$1.13 ,864,$2.25 ,KK8843S-W-W.jpg
DISTRESSED BABY BLUE MAGNETIC LETTER X,KK8843S-X-BB,(All) 50% Off Products,$1.13 ,864,$2.25 ,KK8843S-X-BB.jpg
DISTRESSED WHITE MAGNETIC LETTER X,KK8843S-X-W,(All) 50% Off Products,$1.13 ,864,$2.25 ,KK8843S-X-W.jpg
DISTRESSED ORANGE MAGNETIC LETTER Y,KK8843S-Y-OR,(All) 50% Off Products,$1.13 ,864,$2.25 ,KK8843S-Y-OR.jpg
DISTRESSED WHITE MAGNETIC LETTER Y,KK8843S-Y-W,(All) 50% Off Products,$1.13 ,864,$2.25 ,KK8843S-Y-W.jpg
DISTRESSED LIME GREEN MAGNETIC LETTER Z,KK8843S-Z-LI,(All) 50% Off Products,$1.13 ,864,$2.25 ,KK8843S-Z-LI.jpg
