DISTRESSED WHITE MAGNETIC LETTER Z,KK8843S-Z-W,(All) 50% Off Products,$1.13 ,864,$2.25 ,KK8843S-Z-W.jpg
12,KK8860BK-12,(All) 50% Off Products,$1.58 ,48,$3.15 ,KK8860BK-12.jpg
20,KK8860BK-20,(All) 50% Off Products,$3.75 ,36,$7.50 ,KK8860BK-20.jpg
6,KK8860BK-6,(All) 50% Off Products,$0.83 ,576,$1.65 ,KK8860BK-6.jpg
RUSTY MESSAGE BOARD WITH CUT OUTS,KK8877A,(All) 50% Off Products,$2.58 ,72,$5.15 ,KK8877A.jpg
HORIZONTAL RUSTY PICTURE FRAME WITH CUTOUTS,KK8879A,(All) 50% Off Products,$2.68 ,48,$5.35 ,KK8879A.jpg
VERTICAL RUSTY PICTURE FRAME WITH CUTOUTS,KK8880A,(All) 50% Off Products,$2.63 ,48,$5.25 ,KK8880A.jpg
BLACK AND SILVER MAGNETIC EIFFEL TOWER,KK8881,(All) 50% Off Products,$0.98 ,1440,$1.95 ,KK8881.jpg
RUSTY DRAGONFLY CUT OUT,KK8887A,(All) 50% Off Products,$0.25 ,1920,$0.50 ,KK8887A.jpg
GRAY ZINC SQUARE BOX WITH LID,KK9064-GB,(All) 50% Off Products,$8.75 ,12,$17.50 ,KK9064-GB.jpg
MINIATURE WATER PITCHER,KKFL119A,(All) 50% Off Products,$0.68 ,288,$1.35 ,KKFL119A.jpg
RUSTY BIRD HOUSE PICKS S/3,KKFL180PA,(All) 50% Off Products,$3.23 ,80,$6.45 ,KKFL180PA.jpg
3.25,KL2382B,(All) 50% Off Products,$0.83 ,480,$1.65 ,KL2382B.jpg
2.75,KS2968SA,(All) 50% Off Products,$0.43 ,960,$0.86 ,KS2968SA.jpg
RUSTY IRON STAR,KS4827A,(All) 50% Off Products,$1.28 ,48,$2.55 ,KS4827A.jpg
RUSTY JINGLE BELL,KT9661A,(All) 50% Off Products,$0.83 ,60,$1.65 ,KT9661A.jpg
LARGE WHITE WASHED VOTIVE CHANDELIER,KV4712LW,(All) 50% Off Products,$9.98 ,6,$19.95 ,KV4712LW.jpg
WHITE WASHED VOTIVE CHANDELIER,KV4712SW,(All) 50% Off Products,$7.98 ,8,$15.95 ,KV4712SW.jpg
WHITE WASHED SMALL SHOPPING CART,KV4821W,(All) 50% Off Products,$4.90 ,18,$9.80 ,KV4821W.jpg
WHTIE WASHED HANGING FLOWER BASKET,KV7028S-W,(All) 50% Off Products,$3.23 ,36,$6.45 ,KV7028S-W.jpg
WHITE WASHED EMBOSSED HANGING PLAQUE,KV7646W,(All) 50% Off Products,$1.63 ,144,$3.25 ,KV7646W.jpg
WHTIE WASHED PAN,KV995LW,(All) 50% Off Products,$1.28 ,120,$2.55 ,KV995LW.jpg
LARGE GALVANIZED TUB WITH JUTE ROPE HANDLES,KW009,(All) 50% Off Products,$5.75 ,12,$11.50 ,KW009.jpg
WEATHERED LOOK CANDLE SHADE WITH HEART CUT OUTS,KW4360-HEART,(All) 50% Off Products,$1.53 ,100,$3.05 ,KW4360-HEART.jpg
WEATHERED LOOK CANDLE SHADE WITH STAR CUT OUTS,KW4360-STAR,(All) 50% Off Products,$1.53 ,100,$3.05 ,KW4360-STAR.jpg
WEATHERED LOOK MAIL HOLDER,KW5062,(All) 50% Off Products,$8.98 ,12,$17.95 ,KW5062.jpg
10,KW8483-10,(All) 50% Off Products,$3.93 ,18,$7.85 ,KW8483-10.jpg
13,KW8483-13,(All) 50% Off Products,$4.93 ,12,$9.85 ,KW8483-13.jpg
16,KW8483-16,(All) 50% Off Products,$6.40 ,6,$12.80 ,KW8483-16.jpg
WEATHERED LOOK WATERING CAN PLANTER WITH DRAIN HOLES,KW9467,(All) 50% Off Products,$3.75 ,18,$7.50 ,KW9467.jpg
FULL SET OF MAGNETIC LETTERS WITH DISPLAY BOX - 96 LETTERS,PDQ1-LETTERS,(All) 50% Off Products,$110.00 ,6,$220.00 ,PDQ1-LETTERS.jpg
FULL SET OF MANGETIC FLOWERS WITH DISPLAY BOX - 48 FLOWERS,PDQ2-FLOWERS,(All) 50% Off Products,$57.50 ,6,$115.00 ,PDQ2-FLOWERS.jpg
RED HAT PICTURE FRAME,RH4300,(All) 50% Off Products,$3.59 ,48,$7.18 ,RH4300.jpg
GALVANIZED WIRE SOAP DISH,WB4220N,(All) 50% Off Products,$1.48 ,96,$2.95 ,WB4220N.jpg
MINI RUSTY TAPERED PAIL PICK,WB582A,(All) 50% Off Products,$0.88 ,192,$1.75 ,WB582A.jpg
MINI RUSTY TAPERED PAIL,WB582A-1,(All) 50% Off Products,$0.85 ,288,$1.70 ,WB582A-1.jpg
MINI RUSTY WATER PITCHER PICK,WB584A,(All) 50% Off Products,$0.88 ,192,$1.75 ,WB584A.jpg
MINI RUSTY DUST PAN PICK,WB585A,(All) 50% Off Products,$0.63 ,192,$1.25 ,WB585A.jpg
MINI RUSTY DUST PAN,WB585A-1,(All) 50% Off Products,$0.58 ,288,$1.15 ,WB585A-1.jpg
MINI RUSY PAIL PICK,WB586A,(All) 50% Off Products,$0.75 ,192,$1.50 ,WB586A.jpg
MINI RUSTY PAIL,WB586A-1,(All) 50% Off Products,$0.70 ,288,$1.40 ,WB586A-1.jpg
MINI SQUARE BIRD HOSUE GARDEN DOME,WB595A,(All) 50% Off Products,$2.75 ,72,$5.50 ,WB595A.jpg
MINI ROUND BIRD HOUSE GARDEN DOME,WB598A,(All) 50% Off Products,$2.48 ,72,$4.95 ,WB598A.jpg
MINI WIRE 2 PERSON BENCH,WB599A,(All) 50% Off Products,$1.75 ,120,$3.50 ,WB599A.jpg
MINI WIRE 1 PERSON BENCH,WB600A,(All) 50% Off Products,$1.38 ,180,$2.75 ,WB600A.jpg
MINI WIRE ROUND TABLE,WB603A,(All) 50% Off Products,$1.83 ,96,$3.65 ,WB603A.jpg
BLACK MINI TRICYCLE,WB605B,(All) 50% Off Products,$2.25 ,120,$4.50 ,WB605B.jpg
WHITE MINI TRICYCLE,WB605W,(All) 50% Off Products,$2.25 ,120,$4.50 ,WB605W.jpg
MINI WIRE CHAIR,WB614A,(All) 50% Off Products,$1.18 ,120,$2.35 ,WB614A.jpg
MINI WIRE WHEELBARROW,WB615A,(All) 50% Off Products,$1.98 ,180,$3.95 ,WB615A.jpg
BLACK WIRE WALL BASKET,WB636B,(All) 50% Off Products,$3.75 ,60,$7.50 ,WB636B.jpg
RUSTY WIRE FLOWER BASKET,WB639A,(All) 50% Off Products,$1.98 ,64,$3.95 ,WB639A.jpg
GALVANIZED WIRE FLOWER BASKET,WB639N,(All) 50% Off Products,$1.98 ,64,$3.95 ,WB639N.jpg
BLACK PAPER ROPE ORGANIZER,WB646B,(All) 50% Off Products,$1.25 ,200,$2.50 ,WB646B.jpg
WHITE PAPER ROPE ORGANZIER,WB646W,(All) 50% Off Products,$1.25 ,200,$2.50 ,WB646W.jpg
BLACK WIRE LAMP - SHADE NOT INCLUDED,WB647BK,(All) 50% Off Products,$14.98 ,30,$29.95 ,WB647BK.jpg
LIME GREEN WIRE LAMP - SHADE NOT INCLUDED,WB647LI,(All) 50% Off Products,$14.98 ,30,$29.95 ,WB647LI.jpg
RUSTY ZINC BIRD HOUSE CANDLE HOLDER WITH ROSE,WB659-AG,(All) 50% Off Products,$2.75 ,48,$5.50 ,WB659-AG.jpg
RUSTY ZINC BIRD HOUSE CANDLE HOLDER,WB668-AG,(All) 50% Off Products,$2.63 ,48,$5.25 ,WB668-AG.jpg
RUSTY IRON SOAP DISH,WB681A,(All) 50% Off Products,$4.98 ,24,$9.95 ,WB681A.jpg
WHTIE IRON SOAP DISH,WB681W,(All) 50% Off Products,$4.98 ,24,$9.95 ,WB681W.jpg
RUSTY FRENCH DESIGN CLOCK,WB682A,(All) 50% Off Products,$7.25 ,48,$14.50 ,WB682A.jpg
BLACK WIRE BASKET,WB688B,(All) 50% Off Products,$4.48 ,48,$8.95 ,WB688B.jpg
DECORATIVE BLCK WIRE BIRD HOUSE ON STAND,WB690B,(All) 50% Off Products,$2.43 ,48,$4.85 ,WB690B.jpg
RUSTY IRON FRENCH FLEUR WALL HOOK,WB692A,(All) 50% Off Products,$1.88 ,48,$3.75 ,WB692A.jpg
BLACK IRON FRENCH FLEUR WALL HOOK,WB692B,(All) 50% Off Products,$1.88 ,48,$3.75 ,WB692B.jpg
FRENCH FLEUR WALL COAT HOOK,WB694A,(All) 50% Off Products,$1.75 ,48,$3.50 ,WB694A.jpg
AMERICAN FLAG RIBBON,WPS0901,(All) 50% Off Products,$8.75 ,24,$17.50 ,WPS0901.jpg
GOLD WIRE RIBBON,X7552,(All) 50% Off Products,$2.98 ,48,$5.95 ,X7552.jpg
BROWN HANGING MAGNETIC BOARD WITH STAR CUT OUTS,KE8159BR,Cutouts,$5.36 ,36,$7.15 ,KE8159BR.jpg
ORANGE HANGING MAGNETIC BOARD WITH STAR CUT OUTS,KE8159OR,Cutouts,$5.36 ,36,$7.15 ,KE8159OR.jpg
AQUA MESSAGE BOARD WITH CUT OUTS,KE8877AQ,Cutouts,$4.24 ,3,$5.65 ,KE8877AQ.jpg
BABY BLUE MESSAGE BOARD WITH CUT OUTS,KE8877BB,Cutouts,$4.24 ,3,$5.65 ,KE8877BB.jpg
BLACK MESSAGE BOARD WITH CUT OUTS,KE8877BK,Cutouts,$4.24 ,3,$5.65 ,KE8877BK.jpg
BROWN MESSAGE BOARD WITH CUT OUTS,KE8877BR,Cutouts,$4.24 ,3,$5.65 ,KE8877BR.jpg
FUCHSIA MESSAGE BOARD WITH CUT OUTS,KE8877FU,Cutouts,$4.24 ,3,$5.65 ,KE8877FU.jpg
LIME GREEN MESSAGE BOARD WITH CUT OUTS,KE8877LI,Cutouts,$4.24 ,3,$5.65 ,KE8877LI.jpg
NAVY BLUE MESSAGE BOARD WITH CUT OUTS,KE8877NB,Cutouts,$4.24 ,3,$5.65 ,KE8877NB.jpg
ORANGE MESSAGE BOARD WITH CUT OUTS,KE8877OR,Cutouts,$4.24 ,3,$5.65 ,KE8877OR.jpg
PINK MESSAGE BOARD WITH CUT OUTS,KE8877P,Cutouts,$4.24 ,3,$5.65 ,KE8877P.jpg
RED MESSAGE BOARD WITH CUT OUTS,KE8877R,Cutouts,$4.24 ,3,$5.65 ,KE8877R.jpg
SKY BLUE MESSAGE BOARD WITH CUT OUTS,KE8877SK,Cutouts,$4.24 ,3,$5.65 ,KE8877SK.jpg
TURQUOISE MESSAGE BOARD WITH CUT OUTS,KE8877T,Cutouts,$4.24 ,3,$5.65 ,KE8877T.jpg
WHITE MESSAGE BOARD WITH CUT OUTS,KE8877W,Cutouts,$4.24 ,3,$5.65 ,KE8877W.jpg
YELLOW MESSAGE BOARD WITH CUT OUTS,KE8877YE,Cutouts,$4.24 ,3,$5.65 ,KE8877YE.jpg
HORIZONTAL AQUA PICTURE FRAME WITH CUTOUTS,KE8879AQ,Cutouts,$4.46 ,3,$5.95 ,KE8879AQ.jpg
HORIZONTAL BABY BLUE PICTURE FRAME WITH CUTOUTS,KE8879BB,Cutouts,$4.46 ,3,$5.95 ,KE8879BB.jpg
HORIZONTAL BROWN PICTURE FRAME WITH CUTOUTS,KE8879BR,Cutouts,$4.46 ,3,$5.95 ,KE8879BR.jpg
HORIZONTAL FUCHSIA PICTURE FRAME WITH CUTOUTS,KE8879FU,Cutouts,$4.46 ,3,$5.95 ,KE8879FU.jpg
HORIZONTAL NAVY BLUE PICTURE FRAME WITH CUTOUTS,KE8879NB,Cutouts,$4.46 ,3,$5.95 ,KE8879NB.jpg
HORIZONTAL ORANGE PICTURE FRAME WITH CUTOUTS,KE8879OR,Cutouts,$4.46 ,3,$5.95 ,KE8879OR.jpg
HORIZONTAL PINK PICTURE FRAME WITH CUTOUTS,KE8879P,Cutouts,$4.46 ,3,$5.95 ,KE8879P.jpg
HORIZONTAL RED PICTURE FRAME WITH CUTOUTS,KE8879R,Cutouts,$4.46 ,3,$5.95 ,KE8879R.jpg
HORIZONTAL SKY BLUE PICTURE FRAME WITH CUTOUTS,KE8879SK,Cutouts,$4.46 ,3,$5.95 ,KE8879SK.jpg
HORIZONTAL TURQUOISE PICTURE FRAME WITH CUTOUTS,KE8879T,Cutouts,$4.46 ,3,$5.95 ,KE8879T.jpg
HORIZONTAL WHITE PICTURE FRAME WITH CUTOUTS,KE8879W,Cutouts,$4.46 ,3,$5.95 ,KE8879W.jpg
HORIZONTAL YELLOW PICTURE FRAME WITH CUTOUTS,KE8879YE,Cutouts,$4.46 ,3,$5.95 ,KE8879YE.jpg
VERTICAL AQUA PICTURE FRAME WITH CUTOUTS,KE8880AQ,Cutouts,$4.31 ,3,$5.75 ,KE8880AQ.jpg
VERTICAL BABY BLUE PICTURE FRAME WITH CUTOUTS,KE8880BB,Cutouts,$4.31 ,3,$5.75 ,KE8880BB.jpg
VERTICAL BLACK PICTURE FRAME WITH CUTOUTS,KE8880BK,Cutouts,$4.31 ,3,$5.75 ,KE8880BK.jpg
VERTICAL BROWN PICTURE FRAME WITH CUTOUTS,KE8880BR,Cutouts,$4.31 ,3,$5.75 ,KE8880BR.jpg
VERTICAL FUCHSIA PICTURE FRAME WITH CUTOUTS,KE8880FU,Cutouts,$4.31 ,3,$5.75 ,KE8880FU.jpg
VERTICAL LIME GREEN PICTURE FRAME WITH CUTOUTS,KE8880LI,Cutouts,$4.31 ,3,$5.75 ,KE8880LI.jpg
VERTICAL NAVY BLUE PICTURE FRAME WITH CUTOUTS,KE8880NB,Cutouts,$4.31 ,3,$5.75 ,KE8880NB.jpg
VERTICAL ORANGE PICTURE FRAME WITH CUTOUTS,KE8880OR,Cutouts,$4.31 ,3,$5.75 ,KE8880OR.jpg
VERTICAL PINK PICTURE FRAME WITH CUTOUTS,KE8880P,Cutouts,$4.31 ,3,$5.75 ,KE8880P.jpg
VERTICAL RED PICTURE FRAME WITH CUTOUTS,KE8880R,Cutouts,$4.31 ,3,$5.75 ,KE8880R.jpg
VERTICAL SKY BLUE PICTURE FRAME WITH CUTOUTS,KE8880SK,Cutouts,$4.31 ,3,$5.75 ,KE8880SK.jpg
VERTICAL TURQUOISE PICTURE FRAME WITH CUTOUTS,KE8880T,Cutouts,$4.31 ,3,$5.75 ,KE8880T.jpg
VERTICAL WHITE PICTURE FRAME WITH CUTOUTS,KE8880W,Cutouts,$4.31 ,3,$5.75 ,KE8880W.jpg
VERTICAL YELLOW PICTURE FRAME WITH CUTOUTS,KE8880YE,Cutouts,$4.31 ,3,$5.75 ,KE8880YE.jpg
RUSTY MESSAGE BOARD WITH CUT OUTS,KK8877A,Cutouts,$3.86 ,3,$5.15 ,KK8877A.jpg
HORIZONTAL RUSTY PICTURE FRAME WITH CUTOUTS,KK8879A,Cutouts,$4.01 ,3,$5.35 ,KK8879A.jpg
VERTICAL RUSTY PICTURE FRAME WITH CUTOUTS,KK8880A,Cutouts,$3.94 ,3,$5.25 ,KK8880A.jpg
WEATHERED LOOK CANDLE SHADE WITH HEART CUT OUTS,KW4360-HEART,Cutouts,$2.29 ,4,$3.05 ,KW4360-HEART.jpg
WEATHERED LOOK CANDLE SHADE WITH STAR CUT OUTS,KW4360-STAR,Cutouts,$2.29 ,4,$3.05 ,KW4360-STAR.jpg
AMERICAN FLAG RIBBON,258326,Everyday Products,$10.88 ,2,$14.50 ,258326.jpg
AMERICAN FLAG RIBBON,258329,Everyday Products,$14.63 ,2,$19.50 ,258329.jpg
MEDIUM DECORATIVE BEE HIVE,BH190M,Everyday Products,$3.26 ,5,$4.35 ,BH190M.jpg
SMALL DECORATIVE BEE HIVE,BH190S,Everyday Products,$2.44 ,6,$3.25 ,BH190S.jpg
RUSTY DECORATIVE HEART BIRD HOSUE,KB1307,Everyday Products,$1.72 ,12,$2.29 ,KB1307.jpg
RUSTY BIRD BICK,KB1747A,Everyday Products,$1.13 ,12,$1.50 ,KB1747A.jpg
RUSTY BIRD HOSUE PICK,KB4547,Everyday Products,$1.13 ,12,$1.50 ,KB4547.jpg
RUSTY CAT CANDLE HOLDER,KC3001A,Everyday Products,$4.17 ,4,$5.56 ,KC3001A.jpg
PINK WALL POCKET,KE2605P,Everyday Products,$3.19 ,4,$4.25 ,KE2605P.jpg
AQUA TIN CUP,KE4463AQ,Everyday Products,$2.44 ,6,$3.25 ,KE4463AQ.jpg
RED TIN CUP,KE4463R,Everyday Products,$2.44 ,6,$3.25 ,KE4463R.jpg
12,KE4990SG,Everyday Products,$5.78 ,4,$7.70 ,KE4990SG.jpg
WHITE WITH RED TRIM SOAP DISH,KE5187WR,Everyday Products,$3.86 ,4,$5.15 ,KE5187WR.jpg
PINK TIN MUG WITH LID,KE5230B-P,Everyday Products,$3.75 ,4,$5.00 ,KE5230B-P.jpg
YELLOW POTS WITH LIDS S/4,KE5233Y-4,Everyday Products,$14.81 ,2,$19.75 ,KE5233Y-4.jpg
RED MILK CAN,KE5247LR,Everyday Products,$7.01 ,2,$9.35 ,KE5247LR.jpg
ROUND WHITE TRAYS SET/2,KE5713W-2,Everyday Products,$18.56 ,2,$24.75 ,KE5713W-2.jpg
BROWN TISSUE BOX COVER,KE5879BR,Everyday Products,$5.78 ,3,$7.70 ,KE5879BR.jpg
ORANGE TISSUE BOX COVER,KE5879OR,Everyday Products,$5.78 ,3,$7.70 ,KE5879OR.jpg
AQUA HALF DRINK DISPENSER,KE5921-AQ,Everyday Products,$19.61 ,2,$26.15 ,KE5921-AQ.jpg
PINK HALF DRINK DISPENSER,KE5921-P,Everyday Products,$19.61 ,2,$26.15 ,KE5921-P.jpg
RED HALF DRINK DISPENSER,KE5921-R,Everyday Products,$19.61 ,2,$26.15 ,KE5921-R.jpg
WHITE HALF DRINK DISPENCER,KE5921-W,Everyday Products,$19.61 ,2,$26.15 ,KE5921-W.jpg
AQUA FULL DRINK DISPENSER,KE5921AQ-FULL,Everyday Products,$24.56 ,1,$32.75 ,KE5921AQ-FULL.jpg
PINK FULL DRINK DISPENSER,KE5921P-FULL,Everyday Products,$24.56 ,1,$32.75 ,KE5921P-FULL.jpg
RED FULL DRINK DISPENSER,KE5921R-FULL,Everyday Products,$24.56 ,1,$32.75 ,KE5921R-FULL.jpg
WHITE FULL DRINK DISPENSER,KE5921W-FULL,Everyday Products,$24.56 ,1,$32.75 ,KE5921W-FULL.jpg
BROWN TISSUE AND TOILET PAPER HOLDER,KE5925BR,Everyday Products,$12.34 ,2,$16.45 ,KE5925BR.jpg
RED TISSUE AND TOILET PAPER HOLDER,KE5925R,Everyday Products,$12.34 ,2,$16.45 ,KE5925R.jpg
SMALL AQUA SCALLOPED SQUARE TRAY,KE5958S-AQ,Everyday Products,$5.33 ,4,$7.10 ,KE5958S-AQ.jpg
SMALL BLACK SCALLOPED SQUARE TRAY,KE5958S-BK,Everyday Products,$5.33 ,4,$7.10 ,KE5958S-BK.jpg
SMALL BROWN SCALLOPED SQUARE TRAY,KE5958S-BR,Everyday Products,$5.33 ,4,$7.10 ,KE5958S-BR.jpg
SMALL FUCHSIA SCALLOPED SQUARE TRAY,KE5958S-FU,Everyday Products,$5.33 ,4,$7.10 ,KE5958S-FU.jpg
SMALL LIME GREEN SCALLOPED SQUARE TRAY,KE5958S-LI,Everyday Products,$5.33 ,4,$7.10 ,KE5958S-LI.jpg
SMALL PINK SCALLOPED SQUARE TRAY,KE5958S-P,Everyday Products,$5.33 ,4,$7.10 ,KE5958S-P.jpg
SMALL RED SCALLOPED SQUARE TRAY,KE5958S-R,Everyday Products,$5.33 ,4,$7.10 ,KE5958S-R.jpg
SMALL SKY BLUE SCALLOPED SQUARE TRAY,KE5958S-SK,Everyday Products,$5.33 ,4,$7.10 ,KE5958S-SK.jpg
SMALL YELLOW SCALLOPED SQUARE TRAY,KE5958S-YE,Everyday Products,$5.33 ,4,$7.10 ,KE5958S-YE.jpg
BROWN PICTURE BOOK,KE7099BR,Everyday Products,$8.21 ,2,$10.95 ,KE7099BR.jpg
AQUA CAN WITH LID,KE8162AQ,Everyday Products,$2.66 ,4,$3.55 ,KE8162AQ.jpg
BABY BLUE CAN WITH LID,KE8162BB,Everyday Products,$2.66 ,4,$3.55 ,KE8162BB.jpg
BLACK CAN WITH LID,KE8162BK,Everyday Products,$2.66 ,4,$3.55 ,KE8162BK.jpg
BROWN CAN WITH LID,KE8162BR,Everyday Products,$2.66 ,4,$3.55 ,KE8162BR.jpg
FUCHSIA CAN WITH LID,KE8162FU,Everyday Products,$2.66 ,4,$3.55 ,KE8162FU.jpg
LIME GREEN CAN WITH LID,KE8162LI,Everyday Products,$2.66 ,4,$3.55 ,KE8162LI.jpg
ORANGE CAN WITH LID,KE8162OR,Everyday Products,$2.66 ,4,$3.55 ,KE8162OR.jpg
PINK CAN WITH LID,KE8162P,Everyday Products,$2.66 ,4,$3.55 ,KE8162P.jpg
RED CAN WITH LID,KE8162R,Everyday Products,$2.66 ,4,$3.55 ,KE8162R.jpg
SKY BLUE CAN WITH LID,KE8162SK,Everyday Products,$2.66 ,4,$3.55 ,KE8162SK.jpg
WHITE CAN WITH LID,KE8162W,Everyday Products,$2.66 ,4,$3.55 ,KE8162W.jpg
YELLOW CAN WITH LID,KE8162YE,Everyday Products,$2.66 ,4,$3.55 ,KE8162YE.jpg
RED 3 TIERED SERVING STAND,KE8230R,Everyday Products,$24.71 ,1,$32.95 ,KE8230R.jpg
LARGE BROWN MAGNETIC BOARD,KE8231BR,Everyday Products,$12.26 ,2,$16.35 ,KE8231BR.jpg
LARGE ORANGE MAGNETIC BOARD,KE8231OR,Everyday Products,$12.26 ,2,$16.35 ,KE8231OR.jpg
LARGE PURPLE MAGNETIC BOARD,KE8231PUR,Everyday Products,$12.26 ,2,$16.35 ,KE8231PUR.jpg
LARGE TURQUOISE MAGNETIC BOARD,KE8231T,Everyday Products,$12.26 ,2,$16.35 ,KE8231T.jpg
BROWN WALL COAT HOOK,KE8234BR,Everyday Products,$6.79 ,3,$9.05 ,KE8234BR.jpg
ORANGE WALL COAT HOOK,KE8234OR,Everyday Products,$6.79 ,3,$9.05 ,KE8234OR.jpg
YELLOW WALL COAT HOOK,KE8234YE,Everyday Products,$6.79 ,3,$9.05 ,KE8234YE.jpg
AQUA CAKE STAND,KE8437S-AQ,Everyday Products,$10.69 ,2,$14.25 ,KE8437S-AQ.jpg
BABY BLUE CAKE STAND,KE8437S-BB,Everyday Products,$10.69 ,2,$14.25 ,KE8437S-BB.jpg
BLACK CAKE STAND,KE8437S-BK,Everyday Products,$10.69 ,2,$14.25 ,KE8437S-BK.jpg
BROWN CAKE STAND,KE8437S-BR,Everyday Products,$10.69 ,2,$14.25 ,KE8437S-BR.jpg
FUCHSIA CAKE STAND,KE8437S-FU,Everyday Products,$10.69 ,2,$14.25 ,KE8437S-FU.jpg
LIME GREEN CAKE STAND,KE8437S-LI,Everyday Products,$10.69 ,2,$14.25 ,KE8437S-LI.jpg
NAVY BLUE CAKE STAND,KE8437S-NB,Everyday Products,$10.69 ,2,$14.25 ,KE8437S-NB.jpg
ORANGE CAKE STAND,KE8437S-OR,Everyday Products,$10.69 ,2,$14.25 ,KE8437S-OR.jpg
PINK CAKE STAND,KE8437S-P,Everyday Products,$10.69 ,2,$14.25 ,KE8437S-P.jpg
WHITE CAKE STAND,KE8437S-W,Everyday Products,$10.69 ,2,$14.25 ,KE8437S-W.jpg
YELLOW CAKE STAND,KE8437S-YE,Everyday Products,$10.69 ,2,$14.25 ,KE8437S-YE.jpg
FUCHSIA MAGNETIC LICENCE PLATE,KE8517-FU,Everyday Products,$2.44 ,6,$3.25 ,KE8517-FU.jpg
YELLOW MAGNETIC LICENCE PLATE,KE8517-YE,Everyday Products,$2.44 ,6,$3.25 ,KE8517-YE.jpg
GRAY IRON 6X8 PICTURE FRAME,KF12A079-557L,Everyday Products,$11.21 ,2,$14.95 ,KF12A079-557L.jpg
GRAY IRON 5X7 PICTURE FRAME,KF12A079-557M,Everyday Products,$10.13 ,2,$13.50 ,KF12A079-557M.jpg
GRAY IRON 4X6 PICTURE FRAME,KF12A079-557S,Everyday Products,$8.21 ,2,$10.95 ,KF12A079-557S.jpg
DISTRESSED HORIZONTAL PICTURE FRAME,KF12A100-106,Everyday Products,$8.21 ,2,$10.95 ,KF12A100-106.jpg
DISTRESSED GRAY VINTAGE ROUND PICTURE FRAME,KF12A100-108,Everyday Products,$9.71 ,2,$12.95 ,KF12A100-108.jpg
DISTRESSED GRAY VINTAGE OVAL PICTURE FRAME,KF12A100-109,Everyday Products,$10.46 ,2,$13.95 ,KF12A100-109.jpg
DISTRESSED BIRD CAGE MULTIPLE TEALIGHT CANDLE HOLDER,KF55192,Everyday Products,$20.21 ,1,$26.95 ,KF55192.jpg
FUCHSIA MAGNETIC FLOWER,KF8840-FU,Everyday Products,$2.44 ,6,$3.25 ,KF8840-FU.jpg
LIME GREEN MAGNETIC FLOWER,KF8840-LI,Everyday Products,$2.44 ,6,$3.25 ,KF8840-LI.jpg
RUSTY JINGLE BELL,KJ4945A-1.75,Everyday Products,$0.34 ,12,$0.45 ,KJ4945A-1.75.jpg
GALVANIZED TUBS S/3,KK1060N-3,Everyday Products,$11.70 ,1,$15.60 ,KK1060N-3.jpg
RUSTY WATER PITCHER,KK1142A,Everyday Products,$7.39 ,2,$9.85 ,KK1142A.jpg
RUSTY MOOSE,KK1854A,Everyday Products,$3.19 ,4,$4.25 ,KK1854A.jpg
RUSTY PICK,KK2011A,Everyday Products,$0.86 ,6,$1.15 ,KK2011A.jpg
RUSTY TEA POT PICK,KK2014A,Everyday Products,$0.86 ,6,$1.15 ,KK2014A.jpg
HANGING POCKET CHALKBOARD,KK2159-B,Everyday Products,$2.44 ,6,$3.25 ,KK2159-B.jpg
RUSTY TIN CLIP,KK2323A,Everyday Products,$0.49 ,12,$0.65 ,KK2323A.jpg
RUSTY HANGING JEAN POCKET,KK2853A,Everyday Products,$3.41 ,4,$4.55 ,KK2853A.jpg
RUST WALL CONE,KK2854A,Everyday Products,$5.29 ,3,$7.05 ,KK2854A.jpg
RUSTY HALF TABLE,KK2863A,Everyday Products,$32.29 ,1,$43.05 ,KK2863A.jpg
RUSTY EMBOSSED SQUARE PANEL,KK4118A,Everyday Products,$3.86 ,3,$5.15 ,KK4118A.jpg
RUSTY HANGING JEAN POCKET,KK5482A,Everyday Products,$2.06 ,4,$2.75 ,KK5482A.jpg
ANTIQUE BLACK LUNCH PAIL WITH TRAY,KK5497SB,Everyday Products,$14.21 ,2,$18.95 ,KK5497SB.jpg
RUSTY EMBOSSED HANGIGN PLAQUE,KK7646-AB,Everyday Products,$2.21 ,6,$2.95 ,KK7646-AB.jpg
MEDIUM RUSTY ANGEL,KK8014MA,Everyday Products,$3.79 ,3,$5.05 ,KK8014MA.jpg
SMALL RUSTY ANGEL,KK8014SA,Everyday Products,$1.91 ,6,$2.55 ,KK8014SA.jpg
RUSTY CAN WITH LID,KK8162A,Everyday Products,$2.44 ,4,$3.25 ,KK8162A.jpg
FUCHSIA CHRYSANTHEMUM PICK,KK8522-FU,Everyday Products,$4.54 ,4,$6.05 ,KK8522-FU.jpg
WHITE CHRYSANTHEMUM PICK,KK8522-W,Everyday Products,$4.54 ,4,$6.05 ,KK8522-W.jpg
YELLOW CHRYSANTHEMUM PICK,KK8522-YE,Everyday Products,$4.54 ,4,$6.05 ,KK8522-YE.jpg
FLAT LAVENDER MESSAGE BOARD,KK8701-LAV,Everyday Products,$2.44 ,4,$3.25 ,KK8701-LAV.jpg
FLAT ORANGE MESSAGE BOARD,KK8701-OR,Everyday Products,$2.44 ,4,$3.25 ,KK8701-OR.jpg
FLAT YELLOW MESSAGE BOARD,KK8701-YE,Everyday Products,$2.44 ,4,$3.25 ,KK8701-YE.jpg
BLACK AND SILVER MAGNETIC EIFFEL TOWER,KK8881,Everyday Products,$1.46 ,6,$1.95 ,KK8881.jpg
RUSTY DRAGONFLY CUT OUT,KK8887A,Everyday Products,$0.38 ,12,$0.50 ,KK8887A.jpg
GRAY ZINC SQUARE BOX WITH LID,KK9064-GB,Everyday Products,$13.13 ,2,$17.50 ,KK9064-GB.jpg
MINIATURE WATER PITCHER,KKFL119A,Everyday Products,$1.01 ,6,$1.35 ,KKFL119A.jpg
RUSTY BIRD HOUSE PICKS S/3,KKFL180PA,Everyday Products,$4.84 ,2,$6.45 ,KKFL180PA.jpg
RUSTY JINGLE BELL,KT9661A,Everyday Products,$1.24 ,6,$1.65 ,KT9661A.jpg
WHITE WASHED SMALL SHOPPING CART,KV4821W,Everyday Products,$7.35 ,2,$9.80 ,KV4821W.jpg
WHITE WASHED EMBOSSED HANGING PLAQUE,KV7646W,Everyday Products,$2.44 ,4,$3.25 ,KV7646W.jpg
WHTIE WASHED PAN,KV995LW,Everyday Products,$1.91 ,6,$2.55 ,KV995LW.jpg
LARGE GALVANIZED TUB WITH JUTE ROPE HANDLES,KW009,Everyday Products,$8.63 ,2,$11.50 ,KW009.jpg
WEATHERED LOOK MAIL HOLDER,KW5062,Everyday Products,$13.46 ,2,$17.95 ,KW5062.jpg
10,KW8483-10,Everyday Products,$5.89 ,3,$7.85 ,KW8483-10.jpg
13,KW8483-13,Everyday Products,$7.39 ,2,$9.85 ,KW8483-13.jpg
16,KW8483-16,Everyday Products,$9.60 ,2,$12.80 ,KW8483-16.jpg
RED HAT PICTURE FRAME,RH4300,Everyday Products,$5.39 ,3,$7.18 ,RH4300.jpg
GALVANIZED WIRE SOAP DISH,WB4220N,Everyday Products,$2.21 ,4,$2.95 ,WB4220N.jpg
MINI WIRE 2 PERSON BENCH,WB599A,Everyday Products,$2.63 ,4,$3.50 ,WB599A.jpg
MINI WIRE 1 PERSON BENCH,WB600A,Everyday Products,$2.06 ,4,$2.75 ,WB600A.jpg
MINI WIRE ROUND TABLE,WB603A,Everyday Products,$2.74 ,4,$3.65 ,WB603A.jpg
BLACK MINI TRICYCLE,WB605B,Everyday Products,$3.38 ,3,$4.50 ,WB605B.jpg
WHITE MINI TRICYCLE,WB605W,Everyday Products,$3.38 ,3,$4.50 ,WB605W.jpg
MINI WIRE CHAIR,WB614A,Everyday Products,$1.76 ,6,$2.35 ,WB614A.jpg
BLACK WIRE WALL BASKET,WB636B,Everyday Products,$5.63 ,3,$7.50 ,WB636B.jpg
RUSTY WIRE FLOWER BASKET,WB639A,Everyday Products,$2.96 ,4,$3.95 ,WB639A.jpg
GALVANIZED WIRE FLOWER BASKET,WB639N,Everyday Products,$2.96 ,4,$3.95 ,WB639N.jpg
BLACK PAPER ROPE ORGANIZER,WB646B,Everyday Products,$1.88 ,6,$2.50 ,WB646B.jpg
WHITE PAPER ROPE ORGANZIER,WB646W,Everyday Products,$1.88 ,6,$2.50 ,WB646W.jpg
RUSTY ZINC BIRD HOUSE CANDLE HOLDER WITH ROSE,WB659-AG,Everyday Products,$4.13 ,3,$5.50 ,WB659-AG.jpg
RUSTY ZINC BIRD HOUSE CANDLE HOLDER,WB668-AG,Everyday Products,$3.94 ,2,$5.25 ,WB668-AG.jpg
RUSTY IRON SOAP DISH,WB681A,Everyday Products,$7.46 ,2,$9.95 ,WB681A.jpg
WHTIE IRON SOAP DISH,WB681W,Everyday Products,$7.46 ,2,$9.95 ,WB681W.jpg
RUSTY FRENCH DESIGN CLOCK,WB682A,Everyday Products,$10.88 ,2,$14.50 ,WB682A.jpg
BLACK WIRE BASKET,WB688B,Everyday Products,$6.71 ,3,$8.95 ,WB688B.jpg
RUSTY IRON FRENCH FLEUR WALL HOOK,WB692A,Everyday Products,$2.81 ,4,$3.75 ,WB692A.jpg
BLACK IRON FRENCH FLEUR WALL HOOK,WB692B,Everyday Products,$2.81 ,4,$3.75 ,WB692B.jpg
FRENCH FLEUR WALL COAT HOOK,WB694A,Everyday Products,$2.63 ,4,$3.50 ,WB694A.jpg
AMERICAN FLAG RIBBON,WPS0901,Everyday Products,$13.13 ,2,$17.50 ,WPS0901.jpg
GOLD WIRE RIBBON,X7552,Everyday Products,$4.46 ,4,$5.95 ,X7552.jpg
DISTRESSED RED MAGNETIC LETTER A,KK8843S-A-R,Magnetic Letters,$1.69 ,6,$2.25 ,KK8843S-A-R.jpg
DISTRESSED WHITE MAGNETIC LETTER A,KK8843S-A-W,Magnetic Letters,$1.69 ,6,$2.25 ,KK8843S-A-W.jpg
DISTRESSED WHITE MAGNETIC LETTER B,KK8843S-B-W,Magnetic Letters,$1.69 ,6,$2.25 ,KK8843S-B-W.jpg
DISTRESSED WHITE MAGNETIC LETTER C,KK8843S-C-W,Magnetic Letters,$1.69 ,6,$2.25 ,KK8843S-C-W.jpg
DISTRESSED WHITE MAGNETIC LETTER D,KK8843S-D-W,Magnetic Letters,$1.69 ,6,$2.25 ,KK8843S-D-W.jpg
DISTRESSED MOSS GREEN MANGETIC LETTER E,KK8843S-E-MG,Magnetic Letters,$1.69 ,6,$2.25 ,KK8843S-E-MG.jpg
DISTRESSED RED MAGNETIC LETTER E,KK8843S-E-R,Magnetic Letters,$1.69 ,6,$2.25 ,KK8843S-E-R.jpg
DISTRESSED WHITE MAGNETIC LETTER E,KK8843S-E-W,Magnetic Letters,$1.69 ,6,$2.25 ,KK8843S-E-W.jpg
DISTRESSED WHITE MAGNETIC LETTER F,KK8843S-F-W,Magnetic Letters,$1.69 ,6,$2.25 ,KK8843S-F-W.jpg
DISTRESSED BABY BLUE MAGNETIC LETTER G,KK8843S-G-BB,Magnetic Letters,$1.69 ,6,$2.25 ,KK8843S-G-BB.jpg
DISTRESSED WHITE MAGNETIC LETTER G,KK8843S-G-W,Magnetic Letters,$1.69 ,6,$2.25 ,KK8843S-G-W.jpg
DISTRESSED ORANGE MAGNETIC LETTER H,KK8843S-H-OR,Magnetic Letters,$1.69 ,6,$2.25 ,KK8843S-H-OR.jpg
DISTRESSED WHITE MAGNETIC LETTER H,KK8843S-H-W,Magnetic Letters,$1.69 ,6,$2.25 ,KK8843S-H-W.jpg
DISTRESSED LIME GREEN MAGNETIC LETTER I,KK8843S-I-LI,Magnetic Letters,$1.69 ,6,$2.25 ,KK8843S-I-LI.jpg
DISTRESSED MOSS GREEN MANGETIC LETTER I,KK8843S-I-MG,Magnetic Letters,$1.69 ,6,$2.25 ,KK8843S-I-MG.jpg
DISTRESSED WHITE MAGNETIC LETTER I,KK8843S-I-W,Magnetic Letters,$1.69 ,6,$2.25 ,KK8843S-I-W.jpg
DISTRESSED RED MANGETIC LETTER J,KK8843S-J-R,Magnetic Letters,$1.69 ,6,$2.25 ,KK8843S-J-R.jpg
DISTRESSED WHITE MAGNETIC LETTER J,KK8843S-J-W,Magnetic Letters,$1.69 ,6,$2.25 ,KK8843S-J-W.jpg
DISTRESSED WHITE MAGNETIC LETTER K,KK8843S-K-W,Magnetic Letters,$1.69 ,6,$2.25 ,KK8843S-K-W.jpg
DISTRESSED BABY BLUE MAGNETIC LETTER L,KK8843S-L-BB,Magnetic Letters,$1.69 ,6,$2.25 ,KK8843S-L-BB.jpg
DISTRESSED WHITE MAGNETIC LETTER L,KK8843S-L-W,Magnetic Letters,$1.69 ,6,$2.25 ,KK8843S-L-W.jpg
DISTRESSED ORANGE MAGNETIC LETTER M,KK8843S-M-OR,Magnetic Letters,$1.69 ,6,$2.25 ,KK8843S-M-OR.jpg
DISTRESSED WHITE MAGNETIC LETTER M,KK8843S-M-W,Magnetic Letters,$1.69 ,6,$2.25 ,KK8843S-M-W.jpg
DISTRESSED LIME GREEN MAGNETIC LETTER N,KK8843S-N-LI,Magnetic Letters,$1.69 ,6,$2.25 ,KK8843S-N-LI.jpg
DISTRESSED WHITE MAGNETIC LETTER N,KK8843S-N-W,Magnetic Letters,$1.69 ,6,$2.25 ,KK8843S-N-W.jpg
DISTRESSED MOSS GREEN MANGETIC LETTER O,KK8843S-O-MG,Magnetic Letters,$1.69 ,6,$2.25 ,KK8843S-O-MG.jpg
DISTRESSED WHITE MAGNETIC LETTER O,KK8843S-O-W,Magnetic Letters,$1.69 ,6,$2.25 ,KK8843S-O-W.jpg
DISTRESSED WHITE MAGNETIC LETTER P,KK8843S-P-W,Magnetic Letters,$1.69 ,6,$2.25 ,KK8843S-P-W.jpg
DISTRESSED WHITE MAGNETIC LETTER Q,KK8843S-Q-W,Magnetic Letters,$1.69 ,6,$2.25 ,KK8843S-Q-W.jpg
DISTRESSED BABY BLUE MAGNETIC LETTER R,KK8843S-R-BB,Magnetic Letters,$1.69 ,6,$2.25 ,KK8843S-R-BB.jpg
DISTRESSED WHITE MAGNETIC LETTER R,KK8843S-R-W,Magnetic Letters,$1.69 ,6,$2.25 ,KK8843S-R-W.jpg
DISTRESSED ORANGE MAGNETIC LETTER S,KK8843S-S-OR,Magnetic Letters,$1.69 ,6,$2.25 ,KK8843S-S-OR.jpg
DISTRESSED WHITE MAGNETIC LETTER S,KK8843S-S-W,Magnetic Letters,$1.69 ,6,$2.25 ,KK8843S-S-W.jpg
DISTRESSED WHITE MAGNETIC LETTER T,KK8843S-T-W,Magnetic Letters,$1.69 ,6,$2.25 ,KK8843S-T-W.jpg
DISTRESSED MOSS GREEN MANGETIC LETTER U,KK8843S-U-MG,Magnetic Letters,$1.69 ,6,$2.25 ,KK8843S-U-MG.jpg
DISTRESSED WHITE MAGNETIC LETTER U,KK8843S-U-W,Magnetic Letters,$1.69 ,6,$2.25 ,KK8843S-U-W.jpg
DISTRESSED RED MANGETIC LETTER R,KK8843S-V-R,Magnetic Letters,$1.69 ,6,$2.25 ,KK8843S-V-R.jpg
DISTRESSED WHITE MAGNETIC LETTER V,KK8843S-V-W,Magnetic Letters,$1.69 ,6,$2.25 ,KK8843S-V-W.jpg
DISTRESSED WHITE MAGNETIC LETTER W,KK8843S-W-W,Magnetic Letters,$1.69 ,6,$2.25 ,KK8843S-W-W.jpg
DISTRESSED BABY BLUE MAGNETIC LETTER X,KK8843S-X-BB,Magnetic Letters,$1.69 ,6,$2.25 ,KK8843S-X-BB.jpg
DISTRESSED WHITE MAGNETIC LETTER X,KK8843S-X-W,Magnetic Letters,$1.69 ,6,$2.25 ,KK8843S-X-W.jpg
DISTRESSED ORANGE MAGNETIC LETTER Y,KK8843S-Y-OR,Magnetic Letters,$1.69 ,6,$2.25 ,KK8843S-Y-OR.jpg
