DISTRESSED WHITE MAGNETIC LETTER Y,KK8843S-Y-W,Magnetic Letters,$1.69 ,6,$2.25 ,KK8843S-Y-W.jpg
DISTRESSED LIME GREEN MAGNETIC LETTER Z,KK8843S-Z-LI,Magnetic Letters,$1.69 ,6,$2.25 ,KK8843S-Z-LI.jpg
DISTRESSED WHITE MAGNETIC LETTER Z,KK8843S-Z-W,Magnetic Letters,$1.69 ,6,$2.25 ,KK8843S-Z-W.jpg
FULL SET OF MAGNETIC LETTERS WITH DISPLAY BOX - 96 LETTERS,PDQ1-LETTERS,Magnetic Letters,$165.00 ,2,$220.00 ,PDQ1-LETTERS.jpg
FULL SET OF MANGETIC FLOWERS WITH DISPLAY BOX - 48 FLOWERS,PDQ2-FLOWERS,Magnetic Letters,$86.25 ,2,$115.00 ,PDQ2-FLOWERS.jpg
DISTRESSED BABY BLUE THIN OVAL BUCKET,KD1694BB-3,Pails & Buckets,$16.46 ,4,$21.95 ,KD1694BB-3.jpg
DISTRESSED ORANGE THIN OVAL BUCKET,KD1694OR-3,Pails & Buckets,$16.46 ,4,$21.95 ,KD1694OR-3.jpg
LARGE DISTRESSED WHITE OLIVE BUCKET,KD8850L-W,Pails & Buckets,$11.21 ,4,$14.95 ,KD8850L-W.jpg
SMALL DISTRESSED LIME GREEN OLIVE BUCKET,KD8850S-LI,Pails & Buckets,$8.21 ,4,$10.95 ,KD8850S-LI.jpg
SMALL DISTRESSED WHITE OLIVE BUCKET,KD8850S-W,Pails & Buckets,$8.21 ,4,$10.95 ,KD8850S-W.jpg
RED COAL BUCKETS SET OF 2,KE1078BR-2,Pails & Buckets,$15.04 ,2,$20.05 ,KE1078BR-2.jpg
ORANGE COAL BUCKETS SET OF 2,KE1078OR-2,Pails & Buckets,$15.04 ,2,$20.05 ,KE1078OR-2.jpg
PINK COAL BUCKETS SET OF 2,KE1078P-2,Pails & Buckets,$15.04 ,2,$20.05 ,KE1078P-2.jpg
WHITE COAL BUCKETS SET OF 2,KE1078W-2,Pails & Buckets,$15.04 ,2,$20.05 ,KE1078W-2.jpg
BROWN ICE BUCKET WITH SCOOP,KE5229LBR-SCOOP,Pails & Buckets,$10.69 ,3,$14.25 ,KE5229LBR-SCOOP.jpg
PINK ICE BUCKET WITH SCOOP,KE5229LP-SCOOP,Pails & Buckets,$10.69 ,3,$14.25 ,KE5229LP-SCOOP.jpg
RED ICE BUCKET WITH SCOOP,KE5229LR-SCOOP,Pails & Buckets,$10.69 ,3,$14.25 ,KE5229LR-SCOOP.jpg
WHITE ICE BUCKET WITH SCOOP,KE5229LW-SCOOP,Pails & Buckets,$10.69 ,3,$14.25 ,KE5229LW-SCOOP.jpg
FLAT BLACK 7,KK1009SB,Pails & Buckets,$3.19 ,6,$4.25 ,KK1009SB.jpg
SMALL RUSTY DESKTOP TRASH PAIL,KK2988D-A,Pails & Buckets,$4.50 ,4,$6.00 ,KK2988D-A.jpg
SMALL BACK DESKTOP TRASH PAIL,KK2988D-B,Pails & Buckets,$4.84 ,4,$6.45 ,KK2988D-B.jpg
13,KK8620-MG-8-13,Pails & Buckets,$9.49 ,4,$12.65 ,KK8620-MG-8-13.jpg
15,KK8620-MG-8-15,Pails & Buckets,$13.61 ,4,$18.15 ,KK8620-MG-8-15.jpg
MINI RUSTY TAPERED PAIL PICK,WB582A,Pails & Buckets,$1.31 ,12,$1.75 ,WB582A.jpg
MINI RUSTY TAPERED PAIL,WB582A-1,Pails & Buckets,$1.28 ,12,$1.70 ,WB582A-1.jpg
MINI RUSTY WATER PITCHER PICK,WB584A,Pails & Buckets,$1.31 ,12,$1.75 ,WB584A.jpg
MINI RUSTY DUST PAN PICK,WB585A,Pails & Buckets,$0.94 ,12,$1.25 ,WB585A.jpg
MINI RUSTY DUST PAN,WB585A-1,Pails & Buckets,$0.86 ,12,$1.15 ,WB585A-1.jpg
MINI RUSY PAIL PICK,WB586A,Pails & Buckets,$1.13 ,12,$1.50 ,WB586A.jpg
MINI RUSTY PAIL,WB586A-1,Pails & Buckets,$1.05 ,12,$1.40 ,WB586A-1.jpg
FOAM BRICKS,FB3,Planters & Garden,$1.94 ,4,$2.59 ,FB3.jpg
DECORATIVE WORK TOOS,GS2006A,Planters & Garden,$0.98 ,6,$1.31 ,GS2006A.jpg
DECORATIVE RUSTY WORK TOOLS,GS9537LA,Planters & Garden,$11.52 ,2,$15.36 ,GS9537LA.jpg
WHITE FLOWER BASKETS SET OF 2,KE1078W-2,Planters & Garden,$5.21 ,3,$6.95 ,KE1078W-2.jpg
BROWN PUMPKIN PLANTER,KE2320BR,Planters & Garden,$12.41 ,2,$16.55 ,KE2320BR.jpg
PINK DECORATIVE WATERING CAN,KE5786P,Planters & Garden,$7.61 ,2,$10.15 ,KE5786P.jpg
RED DECORATIVE WATERING CAN,KE5786R,Planters & Garden,$7.61 ,2,$10.15 ,KE5786R.jpg
WHITE DECORATIVE WATERING CAN,KE5786W,Planters & Garden,$7.61 ,2,$10.15 ,KE5786W.jpg
AQUA WATERING CAN PLANTER,KE5788AQ,Planters & Garden,$5.21 ,4,$6.95 ,KE5788AQ.jpg
AQUA WHEELBARROW,KE6005L-AQ,Planters & Garden,$2.44 ,4,$3.25 ,KE6005L-AQ.jpg
FUCHSIA WHEELBARROW,KE6005L-FU,Planters & Garden,$2.44 ,4,$3.25 ,KE6005L-FU.jpg
PINK WHEELBARROW,KE6005L-P,Planters & Garden,$2.44 ,4,$3.25 ,KE6005L-P.jpg
AQUA FLOWER BASKETS SET OF 2,KE7028AQ-2,Planters & Garden,$5.21 ,3,$6.95 ,KE7028AQ-2.jpg
PINK FLOWER BASKETS SET OF 2,KE7028P-2,Planters & Garden,$5.21 ,3,$6.95 ,KE7028P-2.jpg
RED FLOWER BASKETS SET OF 2,KE7028R-2,Planters & Garden,$5.21 ,3,$6.95 ,KE7028R-2.jpg
RUSTY DECORATIVE POT,KK1994MA,Planters & Garden,$4.84 ,4,$6.45 ,KK1994MA.jpg
ANTIQUE BLACK FLOWER BASKETS SET OF 2,KK7028B-2,Planters & Garden,$5.21 ,3,$6.95 ,KK7028B-2.jpg
COPPER GREEN PLANTERS SET OF 3,KK7335CG,Planters & Garden,$14.44 ,6,$19.25 ,KK7335CG.jpg
DISTRESSED ORANGE WATERING CAN,KK8767OR,Planters & Garden,$13.16 ,4,$17.55 ,KK8767OR.jpg
WHTIE WASHED HANGING FLOWER BASKET,KV7028S-W,Planters & Garden,$4.84 ,3,$6.45 ,KV7028S-W.jpg
WEATHERED LOOK WATERING CAN PLANTER WITH DRAIN HOLES,KW9467,Planters & Garden,$5.63 ,4,$7.50 ,KW9467.jpg
MINI SQUARE BIRD HOSUE GARDEN DOME,WB595A,Planters & Garden,$4.13 ,4,$5.50 ,WB595A.jpg
MINI ROUND BIRD HOUSE GARDEN DOME,WB598A,Planters & Garden,$3.71 ,4,$4.95 ,WB598A.jpg
MINI WIRE WHEELBARROW,WB615A,Planters & Garden,$2.96 ,4,$3.95 ,WB615A.jpg
LARGE DISTRESSED BABY BLUE LAMP SHADE,KD8876L-BB,Shades & Lights,$13.88 ,4,$18.50 ,KD8876L-BB.jpg
LARGE DISTRESSED LIME GREEN LAMP SHADE,KD8876L-LI,Shades & Lights,$13.88 ,4,$18.50 ,KD8876L-LI.jpg
LARGE DISTRESSED ORANGE LAMP SHADE,KD8876L-OR,Shades & Lights,$13.88 ,4,$18.50 ,KD8876L-OR.jpg
LARGE DISTRESSED WHITE LAME SHADE,KD8876L-W,Shades & Lights,$13.88 ,4,$18.50 ,KD8876L-W.jpg
LARGE WHITE WASHED VOTIVE CHANDELIER,KV4712LW,Shades & Lights,$14.96 ,1,$19.95 ,KV4712LW.jpg
WHITE WASHED VOTIVE CHANDELIER,KV4712SW,Shades & Lights,$11.96 ,2,$15.95 ,KV4712SW.jpg
BLACK WIRE LAMP - SHADE NOT INCLUDED,WB647BK,Shades & Lights,$22.46 ,1,$29.95 ,WB647BK.jpg
LIME GREEN WIRE LAMP - SHADE NOT INCLUDED,WB647LI,Shades & Lights,$22.46 ,1,$29.95 ,WB647LI.jpg
DECORATIVE BLCK WIRE BIRD HOUSE ON STAND,WB690B,Shades & Lights,$3.64 ,4,$4.85 ,WB690B.jpg
IRON STAR,IS005,Stars,$2.23 ,6,$2.97 ,IS005.jpg
IRON STAR,IS547,Stars,$5.15 ,3,$6.86 ,IS547.jpg
5,KG2608C-BK,Stars,$0.94 ,12,$1.25 ,KG2608C-BK.jpg
7,KG2608E-BK,Stars,$1.61 ,6,$2.15 ,KG2608E-BK.jpg
BLACK STAR VOTIVE HOLDER,KK5153B,Stars,$1.24 ,12,$1.65 ,KK5153B.jpg
12,KK7249BK-12,Stars,$4.91 ,4,$6.55 ,KK7249BK-12.jpg
16,KK7249BK-16,Stars,$7.39 ,3,$9.85 ,KK7249BK-16.jpg
20,KK7249BK-20,Stars,$10.31 ,2,$13.75 ,KK7249BK-20.jpg
12,KK7249OR-12,Stars,$4.91 ,4,$6.55 ,KK7249OR-12.jpg
16' OLD RED STAR POCKET,KK7249OR-16,Stars,$7.39 ,3,$9.85 ,KK7249OR-16.jpg
20,KK7249OR-20,Stars,$10.31 ,2,$13.75 ,KK7249OR-20.jpg
12,KK7454OY-12,Stars,$2.89 ,4,$3.85 ,KK7454OY-12.jpg
18,KK7454OY-18,Stars,$6.19 ,3,$8.25 ,KK7454OY-18.jpg
24,KK7454OY-24,Stars,$7.95 ,2,$10.60 ,KK7454OY-24.jpg
12,KK8860BK-12,Stars,$2.36 ,4,$3.15 ,KK8860BK-12.jpg
20,KK8860BK-20,Stars,$5.63 ,3,$7.50 ,KK8860BK-20.jpg
6,KK8860BK-6,Stars,$1.24 ,6,$1.65 ,KK8860BK-6.jpg
3.25,KL2382B,Stars,$1.24 ,6,$1.65 ,KL2382B.jpg
2.75,KS2968SA,Stars,$0.65 ,12,$0.86 ,KS2968SA.jpg
RUSTY IRON STAR,KS4827A,Stars,$1.91 ,4,$2.55 ,KS4827A.jpg
