8 Point Star Cookie Cutter,8165A,Cookie Cutters|New,"NEW! Prepare for the holy days, including Ramadan and Eid ul Fitr, with this 3 1/2"" cookie cutter. Bring cookies to an evening celebration, use as a tracing tool, or decorate your homestead.",,,,,,,,,,,,,,AnnClark400,AnnClark160,https://s3.amazonaws.com/cdn.annclarkcookiecutters.com/images/uploads/8165a-islamic-star-cookie-cutter-ann-clark-lrg.jpg,8165a-islamic-star-cookie-cutter-ann-clark-lrg.jpg,,,AnnClark800,8165a-islamic-star-cookie-cutter-ann-clark-lrg.jpg
Apple Cookie Cutter,8146A,Cookie Cutters|New,"NEW! Take a bite out of our Apple Cookie Cutter. Present it as a teacher's gift or serve a platter of the cookies to classmates. You're sure to get an A+ with these cookies!



Cookies decorated by Flour Box Bakery, Meg Makes and Bakes, and Dozen Eggs Bakery.",,,,,,,,,,,,,,AnnClark400,AnnClark160,https://s3.amazonaws.com/cdn.annclarkcookiecutters.com/images/uploads/8146a-apple-cookie-cutter-ann-clark-lrg.jpg,8146a-apple-cookie-cutter-ann-clark-lrg.jpg,,,AnnClark800,8146a-apple-cookie-cutter-ann-clark-lrg.jpg
Award Statue Cookie Cutter,8092A,Occasions & Celebrations|Party,"NEW! And the award for best cookie cutter goes to *dramatic pause* the 5 inch Award Statue/Mummy cookie cutter! Break this out for an Oscars viewing party or for other awards ceremonies, or use it for mummy Halloween treats! Just like a real Academy Award, it should never be put in the dishwasher.

Cookies decorated by Party Majors.",,,,,,,,,,,,,,AnnClark400,AnnClark160,https://s3.amazonaws.com/cdn.annclarkcookiecutters.com/images/uploads/8092a-award-statue-cookie-cutter-ann-clark-lrg.jpg,8092a-award-statue-cookie-cutter-ann-clark-lrg.jpg,,,AnnClark800,8092a-award-statue-cookie-cutter-ann-clark-lrg.jpg
Baby Carriage Cookie Cutter,8133A,Occasions & Celebrations|Baby Shower,"NEW! First comes love, then comes marriage, then comes the Baby Carriage Cookie Cutter- a perfect shape for a baby shower. Honor the mother-to-be with baby themed cookies, and celebrate the life of the child that is to come!",,,,,,,,,,,,,,AnnClark400,AnnClark160,https://s3.amazonaws.com/cdn.annclarkcookiecutters.com/images/uploads/8133a-baby-carriage-cookie-cutter-ann-clark-lrg.jpg,8133a-baby-carriage-cookie-cutter-ann-clark-lrg.jpg,,,AnnClark800,8133a-baby-carriage-cookie-cutter-ann-clark-lrg.jpg
Bear Cookie Cutter,8154A,Animals|Woodland,"NEW! Embrace your love of the wild with this cookie cutter! Ideal for outdoor enthusiasts, the Bear will bring a little part of the Alaskan woods to your kitchen.",,,,,,,,,,,,,,AnnClark400,AnnClark160,https://s3.amazonaws.com/cdn.annclarkcookiecutters.com/images/uploads/8154a-bear-cookie-cutter-ann-clark-lrg.jpg,8154a-bear-cookie-cutter-ann-clark-lrg.jpg,,,AnnClark800,8154a-bear-cookie-cutter-ann-clark-lrg.jpg
Carrot Cookie Cutter,8077A,Themes|Food & Drink,"NEW! They're not just for rabbits and horses! Ann Clark's 3 7/8"" x 2"" Carrot Cookie Cutter is ideal to use for Easter celebrations or for any food-themed cookie platter. What's up, Doc?",,,,,,,,,,,,,,AnnClark400,AnnClark160,https://s3.amazonaws.com/cdn.annclarkcookiecutters.com/images/uploads/8077a-carrot-cookie-cutter-ann-clark-lrg.jpg,8077a-carrot-cookie-cutter-ann-clark-lrg.jpg,,,AnnClark800,8077a-carrot-cookie-cutter-ann-clark-lrg.jpg
Caterpillar Cookie Cutter,8102A,Animals|Birds & Insects,"NEW! It may or may not be very hungry! Our 2 1/2"" x 4 1/2"" Caterpillar Cookie Cutter is darling for a baby shower. Also great for bug enthusiasts and for science lessons.",,,,,,,,,,,,,,AnnClark400,AnnClark160,https://s3.amazonaws.com/cdn.annclarkcookiecutters.com/images/uploads/8102a-catepillar-cookie-cutter-ann-clark-lrg.jpg,8102a-catepillar-cookie-cutter-ann-clark-lrg.jpg,,,AnnClark800,8102a-catepillar-cookie-cutter-ann-clark-lrg.jpg
Four Leaf Clover Cookie Cutter,8066A,Holidays|St. Patrick's Day,"NEW! Eireann go bragh! (""Ireland Forever"" in Gaelic). Celebrate Ireland and Irish heritage with the Clover Cookie Cutter, 3 3/4"". Have some clover shaped cookies after you've finished the corned beef & cabbage.",,,,,,,,,,,,,,AnnClark400,AnnClark160,https://s3.amazonaws.com/cdn.annclarkcookiecutters.com/images/uploads/8066a-four-leaf-clover-cookie-cutter-ann-clark-lrg.jpg,8066a-four-leaf-clover-cookie-cutter-ann-clark-lrg.jpg,,,AnnClark800,8066a-four-leaf-clover-cookie-cutter-ann-clark-lrg.jpg
Crayon Cookie Cutter,8053A,Themes|School,"NEW! Get crafty with Ann Clark's 3 5/8"" Crayon Cookie Cutter. Use this crayon shape at school or as an after-school activity at home. Make crayon cookies or treats that are fun to decorate. Made in the USA.",,,,,,,,,,,,,,AnnClark400,AnnClark160,https://s3.amazonaws.com/cdn.annclarkcookiecutters.com/images/uploads/8053a-crayon-cookie-cutter-ann-clark-lrg.jpg,8053a-crayon-cookie-cutter-ann-clark-lrg.jpg,,,AnnClark800,8053a-crayon-cookie-cutter-ann-clark-lrg.jpg
Cute Elephant Cookie Cutter,8169A,Occasions & Celebrations|Baby Shower,"NEW! An elephant never forgets- and you won't be forgotten if you give someone this adorable cookie cutter! Works well for baby showers, zoo themed parties, and more.",,,,,,,,,,,,,,AnnClark400,AnnClark160,https://s3.amazonaws.com/cdn.annclarkcookiecutters.com/images/uploads/8169a-cute-elephant-cookie-cutter-ann-clark-lrg.jpg,8169a-cute-elephant-cookie-cutter-ann-clark-lrg.jpg,,,AnnClark800,8169a-cute-elephant-cookie-cutter-ann-clark-lrg.jpg
Cute Ghost Cookie Cutter,8173A,Seasons|Fall,"NEW! BOO! The Cute Ghost cookie cutter will add a delightfully spooky flair to your next Halloween shindig. Whether your decorate your treats or crafts to be scary or silly, you're bound to have fun with this shape. Bonus: turn it upside down to make flower cookies for Spring & Summer!",,,,,,,,,,,,,,AnnClark400,AnnClark160,https://s3.amazonaws.com/cdn.annclarkcookiecutters.com/images/uploads/8173a-cute-ghost-cookie-cutter-ann-clark-lrg.jpg,8173a-cute-ghost-cookie-cutter-ann-clark-lrg.jpg,,,AnnClark800,8173a-cute-ghost-cookie-cutter-ann-clark-lrg.jpg
Cute Llama Cookie Cutter,8159A,Animals|Farm,"NEW! Llama and alpaca fans, this one's for you! This cookie cutter may not have fur, fleece, or long eyelashes, but it will cut out adorable cookies that you can use for a baby shower or other occasion.

Cookies decorated by Sweet Bellas.",,,,,,,,,,,,,,AnnClark400,AnnClark160,https://s3.amazonaws.com/cdn.annclarkcookiecutters.com/images/uploads/8159a-cute-llama-cookie-cutter-ann-clark-lrg.jpg,8159a-cute-llama-cookie-cutter-ann-clark-lrg.jpg,,,AnnClark800,8159a-cute-llama-cookie-cutter-ann-clark-lrg.jpg
Flour Box Bakery's Double Heart Cookie Cutter,8163A,Themes|Designer Collection,"NEW!
Be still my beating heart! This double heart shape is ideal for celebrating romantic love, from Valentine's Day to weddings, as well as honoring family & friendship! Show someone you care with heart cookies or other cut-out treats.


Cookies decorated by Flour Box Bakery.
ABOUT THE DESIGNER
Anne Yorks is the owner and head decorator of Flour Box Bakery LLC. She started decorating cookies in 2007 when she left the 'real world' to be a stay-at-home mom and pursue her dreams of owning and operating her own company. A baker since a very young age, Anne is self-taught and has perfected her cookies and recipes over years of trial and error. She has taught two online Craftsy classes and loves to teach live classes in her cookie studio in Bellefonte, PA.",,,,,,,,,,,,,,AnnClark400,AnnClark160,https://s3.amazonaws.com/cdn.annclarkcookiecutters.com/images/uploads/8163a-double-heart-flour-box-bakery-cookie-cutter-ann-clark-lrg.jpg,8163a-double-heart-flour-box-bakery-cookie-cutter-ann-clark-lrg.jpg,,,AnnClark800,8163a-double-heart-flour-box-bakery-cookie-cutter-ann-clark-lrg.jpg
Duckling Cookie Cutter,8130A,Animal|Farm Animal,"NEW! Make way for the Duckling Cookie Cutter! Equally adorable as an Easter decoration or as a shower gift for the mom-to-be, this cookie cutter is also ideal for crafting purposes.",,,,,,,,,,,,,,AnnClark400,AnnClark160,https://s3.amazonaws.com/cdn.annclarkcookiecutters.com/images/uploads/8130a-duckling-rubber-ducky-cookie-cutter-ann-clark-lrg.jpg,8130a-duckling-rubber-ducky-cookie-cutter-ann-clark-lrg.jpg,,,AnnClark800,8130a-duckling-rubber-ducky-cookie-cutter-ann-clark-lrg.jpg
Easter Bunny Cookie Cutter,8124A,Holidays|Easter,"NEW! Here comes Peter Cottontail, hoppin' down the bunny trail! Try our 4 1/8"" Easter Bunny Cookie Cutter for your Easter festivities, or any time you want a springtime pick-me-up. This is one bunny you won't have to feed.

Cookies decorated by Lizard Lick",,,,,,,,,,,,,,AnnClark400,AnnClark160,https://s3.amazonaws.com/cdn.annclarkcookiecutters.com/images/uploads/8124a-bunny-easter-cookie-cutter-ann-clark-lrg.jpg,8124a-bunny-easter-cookie-cutter-ann-clark-lrg.jpg,,,AnnClark800,8124a-bunny-easter-cookie-cutter-ann-clark-lrg.jpg
Small Easter Egg Cookie Cutter,8121A,Holidays|Easter,"NEW! For a twist on traditional Easter activities, how about using Egg cookie cutters? Trace, cut, and play around with this 3"" shape, and decorate cookies for dessert. Decorate egg-shaped cookies just as you would actual eggs!",,,,,,,,,,,,,,AnnClark400,AnnClark160,https://s3.amazonaws.com/cdn.annclarkcookiecutters.com/images/uploads/8121a-easter-egg-cookie-cutter-ann-clark-lrg.jpg,8121a-easter-egg-cookie-cutter-ann-clark-lrg.jpg,,,AnnClark800,8121a-easter-egg-cookie-cutter-ann-clark-lrg.jpg
Flour Box Bakery's Easter Basket Cookie Cutter,8125A,Themes|Designer Collection,"NEW!
A tisket, a tasket, what's in your Easter basket? Decorate this 3 3/4"" x 3 1/8"" basket to represent the treasures of Easter morning. Pair this shape with Eggs and Bunnies for a complete theme!
Cookies decorated by Flour Box Bakery.
ABOUT THE DESIGNER
Anne Yorks is the owner and head decorator of Flour Box Bakery LLC. She started decorating cookies in 2007 when she left the 'real world' to be a stay-at-home mom and pursue her dreams of owning and operating her own company. A baker since a very young age, Anne is self-taught and has perfected her cookies and recipes over years of trial and error. She has taught two online Craftsy classes and loves to teach live classes in her cookie studio in Bellefonte, PA.",,,,,,,,,,,,,,AnnClark400,AnnClark160,https://s3.amazonaws.com/cdn.annclarkcookiecutters.com/images/uploads/8125a-easter-basket-cookie-cutter-ann-clark-lrg.jpg,8125a-easter-basket-cookie-cutter-ann-clark-lrg.jpg,,,AnnClark800,8125a-easter-basket-cookie-cutter-ann-clark-lrg.jpg
Flour Box Bakery's Kitchen Mixer Cookie Cutter,8098A,Themes|Designer Collection,"NEW!
Time to mix it up with the 3 7/8"" x 3 1/2"" Kitchen Mixer Cookie Cutter! Designed by Anne Yorks at Flour Box Bakery, this shape will be a neat addition to your collection. It's the perfect shape for bridal showers and bakers. Complements the Rolling Pin and Piping Bag.


Cookies decorated by Flour Box Bakery and Lorraine Russo-Harty
ABOUT THE DESIGNER
Anne Yorks is the owner and head decorator of Flour Box Bakery LLC. She started decorating cookies in 2007 when she left the 'real world' to be a stay-at-home mom and pursue her dreams of owning and operating her own company. A baker since a very young age, Anne is self-taught and has perfected her cookies and recipes over years of trial and error. She has taught two online Craftsy classes and loves to teach live classes in her cookie studio in Bellefonte, PA.",,,,,,,,,,,,,,AnnClark400,AnnClark160,https://s3.amazonaws.com/cdn.annclarkcookiecutters.com/images/uploads/8098a-kitchen-mixer-cookie-cutter-ann-clark-lrg.jpg,8098a-kitchen-mixer-cookie-cutter-ann-clark-lrg.jpg,,,AnnClark800,8098a-kitchen-mixer-cookie-cutter-ann-clark-lrg.jpg
Flour Box Bakery's Piping Bag / Carrot Cookie Cutter,8100A,Themes|Designer Collection,"NEW!
Just Bake It! With Flour Box Bakery's Piping Bag Cookie Cutter, you'll feel like a cookie artist. Use this shape to cut out cookies and other soft foods for anyone who loves to bake. Also useful as a Carrot shape, if you'd prefer!
Cookies decorated by Flour Box Bakery.
ABOUT THE DESIGNER
Anne Yorks is the owner and head decorator of Flour Box Bakery LLC. She started decorating cookies in 2007 when she left the 'real world' to be a stay-at-home mom and pursue her dreams of owning and operating her own company. A baker since a very young age, Anne is self-taught and has perfected her cookies and recipes over years of trial and error. She has taught two online Craftsy classes and loves to teach live classes in her cookie studio in Bellefonte, PA.",,,,,,,,,,,,,,AnnClark400,AnnClark160,https://s3.amazonaws.com/cdn.annclarkcookiecutters.com/images/uploads/8100a-piping-bag-cookie-cutter-ann-clark-lrg.jpg,8100a-piping-bag-cookie-cutter-ann-clark-lrg.jpg,,,AnnClark800,8100a-piping-bag-cookie-cutter-ann-clark-lrg.jpg
Flour Box Bakery's Rolling Pin Cookie Cutter,8099A,Themes|Designer Collection,"NEW!
It's how we roll- the Rolling Pin Cookie Cutter by Flour Box Bakery makes a cute and unexpected gift for your loved ones who love to bake! Goes with the Kitchen Mixer and Piping Bag.
Cookies decorated by Flour Box Bakery.
ABOUT THE DESIGNER
Anne Yorks is the owner and head decorator of Flour Box Bakery LLC. She started decorating cookies in 2007 when she left the 'real world' to be a stay-at-home mom and pursue her dreams of owning and operating her own company. A baker since a very young age, Anne is self-taught and has perfected her cookies and recipes over years of trial and error. She has taught two online Craftsy classes and loves to teach live classes in her cookie studio in Bellefonte, PA.",,,,,,,,,,,,,,AnnClark400,AnnClark160,https://s3.amazonaws.com/cdn.annclarkcookiecutters.com/images/uploads/8099a-rolling-pin-cookie-cutter-ann-clark-lrg.jpg,8099a-rolling-pin-cookie-cutter-ann-clark-lrg.jpg,,,AnnClark800,8099a-rolling-pin-cookie-cutter-ann-clark-lrg.jpg
Foot Cookie Cutter,8168A,Occasions & Celebrations|Baby Shower,"NEW! Ten tiny fingers, ten tiny toes. The Foot Cookie Cutter, 3 5/8"", makes a cute gift for a mom-to-be. It's also great for craft projects, as a Christmas tree ornament to commemorate baby's first year, or to celebrate a beach vacation!",,,,,,,,,,,,,,AnnClark400,AnnClark160,https://s3.amazonaws.com/cdn.annclarkcookiecutters.com/images/uploads/8168a-foot-cookie-cutter-ann-clark-lrg.jpg,8168a-foot-cookie-cutter-ann-clark-lrg.jpg,,,AnnClark800,8168a-foot-cookie-cutter-ann-clark-lrg.jpg
Graduation Cap Cookie Cutter,8070A,Occasions & Celebrations|Graduation,"NEW! Are you counting down the days 'til you're finally DONE with school?! Our Graduation Cap Cookie Cutter, 2 5/8"" x 4 3/8"", is here to celebrate just that! Pair it with the Diploma cookie cutter for a full celebratory set, and congratulations on your accomplishments.



Cookies decorated by A Dozen Eggs and Meg Makes and Bakes/a>.",,,,,,,,,,,,,,AnnClark400,AnnClark160,https://s3.amazonaws.com/cdn.annclarkcookiecutters.com/images/uploads/8070a-graduation-cap-cookie-cutter-ann-clark-lrg.jpg,8070a-graduation-cap-cookie-cutter-ann-clark-lrg.jpg,,,AnnClark800,8070a-graduation-cap-cookie-cutter-ann-clark-lrg.jpg
Hammer Cookie Cutter,8076A,Cookie Cutters|New,"NEW! Celebrate home improvement with the Hammer Cookie Cutter, 4 3/8"" x 3 1/4"". Use it with the Saw Cookie Cutter to cut out construction-themed cookies. Now get to work!",,,,,,,,,,,,,,AnnClark400,AnnClark160,https://s3.amazonaws.com/cdn.annclarkcookiecutters.com/images/uploads/8076a_hammer-cookie-cutter-ann-clark-lrg.jpg,8076a_hammer-cookie-cutter-ann-clark-lrg.jpg,,,AnnClark800,8076a_hammer-cookie-cutter-ann-clark-lrg.jpg
Hexagon Cookie Cutter,8178A,Themes|Shapes,NEW! Add to your geometry collection with this six-sided shape. Make learning fun- and delicious-by bringing cookies or other treats to class.,,,,,,,,,,,,,,AnnClark400,AnnClark160,https://s3.amazonaws.com/cdn.annclarkcookiecutters.com/images/uploads/8178a-hexagon-cookie-cutter-ann-clark-lrg.jpg,8178a-hexagon-cookie-cutter-ann-clark-lrg.jpg,,,AnnClark800,8178a-hexagon-cookie-cutter-ann-clark-lrg.jpg
Hot Air Balloon Cookie Cutter,8067A,Themes|Transportation,"NEW! All hail Jules Verne! Use your imagination to bring these to life with decorating supplies, and it will be just like a hot air balloon festival. This hot air balloon cookie cutter is 4 1/4"" and could also be used to cut other foods including fondant, cheese, and soft fruits.",,,,,,,,,,,,,,AnnClark400,AnnClark160,https://s3.amazonaws.com/cdn.annclarkcookiecutters.com/images/uploads/8067a-hot-air-balloon-cookie-cutter-ann-clark-lrg.jpg,8067a-hot-air-balloon-cookie-cutter-ann-clark-lrg.jpg,,,AnnClark800,8067a-hot-air-balloon-cookie-cutter-ann-clark-lrg.jpg
Large Butterfly Cookie Cutter,8123A,Cookie Cutters|New,NEW! When Spring has Sprung- or you wish it had- bring out the Large Butterfly Cookie Cutter for a party or for everyday fun. Insect lovers will flutter their wings for this shape! Use it to cut out cookies or for other craft projects.,,,,,,,,,,,,,,AnnClark400,AnnClark160,https://s3.amazonaws.com/cdn.annclarkcookiecutters.com/images/uploads/8123a-butterfly-large-cookie-cutter-ann-clark-lrg.jpg,8123a-butterfly-large-cookie-cutter-ann-clark-lrg.jpg,,,AnnClark800,8123a-butterfly-large-cookie-cutter-ann-clark-lrg.jpg
Large Football Cookie Cutter,8174A,Occasions & Celebrations|Super Bowl & Tailgating,"NEW! 1, 2, 3, HIKE! Get excited for a Homecoming game, the Super Bowl, Rose Bowl, or any other football-related event with this shape. Just remember: no excessive celebration!",,,,,,,,,,,,,,AnnClark400,AnnClark160,https://s3.amazonaws.com/cdn.annclarkcookiecutters.com/images/uploads/8174a-large-football-cookie-cutter-ann-clark-lrg.jpg,8174a-large-football-cookie-cutter-ann-clark-lrg.jpg,,,AnnClark800,8174a-large-football-cookie-cutter-ann-clark-lrg.jpg
Flour Box Bakery's Latte Cup Cookie Cutter,8158A,Themes|Designer Collection,"NEW!
Say ""thanks a latte"" or ""love you latte"" with this shape! Ideal for Valentine's Day or for a caffeine lover, this shape will get you buzzing. Espresso/coffee sold separately.


Cookies decorated by Flour Box Bakery.
ABOUT THE DESIGNER
Anne Yorks is the owner and head decorator of Flour Box Bakery LLC. She started decorating cookies in 2007 when she left the 'real world' to be a stay-at-home mom and pursue her dreams of owning and operating her own company. A baker since a very young age, Anne is self-taught and has perfected her cookies and recipes over years of trial and error. She has taught two online Craftsy classes and loves to teach live classes in her cookie studio in Bellefonte, PA.",,,,,,,,,,,,,,AnnClark400,AnnClark160,https://s3.amazonaws.com/cdn.annclarkcookiecutters.com/images/uploads/8158a-latte-cup-flour-box-bakery-cookie-cutter-ann-clark-lrg.jpg,8158a-latte-cup-flour-box-bakery-cookie-cutter-ann-clark-lrg.jpg,,,AnnClark800,8158a-latte-cup-flour-box-bakery-cookie-cutter-ann-clark-lrg.jpg
Letter D Cookie Cutter,8036A,Themes|Alphabet,"NEW! Teach the alphabet with our Letter D Cookie Cutter, 3 1/4"" x 3"". Spell your child's name or the name of your pet! Also useful for other occasions, such as for wedding favors or a graduation party.",,,,,,,,,,,,,,AnnClark400,AnnClark160,https://s3.amazonaws.com/cdn.annclarkcookiecutters.com/images/uploads/8036a-letter-d-cookie-cutter-ann-clark-lrg.jpg,8036a-letter-d-cookie-cutter-ann-clark-lrg.jpg,,,AnnClark800,8036a-letter-d-cookie-cutter-ann-clark-lrg.jpg
Letter N Cookie Cutter,8050A,Themes|Alphabet,"Who could say ""No"" to the 3 1/4"" Letter N Cookie Cutter? If it was your child's first word, bake cookies to commemorate the occasion! Otherwise, celebrate a bride & groom by using this cookie to make monogrammed cookies, or put out a cookie platter at a graduation party.",,,,,,,,,,,,,,AnnClark400,AnnClark160,https://s3.amazonaws.com/cdn.annclarkcookiecutters.com/images/uploads/8050a-letter-n-cookie-cutter-ann-clark-lrg.jpg,8050a-letter-n-cookie-cutter-ann-clark-lrg.jpg,,,AnnClark800,8050a-letter-n-cookie-cutter-ann-clark-lrg.jpg
Letter W Cookie Cutter,8045A,Themes|Alphabet,"NEW! What would you do with the 3 1/4"" Letter W Cookie Cutter? The possibilities are endless! A few ideas: use for a school project; bake cookies for a wedding or bridal shower; or bring to the birthday party of someone with a ""W"" initial.",,,,,,,,,,,,,,AnnClark400,AnnClark160,https://s3.amazonaws.com/cdn.annclarkcookiecutters.com/images/uploads/8045a-letter-w-cookie-cutter-ann-clark-lrg.jpg,8045a-letter-w-cookie-cutter-ann-clark-lrg.jpg,,,AnnClark800,8045a-letter-w-cookie-cutter-ann-clark-lrg.jpg
LilaLoa's Cute Unicorn Cookie Cutter,8143A,Themes|Designer Collection,"NEW!
Feel the magic of the Cute Unicorn! Lots of fun to use for everyday play, and great for birthdays or baby showers, this darling shape is sure to be loved by anyone who likes to indulge in a fantasy world. Designed by LilaLoa, a well-known cookie artist.


Cookies decorated by LilaLoa


ABOUT THE DESIGNER
Georganne Bell is the sugar artist behind the cookie decorating blog LilaLoa. She began her journey into sugar through cakes, but quickly switched to cookies when she moved to South Korea and discovered that her oven was the size of a bread box. A mix of innovation, science, and sugar, she continues to create cookies, design cutters, and teach local cookie decorating classes while raising her four young children and avoiding laundry at all costs.
Size: 3 1/8"" x 4 1/4""",,,,,,,,,,,,,,AnnClark400,AnnClark160,https://s3.amazonaws.com/cdn.annclarkcookiecutters.com/images/uploads/1577_2665_large.jpg,1577_2665_large.jpg,,,AnnClark800,1577_2665_large.jpg
LilaLoa's Unicorn Face Cookie Cutter,8142A,Themes|Designer Collection,"NEW!
A magical shape for children of all ages, the Unicorn Face is sure to bring smiles! Use for birthdays, school events, and everyday fun. Designed by LilaLoa, a well-known cookie artist.


ABOUT THE DESIGNER
Georganne Bell is the sugar artist behind the cookie decorating blog LilaLoa. She began her journey into sugar through cakes, but quickly switched to cookies when she moved to South Korea and discovered that her oven was the size of a bread box. A mix of innovation, science, and sugar, she continues to create cookies, design cutters, and teach local cookie decorating classes while raising her four young children and avoiding laundry at all costs.
Size: 3 7/8"" x 2 3/4""",,,,,,,,,,,,,,AnnClark400,AnnClark160,https://s3.amazonaws.com/cdn.annclarkcookiecutters.com/images/uploads/8142a-unicorn-face-cookie-cutter-ann-clark-lrg.jpg,8142a-unicorn-face-cookie-cutter-ann-clark-lrg.jpg,,,AnnClark800,8142a-unicorn-face-cookie-cutter-ann-clark-lrg.jpg
Llama Cookie Cutter,8144A,Animals|Farm,"NEW! Whether you prefer llamas or alpacas (llamas are larger and known for aggressively guarding spaces; alpacas are smaller and produce fleece), this shape will be a cute addition to your collection. Share the ""llapaca"" love!

Cookies decorated by Flour Box Bakery.",,,,,,,,,,,,,,AnnClark400,AnnClark160,https://s3.amazonaws.com/cdn.annclarkcookiecutters.com/images/uploads/8144a-llama-cookie-cutter-ann-clark-lrg.jpg,8144a-llama-cookie-cutter-ann-clark-lrg.jpg,,,AnnClark800,8144a-llama-cookie-cutter-ann-clark-lrg.jpg
Minnesota Cookie Cutter,8071A,Themes|States,"NEW! Welcome to the land of 10,000 lakes! The 3 1/2"" x 3"" Minnesota Cookie Cutter makes a special gift for those who hold the state dear to their hearts. Use for MN tailgate parties, fundraisers, geography lessons and more. Also ideal for fans of the movie Fargo.",,,,,,,,,,,,,,AnnClark400,AnnClark160,https://s3.amazonaws.com/cdn.annclarkcookiecutters.com/images/uploads/8071a-minnesota-cookie-cutter-ann-clark-lrg.jpg,8071a-minnesota-cookie-cutter-ann-clark-lrg.jpg,,,AnnClark800,8071a-minnesota-cookie-cutter-ann-clark-lrg.jpg
Moose Head Cookie Cutter,1941A,Animals|Woodland,"Calling all Rocky & Bullwinkle fans! The Moose Head Cookie Cutter, 4 1/2"", will cut out delicious cookies, brownies, and whatever else you dream up to serve in your kitchen. You ""moose"" also try the full-body moose (mooses), 1940A and 7866A, for a complete theme.",,,,,,,,,,,,,,AnnClark400,AnnClark160,https://s3.amazonaws.com/cdn.annclarkcookiecutters.com/images/uploads/1941a-moose-head-cookie-cutter-ann-clark-lrg.jpg,1941a-moose-head-cookie-cutter-ann-clark-lrg.jpg,,,AnnClark800,1941a-moose-head-cookie-cutter-ann-clark-lrg.jpg
Mountain Lake Cookie Cutter Gift Set,05-021,Sets|Boxed Sets,"NEW! This gift set evokes the feeling of waking up to crisp mountain air and fishing in a tranquil river. The Mountain Lake Cookie Cutter 5 Piece Gift Set includes a Moose, Fish, Tree, Loon and Mountain Bear, and is an ideal gift for the person who lives and breathes the great outdoors! Made in USA.",,,,,,,,,,,,,,AnnClark400,AnnClark160,https://s3.amazonaws.com/cdn.annclarkcookiecutters.com/images/uploads/05-021_Mountain-Lake-lrg.jpg,05-021_Mountain-Lake-lrg.jpg,,,AnnClark800,05-021_Mountain-Lake-lrg.jpg
Number 2 Cookie Cutter,8182A,Themes|Numbers,"NEW! Whether you're celebrating a 2nd or 102nd birthday; anniversary, or something else special that includes the #2, the Number 2 Cookie Cutter will be a perfect fit. You could also make number 2 cookies for a graduate; from preschool to post-doc! Made in the USA.",,,,,,,,,,,,,,AnnClark400,AnnClark160,https://s3.amazonaws.com/cdn.annclarkcookiecutters.com/images/uploads/8182a-number-2-cookie-cutter-ann-clark-lrg.jpg,8182a-number-2-cookie-cutter-ann-clark-lrg.jpg,,,AnnClark800,8182a-number-2-cookie-cutter-ann-clark-lrg.jpg
Number 3 Cookie Cutter,8183A,Themes|Numbers,"NEW! Make someone feel better about turning 30 (thirty, flirty, and thriving!), or celebrate a toddler's 3rd birthday, with the 3 1/4"" Number 3 Cookie Cutter. Additionally, use this shape for an anniversary, school party, or for a sporting event.",,,,,,,,,,,,,,AnnClark400,AnnClark160,https://s3.amazonaws.com/cdn.annclarkcookiecutters.com/images/uploads/8183a-number-3-cookie-cutter-ann-clark-lrg.jpg,8183a-number-3-cookie-cutter-ann-clark-lrg.jpg,,,AnnClark800,8183a-number-3-cookie-cutter-ann-clark-lrg.jpg
