Number 5 Cookie Cutter,8184A,Themes|Numbers,"NEW! Celebrate the big 5, or the big 5-0- whether it's a birthday or anniversary- with our 3 1/4"" Number 5 Cookie Cutter. You could also use this shape for a graduation, to show support at a sporting event, or other occasions that call for #5! Made in the USA.

Cookies decorated by Oh Sugar Cookies",,,,,,,,,,,,,,AnnClark400,AnnClark160,https://s3.amazonaws.com/cdn.annclarkcookiecutters.com/images/uploads/8184a-number-5-cookie-cutter-ann-clark-lrg.jpg,8184a-number-5-cookie-cutter-ann-clark-lrg.jpg,,,AnnClark800,8184a-number-5-cookie-cutter-ann-clark-lrg.jpg
Torch Cookie Cutter,8091A,Themes|Sports,"NEW! Let the games begin! The Olympic games, that is. Use this 5"" x 2 1/4"" Cookie Cutter to celebrate the Winter Olympics in style. Watch insanely talented athletes accomplish major feats as you munch on Torch cookies! Also useful for medieval-themed parties (Game of Thrones, anyone?).",,,,,,,,,,,,,,AnnClark400,AnnClark160,https://s3.amazonaws.com/cdn.annclarkcookiecutters.com/images/uploads/8091a-torch-olympic-cookie-cutter-ann-clark-lrg.jpg,8091a-torch-olympic-cookie-cutter-ann-clark-lrg.jpg,,,AnnClark800,8091a-torch-olympic-cookie-cutter-ann-clark-lrg.jpg
Penguin Cookie Cutter,8153A,Seasons|Winter,NEW! We've made a smaller version of an arctic favorite! March or waddle with this cute cookie cutter. Decorate cookies for a special occasion or just give to someone who likes penguins!,,,,,,,,,,,,,,AnnClark400,AnnClark160,https://s3.amazonaws.com/cdn.annclarkcookiecutters.com/images/uploads/8153a-penguin-cookie-cutter-ann-clark-lrg.jpg,8153a-penguin-cookie-cutter-ann-clark-lrg.jpg,,,AnnClark800,8153a-penguin-cookie-cutter-ann-clark-lrg.jpg
Flour Box Bakery's Reindeer Head Cookie Cutter,8161A,Themes|Designer Collection,"NEW!
On Dasher, on Dancer, on Prancer & Vixen! Get into the holiday spirit with this cute Reindeer Head cutter, designed by cookie artist Anne Yorks at Flour Box Bakery.


Cookies decorated by Flour Box Bakery.
ABOUT THE DESIGNER
Anne Yorks is the owner and head decorator of Flour Box Bakery LLC. She started decorating cookies in 2007 when she left the 'real world' to be a stay-at-home mom and pursue her dreams of owning and operating her own company. A baker since a very young age, Anne is self-taught and has perfected her cookies and recipes over years of trial and error. She has taught two online Craftsy classes and loves to teach live classes in her cookie studio in Bellefonte, PA.",,,,,,,,,,,,,,AnnClark400,AnnClark160,https://s3.amazonaws.com/cdn.annclarkcookiecutters.com/images/uploads/8161a-reindeer-face-flour-box-bakery-cookie-cutter-ann-clark-lrg.jpg,8161a-reindeer-face-flour-box-bakery-cookie-cutter-ann-clark-lrg.jpg,,,AnnClark800,8161a-reindeer-face-flour-box-bakery-cookie-cutter-ann-clark-lrg.jpg
Sewing Machine Cookie Cutter,8108A,Themes|Shapes,NEW! You don't have to be a seamstress to enjoy the Sewing Machine cookie cutter! This shape makes a whimsical gift for a sewing friend. Pair with the Spool of Thread for a complete theme.,,,,,,,,,,,,,,AnnClark400,AnnClark160,https://s3.amazonaws.com/cdn.annclarkcookiecutters.com/images/uploads/8108a-sewing-machine-cookie-cutter-ann-clark-lrg.jpg,8108a-sewing-machine-cookie-cutter-ann-clark-lrg.jpg,,,AnnClark800,8108a-sewing-machine-cookie-cutter-ann-clark-lrg.jpg
Shark Fin Cookie Cutter,8175A,Animals|Ocean Creatures,"NEW! Is that ""Jaws"" music we hear in the background? This ""great"" cookie cutter will be a fun addition to your Shark Week festivities, or for learning about sharks in school. This summertime shape could also be used to make surfboard cookies.",,,,,,,,,,,,,,AnnClark400,AnnClark160,https://s3.amazonaws.com/cdn.annclarkcookiecutters.com/images/uploads/8175a-shark-fin-cookie-cutter-ann-clark-lrg.jpg,8175a-shark-fin-cookie-cutter-ann-clark-lrg.jpg,,,AnnClark800,8175a-shark-fin-cookie-cutter-ann-clark-lrg.jpg
Simple Butterfly Cookie Cutter,8140A,Animals|Birds & Insects,"NEW! Flutter your wings for our Simple Butterfly Cookie Cutter, 3 1/8"" x 3 5/8"". It's a butterfly you can catch without a net! Make some butterfly cookies for a girl's birthday party, or just for fun.",,,,,,,,,,,,,,AnnClark400,AnnClark160,https://s3.amazonaws.com/cdn.annclarkcookiecutters.com/images/uploads/8140a-butterfly-cookie-cutter-ann-clark-lrg.jpg,8140a-butterfly-cookie-cutter-ann-clark-lrg.jpg,,,AnnClark800,8140a-butterfly-cookie-cutter-ann-clark-lrg.jpg
Small Butterfly Cookie Cutter,8122A,Animals|Birds & Insects,"NEW! Spread your wings for the 3 1/8"" Butterfly Cookie Cutter.This shape forms pretty cookies, plus it makes a nice gift or decoration.",,,,,,,,,,,,,,AnnClark400,AnnClark160,https://s3.amazonaws.com/cdn.annclarkcookiecutters.com/images/uploads/8122a-butterfly-small-cookie-cutter-ann-clark-lrg.jpg,8122a-butterfly-small-cookie-cutter-ann-clark-lrg.jpg,,,AnnClark800,8122a-butterfly-small-cookie-cutter-ann-clark-lrg.jpg
Flour Box Bakery's Small Leaf Cookie Cutter,8157A,Themes|Designer Collection,"NEW!
From Spring to Fall, this versatile shape could be used as a leaf; a bird; and even as a paisley pattern! Decorate leaves for back-to school or baby bird cookies for a baby shower.
Cookies decorated by Flour Box Bakery.
ABOUT THE DESIGNER
Anne Yorks is the owner and head decorator of Flour Box Bakery LLC. She started decorating cookies in 2007 when she left the 'real world' to be a stay-at-home mom and pursue her dreams of owning and operating her own company. A baker since a very young age, Anne is self-taught and has perfected her cookies and recipes over years of trial and error. She has taught two online Craftsy classes and loves to teach live classes in her cookie studio in Bellefonte, PA.",,,,,,,,,,,,,,AnnClark400,AnnClark160,https://s3.amazonaws.com/cdn.annclarkcookiecutters.com/images/uploads/8157a-small-leaf-cookie-cutter-ann-clark-lrg.jpg,8157a-small-leaf-cookie-cutter-ann-clark-lrg.jpg,,,AnnClark800,8157a-small-leaf-cookie-cutter-ann-clark-lrg.jpg
Flour Box Bakery's Snowman Head Cookie Cutter,8162A,Themes|Designer Collection,"NEW!
Go out and play in the snow with this ""frosty"" Snowman Head shape! Designed by cookie artist Anne Yorks at Flour Box Bakery, this wintry cookie cutter will enhance any snow day.


Cookies decorated by Flour Box Bakery.
ABOUT THE DESIGNER
Anne Yorks is the owner and head decorator of Flour Box Bakery LLC. She started decorating cookies in 2007 when she left the 'real world' to be a stay-at-home mom and pursue her dreams of owning and operating her own company. A baker since a very young age, Anne is self-taught and has perfected her cookies and recipes over years of trial and error. She has taught two online Craftsy classes and loves to teach live classes in her cookie studio in Bellefonte, PA.",,,,,,,,,,,,,,AnnClark400,AnnClark160,https://s3.amazonaws.com/cdn.annclarkcookiecutters.com/images/uploads/8162a-snowman-head-cookie-cutter-ann-clark-lrg.jpg,8162a-snowman-head-cookie-cutter-ann-clark-lrg.jpg,,,AnnClark800,8162a-snowman-head-cookie-cutter-ann-clark-lrg.jpg
Spool of Thread Cookie Cutter,8107A,Themes|Shapes,"NEW! Make it ""sew"" with the Spool of Thread cutter! This shape is a delightful gift for anyone who likes to sew, regardless of level. Pair it with the Scissors and Sewing Machine for a complete theme.",,,,,,,,,,,,,,AnnClark400,AnnClark160,https://s3.amazonaws.com/cdn.annclarkcookiecutters.com/images/uploads/8107a-spool-of-thread-cookie-cutter-ann-clark-lrg.jpg,8107a-spool-of-thread-cookie-cutter-ann-clark-lrg.jpg,,,AnnClark800,8107a-spool-of-thread-cookie-cutter-ann-clark-lrg.jpg
Sports Jersey Cookie Cutter-MMC,28-068,Cookie Cutters|New,"NEW! Swing a bat, sink a basket, or set up a spike with the 4 3/8"" Sports Jersey cookie cutter! Make cookies for game day and cheer on your favorite team or player. Perfect for all kinds of sporting events: Homecoming game, March Madness, Little League, Super Bowl, olympics - and beyond! Comes with a recipe card for dough and frosting. Made in the USA.",,,,,,,,,,,,,,AnnClark400,AnnClark160,https://s3.amazonaws.com/cdn.annclarkcookiecutters.com/images/uploads/28-068-sports-jersey-cookie-cutter-ann-clark-lrg.jpg,28-068-sports-jersey-cookie-cutter-ann-clark-lrg.jpg,,,AnnClark800,28-068-sports-jersey-cookie-cutter-ann-clark-lrg.jpg
Strawberry Cookie Cutter,8068A,Themes|Food & Drink,"NEW! Enjoy sweet summertime with the 3 1/4"" x 2 3/4"" Strawberry Cookie Cutter. Strawberry shortcake, anyone? Bring a sweet treat to your next summer picnic, or use as a stencil for an art project at home. Also if you turn it upside down and cut off the tip of the dough it creates a lovely rose shape.",,,,,,,,,,,,,,AnnClark400,AnnClark160,https://s3.amazonaws.com/cdn.annclarkcookiecutters.com/images/uploads/8068a-strawberry-cookie-cutter-ann-clark-lrg.jpg,8068a-strawberry-cookie-cutter-ann-clark-lrg.jpg,,,AnnClark800,8068a-strawberry-cookie-cutter-ann-clark-lrg.jpg
Flour Box Bakery's T-Shirt Cookie Cutter,8160A,Themes|Designer Collection,"NEW!
Cheer for your favorite player or team, make cookies for a fundraising event, and much more, with this T-Shirt cookie cutter. Use as a shirt or jersey, for all kinds of sports, or even make ""die-dye"" shirts. Decorate to be medical scrubs, too! Designed by Anne Yorks at Flour Box Bakery. This is similar to our larger t-shirt, so if you're looking for that shirt in a smaller size, try this one.


Cookies decorated by Flour Box Bakery.
ABOUT THE DESIGNER
Anne Yorks is the owner and head decorator of Flour Box Bakery LLC. She started decorating cookies in 2007 when she left the 'real world' to be a stay-at-home mom and pursue her dreams of owning and operating her own company. A baker since a very young age, Anne is self-taught and has perfected her cookies and recipes over years of trial and error. She has taught two online Craftsy classes and loves to teach live classes in her cookie studio in Bellefonte, PA.",,,,,,,,,,,,,,AnnClark400,AnnClark160,https://s3.amazonaws.com/cdn.annclarkcookiecutters.com/images/uploads/8160a-t-shirt-jersey-flour-box-bakery-cookie-cutter-ann-clark-lrg.jpg,8160a-t-shirt-jersey-flour-box-bakery-cookie-cutter-ann-clark-lrg.jpg,,,AnnClark800,8160a-t-shirt-jersey-flour-box-bakery-cookie-cutter-ann-clark-lrg.jpg
Tennessee Cookie Cutter,8075A,Themes|States,"NEW! Are you from Memphis? 'cause you're the only 10 I see! Feel like a ""10"" with our 1 1/2"" x 5 1/8"" Tennessee Cookie Cutter. Bake TN shaped cookies or give to a country music fan.",,,,,,,,,,,,,,AnnClark400,AnnClark160,https://s3.amazonaws.com/cdn.annclarkcookiecutters.com/images/uploads/8075a-tennessee-state-cookie-cutter-ann-clark-lrg.jpg,8075a-tennessee-state-cookie-cutter-ann-clark-lrg.jpg,,,AnnClark800,8075a-tennessee-state-cookie-cutter-ann-clark-lrg.jpg
Tool Boxed Set,33-025,Sets|Boxed Sets,"NEW! It's ""tool time"" with this 5 pc cookie cutter set! It won't help you build a treehouse or fix a leak, but it will cut out the perfect cookies for Father's Day, Mother's Day, a housewarming party, or a gift for someone who's helped you with a home repair.

Set includes:

Hammer- 4 3/8"" x 3 1/4""
Saw- 1 7/8"" x 5 1/2""
Wrench- 1 3/4"" x 5 1/4""
Pliers- 5 1/8"" x 2 7/8""
Pencil- 1 5/8"" x 4""",,,,,,,,,,,,,,AnnClark400,AnnClark160,https://s3.amazonaws.com/cdn.annclarkcookiecutters.com/images/uploads/33-025-tool-cookie-cutter-set-ann-clark-lrg.jpg,33-025-tool-cookie-cutter-set-ann-clark-lrg.jpg,,,AnnClark800,33-025-tool-cookie-cutter-set-ann-clark-lrg.jpg
Tunde's Creations Baby Dress Cookie Cutter,8167A,Themes|Designer Collection,"NEW!
Welcome a baby girl with the Baby Dress by Tunde! Works well for christenings, baby showers, and other celebrations for the new little one.


Cookies decorated by Tunde


ABOUT THE DESIGNER
Tunde is a Hungarian Gingerbread artist who shares art through her blog, as well as through her cookie decorating books, Youtube videos, and live classes. She lives in Bowling Green, Kentucky with her husband and three children.
Size: 3 1/4"" x 3 1/2""",,,,,,,,,,,,,,AnnClark400,AnnClark160,https://s3.amazonaws.com/cdn.annclarkcookiecutters.com/images/uploads/8167a-baby-dress-tundes-creations-cookie-cutter-ann-clark-lrg.jpg,8167a-baby-dress-tundes-creations-cookie-cutter-ann-clark-lrg.jpg,,,AnnClark800,8167a-baby-dress-tundes-creations-cookie-cutter-ann-clark-lrg.jpg
Tunde's Creations Baby Romper Cookie Cutter,8166A,Themes|Designer Collection,"NEW!
Congratulate a new parent with this darling Baby Romper cookie cutter! Great for baby showers, either given as a gift or used to cut out cookies and other treats for the celebration.


Cookies decorated by Tunde


ABOUT THE DESIGNER
Tunde is a Hungarian Gingerbread artist who shares art through her blog, as well as through her cookie decorating books, Youtube videos, and live classes. She lives in Bowling Green, Kentucky with her husband and three children.
Size: 3 1/4"" x 3""",,,,,,,,,,,,,,AnnClark400,AnnClark160,https://s3.amazonaws.com/cdn.annclarkcookiecutters.com/images/uploads/8166a-baby-romper-tundes-creations-cookie-cutter-ann-clark-lrg.jpg,8166a-baby-romper-tundes-creations-cookie-cutter-ann-clark-lrg.jpg,,,AnnClark800,8166a-baby-romper-tundes-creations-cookie-cutter-ann-clark-lrg.jpg
Wedding Dress Cookie Cutter,8132A,Occasions & Celebrations|Wedding,"NEW! Say ""yes"" to the Wedding Dress Cookie Cutter! Whether you're a bride-to-be, a fan of Cinderella, or just want to be fancy, use this cookie cutter for some special cookies or for crafting purposes.",,,,,,,,,,,,,,AnnClark400,AnnClark160,https://s3.amazonaws.com/cdn.annclarkcookiecutters.com/images/uploads/8132a-dress-gown-cookie-cutter-ann-clark-lrg.jpg,8132a-dress-gown-cookie-cutter-ann-clark-lrg.jpg,,,AnnClark800,8132a-dress-gown-cookie-cutter-ann-clark-lrg.jpg
Wine Bottle Cookie Cutter,8120A,Themes|Food & Drink,"NEW! Pass around the Wine Bottle Cookie Cutter at your next party- it's sure to please both red and white wine connoisseurs. This shape is perfect for any occasion that calls for a popped cork and can be used to make cookies, pastries, cut cheese or soft fruit or given as a hostess gift or stocking stuffer.",,,,,,,,,,,,,,AnnClark400,AnnClark160,https://s3.amazonaws.com/cdn.annclarkcookiecutters.com/images/uploads/8120a-wine-bottle-cookie-cutter-ann-clark-lrg.jpg,8120a-wine-bottle-cookie-cutter-ann-clark-lrg.jpg,,,AnnClark800,8120a-wine-bottle-cookie-cutter-ann-clark-lrg.jpg
Wine Glass Cookie Cutter,1486A,Themes|Food & Drink,"Raise your glass! The Wine Glass Cookie Cutter, 4 1/4"", will be a welcome addition to any celebration- anniversary, graduation, birthday, or even just because. Treat the wine lover in your life to this stylish cookie cutter.",,,,,,,,,,,,,,AnnClark400,AnnClark160,https://s3.amazonaws.com/cdn.annclarkcookiecutters.com/images/uploads/1486a-glass-cookie-cutter-ann-clark-lrg.jpg,1486a-glass-cookie-cutter-ann-clark-lrg.jpg,,,AnnClark800,1486a-glass-cookie-cutter-ann-clark-lrg.jpg
