Real Tree Camouflage PrintTrifold Organizer Bible Cover,BBC556,Bible Covers And Accessories|Bible Covers|Organizer Covers,"So functional and with a style all its own, our Tri-Fold Realtree Camo Bible Organizer is sure to excite! Perfect for class, Bible study group or the commute, this handy poly-canvas organizer provides uncommon storage features. 
On the front, you'll find a Velcro tabbed pouch to accommodate your phone, and another with a faux leather tabbed zipper, that is large enough for a wallet. A faux leather strap with Velcro closure pulls the organizer open to reveal another Velcro tabbed pouch, 2 pen compartments, 4 card slots - including one with an ID window, a slip pocket large enough to fit your iPad and many styles of notebooks and journals, a second slip pocket and a zipped mesh pocket. Another zip with a faux leather tabbed zipper, and you have a compartment to envelop your book or Bible and another couple of pens. A suitcase style carry handle and a ""Way - Truth - Life"" statement complete the look.
This Bible cover is available in two sizes: medium and large. Please refer to the last image in the image carousel on the left for the Bible Cover Sizing Chart before you make a selection.
Separate Bible and Organizer Compartments
Faux Leather Trimmings
2 Exterior Pouches
2 Interior Slip Pockets
Interior Zipped Mesh Pocket
Interior Velcro Tabbed Pocket
4 ID / Card Slots
4 Pen Loops
Available in Medium and Large
Refer to Image Carousel for Bible Cover Sizing Chart",,,,,,,,,,,,,,ChristianArt400,ChristianArt160,https://www.christianartgifts.com/product-images/BBC556_1--front.jpg,BBC556_1--front.jpg,,,ChristianArt800,BBC556_1--front.jpg
Teal Poly-Canvas Value Bible Cover with Fish Badge,BBC617,Bible Covers And Accessories|Bible Covers|Value Covers,"Whether you’re toting your Bible to church, small group or a coffee date with a friend, protect it with this sturdy Teal Poly-Canvas Value Bible Cover with Fish Badge.

The durable Poly-canvas Bible cover features the Christian fish in teal, a symbol traditionally used to identify followers of Jesus Christ,  appliquéd on a rubberized patch in the lower right hand corner. the Bible cover includes an external zipper with a cross engraved zipper pull, lay-flat spine handle, back zipper slip pocket and 1 pen loop inside.

This Bible cover is available in three sizes: small, medium and large. Please refer to the last image in the image carousel on the left for the Bible Cover Sizing Chart before you make a selection. 
Appliquéd Patch with Fish Design 
Inside Slip Pockets
Back Zipper Slip Pocket
Cross Engraved Zipper Pull
One Pen Loop
Lay-Flat Spine Handle
Self-seal Bag Packaging
Available in Small, Medium and Large 
Refer to Image Carousel for Bible Cover Sizing Chart",,,,,,,,,,,,,,ChristianArt400,ChristianArt160,https://www.christianartgifts.com/product-images/BBC617_1--front.jpg,BBC617_1--front.jpg,,,ChristianArt800,BBC617_1--front.jpg
Gray Poly-canvas Bible Cover with Ichthus Fish Badge,BBC615,Bible Covers And Accessories|Bible Covers|Value Covers,"The Gray Poly-canvas Bible Cover with Ichthus Fish Badge will protect your Bible whether you’re toting it to church, small group or a coffee date with a friend.

The poly-canvas Bible cover features the Christian Ichthus fish symbol, traditionally used to identify followers of Jesus Christ, on a patch that is appliquéd on the bottom right corner. The value Bible cover includes an external zipper with a cross engraved zipper pull, lay-flat spine handle, back zipper slip pocket and 1 pen loop inside.

This Bible cover is available in three sizes: small, medium and large. Please refer to the last image in the image carousel on the left for the Bible Cover Sizing Chart before you make a selection.

The value and durability of the Gray Poly-canvas Bible Cover with Ichthus Fish Badge makes it a great Bile cover for young children and teens.
Gray Poly-canvas
Ichthus Fish Patch Appliqué 
Inside Slip Pockets 
Back Zippered Slip Pocket 
Cross Engraved Zipper Pull 
One Pen Loop 
Lay-Flat Spine Handle 
Self-seal Bag Packaging 
Available in Small, Medium and Large 
Refer to Image Carousel for Bible Cover Sizing Chart",,,,,,,,,,,,,,ChristianArt400,ChristianArt160,https://www.christianartgifts.com/product-images/BBC615_1--front.jpg,BBC615_1--front.jpg,,,ChristianArt800,BBC615_1--front.jpg
Blue Poly-canvas Bible Cover with Ichthus Fish Badge,BBC618,Bible Covers And Accessories|Bible Covers|Value Covers,"Whether you’re toting your Bible to church, small group or a coffee date with a friend, protect it with this sturdy Blue Poly-canvas Bible Cover with Ichthus Fish Badge, which features the fish symbol traditionally used to identify followers of Jesus Christ.
The Ichthus fish appliqué is neatly stitched on the solid blue, poly canvas material. The Bible cover includes an external zipper with a cross engraved zipper-pull, lay-flat spine handle, back zippered pocket, and 1 interior pen loop.
This Bible cover is available in three sizes: small, medium, and large. Please refer to the last image in the image carousel on the left for the Bible Cover Sizing Chart before you make a selection. 
The Blue Poly-canvas Bible Cover with Ichthus Fish Badge is an affordable yet durable cover that offers great protection for a teenagers or tweens Bible.
Solid Blue Poly-canvas Cover 
Ichthus Fish Patch Appliqué 
Inside Slip Pockets 
Back Zippered Slip Pocket 
Cross Engraved Zipper Pull 
One Pen Loop 
Lay-Flat Spine Handle 
Self-seal Bag Packaging 
Available in Small, Medium and Large 
Refer to Image Carousel for Bible Cover Sizing Chart",,,,,,,,,,,,,,ChristianArt400,ChristianArt160,https://www.christianartgifts.com/product-images/BBC618_1--front.jpg,BBC618_1--front.jpg,,,ChristianArt800,BBC618_1--front.jpg
Purple Poly-Canvas Value Bible Cover with Fish Badge,BBC619,Bible Covers And Accessories|Bible Covers|Value Covers,"Whether you’re toting your Bible to church, small group or a coffee date with a friend, protect it with this sturdy Bible Cover, which features the Christian fish symbol traditionally used to identify followers of Jesus Christ. The fish appliqué is neatly stitched on a solid burgundy, poly canvas material and includes an external zipper with a cross engraved zipper pull, lay-flat spine handle, back zipper slip pocket and 1 pen loop inside.

This Bible cover is available in three sizes: small, medium and large. Please refer to the last image in the image carousel on the left for the Bible Cover Sizing Chart before you make a selection.
Jesus Fish Patch Appliqué 
Inside Slip Pockets 
Back Zipper Slip Pocket 
Cross Engraved Zipper Pull 
One Pen Loop 
Lay-Flat Spine Handle 
Self-seal Bag Packaging
Available in Small, Medium and Large 
Refer to Image Carousel for Bible Cover Sizing Chart",,,,,,,,,,,,,,ChristianArt400,ChristianArt160,https://www.christianartgifts.com/product-images/BBC619_1--front.jpg,BBC619_1--front.jpg,,,ChristianArt800,BBC619_1--front.jpg
Real Tree Camouflage PrintTrifold Organizer Bible Cover,BBC556,Bible Covers And Accessories|Bible Covers|Organizer Covers,"So functional and with a style all its own, our Tri-Fold Realtree Camo Bible Organizer is sure to excite! Perfect for class, Bible study group or the commute, this handy poly-canvas organizer provides uncommon storage features. 
On the front, you'll find a Velcro tabbed pouch to accommodate your phone, and another with a faux leather tabbed zipper, that is large enough for a wallet. A faux leather strap with Velcro closure pulls the organizer open to reveal another Velcro tabbed pouch, 2 pen compartments, 4 card slots - including one with an ID window, a slip pocket large enough to fit your iPad and many styles of notebooks and journals, a second slip pocket and a zipped mesh pocket. Another zip with a faux leather tabbed zipper, and you have a compartment to envelop your book or Bible and another couple of pens. A suitcase style carry handle and a ""Way - Truth - Life"" statement complete the look.
This Bible cover is available in two sizes: medium and large. Please refer to the last image in the image carousel on the left for the Bible Cover Sizing Chart before you make a selection.
Separate Bible and Organizer Compartments
Faux Leather Trimmings
2 Exterior Pouches
2 Interior Slip Pockets
Interior Zipped Mesh Pocket
Interior Velcro Tabbed Pocket
4 ID / Card Slots
4 Pen Loops
Available in Medium and Large
Refer to Image Carousel for Bible Cover Sizing Chart",,,,,,,,,,,,,,ChristianArt400,ChristianArt160,https://www.christianartgifts.com/product-images/BBC556_1--front.jpg,BBC556_1--front.jpg,,,ChristianArt800,BBC556_1--front.jpg
Amazing Grace Gray and Turquoise Faux Leather Fashion Bible Cover with Tassels,BBC673,Bible Covers And Accessories|Bible Covers|Fashion Covers,"Make a fashion statement while sharing the good news of God's amazing grace with the Amazing Grace Gray and Turquoise Faux Leather Fashion Bible Cover with Tassels—a practical way to protect and carry your Bible and convey God's grace.
A beautiful Jacobean design is heat debossed on the front panel of the Bible case to create a tone on tone pattern. Charcoal gray faux leather is used on the back panel, spine, and corners of the front panel. A gray faux leather knotted cord is threaded through the front panel's top section and accented with two tassels. Individual golden metal letters, centered at the bottom of the front panel, spell out the sentiment.
AMAZING GRACE
A faux leather lay-flat handle on the spine is constructed from the same charcoal gray faux leather as the spine and allows the cover to open fully. A gold metal cross-engraved zipper pull keeps the cover closed when not in use and keeps loose papers secure. The back panel features a slip pocket for notes and small notebooks and two pen loops that can be used to hold pens or highlighters are included in the cover's interior.
This Bible cover is available in two sizes: medium and large. Please refer to the last image in the image carousel on the left for the Bible Cover Sizing Chart before selecting a size.
The Amazing Grace Gray and Turquoise Faux Leather Fashion Bible Cover with Tassels is a lovely gift for a Christian woman. She will appreciate being able to carry her Bible in a protective and fashionable cover.
Gray and Turquoise Faux Leather 
Heat Debossed Turquoise Tone on Tone Jacobean Design 
Lay-Flat Carry Handle 
Exterior Slip Pocket 
Gold Cross-Engraved Zipper Pull 
2 Pen Loops 
Available in Medium and Large 
Refer to Image Carousel for Bible Cover Sizing Chart",,,,,,,,,,,,,,ChristianArt400,ChristianArt160,https://www.christianartgifts.com/product-images/BBC673_1--front.jpg,BBC673_1--front.jpg,,,ChristianArt800,BBC673_1--front.jpg
Deeply Rooted in God's Love Poly-canvas Value Bible Cover - Ephesians 3:17,BBC600,Bible Covers And Accessories|Bible Covers|Value Covers,"The Deeply Rooted in God's Love Poly-canvas Value Bible Cover will keep your Bible protected in a unique and artsy sort of way. 

The silk-screened cover features a teal tree, teal sprigs, and rusty brown birds snuggling on a branch. The sentiment is printed in a stark contrasting white against a charcoal background. 

Deeply rooted in God's love. 
Ephesians 3:17 


The back panel has a slip pocket. The sewn-in lay-flat spine handle ensures the Bible cover opens all the way and lays flat. Inside is a pen loop, and a cross engraved zipper pull securely closes the cover.

The Deeply Rooted in God's Love Poly-canvas Value Bible Cover is part of the Love Grows Collection featuring the vibrant artistry of Sally Sharp's whimsical birds mated for life. Other items in this collection include a Magnet Set, Tote Bag, Notebook and a Magnetic Bookmark Set. 

This Bible cover is available in two sizes: medium and large. Please refer to the last image in the image carousel on the left for the Bible Cover Sizing Chart before you make a selection. 

Remind someone you love of God's great love for them with the Deeply Rooted in God's Love Poly-canvas Value Bible Cover. 

Unique Design by ©Sally Sharp 
Poly-canvas Cover 
Back Slip Pocket 
Cross Engraved Zipper-Pull 
Carry Handle 
Pen Loop Inside 
Available in Medium and Large 
Refer to Image Carousel for Bible Cover Sizing Chart",,,,,,,,,,,,,,ChristianArt400,ChristianArt160,https://www.christianartgifts.com/product-images/BBC600_1--front.jpg,BBC600_1--front.jpg,,,ChristianArt800,BBC600_1--front.jpg
Stand Firm Oak Moss Camo Poly-Canvas Organizer Bible Cover - 1 Corinthians 16:13,BBC601,Bible Covers And Accessories|Bible Covers|Organizer Covers,"The Stand Firm Oak Moss Camo Poly-Canvas Organizer Bible Cover combines super storage with the fashionable camo look. 

The entire Bible cover is covered with an oak moss camouflage design. The front panel holds a zippered pocket and a Velcro tabbed flap pouch featuring an appliquéd patch with the sentiment and Scripture Reference. 

STAND FIRM 
1 Corinthians 16:13 

A handy slip pocket can be found on the back panel. Inside you will find a zippered mesh pocket and pen loop. The suitcase-style reinforced carry handle is attached with silver hardware. The tab zipper-pulls are made from poly-canvas. A hanging loop is attached to the handle to clip on your keys or water bottle. 

This Bible cover is available in two sizes: medium and large. Please refer to the last image in the image carousel on the left for the Bible Cover Sizing Chart before you make a selection. 

The Stand Firm Oak Moss Camo Poly-Canvas Organizer Bible Cover will suit your husband, father, or son who loves the outdoors and who carries that love into their everyday life. 

Poly-canvas Bible Organizer Cover 
Mossy Oak Camouflage Design 
Front Zipped Pocket 
Front Velcro Flap Pouch 
Back Slip Pocket 
Tab Zipper-Pulls 
Carry Handle 
Attached Hanging Loop
Interior Zipped Mesh Pocket 
Pen Loop Inside 
Available in Medium and Large 
Refer to Image Carousel for Bible Cover Sizing Chart",,,,,,,,,,,,,,ChristianArt400,ChristianArt160,https://www.christianartgifts.com/product-images/BBC601_1--front.jpg,BBC601_1--front.jpg,,,ChristianArt800,BBC601_1--front.jpg
Blessed Purple Butterfly Blessings Faux Leather Fashion Bible Cover - Jeremiah 17:7,BBC602,Bible Covers And Accessories|Bible Covers|Fashion Covers,"The Blessed Purple Butterfly Blessings Faux Leather Fashion Bible Cover features the artwork of Jane Shasky. Fresh botanicals embellished with elegant calligraphy fashioned as a ""carte postale"" serves as a background for a signature purple butterfly. 
The Jane Shasky design is screen-printed on the silky front panel of the faux leather Bible cover. A purple butterfly with open wings is superimposed on a watermarked pink rose design.  A Scripture verse from Jeremiah is printed in the bottom right-hand corner and is the theme for this faux leather Bible cover.

Blessed
Blessed is the man who trusts in the LORD.
Jeremiah 17:7

The back cover is heat debossed with a continuous flower design that wraps around the spine where you will find a lay-flat handle. There is an exterior zipper with a cross engraved zipper-pull and 2 pen loops inside.
This Bible cover is available in three sizes: medium, large and extra-large. Please refer to the last image in the image carousel on the left for the Bible Cover Sizing Chart before you make a selection.
The Bible cover is part of the Butterfly Blessings Collection that includes mugs, cutting boards, keyring, and more.  

Build a gift around the Blessed Purple Butterfly Blessings Faux Leather Fashion Bible Cover and add some of the other items in this collection that any woman who loves the LORD, gardening, and the outdoors will cherish.
Purple butterfly design
Butterfly Blessings Collection
Art © Jane Shasky
Silver cross engraved zipper pull
Lay-flat spine handle
2 Interior pen loops 
Available in medium, large and extra-large 
Refer to Image Carousel for Bible Cover Sizing Chart",,,,,,,,,,,,,,ChristianArt400,ChristianArt160,https://www.christianartgifts.com/product-images/BBC602_1--front.jpg,BBC602_1--front.jpg,,,ChristianArt800,BBC602_1--front.jpg
Grace Butterfly Blessings Teal Faux Leather Fashion Bible Cover - Ephesians 2:8,BBC603,Bible Covers And Accessories|Bible Covers|Fashion Covers,"The Grace Butterfly Blessings Teal Faux Leather Fashion Bible Cover features the artwork of Jane Shasky, with her fresh botanicals embellished with elegant calligraphy fashioned as a ""carte postale"" serving as a background for a signature teal butterfly. 
The Jane Shasky design is screen-printed on the silky front panel of the faux leather Bible cover. A teal butterfly with open wings is superimposed on a watermarked pink rose design. Scripture from Ephesians can be found in the lower right-hand corner and is the theme for this Bible cover.
Grace
For it is by grace you have been saved.
Ephesians 2:8
The back cover wraps around the spine and is embossed with a continuous flower design. There is an exterior zipper with a cross engraved zipper-pull, a convenient lay-flat spine handle, and 2 pen loops inside.
This Bible cover is available in two sizes: medium and large. Please refer to the last image in the image carousel on the left for the Bible Cover Sizing Chart before you make a selection.
The Bible cover is part of the Butterfly Blessings Collection that includes teapots, journals, mugs, and cutting boards.  Bless a friend who loves the LORD and gardening with the Grace Butterfly Blessings Teal Faux Leather Fashion Bible Cover.
Teal Butterfly Design
Butterfly Blessings Collection
Fashion Bible Cover/Case
Cross Engraved Zipper-Pull
Lay-Flat Spine Handle
2 Pen Loops Inside
Art © Jane Shasky
Available in Medium and Large 
Refer to Image Carousel for Bible Cover Sizing Chart",,,,,,,,,,,,,,ChristianArt400,ChristianArt160,https://www.christianartgifts.com/product-images/BBC603_1--front.jpg,BBC603_1--front.jpg,,,ChristianArt800,BBC603_1--front.jpg
Faith Teal Tri-fold Organizer Bible Cover,BBC677,Bible Covers And Accessories|Bible Covers|Organizer Covers,"The Faith Teal Tri-fold Organizer Bible Cover is the perfect Bible cover and organizer for the serious notetaker in your life.
A white floral design is printed on the front panel of the teal cotton canvas Bible cover. A gold metal heavy-duty zipper with a teal faux leather tassel securely closes a pocket on this panel, while the panel itself has a faux leather strap that wraps around the Bible organizer and snaps closed on the back panel with two gold snap closures. A faux leather lay-flat spine handle allows for easy handling. The sentiment is stamped on a gold metal badge.
FAITH
When you unsnap the closure and open the front panel, you will find an interior Bible case and a notebook with a highlighter. The Bible case has two slip pockets to hold your Bible securely. A heavy-duty gold metal zipper and zipper pull offer a smooth closure while a teal faux leather tassel gives you a good grip. A mini slip pocket attached to the interior slip pocket is a good place to keep Kleenex, folded up church bulletin, or your cell phone. On the outside of the interior Bible case panel, you will find two pen loops and an attached clear plastic case with a black zippered closure that doubles as a pencil case or cell phone pouch. The opposite panel has an included notepad and pen highlighter held by a pen loop.
This Bible cover is available in two sizes: medium and large. Please refer to the last image in the image carousel on the left for the Bible Cover Sizing Chart before you make a selection.
Do you know a seriously organized woman in need of a Bible case? Then this tri-fold organizer is for her. Or, do you know someone that needs to be more organized? Give her the gift of organization with the Faith Teal Tri-fold Organizer Bible Cover.
Teal Poly-canvas Organizer 
Printed Design 
Gold Metal Zipper and Zipper Pull 
Faux Leather Tassel on Zipper Pull 
Exterior Zipped Pocket 
Interior Zipped Clear Plastic Pocket 
Cell Phone Pouch 
Interior Credit Card Organizer 
Interior Slip Pockets 
3 Pen Loops 
Notepad and Pen/Highlighter Included 
Stamped Gold Metal Badge 
Available in Medium and Large 
Refer to Image Carousel for Bible Cover Sizing Chart",,,,,,,,,,,,,,ChristianArt400,ChristianArt160,https://www.christianartgifts.com/product-images/BBC677_1--front.jpg,BBC677_1--front.jpg,,,ChristianArt800,BBC677_1--front.jpg
Hope in the LORD Charcoal Value Bible Cover - Isaiah 40:31,BBC734,Bible Covers And Accessories|Bible Covers|Value Covers,"The Hope in the LORD Charcoal Value Bible Cover shares the priceless message of renewal that comes from trusting God with everything.
The durable value cover is water-resistant, and the gray poly-canvas is screen printed with a white and light gray design and text that features a striking eagle surrounded by embellished banners that hold the text from Isaiah.
Those who hope in the LORD will renew their strength 

 Isaiah 40:31 

  silver cross engraved zipper-pull attached to a sturdy zipper securely closes the Bible case and a lay-flat handle constructed from the same material as the Bible case folds neatly away so that the Bible can open flat. A slip pocket on the back cover is handy for storing notes and church bulletins, and two interior pen loops keep a pen and pencil or highlighter at the ready.
This Bible cover is available in two sizes: medium and large. Please refer to the last image in the image carousel on the left for the Bible Cover Sizing Chart before you make a selection.
The Hope in the LORD Charcoal Value Bible Cover will be an uplifting and encouraging gift to the men in your small group or Bible study, and it is priced just right. Wrap the Hope in the LORD Charcoal Value Bible Cover as an inspirational end of year gift for a couple of friends this holiday season
Charcoal background with white and gray screen printed eagle and text 
Poly-canvas material 
Back slip pocket 
Silver cross engraved zipper pull 
2 interior pen loops
Lay-flat spine handle 
Packaged in self-seal bag 
Available in Medium and Large 
Refer to Image Carousel for Bible Cover Sizing Chart",,,,,,,,,,,,,,ChristianArt400,ChristianArt160,https://www.christianartgifts.com/product-images/BBC734_1--front.jpg,BBC734_1--front.jpg,,,ChristianArt800,BBC734_1--front.jpg
Strength & Dignity Pink Value Bible Cover,BBC736,Bible Covers And Accessories|Bible Covers|Value Covers,"Treat your friend who has supported you and cheered you on through thick and thin with an inspirational and uplifting gift when you give her the Strength & Dignity Pink Value Bible Cover as a thank you gift.
The waterproof pretty-in-pink poly-canvas Bible case is screen printed with a delightful design that features an oversized navy ampersand decorated with charming flowers and butterflies. The sentiment is presented in a swirling black cursive script. 

 Strength & Dignity

A silver cross engraved zipper-pull attached to a sturdy zipper securely closes the Bible case and a lay-flat handle constructed from the same material as the Bible case folds neatly away so that the Bible can open flat. A slip pocket on the back cover is handy for storing notes and church bulletins, and two interior pen loops keep a pen and pencil or highlighter at the ready.
This Bible cover is available in two sizes: medium and large. Please refer to the last image in the image carousel on the left for the Bible Cover Sizing Chart before you make a selection.
The Strength & Dignity Pink Value Bible Cover is a great way to recognize the wisdom of a woman who has spoken truth into your life, so wrap it as a thank you gift for a mentor, Bible study leader, or friend.
Pink background with oversized ampersand decorated with flowers and butterflies 
Poly-canvas material 
Back slip pocket 
Silver cross engraved zipper pull 
2 interior pen loops 
Lay-flat spine handle 
Packaged in self-seal bag 
Available in Medium and Large 
Refer to Image Carousel for Bible Cover Sizing Chart",,,,,,,,,,,,,,ChristianArt400,ChristianArt160,https://www.christianartgifts.com/product-images/BBC736_1--front.jpg,BBC736_1--front.jpg,,,ChristianArt800,BBC736_1--front.jpg
