"LG. WHITE WASH METAL AND WOOD TRAY 17""X 4""h",MW21007L,,"LG. WHITE WASH METAL AND WOOD TRAY 17""X 4""h",,,,,"4""h",,2,$29.95 ,4,$26.95 ,,,2,kraftklub400,kraftklub160,https://kraftklub.com/cache/large/product/3495/lL8TIPH3zFb2JQFGAjy486IcQzdEOghCoLCyF7ib.jpg,lL8TIPH3zFb2JQFGAjy486IcQzdEOghCoLCyF7ib.jpg,,,kraftklub800,lL8TIPH3zFb2JQFGAjy486IcQzdEOghCoLCyF7ib.jpg
"SM AQUA ENAMEL WASH TUB & STAND 15""X 23.5""H",KE4993AQ,,"SM AQUA ENAMEL WASH TUB & STAND 15""X 23.5""H",,,,,"23.5""H",,1,$45.68 ,6,Pcs,,,1,kraftklub400,kraftklub160,https://kraftklub.com/cache/large/product/386/eafLOoMt0WLgh5OvQRxWo2HQKBE3j0licmbeNvvF.jpg,eafLOoMt0WLgh5OvQRxWo2HQKBE3j0licmbeNvvF.jpg,,,kraftklub800,eafLOoMt0WLgh5OvQRxWo2HQKBE3j0licmbeNvvF.jpg
"SM. WHITE WASH METAL AND WOOD TRAY 15""X 3""h",MW21007S,,"SM. WHITE WASH METAL AND WOOD TRAY 15""X 3""h",,,,,"3""h",,2,$26.35 ,4,$23.71 ,,,2,kraftklub400,kraftklub160,https://kraftklub.com/cache/large/product/3496/CgPsdMXXRXDk5omdaO16UQyBptrXhq5DFAuHNjMN.jpg,CgPsdMXXRXDk5omdaO16UQyBptrXhq5DFAuHNjMN.jpg,,,kraftklub800,CgPsdMXXRXDk5omdaO16UQyBptrXhq5DFAuHNjMN.jpg
THIN RUSTY WIRE,kw1362a-24,,THIN RUSTY WIRE,,,,,WIRE,,6,$1.37 ,12,$1.24 ,,,6,kraftklub400,kraftklub160,https://kraftklub.com/cache/large/product/2687/KW1362A-24.jpg,KW1362A-24.jpg,,,kraftklub800,KW1362A-24.jpg
COPPER CORRUGATED HEART CUT OUT,KK9624-CP,,COPPER CORRUGATED HEART CUT OUT,,,,,OUT,,6,$1.48 ,12,$1.34 ,,,6,kraftklub400,kraftklub160,https://kraftklub.com/cache/large/product/2988/KK9624-CP.jpg,KK9624-CP.jpg,,,kraftklub800,KK9624-CP.jpg
GRAY ZINC WATER PITCHER,KK10079-GB,,,,,,,,,2,$10.94 ,6,$9.85 ,,,2,kraftklub400,kraftklub160,https://kraftklub.com/cache/large/product/2836/KK10079-GB.jpg,KK10079-GB.jpg,,,kraftklub800,KK10079-GB.jpg
GRAY ZINC CHICKEN WIRE 4 GLASS JAR HOLDER WITH WOODEN HANDLE,WB984,,GRAY ZINC CHICKEN WIRE 4 JAR HOLDER WITH WOODEN HANDLE,,,,,HANDLE,,4,$7.08 ,12,$7.08 ,,,4,kraftklub400,kraftklub160,https://kraftklub.com/cache/large/product/3459/WB984.jpg,WB984.jpg,,,kraftklub800,WB984.jpg
"RUSTY BLACK TIN CONE S/2 15"" & 13""",KK2380AB-2,,"RUSTY BLACK  TIN CONE S/2  15"" & 13""",,,,,"13""",,2,$10.94 ,12,$9.85 ,,,2,kraftklub400,kraftklub160,https://kraftklub.com/cache/large/product/3471/sKEeftY5CZS67rWsFQuQChZTOxhF7grKw52R8AUj.jpg,sKEeftY5CZS67rWsFQuQChZTOxhF7grKw52R8AUj.jpg,,,kraftklub800,sKEeftY5CZS67rWsFQuQChZTOxhF7grKw52R8AUj.jpg
BROWN FRENCH BUCKET,KE1009BR-9,,,,,,,,,4,$5.64 ,12,$5.08 ,,,4,kraftklub400,kraftklub160,https://kraftklub.com/cache/large/product/2369/KE1009BR-9.jpg,KE1009BR-9.jpg,,,kraftklub800,KE1009BR-9.jpg
GRAY ZINC CONTAINER IN SET OF 2,KK8947GB-2,,GRAY ZINC CONTAINER IN SET OF 2,,,,,2,,1,$29.64 ,6,Pcs,,,1,kraftklub400,kraftklub160,https://kraftklub.com/cache/large/product/1833/KK8947GB-2.jpg,KK8947GB-2.jpg,,,kraftklub800,KK8947GB-2.jpg
"WEATHERED LOOK MAGNET DISPLAY (ROTATION MOTION)10""WXL10""X24""H",KW8505-24,,"WEATHERED LOOK MAGNET DISPLAY (ROTATION MOTION) 10""WXL10""X24""H",,,,,"10""WXL10""X24""H",,1,$33.20 ,6,$29.88 ,,,1,kraftklub400,kraftklub160,https://kraftklub.com/cache/large/product/3398/KW8505-24.jpg,KW8505-24.jpg,,,kraftklub800,KW8505-24.jpg
GRAY ZINC WIRE CADDY WITH ONE GLASS JAR WITH LID,WB775,, WB775,,,,,WB775,,4,$7.01 ,12,$7.01 ,,,4,kraftklub400,kraftklub160,https://kraftklub.com/cache/large/product/3451/WB775.jpg,WB775.jpg,,,kraftklub800,WB775.jpg
LARGE WHITE ROUND BUCKET WITH SIDE HANDLES,KE10037L-W,,LARGE WHITE ROUND BUCKET WITH SIDE HANDLES,,,,,HANDLES,,2,$18.64 ,12,Pcs,,,2,kraftklub400,kraftklub160,https://kraftklub.com/cache/large/product/122/KE10037L-W.jpg,KE10037L-W.jpg,,,kraftklub800,KE10037L-W.jpg
DISTRESSED WEATHERED PITCHER WITH COPPER PLAQUE,kk2028-D,,,,,,,,,4,$6.32 ,12,$5.69 ,,,4,kraftklub400,kraftklub160,https://kraftklub.com/cache/large/product/2690/KK2028-D.jpg,KK2028-D.jpg,,,kraftklub800,KK2028-D.jpg
"LARGE AIR TIGHT CLEAR GLASS JAR WITH LID 6.3""X13""",KG1633-1780-LC,,"LARGE AIR TIGHT CLEAR GLASS JAR WITH LID 6.3""X13""",,,,,"6.3""X13""",,4,$6.20 ,6,Pcs,,,4,kraftklub400,kraftklub160,https://kraftklub.com/cache/large/product/3328/KG1633-1780-LC.jpg,KG1633-1780-LC.jpg,,,kraftklub800,KG1633-1780-LC.jpg
WEATHERED LOOK MAGNETIC SNOWFLAKE,KW9040,,,,,,,,,6,$2.61 ,360,$2.35 ,,,6,kraftklub400,kraftklub160,https://kraftklub.com/cache/large/product/3435/KW9040.jpg,KW9040.jpg,,,kraftklub800,KW9040.jpg
RUSTY ZINC THREE JAR HOLDER WITH HANDLE AND JARS,WB665-AG,,RUSTY ZINC THREE JAR HOLDER WITH HANDLE AND JARS,,,,,JARS,,2,$11.23 ,15,$10.11 ,,,2,kraftklub400,kraftklub160,https://kraftklub.com/cache/large/product/3440/WB665-AG.jpg,WB665-AG.jpg,,,kraftklub800,WB665-AG.jpg
"RUSTY BLACK LID WITH HANDLE 3.5""",KL5209AB,,,,,,,,,12,$1.48 ,480,Pcs,,,12,kraftklub400,kraftklub160,https://kraftklub.com/cache/large/product/2649/KL5209AB.jpg,KL5209AB.jpg,,,kraftklub800,KL5209AB.jpg
"RUSTY ZINC WIRE EGG HOLDER 6.5""X6.1""X8.4""",WB669-AG,,RUSTY ZINC WIRE EGG HOLDER,,,,,HOLDER,,4,$5.88 ,12,$5.29 ,,,4,kraftklub400,kraftklub160,https://kraftklub.com/cache/large/product/2203/WB669-AG.jpg,WB669-AG.jpg,,,kraftklub800,WB669-AG.jpg
RUSTY COMPARTMENTALIZED FOUR GLASS JAR HOLDER WITH BIRD HANDLE,WB980,,RUSTY COMPARTMENTALIZED FOUR JAR HOLDER WITH BIRD HANDLE,,,,,HANDLE,,3,$11.54 ,12,$11.54 ,,,3,kraftklub400,kraftklub160,https://kraftklub.com/cache/large/product/3458/WB980.jpg,WB980.jpg,,,kraftklub800,WB980.jpg
METALIC GOLD CORRUGATED HEART CUT OUT,KK9624-MG,,METALIC GOLD CORRUGATED HEART CUT OUT,,,,,OUT,,6,$1.48 ,12,$1.34 ,,,6,kraftklub400,kraftklub160,https://kraftklub.com/cache/large/product/2987/KK9624-MG.jpg,KK9624-MG.jpg,,,kraftklub800,KK9624-MG.jpg
"LG. RECT. WHEATHERED LOOK METAL AND WOOD TRAY 20.5""X10""X3""",MW21008L,,"LG. RECT. WHEATHERED LOOK METAL AND WOOD TRAY 20.5""X10""X3""",,,,,"20.5""X10""X3""",,2,$27.45 ,4,$24.70 ,,,2,kraftklub400,kraftklub160,https://kraftklub.com/cache/large/product/3497/gp3gsfEr7ZLCkcQoQKKygW4cFAeSRPLHcIXFLYpT.jpg,gp3gsfEr7ZLCkcQoQKKygW4cFAeSRPLHcIXFLYpT.jpg,,,kraftklub800,gp3gsfEr7ZLCkcQoQKKygW4cFAeSRPLHcIXFLYpT.jpg
GALVANIZED CORRUGATED HEART CUT OUT GARLAND,KK9628-N,,GALVANIZED CORRUGATED HEART CUT OUT GARLAND,,,,,GARLAND,,3,$8.26 ,12,$7.43 ,,,3,kraftklub400,kraftklub160,https://kraftklub.com/cache/large/product/2992/KK9628-N.jpg,KK9628-N.jpg,,,kraftklub800,KK9628-N.jpg
"BLACK WOODEN CHALKBAORD DOG WITH JUTE ROPE 24.5""X14.5""X0.25""",WD13293414C,,"BLACK WOODEN CHALKBAORD DOG WITH JUTE ROPE 24.5""X14.5""X0.25""",,,,,"24.5""X14.5""X0.25""",,2,$10.63 ,12,$9.57 ,,,2,kraftklub400,kraftklub160,https://kraftklub.com/cache/large/product/1035/WD13293414C.jpg,WD13293414C.jpg,,,kraftklub800,WD13293414C.jpg
LARGE RUSTY MAGNETIC STAR,KK9223L-A,,LARGE RUSTY MAGNETIC STAR,,,,,STAR,,6,$1.95 ,90,$1.76 ,,,6,kraftklub400,kraftklub160,https://kraftklub.com/cache/large/product/3386/KK9223L-A.jpg,KK9223L-A.jpg,,,kraftklub800,KK9223L-A.jpg
"STAIN WOOD W/TIN LETTERS ""HOME"" WALL SIGN 39""LX8""W",MW21010,,"STAIN WOOD W/TIN LETTERS ""HOME"" WALL SIGN 39""LX8""W",,,,,"39""LX8""W",,2,$21.95 ,6,$19.75 ,,,2,kraftklub400,kraftklub160,https://kraftklub.com/cache/large/product/3500/m9Z7RTHSniQzdMDFQ3M3rr2N68mXSCexWqi16zww.jpg,m9Z7RTHSniQzdMDFQ3M3rr2N68mXSCexWqi16zww.jpg,,,kraftklub800,m9Z7RTHSniQzdMDFQ3M3rr2N68mXSCexWqi16zww.jpg
"BUFFALO BLACK PLAID AUTUM Metal plate D12.99XH0.59""",KK90159,,"BUFFALO BLACK PLAID AUTUM Metal plate D12.99XH0.59""",,,,,"D12.99XH0.59""",,4,$3.15 ,12,$2.83 ,,,4,kraftklub400,kraftklub160,https://kraftklub.com/cache/large/product/3506/M1aJT1iK9Of1dbWVCUWxBSeGyTtXyJFd8uELrEfX.jpg,M1aJT1iK9Of1dbWVCUWxBSeGyTtXyJFd8uELrEfX.jpg,,,kraftklub800,M1aJT1iK9Of1dbWVCUWxBSeGyTtXyJFd8uELrEfX.jpg
GRAY ZINC OVAL BUCKETS SET OF 2,KK10034GB-2,,,,,,,,,2,$21.94 ,12,$19.75 ,,,2,kraftklub400,kraftklub160,https://kraftklub.com/cache/large/product/2810/KK10034GB-2.jpg,KK10034GB-2.jpg,,,kraftklub800,KK10034GB-2.jpg
"BUFFALO RED METAL PLAID OVAL POT 8.86X5.31XH4.33""",KK842S003,,"BUFFALO RED METAL PLAID  OVAL POT 8.86X5.31XH4.33""",,,,,"8.86X5.31XH4.33""",,4,$3.25 ,12,$2.92 ,,,4,kraftklub400,kraftklub160,https://kraftklub.com/cache/large/product/3503/4ujTAEaEjg285apVRG6FWhCkBlfQ1XC2EnSzG4vk.jpg,4ujTAEaEjg285apVRG6FWhCkBlfQ1XC2EnSzG4vk.jpg,,,kraftklub800,4ujTAEaEjg285apVRG6FWhCkBlfQ1XC2EnSzG4vk.jpg
"5"" ANTIQUE TERRACOTTA ROSE POT, GREEN ALGAE WHEN WET",TC0313-5,,"5"" ANTIQUE TERRACOTTA ROSE POT, GREEN ALGAE WHEN WET",,,,,WET,,6,$4.69 ,6,$4.22 ,,,6,kraftklub400,kraftklub160,https://kraftklub.com/cache/large/product/3186/TC0313-5.jpg,TC0313-5.jpg,,,kraftklub800,TC0313-5.jpg
"WHITE ENAMEL PAIL 9.5""Wx10""H",KE5252LW,,"WHITE ENAMEL PAIL 9.5""Wx10""H",,,,,"9.5""Wx10""H",,2,$10.74 ,12,$9.56 ,,,2,kraftklub400,kraftklub160,https://kraftklub.com/cache/large/product/449/lqH2mkNyODmCnycT0AIe1IKMvEeAit38N3EmZcNI.jpg,lqH2mkNyODmCnycT0AIe1IKMvEeAit38N3EmZcNI.jpg,,,kraftklub800,lqH2mkNyODmCnycT0AIe1IKMvEeAit38N3EmZcNI.jpg
"AQUA ENAMEL PAIL (3.75""X4.25"") 4""",KE1012S-AQ-NT,,"AQUA ENAMEL PAIL (3.75""X4.25"") 4""",,,,,"4""",,4,$4.92 ,12,$4.44 ,,,4,kraftklub400,kraftklub160,https://kraftklub.com/cache/large/product/205/KE1012S-AQ-NT.jpg,KE1012S-AQ-NT.jpg,,,kraftklub800,KE1012S-AQ-NT.jpg
WHITE WASH EMBOSSED WATER PITCHER,KK195431,,,,,,,,,4,$6.54 ,12,$5.89 ,,,4,kraftklub400,kraftklub160,https://kraftklub.com/cache/large/product/2882/KK195431-H19A5431.jpg,KK195431-H19A5431.jpg,,,kraftklub800,KK195431-H19A5431.jpg
GRAY METAL SINGLE GLASS JAR WITH CADDY,WB733,," GRAY METAL SINGLE JAR WITH GLASS CADDY 5.5""HX2.75""W",,,,,"5.5""HX2.75""W",,4,$5.88 ,12,$4.41 ,,,4,kraftklub400,kraftklub160,https://kraftklub.com/cache/large/product/3443/WB733.jpg,WB733.jpg,,,kraftklub800,WB733.jpg
GRAY METAL HANGING CANDLE HOLDER,WB735,,,,,,,,,4,$4.23 ,15,$5.08 ,,,4,kraftklub400,kraftklub160,https://kraftklub.com/cache/large/product/3445/WB735.jpg,WB735.jpg,,,kraftklub800,WB735.jpg
"WEATHERED LOOK SMALL MAGNETIC LETTER ""Y"" 3.5""",KW8843S-Y,,"WEATHERED LOOK SMALL MAGNETIC LETTER ""Y"" 3.5""",,,,,"3.5""",,6,$2.37 ,432,$2.13 ,,,6,kraftklub400,kraftklub160,https://kraftklub.com/cache/large/product/3423/KW8843S-Y.jpg,KW8843S-Y.jpg,,,kraftklub800,KW8843S-Y.jpg
"MOSS GREE ORNAMENT BELL 3.25""",KK10095MG-3.25,," MOSS GREE ORNAMENT BELL 3.25""",,,,,"3.25""",,12,$2.75 ,72,$2.48 ,,,12,kraftklub400,kraftklub160,https://kraftklub.com/cache/large/product/3364/iFtBUbolhecarfMuXq8hCMQynOZqhol2cb6i0iFn.jpg,iFtBUbolhecarfMuXq8hCMQynOZqhol2cb6i0iFn.jpg,,,kraftklub800,iFtBUbolhecarfMuXq8hCMQynOZqhol2cb6i0iFn.jpg
GRAY ZINC MINI GARDEN BENCHES SET OF 2,KK8788GB-2,,GRAY ZINC MINI GARDEN BENCHES SET OF 2,,,,,2,,2,$7.08 ,18,Set,,,2,kraftklub400,kraftklub160,https://kraftklub.com/cache/large/product/1758/KK8788GB-2.jpg,KK8788GB-2.jpg,,,kraftklub800,KK8788GB-2.jpg
3 TIERED SERVING STAND WEATHERED LOOK,KW8230,,,,,,,,,1,$32.45 ,6,Pcs,,,1,kraftklub400,kraftklub160,https://kraftklub.com/cache/large/product/2022/KW8230.jpg,KW8230.jpg,,,kraftklub800,KW8230.jpg
"LARGE RUSTY BLACK HANGING WIND MILL DECOR 19.5""",KK9605L-AB,,"LARGE RUSTY BLACK HANGING WIND MILL DECOR 19.5""",,,,,"19.5""",,2,$17.76 ,6,$15.98 ,,,2,kraftklub400,kraftklub160,https://kraftklub.com/cache/large/product/3477/GXi6cymvXXkEo11exSFcvlSBy7NEk9JUmwkf6Bhz.jpg,GXi6cymvXXkEo11exSFcvlSBy7NEk9JUmwkf6Bhz.jpg,,,kraftklub800,GXi6cymvXXkEo11exSFcvlSBy7NEk9JUmwkf6Bhz.jpg
"5.5"" PINK GLITTER PUFFY HEART",KG7148P-5.5,,"5.5"" PINK GLITTER PUFFY HEART",,,,,HEART,,6,$3.86 ,240,$3.47 ,,,6,kraftklub400,kraftklub160,https://kraftklub.com/cache/large/product/3340/KG7148P-5.5.jpg,KG7148P-5.5.jpg,,,kraftklub800,KG7148P-5.5.jpg
"ANTIQUE BLACK COAL BUCKETS, SET OF 2",KK1078BK-2,,"ANTIQUE BLACK COAL BUCKETS, SET OF 2",,,,,2,,2,$21.94 ,6,$19.74 ,,,2,kraftklub400,kraftklub160,https://kraftklub.com/cache/large/product/1485/brrheadjtJNrGONB50DQk9MrchRPLcpWq8NKgIg9.jpg,brrheadjtJNrGONB50DQk9MrchRPLcpWq8NKgIg9.jpg,,,kraftklub800,brrheadjtJNrGONB50DQk9MrchRPLcpWq8NKgIg9.jpg
WEATHERED LOOK ROUND TUBS WTIH RING HANDLES SET OF 3,KW3304-3,,,,,,,,,2,$21.94 ,6,Pcs,,,2,kraftklub400,kraftklub160,https://kraftklub.com/cache/large/product/2681/KW3304-3.jpg,KW3304-3.jpg,,,kraftklub800,KW3304-3.jpg
RUSTY BLACK SCALLOPED HALF PAIL 6hX7.25wX3.25,KK8277AB,,RUSTY BLACK  SCALLOPED HALF PAIL 6hX7.25wX3.25 ,,,,,6hX7.25wX3.25,,4,$5.22 ,12,$4.70 ,,,4,kraftklub400,kraftklub160,https://kraftklub.com/cache/large/product/3473/gZLdQFuGPQ2IArAM5nVjh9ZiLzRDWMvqKdvLTleE.jpg,gZLdQFuGPQ2IArAM5nVjh9ZiLzRDWMvqKdvLTleE.jpg,,,kraftklub800,gZLdQFuGPQ2IArAM5nVjh9ZiLzRDWMvqKdvLTleE.jpg
RUSTY ZINC LARGE ROSEBUD MAGNET,KK9846-AG,,,,,,,,,4,$4.10 ,120,$3.69 ,,,4,kraftklub400,kraftklub160,https://kraftklub.com/cache/large/product/3388/KK9846-AG.jpg,KK9846-AG.jpg,,,kraftklub800,KK9846-AG.jpg
"11"" ANTIQUE BLACK BATTERY OPERATED LANTERN",KL8918L-BK,,"11"" ANTIQUE BLACK BATTERY OPERATED LANTERN",,,,,LANTERN,,2,$21.32 ,12,$19.19 ,,,2,kraftklub400,kraftklub160,https://kraftklub.com/cache/large/product/3392/KL8918L-BK.jpg,KL8918L-BK.jpg,,,kraftklub800,KL8918L-BK.jpg
WHITE BUCKET W/LID WOOD HANDLES,KE8226-W,,WHITE BUCKET W/LID WOOD HANDLES,,,,,HANDLES,,2,$12.69 ,12,Pcs,,,2,kraftklub400,kraftklub160,https://kraftklub.com/cache/large/product/917/KE8226-W.jpg,KE8226-W.jpg,,,kraftklub800,KE8226-W.jpg
MEDIUM GRAY ZINC PILLAR CANDLE HOLDER AND VASE,KK9468M-GB,,,,,,,,,3,$4.45 ,12,$4.01 ,,,3,kraftklub400,kraftklub160,https://kraftklub.com/cache/large/product/1921/KK9468M-GB.jpg,KK9468M-GB.jpg,,,kraftklub800,KK9468M-GB.jpg
HUNTER GREEN LARGE OVAL BUCKETS WITH WOOD HANDLE S/2,KE2038HG-2,,HUNTER GREEN LARGE OVAL BUCKETS WITH WOOD HANDLE S/2,,,,,S/2,,1,$38.44 ,6,Pcs,,,1,kraftklub400,kraftklub160,https://kraftklub.com/cache/large/product/284/KE2038HG-2.jpg,KE2038HG-2.jpg,,,kraftklub800,KE2038HG-2.jpg
"10"" ANTIQUE BLACK BATTERY OPERATED LANTERN",KL8918S-BK,,"10"" ANTIQUE BLACK BATTERY OPERATED LANTERN",,,,,LANTERN,,2,$16.57 ,15,$14.91 ,,,2,kraftklub400,kraftklub160,https://kraftklub.com/cache/large/product/3394/KL8918S-BK.jpg,KL8918S-BK.jpg,,,kraftklub800,KL8918S-BK.jpg
GRAY ZINC MAGNETIC GARDEN ROSE,KK9117-GB,,GRAY ZINC MAGNETIC GARDEN ROSE,,,,,ROSE,,6,$3.98 ,15,$3.58 ,,,6,kraftklub400,kraftklub160,https://kraftklub.com/cache/large/product/3383/KK9117-GB.jpg,KK9117-GB.jpg,,,kraftklub800,KK9117-GB.jpg
LARGE WEATHERED LOOK TAPERED PAIL,KW10025L,,,,,,,,,2,$21.94 ,8,Pcs,,,2,kraftklub400,kraftklub160,https://kraftklub.com/cache/large/product/2796/KW10025L.jpg,KW10025L.jpg,,,kraftklub800,KW10025L.jpg
"WEATHERED WASH METAL AND WOOD WALL ENVELOPE 12""HX11""W",MW21012A,,"WEATHERED WASH METAL AND WOOD WALL ENVELOPE 12""HX11""W",,,,,"12""HX11""W",,2,$12.95 ,12,$11.65 ,,,2,kraftklub400,kraftklub160,https://kraftklub.com/cache/large/product/3489/Dlwk4Ov5O2MFrQUlgm2V8w0hyQeYQIO3Je8PYKOv.jpg,Dlwk4Ov5O2MFrQUlgm2V8w0hyQeYQIO3Je8PYKOv.jpg,,,kraftklub800,Dlwk4Ov5O2MFrQUlgm2V8w0hyQeYQIO3Je8PYKOv.jpg
"WHITE WASH METAL AND WOOD WALL ENVELOPE 12""HX11""W",MW21012B,,"WHITE WASH METAL AND WOOD WALL ENVELOPE 12""HX11""W",,,,,"12""HX11""W",,2,$12.95 ,12,$11.65 ,,,2,kraftklub400,kraftklub160,https://kraftklub.com/cache/large/product/3490/J4C9cWuBbTLIjOVKsOM3wQqFHFMau3VbKCiU2cmf.jpg,J4C9cWuBbTLIjOVKsOM3wQqFHFMau3VbKCiU2cmf.jpg,,,kraftklub800,J4C9cWuBbTLIjOVKsOM3wQqFHFMau3VbKCiU2cmf.jpg
RUSTY ZINC CHICKEN WIRE GARDEN DOME IN SET OF 2,WB661AG-2,,RUSTY ZINC CHICKEN WIRE GARDEN DOME IN SET OF 2,,,,,2,,1,$18.41 ,12,Set,,,1,kraftklub400,kraftklub160,https://kraftklub.com/cache/large/product/2197/WB661AG-2.jpg,WB661AG-2.jpg,,,kraftklub800,WB661AG-2.jpg
LARGE RED & BLACK MAGNETIC BUTTERFLY,KK8885L-R,,LARGE RED & BLACK MAGNETIC BUTTERFLY,,,,,BUTTERFLY,,6,$2.45 ,432,$2.93 ,,,6,kraftklub400,kraftklub160,https://kraftklub.com/cache/large/product/3373/KK8885L-R.jpg,KK8885L-R.jpg,,,kraftklub800,KK8885L-R.jpg
"5"""" ANTIQUE TERRACOTTA SAUCER, GREEN ALGAE WHEN WET",TC12.5-5,,"5"""" ANTIQUE TERRACOTTA SAUCER, GREEN ALGAE WHEN WET",,,,,WET,,12,$1.41 ,18,$1.27 ,,,12,kraftklub400,kraftklub160,https://kraftklub.com/cache/large/product/3189/TC12.5-5.jpg,TC12.5-5.jpg,,,kraftklub800,TC12.5-5.jpg
"RUSTY BLACK BUTTON MINI METAL MAGNET 1""W",KK8160AB,,"RUSTY BLACK BUTTON MINI METAL MAGNET 1""W",,,,,"1""W",,3,$7.09 ,12,$6.38 ,,,3,kraftklub400,kraftklub160,https://kraftklub.com/cache/large/product/3476/EBsrcyWjePKc4KNnxBCvUUrwdIthXeeC2wcD0KxX.jpg,EBsrcyWjePKc4KNnxBCvUUrwdIthXeeC2wcD0KxX.jpg,,,kraftklub800,EBsrcyWjePKc4KNnxBCvUUrwdIthXeeC2wcD0KxX.jpg
GRAY ZINC HANGING ANGEL WITH HEART CUT OUTS,WB702,,GRAY ZINC HANGING ANGEL WITH HEART CUT OUTS,,,,,OUTS,,3,$4.69 ,12,$4.21 ,,,3,kraftklub400,kraftklub160,https://kraftklub.com/cache/large/product/2217/WB702.jpg,WB702.jpg,,,kraftklub800,WB702.jpg
"GRAY ZINC,WHITE WASH & RUSTY TALL MILK CAN",KK195601,,,,,,,,,2,$18.14 ,3,$16.33 ,,,2,kraftklub400,kraftklub160,https://kraftklub.com/cache/large/product/2878/KK195601-H19S5601.jpg,KK195601-H19S5601.jpg,,,kraftklub800,KK195601-H19S5601.jpg
WEATHERED LOOK RECTANGULAR SERVING TRAY WITH WOODEN HANDLES,KW9147,,WEATHERED LOOK RECTANGULAR SERVING TRAY WITH WOODEN HANDLES,,,,,HANDLES,,2,$15.38 ,12,$13.83 ,,,2,kraftklub400,kraftklub160,https://kraftklub.com/cache/large/product/2079/KW9147.jpg,KW9147.jpg,,,kraftklub800,KW9147.jpg
LARGE ROUND WIDE CONCRETE PLANTER,KK023-CT,,,,,,,,,6,$3.26 ,12,$2.93 ,,,6,kraftklub400,kraftklub160,https://kraftklub.com/cache/large/product/3356/KK023-CT.jpg,KK023-CT.jpg,,,kraftklub800,KK023-CT.jpg
"BUFFALO BLACK Metal Round pot D4.72XH5.12""",KK13201,,"BUFFALO BLACK Metal Round pot D4.72XH5.12""",,,,,"D4.72XH5.12""",,4,$2.95 ,12,$2.66 ,,,4,kraftklub400,kraftklub160,https://kraftklub.com/cache/large/product/3508/KtPhV92k08leH1nEFFM4Lo8H03JG3P5KBE7L5f4f.jpg,KtPhV92k08leH1nEFFM4Lo8H03JG3P5KBE7L5f4f.jpg,,,kraftklub800,KtPhV92k08leH1nEFFM4Lo8H03JG3P5KBE7L5f4f.jpg
"AQUA ENAMEL COMB-BRUSH 8""x2""",KE2395AQ,,"AQUA ENAMEL COMB-BRUSH 8""x2""",,,,,"8""x2""",,6,$5.88 ,12,$5.51 ,,,6,kraftklub400,kraftklub160,https://kraftklub.com/cache/large/product/303/KE2395AQ.jpg,KE2395AQ.jpg,,,kraftklub800,KE2395AQ.jpg
"PINK ENAMEL COMB-BRUSH 8""x 2""",KE2395P,,"PINK ENAMEL COMB-BRUSH 8""x 2""",,,,,"2""",,6,$5.88 ,12,$5.51 ,,,6,kraftklub400,kraftklub160,https://kraftklub.com/cache/large/product/304/KE2395P.jpg,KE2395P.jpg,,,kraftklub800,KE2395P.jpg
"RED ENAMEL COMB/BRUSH BOX 8""x2""",KE2395R,,"RED ENAMEL COMB/BRUSH BOX 8""x2""",,,,,"8""x2""",,6,$5.88 ,12,$5.51 ,,,6,kraftklub400,kraftklub160,https://kraftklub.com/cache/large/product/305/KE2395R.jpg,KE2395R.jpg,,,kraftklub800,KE2395R.jpg
"WHT ENAMEL COMB/BRUSH BOX 8"" x 2""",KE2395W,,"WHT ENAMEL COMB/BRUSH BOX 8"" x 2""",,,,,"2""",,6,$5.88 ,12,$5.30 ,,,6,kraftklub400,kraftklub160,https://kraftklub.com/cache/large/product/306/KE2395W.jpg,KE2395W.jpg,,,kraftklub800,KE2395W.jpg
RUSTY COMB AND BRUSH HOLDER,KK2395A,,RUSTY COMB AND BRUSH HOLDER,,,,,HOLDER,,6,$3.65 ,60,Pcs,,,6,kraftklub400,kraftklub160,https://kraftklub.com/cache/large/product/1527/KK2395A.jpg,KK2395A.jpg,,,kraftklub800,KK2395A.jpg
"20"" WEATHERED LOOK W/ RUSHT TRIM STAR WALL POCKET",KW7249PA-20,,"20"" WEATHERED LOOK W/ RUSHT TRIM STAR POCKET",,,,,POCKET,,2,$13.95 ,6,$12.55 ,,,2,kraftklub400,kraftklub160,https://kraftklub.com/cache/large/product/3502/MKOcF9zCK1h2WoaQ7eBV4erbSVeFQNlCBeI6jVCe.jpg,MKOcF9zCK1h2WoaQ7eBV4erbSVeFQNlCBeI6jVCe.jpg,,,kraftklub800,MKOcF9zCK1h2WoaQ7eBV4erbSVeFQNlCBeI6jVCe.jpg
GRAY ZINC MINI WIRE CHAIR,WB996-GB,,,,,,,,,4,$4.15 ,12,$3.74 ,,,4,kraftklub400,kraftklub160,https://kraftklub.com/cache/large/product/2407/WB996.jpg,WB996.jpg,,,kraftklub800,WB996.jpg
LG. RUSTY BLACK COLANDER LAMP SHADE WITH STARS,KK8875L-AB,,"LG. RUSTY BLACK COLANDER LAMP SHADE WITH STARS 15""X13.5""X7""",,,,,"15""X13.5""X7""",,2,$18.42 ,6,$16.57 ,,,2,kraftklub400,kraftklub160,https://kraftklub.com/cache/large/product/3469/GALvHvx1yJctDfLoloPlmpWAce4vrTn5DsLIpHcL.jpg,GALvHvx1yJctDfLoloPlmpWAce4vrTn5DsLIpHcL.jpg,,,kraftklub800,GALvHvx1yJctDfLoloPlmpWAce4vrTn5DsLIpHcL.jpg
"7"" OLD RED OIL LANTER",KL275-OLD-RED,,"7"" OLD RED OIL LANTER",,,,,LANTER,,2,$9.44 ,15,$8.50 ,,,2,kraftklub400,kraftklub160,https://kraftklub.com/cache/large/product/3390/KL275-OLD-RED.jpg,KL275-OLD-RED.jpg,,,kraftklub800,KL275-OLD-RED.jpg
RUSTY COAL BUCKETS SET OF 2,KK1078A-2,,RUSTY COAL BUCKETS SET OF 2,,,,,2,,2,$21.56 ,12,Pcs,,,2,kraftklub400,kraftklub160,https://kraftklub.com/cache/large/product/1484/KK1078A-2.jpg,KK1078A-2.jpg,,,kraftklub800,KK1078A-2.jpg
LARGE WHITE HAND MADE WIRE BICYCLE WITH BASKET,WB779W-12,,,,,,,,,2,$13.14 ,12,$11.83 ,,,2,kraftklub400,kraftklub160,https://kraftklub.com/cache/large/product/2803/WB779W-12.jpg,WB779W-12.jpg,,,kraftklub800,WB779W-12.jpg
MEDIUM GRAY ZINC HAND MADE WIRE BICYCLE WITH BASKET,WB780GB-7.8,,,,,,,,,3,$10.94 ,24,$9.85 ,,,3,kraftklub400,kraftklub160,https://kraftklub.com/cache/large/product/3456/WB780GB-7.8.jpg,WB780GB-7.8.jpg,,,kraftklub800,WB780GB-7.8.jpg
WHITE DISTRESSED OVAL FLOWER BUCKET,KK8688-W,,WHITE DISTRESSED OVAL FLOWER BUCKET,,,,,BUCKET,,2,$15.98 ,8,Pcs,,,2,kraftklub400,kraftklub160,https://kraftklub.com/cache/large/product/1729/KK8688-W.jpg,KK8688-W.jpg,,,kraftklub800,KK8688-W.jpg
GRAY ZINC MAGNETIC WATER LILY,KK9118-GB,,GRAY ZINC MAGNETIC WATER LILY,,,,,LILY,,6,$3.50 ,144,$3.15 ,,,6,kraftklub400,kraftklub160,https://kraftklub.com/cache/large/product/3385/KK9118-GB.jpg,KK9118-GB.jpg,,,kraftklub800,KK9118-GB.jpg
MEDIUM GRAY ZINC HANGING HALF BUCKET,KK10012M-GB,,,,,,,,,2,$17.05 ,6,$15.34 ,,,2,kraftklub400,kraftklub160,https://kraftklub.com/cache/large/product/2853/KK10012S-GB.jpg,KK10012S-GB.jpg,,,kraftklub800,KK10012S-GB.jpg
"BLACK ENAMEL FRENCH BUCKET 9""HX5""D",KE1009BK-9,,"BLACK ENAMEL FRENCH BUCKET 9""HX5""D",,,,,"9""HX5""D",,4,$5.64 ,18,$5.07 ,,,4,kraftklub400,kraftklub160,https://kraftklub.com/cache/large/product/136/WOnRNdlGOLqMkslFfG5yKWS274df3JWFM3Mfu1bo.jpg,WOnRNdlGOLqMkslFfG5yKWS274df3JWFM3Mfu1bo.jpg,,,kraftklub800,WOnRNdlGOLqMkslFfG5yKWS274df3JWFM3Mfu1bo.jpg
"RUSTY BLACK STAR CANDLE SHADE FOR 2.25""",KS4292-AB,,"RUSTY BLACK STAR CANDLE SHADE FOR 2.25""",,,,,"2.25""",,6,$3.66 ,12,$3.29 ,,,6,kraftklub400,kraftklub160,https://kraftklub.com/cache/large/product/3513/rRThW3GZXdOh32uWlsvCSWUP5pHvVzLP2EXcIFtf.jpg,rRThW3GZXdOh32uWlsvCSWUP5pHvVzLP2EXcIFtf.jpg,,,kraftklub800,rRThW3GZXdOh32uWlsvCSWUP5pHvVzLP2EXcIFtf.jpg
"BLACK ENAMEL FRENCH BUCKET 13"" X 7""DIA",KE1009BK-13,,"BLACK ENAMEL FRENCH BUCKET 13"" X 7""DIA",,,,,"7""DIA",,3,$9.26 ,18,$8.33 ,,,3,kraftklub400,kraftklub160,https://kraftklub.com/cache/large/product/132/Yv1xdz2TUanBENemu7fBr9CdcIOr1CRGl0lA9Gaq.jpg,Yv1xdz2TUanBENemu7fBr9CdcIOr1CRGl0lA9Gaq.jpg,,,kraftklub800,Yv1xdz2TUanBENemu7fBr9CdcIOr1CRGl0lA9Gaq.jpg
"SM. RECT. WHEATHERED LOOK METAL AND WOOD TRAY 16.5""X 7.5w""X3",MW21008S,,"SM.  RECT. WHEATHERED LOOK METAL AND WOOD TRAY 16.5""X 7.5w""X3",,,,,"7.5w""X3",,2,$24.15 ,4,$21.73 ,,,2,kraftklub400,kraftklub160,https://kraftklub.com/cache/large/product/3498/lTQQ5YJJBFG9H8pnf8ATafEJXlc4pWA0x7CVEkQ2.jpg,lTQQ5YJJBFG9H8pnf8ATafEJXlc4pWA0x7CVEkQ2.jpg,,,kraftklub800,lTQQ5YJJBFG9H8pnf8ATafEJXlc4pWA0x7CVEkQ2.jpg
"BLACK ENAMEL FRENCH BUCKET 18"" X 9"" DIA",KE1009BK-18,,"BLACK ENAMEL FRENCH BUCKET 18"" X 9"" DIA",,,,,DIA,,2,$13.36 ,6,$12.02 ,,,2,kraftklub400,kraftklub160,https://kraftklub.com/cache/large/product/134/iLwOAz45M1mo1Gqvg4Pb02LLgNS4G6yDfcyZi6PM.jpg,iLwOAz45M1mo1Gqvg4Pb02LLgNS4G6yDfcyZi6PM.jpg,,,kraftklub800,iLwOAz45M1mo1Gqvg4Pb02LLgNS4G6yDfcyZi6PM.jpg
SKY BLUE DRINK CADDY W/WOOD HANDLE,KE8228SK,,SKY BLUE DRINK CADDY W/WOOD HANDLE,,,,,HANDLE,,2,$21.20 ,8,$17.69 ,,,2,kraftklub400,kraftklub160,https://kraftklub.com/cache/large/product/940/KE8228SK.jpg,KE8228SK.jpg,,,kraftklub800,KE8228SK.jpg
CHRISTMAS MILK CAN W/WOOD HANDLES,KK20038X,,CHRISTMAS MILK CAN W/WOOD HANDLES,,,,,HANDLES,,2,$13.47 ,12,$12.12 ,,,2,kraftklub400,kraftklub160,https://kraftklub.com/cache/large/product/3055/KK20038-GB-SM.jpg,KK20038-GB-SM.jpg,,,kraftklub800,KK20038-GB-SM.jpg
BLACK SIGN PICK WITH ROUND TOP,KK2011-B,,BLACK SIGN PICK WITH ROUND TOP_x005F_x000D_,,,,,TOP_x005F_x000D_,,2,$2.33 ,6,Pcs,,,2,kraftklub400,kraftklub160,https://kraftklub.com/cache/large/product/1509/KK2011-B.jpg,KK2011-B.jpg,,,kraftklub800,KK2011-B.jpg
DISTRESSED WEATHERED WATERING CAN,KK2029-D,,,,,,,,,3,$7.15 ,12,Pcs,,,3,kraftklub400,kraftklub160,https://kraftklub.com/cache/large/product/2691/KK2029-D.jpg,KK2029-D.jpg,,,kraftklub800,KK2029-D.jpg
SMALL LEMON YELLOW & BLACK MAGNETIC BUTTERFLY,KK8885S-YE,,SMALL LEMON YELLOW & BLACK MAGNETIC BUTTERFLY,,,,,BUTTERFLY,,6,$2.23 ,432,$2.67 ,,,6,kraftklub400,kraftklub160,https://kraftklub.com/cache/large/product/3378/KK8885S-YE.jpg,KK8885S-YE.jpg,,,kraftklub800,KK8885S-YE.jpg
LARGE GRAY ZINC HANGING HALF BUCKET,KK10012L-GB,," LARGE GRAY ZINC HANGING HALF BUCKET 18""X9.5""X9""",,,,,"18""X9.5""X9""",,2,$23.65 ,6,$0.00 ,,,2,kraftklub400,kraftklub160,https://kraftklub.com/cache/large/product/2852/g7AO5UbqD0RtsGlSThPcLDart0iqzxHbsd2agpCY.jpg,g7AO5UbqD0RtsGlSThPcLDart0iqzxHbsd2agpCY.jpg,,,kraftklub800,g7AO5UbqD0RtsGlSThPcLDart0iqzxHbsd2agpCY.jpg
"ROUND LILAC PAIL WITH WOODEN HANDLE 5""X8.25""",KE10017-LAC,,"ROUND LILAC PAIL WITH WOODEN HANDLE 5""X8.25""",,,,,"5""X8.25""",,6,$4.67 ,12,$4.21 ,,,6,kraftklub400,kraftklub160,https://kraftklub.com/cache/large/product/112/KE10017-LAC.jpg,KE10017-LAC.jpg,,,kraftklub800,KE10017-LAC.jpg
"WEATHERED LOOK SMALL MAGNETIC LETTER ""M"" 3.5",KW8843S-M,,"WEATHERED LOOK SMALL MAGNETIC LETTER ""M"" 3.5",,,,,3.5,,6,$2.37 ,432,$2.13 ,,,6,kraftklub400,kraftklub160,https://kraftklub.com/cache/large/product/3411/KW8843S-M.jpg,KW8843S-M.jpg,,,kraftklub800,KW8843S-M.jpg
GRAY ZINC WIDE MOUTH PITCHER,KK10036-GB,,,,,,,,,2,$13.14 ,12,Pcs,,,2,kraftklub400,kraftklub160,https://kraftklub.com/cache/large/product/2807/KK10036-GB.jpg,KK10036-GB.jpg,,,kraftklub800,KK10036-GB.jpg
SYMMETRIC BLACK OVAL TUBS SET OF 3,KK185198,,,,,,,,,1,$25.24 ,3,$22.72 ,,,1,kraftklub400,kraftklub160,https://kraftklub.com/cache/large/product/2861/KK185198-H18A5198.jpg,KK185198-H18A5198.jpg,,,kraftklub800,KK185198-H18A5198.jpg
