4 Slat Always,4SLTF01,(All) Knotty Products|Sign Fences||||||||,4 Slat Brown Wood Fence w/ Always Something,In Stock,,,1,"12""x24""x1/2""",1,9.00,,0.00,,0.00,1,4SLTF01.jpg,
4 Slat Early to Bed,4SLTF02,(All) Knotty Products|Sign Fences||||||||,4 Slat Brown Wood fence w/ Early to Bed,In Stock,,,1,"12""x24""x1/2""",1,9.00,,0.00,,0.00,1,4SLTF02.jpg,
Balck CYB,SLDR06,(All) Knotty Products|Star Ladders||||||||,"Wood Ladder w/ 12"" Black CYB Star",In Stock,,,1,"9""x24""",1,7.00,,0.00,,0.00,1,SLDR06.jpg,
Bear Fence,8SPKT01,(All) Knotty Products|Sign Fences||||||||,Bear w/ welcome fence,In Stock,,,1,"12""x18""x3/4""",1,8.00,,0.00,,0.00,1,8SPKT01.jpg,
Black BOH,SLDR07,(All) Knotty Products|Star Ladders||||||||,"Wood Ladder w/ 12"" Black Bless our Home Star",In Stock,,,1,"9""x24""",1,7.00,,0.00,,0.00,1,SLDR07.jpg,
Black BOH Banner,SLDR14,(All) Knotty Products|Star Ladders||||||||,"Wood Ladder w/ 12"" Black Star-Bless our Home Banner",In Stock,,,1,"9""x24""",1,7.00,,0.00,,0.00,1,SLDR14.jpg,
Black BOH Long,LSTF06,(All) Knotty Products|Star Fences||||||||,"Wood Fenc e w/ Black 12"" BOH Star",In Stock,,,1,"18""x14""",1,9.00,,0.00,,0.00,1,LSTF06.jpg,
Black BOH Star Stand,SST09,(All) Knotty Products|Standing Stars||||||||,"Wood Standing Star w/ Black 12""BOH Star",In Stock,,,1,"12""x28""",1,12.00,,0.00,,0.00,1,SST09.jpg,
Black CYB Long,LSTF07,(All) Knotty Products|Star Fences||||||||,"Wood Fence w/ Black 12"" CYB Star",In Stock,,,1,"18""x14""",1,9.00,,0.00,,0.00,1,LSTF07.jpg,
Black CYB Star Stand,SST12,(All) Knotty Products|Standing Stars||||||||,"Wood Standing Star w/ Black 12"" CYB Star",In Stock,,,1,"12""x28""",1,12.00,,0.00,,0.00,1,SST12.jpg,
Black FFF Banner,SLDR15,(All) Knotty Products|Star Ladders||||||||,"Wood Ladder w/ 12"" Black Star-FFF Banner",In Stock,,,1,"9""x24""",1,7.00,,0.00,,0.00,1,SLDR15.jpg,
Black FHL,SLDR08,(All) Knotty Products|Star Ladders||||||||,"Wood Ladder w/ 12"" Black FHL Star",In Stock,,,1,"9""x24""",1,7.00,,0.00,,0.00,1,SLDR08.jpg,
Black FHL Long,LSTF05,(All) Knotty Products|Star Fences||||||||,"Wood Fence w/ Black 12"" FHL Star",In Stock,,,1,"18""x14""",1,9.00,,0.00,,0.00,1,LSTF05.jpg,
Black FHL Star Stand,SST10,(All) Knotty Products|Standing Stars||||||||,"Wood Standing Star w/ Black 12""FHL Star",In Stock,,,1,"12""x28""",1,12.00,,0.00,,0.00,1,SST10.jpg,
Black HSH,SLDR05,(All) Knotty Products|Star Ladders||||||||,"Wood Ladder w/ Black 12"" HSH Star",In Stock,,,1,"9""x24""",1,7.00,,0.00,,0.00,1,SLDR05.jpg,
Black HSH Long,LSTF08,(All) Knotty Products|Star Fences||||||||,"Wood Fence w/ Black 12"" HSH Star",In Stock,,,1,"18""x14""",1,9.00,,0.00,,0.00,1,LSTF08.jpg,
Black HSH Star Stand,SST11,(All) Knotty Products|Standing Stars||||||||,"Wood Standing Star w/ Black 12"" HSH Star",In Stock,,,1,"12""x28""",1,12.00,,0.00,,0.00,1,SST11.jpg,
Black House Regular,HSE04,(All) Knotty Products|Houses||||||||,Wood Black House with Mustard,In Stock,,,1,"6 1/2""x13""",1,6.00,,0.00,,0.00,1,HSE04.jpg,
Black LLL Banner,SLDR13,(All) Knotty Products|Star Ladders||||||||,"Wood Ladder w/ 12"" Black Star LLL Banner",In Stock,,,1,"9""x24""",1,7.00,,0.00,,0.00,1,SLDR13.jpg,
Black Star BOH,SST20,(All) Knotty Products|Standing Stars||||||||,"Wood Standing Star w/ Black 12"" Star - BOH Banner",In Stock,,,1,"12""x28""",1,12.00,,0.00,,0.00,1,SST20.jpg,
Black Star FFF,SST19,(All) Knotty Products|Standing Stars||||||||,"Wood Standing Star w/ Black 12"" Star- FFF Banner",In Stock,,,1,"12""x28""",1,12.00,,0.00,,0.00,1,SST19.jpg,
Black Star LLL,SST17,(All) Knotty Products|Standing Stars||||||||,"Wood Standing Star w/ Black 12"" Star-LLL Banner",In Stock,,,1,"12""x28""",1,12.00,,0.00,,0.00,1,SST17.jpg,
Black Star welcome,SST18,(All) Knotty Products|Standing Stars||||||||,"Wood Standing Star w/ Black 12"" Star- Welcome Banner",In Stock,,,1,"12""x28""",1,12.00,,0.00,,0.00,1,SST18.jpg,
Black Welcome Banner,SLDR16,(All) Knotty Products|Star Ladders||||||||,"Wood Ladder w/ 12"" Black Star- Welcome Banner",In Stock,,,1,"9""x24""",1,7.00,,0.00,,0.00,1,SLDR16.jpg,
Black Welcome Fence,8PKT11,(All) Knotty Products|Sign Fences||||||||,Black Welcome to our Home on Wood Fence,In Stock,,,1,"12""x24""x3/4""",1,9.00,,0.00,,0.00,1,8PKT11.jpg,
Black w/ BOH Sign,HSS08,(All) Knotty Products|Houses||||||||,Wood Black House w/ Bless Our Home Banner,In Stock,,,1,"6 1/2""x13""",1,6.50,,0.00,,0.00,1,HSS08.jpg,
Black w/ FFF Sign,HSS05,(All) Knotty Products|Houses||||||||,Wood Black House w/ FFF Banner,In Stock,,,1,"6 1/2""x13""",1,6.50,,0.00,,0.00,1,HSS05.jpg,
Black w/ LLL Sign,HSS06,(All) Knotty Products|Houses||||||||,Wood Black House w/LLL Banner,In Stock,,,1,"6 1/2""x13""",1,6.50,,0.00,,0.00,1,HSS06.jpg,
Black w/Wel Sign,HSS07,(All) Knotty Products|Houses||||||||,Wood Black House w/ Welcome Banner,In Stock,,,1,"6 1/2""x 13""",1,6.50,,0.00,,0.00,1,HSS07.jpg,
Blk Star Must Heart,SLTF03,(All) Knotty Products|Fences with Wreath||||||||,White Wood Fence w/ Wreath- Cream Pips-Black Star- Mustard Heart,In Stock,,,1,"12""x18""x3/4""",1,11.25,,0.00,,0.00,1,SLTF03.jpg,
Blk Star and Heart,SLTF04,(All) Knotty Products|Fences with Wreath||||||||,White Wood fence w/ Wreath-Cream Pips-Black Star and Heart,In Stock,,,1,"12""x18""x3/4""",1,11.25,,0.00,,0.00,1,SLTF04.jpg,
Blk w/ Mustard,8SPKT05,(All) Knotty Products|Sign Fences||||||||,Black Fence w/ mustard star,In Stock,,,1,"12""x18""x3/4""",1,8.00,,0.00,,0.00,1,8SPKT05.jpg,
Blk-Must w/ Wreath,HSW01,(All) Knotty Products|Houses||||||||,Wood Black and Mustard House with Wreath Accent,In Stock,,,1,"6 1/2""x13""",1,6.50,,0.00,,0.00,1,HSW01.jpg,
Block Bear,BKS03,(All) Knotty Products|Block Signs||||||||,White Wood Block Sign w/ Bear,In Stock,,,1,"7 1/2""x 8 1/2""",1,3.50,,0.00,,0.00,1,BKS03.jpg,
Block Blessed,BKS01,(All) Knotty Products|Block Signs||||||||,White Wood Block Sign w/ Simply Blessed,In Stock,,,1,"7 1/2"" x 8 1/2""",1,3.50,,0.00,,0.00,1,BKS01.jpg,
Block CYB,BKS05,(All) Knotty Products|Block Signs||||||||,Wood Block Sign w/ CYB,In Stock,,,1,"7 1/2""x 8 1/2""",1,3.50,,0.00,,0.00,1,BKS05.jpg,
Block Cherish Family,BKS08,(All) Knotty Products|Block Signs||||||||,Black Wood Block Sign w/ Cherish Family,In Stock,,,1,"7 1/2""x 8 1/2""",1,3.50,,0.00,,0.00,1,BKS08.jpg,
Block Country,BKS10,(All) Knotty Products|Block Signs||||||||,Wood Block Sign w/ Country Life,In Stock,,,1,"7 1/2""x 8 1/2""",1,3.50,,0.00,,0.00,1,BKS10.jpg,
Block Deer,BKS07,(All) Knotty Products|Block Signs||||||||,Wood Block Sign w/ Deer,In Stock,,,1,"7 1/2""x 8 1/2""",1,3.50,,0.00,,0.00,1,BKS07.jpg,
Block HSH,BKS06,(All) Knotty Products|Block Signs||||||||,Black Wood Block Sign w/ HSH,In Stock,,,1,"7 1/2""x 8 1/2""",1,3.50,,0.00,,0.00,1,BKS06.jpg,
Block Love Patient,BKS09,(All) Knotty Products|Block Signs||||||||,Wood Block Sign w/ Love is Patient,In Stock,,,1,"7 1/2""x 8 1/2""",1,3.50,,0.00,,0.00,1,BKS09.jpg,
Block Love grows,BKS02,(All) Knotty Products|Block Signs||||||||,Black Wood Block Sign w/ Love Grows Here,In Stock,,,1,"7 1/2"" x 8 1/2""",1,3.50,,0.00,,0.00,1,BKS02.jpg,
Block Rooster,BKS04,(All) Knotty Products|Block Signs||||||||,White Wood Block Sign w/ Rooster,In Stock,,,1,"7 1/2""x 8 1/2""",1,3.50,,0.00,,0.00,1,BKS04.jpg,
Blue Kindness Fence,8PKT10,(All) Knotty Products|Sign Fences||||||||,Do all things with kindness on Blue Wood Fence,In Stock,,,1,"12""x24""x3/4""",1,9.00,,0.00,,0.00,1,8PKT10.jpg,
Blue Life Fence,8PKT07,(All) Knotty Products|Sign Fences||||||||,Life is Better on Blue Wood Fence,In Stock,,,1,"12""x24""x3/4""",1,9.00,,0.00,,0.00,1,8PKT07.jpg,
Burg BOH,SLDR12,(All) Knotty Products|Star Ladders||||||||,"Wood Ladder w/ 12"" Burgundy Bless our Home Star",In Stock,,,1,"9""x24""",1,7.00,,0.00,,0.00,1,SLDR12.jpg,
Burg BOH Long,LSTF11,(All) Knotty Products|Star Fences||||||||,"Wood Fence w/ Burgundy 12"" BOH Star",In Stock,,,1,"18""x14""",1,9.00,,0.00,,0.00,1,LSTF11.jpg,
Burg BOH Star Stand,SST08,(All) Knotty Products|Standing Stars||||||||,"Wood Standing Star w/ Burg 12"" BOH Star",In Stock,,,1,"12""x28""",1,12.00,,0.00,,0.00,1,SST08.jpg,
Burg CYB,SLDR10,(All) Knotty Products|Star Ladders||||||||,"Wood Ladder w/ 12"" Burgundy CYB Star",In Stock,,,1,"9""x24""",1,7.00,,0.00,,0.00,1,SLDR10.jpg,
Burg CYB Long,LSTF09,(All) Knotty Products|Star Fences||||||||,"Wood Fence w/ Burgundy 12"" CYB Star",In Stock,,,1,"18""x14""",1,9.00,,0.00,,0.00,1,LSTF09.jpg,
Burg CYB Star Stand,SST06,(All) Knotty Products|Standing Stars||||||||,"Wood Standing Star w/ Burg 12"" CYB Star",In Stock,,,1,"12""x28""",1,12.00,,0.00,,0.00,1,SST06.jpg,
Burg FHL,SLDR09,(All) Knotty Products|Star Ladders||||||||,"Wood Ladder w/ 12"" Burgundy FHL",In Stock,,,1,"9""x24""",1,7.00,,0.00,,0.00,1,SLDR09.jpg,
Burg FHL Long,LSTF10,(All) Knotty Products|Star Fences||||||||,"Wood Fence w/ Burgundy 12"" FHL Star",In Stock,,,1,"18""x14""",1,9.00,,0.00,,0.00,1,LSTF10.jpg,
Burg FHL Star Stand,SST05,(All) Knotty Products|Standing Stars||||||||,"Wood Standing Star w/ Burg 12"" FHL Star",In Stock,,,1,"12""x28""",1,12.00,,0.00,,0.00,1,SST05.jpg,
Burg HSH,SLDR11,(All) Knotty Products|Star Ladders||||||||,"Wood Ladder w/ 12"" Burgundy HSH Star",In Stock,,,1,"9""x24""",1,7.00,,0.00,,0.00,1,SLDR11.jpg,
Burg HSH Long,LSTF12,(All) Knotty Products|Star Fences||||||||,"Wood Fence w/ Burgundy 12"" HSH Star",In Stock,,,1,"18""x14""",1,9.00,,0.00,,0.00,1,LSTF12.jpg,
Burg HSH Star Stands,SST07,(All) Knotty Products|Standing Stars||||||||,"Wood Standing Star w/ Burg 12""HSH Star",In Stock,,,1,"12""x28""",1,12.00,,0.00,,0.00,1,SST07.jpg,
Burg House regular,HSE02,(All) Knotty Products|Houses||||||||,Wood Burgundy House with Tan,In Stock,,,1,"6 1/2"" x13""",1,6.00,,0.00,,0.00,1,HSE02.jpg,
Burg w/ BOH Sign,HSS14,(All) Knotty Products|Houses||||||||,Burgundy House w/ Bless our Home Banner,In Stock,,,1,"6 1/2""x13""",1,6.50,,0.00,,0.00,1,HSS14.jpg,
Burg w/ FFF Sign,HSS13,(All) Knotty Products|Houses||||||||,Burgundy House w/ FFF Banner,In Stock,,,1,"6 1/2""x13""",1,6.50,,0.00,,0.00,1,HSS13.jpg,
Burg w/ LLL Sign,HSS15,(All) Knotty Products|Houses||||||||,Burgundy House w/ LLL Banner,In Stock,,,1,"6 1/2""x13""",1,6.50,,0.00,,0.00,1,HSS15.jpg,
Burg w/ Wel Sign,HSS16,(All) Knotty Products|Houses||||||||,Burgundy House w/ Welcome Banner,In Stock,,,1,"6 1/2""x13""",1,6.50,,0.00,,0.00,1,HSS16.jpg,
Burg w/ Wreath,HSW03,(All) Knotty Products|Houses||||||||,Wood Burgundy and Tan House with Wreath Accent,In Stock,,,1,"6 1/2""x13""",1,6.50,,0.00,,0.00,1,HSW03.jpg,
CYB Black Fence,8PKT09,(All) Knotty Products|Sign Fences||||||||,Count your Blessings on Black Wood Fence,In Stock,,,1,"12""x24""x3/4""",1,9.00,,0.00,,0.00,1,8PKT09.jpg,
CYB Brown Fence,8PKT13,(All) Knotty Products|Sign Fences||||||||,Count your Blessings on brown Wood Fence,In Stock,,,1,"12""x24""x3/4""",1,9.00,,0.00,,0.00,1,8PKT13.jpg,
Cream BOH,SLDR02,(All) Knotty Products|Star Ladders||||||||,"Wood Ladder w/ Cream 12"" Bless our Home Star",In Stock,,,1,"9""x24""",1,7.00,,0.00,,0.00,1,SLDR02.jpg,
Cream BOH Banner,SLDR19,(All) Knotty Products|Star Ladders||||||||,"Wood Ladder w/ 12"" Cream Star- Bless our Home Banner",In Stock,,,1,"9""x24""",1,7.00,,0.00,,0.00,1,SLDR19.jpg,
Cream CYB,SLDR01,(All) Knotty Products|Star Ladders||||||||,"Wood Ladder w/ Cream 12"" CYB Star",In Stock,,,1,"9""x24""",1,7.00,,0.00,,0.00,1,SLDR01.jpg,
Cream FFF Banner,SLDR17,(All) Knotty Products|Star Ladders||||||||,"Wood Ladder w/ 12"" Cream Star-FFF Banner",In Stock,,,1,"9""x24""",1,7.00,,0.00,,0.00,1,SLDR17.jpg,
Cream FHL,SLDR04,(All) Knotty Products|Star Ladders||||||||,"Wood Ladder w/ Cream 12"" FHL Star",In Stock,,,1,"9""x24""",1,7.00,,0.00,,0.00,1,SLDR04.jpg,
Cream HSH,SLDR03,(All) Knotty Products|Star Ladders||||||||,"Wood Ladder w/ Cream 12"" Home sweet Home Star",In Stock,,,1,"9""x24""",1,7.00,,0.00,,0.00,1,SLDR03.jpg,
Cream HSH Long,LSTF01,(All) Knotty Products|Star Fences||||||||,"Wood Fence w/ Cream 12"" HSH Star",In Stock,,,1,"18""x14""",1,9.00,,0.00,,0.00,1,LSTF01.jpg,
Cream LLL Banner,SLDR18,(All) Knotty Products|Star Ladders||||||||,"Wood Ladder w/ 12"" Cream Star-LLL Banner",In Stock,,,1,"9""x24""",1,7.00,,0.00,,0.00,1,SLDR18.jpg,
Cream Star BOH,SST14,(All) Knotty Products|Standing Stars||||||||,"Wood Standing Star w/ Cream 12"" Star- BOH Banner",In Stock,,,1,"12""x28""",1,12.00,,0.00,,0.00,1,SST14.jpg,
Cream Star FFF,SST16,(All) Knotty Products|Standing Stars||||||||,"Wood Standing Star w/ Cream 12"" Star-FFF Banner",In Stock,,,1,"12""x28""",1,12.00,,0.00,,0.00,1,SST16.jpg,
Cream Star LLL,SST15,(All) Knotty Products|Standing Stars||||||||,"Wood Standing Star w/ Cream 12"" Star-LLL Banner",In Stock,,,1,"12""x28""",1,12.00,,0.00,,0.00,1,SST15.jpg,
Cream Star-Welcome,SST13,(All) Knotty Products|Standing Stars||||||||,"Wood Standing Star w/ Cream 12"" Star- Welcome Banner",In Stock,,,1,"12""x28""",1,12.00,,0.00,,0.00,1,SST13.jpg,
Cream Welcome Banner,SLDR20,(All) Knotty Products|Star Ladders||||||||,"Wood Ladder w/ 12"" Cream Star-Welcome Banner",In Stock,,,1,"9""x24""",1,7.00,,0.00,,0.00,1,SLDR20.jpg,
Deer Fence,8PKT03,(All) Knotty Products|Sign Fences||||||||,Deer witth Tracks and welcome on Wood fence,In Stock,,,1,"12""x24""x3/4""",1,9.00,,0.00,,0.00,1,8PKT03.jpg,
Family Fence,8PKT14,(All) Knotty Products|Sign Fences||||||||,Family - arent things on Brown Wood Fence,In Stock,,,1,"12""x24""x3/4""",1,9.00,,0.00,,0.00,1,8PKT14.jpg,
Fence w/ BLK BoH,SF03,(All) Knotty Products|Star Fences||||||||,"Wood Fence w/ Cream 12"" Star and Black BOH Banner",In Stock,,,1,"12""x18""x3/4""",1,7.50,,0.00,,0.00,1,SF03.jpg,
Fence w/ BLK LLL,SF04,(All) Knotty Products|Star Fences||||||||,"Wood Fence w/ Cream 12"" Star and Black LLL Banner",In Stock,,,1,"12""x18""x3/4""",1,7.50,,0.00,,0.00,1,SF04.jpg,
Fence w/ BLK WEL,SF02,(All) Knotty Products|Star Fences||||||||,"Wood Fence w/ Cream 12"" Star and Black Welcome Banner",In Stock,,,1,"12""x18""x3/4""",1,7.50,,0.00,,0.00,1,SF02.jpg,
Fence w/ BlkFFF,SF01,(All) Knotty Products|Star Fences||||||||,"Wood fence w/ Cream 12"" Star and Black FFF Banner",In Stock,,,1,"12""x18""x3/4""",1,7.50,,0.00,,0.00,1,SF01.jpg,
Fence w/ Cr BOH,SF08,(All) Knotty Products|Star Fences||||||||,"Wood Fence w/ Black 12"" Star and Cream BOH Banner",In Stock,,,1,"12""x18""x3/4""",1,7.50,,0.00,,0.00,1,SF08.jpg,
Fence w/ Cr FFF,SF07,(All) Knotty Products|Star Fences||||||||,"Wood Fence w/ Black 12"" Star and Cream FFF Banner",In Stock,,,1,"12""x18""x3/4""",1,7.50,,0.00,,0.00,1,SF07.jpg,
Fence w/ Cr LLL,SF05,(All) Knotty Products|Star Fences||||||||,"Wood Fence w/ Black 12"" Star and cream LLL Banner",In Stock,,,1,"12""x18""x3/4""",1,7.50,,0.00,,0.00,1,SF05.jpg,
Fence w/ Cr WEL,SF06,(All) Knotty Products|Star Fences||||||||,"Wood Fence w/ Black 12"" Star and cream Welcome banner",In Stock,,,1,"12""x18""x3/4""",1,7.50,,0.00,,0.00,1,SF06.jpg,
Framed HSH,SLFS03,(All) Knotty Products|Slat Signs||||||||,Framed Slat Sign Black w/ HSH,In Stock,,,1,"10""x18""",1,7.00,,0.00,,0.00,1,SLFS03.jpg,
Framed Simply,SLFS04,(All) Knotty Products|Slat Signs||||||||,Framed Slat Sign Blue w/ Simply Blessed,In Stock,,,1,"10""x18""",1,7.00,,0.00,,0.00,1,SLFS04.jpg,
Framed Woods,SLFS02,(All) Knotty Products|Slat Signs||||||||,Framed Slat Sign Red w/ Welcome to Woods,In Stock,,,1,"10""x18""",1,7.00,,0.00,,0.00,1,SLFS02.jpg,
Framed kindness,SLFS01,(All) Knotty Products|Slat Signs||||||||,Framed Slat Sign Blue  w/ Kindness Matters,In Stock,,,1,"10""x18""",1,7.00,,0.00,,0.00,1,SLFS01.jpg,
HSH Brown Fence,8PKT06,(All) Knotty Products|Sign Fences||||||||,Home Sweet Home w/ Accents on Dark Brown Wood Fence,In Stock,,,1,"12""x24""x3/4""",1,9.00,,0.00,,0.00,1,8PKT06.jpg,
HSH Burlap Fence,8PKT02,(All) Knotty Products|Sign Fences||||||||,Home Sweet Home w/ Burlap Welcome Banner on Black Wood Fence,In Stock,,,1,"12""x24""x3/4""",1,9.00,,0.00,,0.00,1,8PKT02.jpg,
Horse Fence,8SPKT02,(All) Knotty Products|Sign Fences||||||||,Horse w/ Hooves Fence,In Stock,,,1,"12""x18""x3/4""",1,8.00,,0.00,,0.00,1,8SPKT02.jpg,
Ladder w/ BLK BOH,WLDR03,(All) Knotty Products|Ladder with Wreath||||||||,Wood Ladder w/ Wreath-Cream Pips- Black BOH Banner,In Stock,,,1,"9""x24""",1,11.00,,0.00,,0.00,1,WLDR03.jpg,
Ladder w/ BLK FFF,WLDR01,(All) Knotty Products|Ladder with Wreath||||||||,Wood Ladder w/ Wreath-Cream Pips- Black FFF Banner,In Stock,,,1,"9""x24""",1,11.00,,0.00,,0.00,1,WLDR01.jpg,
Ladder w/ BLK LLL,WLDR04,(All) Knotty Products|Ladder with Wreath||||||||,Wood Ladder w/ Wreath- Cream Pips-Black LLL Banner,In Stock,,,1,"9""x24""",1,11.00,,0.00,,0.00,1,WLDR04.jpg,
Ladder w/ BLK WEL,WLDR02,(All) Knotty Products|Ladder with Wreath||||||||,Wood Ladder w/ Wreath-Cream Pips- Black Welcome Banner,In Stock,,,1,"9""x24""",1,11.00,,0.00,,0.00,1,WLDR02.jpg,
Ladder w/ Cr BOH,WLDR08,(All) Knotty Products|Ladder with Wreath||||||||,Wood fence w/ Wreath-Cream Pips- Cream BOH Banner,In Stock,,,1,"9""x24""",1,11.00,,0.00,,0.00,1,WLDR08.jpg,
Ladder w/ Cr FFF,WLDR07,(All) Knotty Products|Ladder with Wreath||||||||,Wood Ladder w/ Wreath-Cream Pips-Cream FFF Banner,In Stock,,,1,"9""x24""",1,11.00,,0.00,,0.00,1,WLDR07.jpg,
Ladder w/ Cr LLL,WLDR05,(All) Knotty Products|Ladder with Wreath||||||||,Wood Ladder w/ Wreath-Cream Pips-Cream LLL Banner,In Stock,,,1,"9""x24""",1,11.00,,0.00,,0.00,1,WLDR05.jpg,
Ladder w/ Cr WEL,WLDR06,(All) Knotty Products|Ladder with Wreath||||||||,Wood Ladder w/ Wreath-Cream Pips-Cream Welcome Banner,In Stock,,,1,"9""x24""",1,11.00,,0.00,,0.00,1,WLDR06.jpg,
Lg Fence- Blk FFF,WFNC04,(All) Knotty Products|Fences with Wreath||||||||,Woood Fence w/ Wreath- Cream Pips- Black FFF Banner,In Stock,,,1,"12""x24""x3/4""",1,14.50,,0.00,,0.00,1,WFNC04.jpg,
Lg Fence-Blk BOH,WFNC01,(All) Knotty Products|Fences with Wreath||||||||,Wood Fence w/Wreath-CreamPips-Black BOH Banner,In Stock,,,1,"12""x24""x3/4""",1,14.50,,0.00,,0.00,1,WFNC01.jpg,
Lg Fence-Blk LLL,WFNC02,(All) Knotty Products|Fences with Wreath||||||||,Wood Fence w/ Wreath-Cream Pips-Black LLL Banner,In Stock,,,1,"12""x24""x3/4""",1,14.50,,0.00,,0.00,1,WFNC02.jpg,
Lg Fence-Blk Welcome,WFNC03,(All) Knotty Products|Fences with Wreath||||||||,Wood fence w/ Wreath-Cream Pips-Black Welcome Banner,In Stock,,,1,"12""x24""x3/4""",1,14.50,,0.00,,0.00,1,WFNC03.jpg,
Lg Fence-Cr BOH,WFNC05,(All) Knotty Products|Fences with Wreath||||||||,Wood Fence w/ Wreath - Cream Pips- Cream BOH Banner,In Stock,,,1,"12""x24""x3/4""",1,14.50,,0.00,,0.00,1,WFNC05.jpg,
Lg Fence-Cr FFF,WFNC08,(All) Knotty Products|Fences with Wreath||||||||,Wood Fence w/ Wreath- Cream Pips- Cream FFF Banner,In Stock,,,1,"12""x24""x3/4""",1,14.50,,0.00,,0.00,1,WFNC08.jpg,
Lg Fence-Cr LLL,WFNC07,(All) Knotty Products|Fences with Wreath||||||||,Wood Fence w/ Wreath- Cream Pips- Cream LLL Banner,In Stock,,,1,"12""x24""x3/4""",1,14.50,,0.00,,0.00,1,WFNC07.jpg,
Lg Fence-Cr WEL,WFNC06,(All) Knotty Products|Fences with Wreath||||||||,Wood Fence w/ Wreath- Cream Pips- Cream Welcome Banner,In Stock,,,1,"12""x24""x3/4""",1,14.50,,0.00,,0.00,1,WFNC06.jpg,
Long Farmhouse Fence,LFNC03,(All) Knotty Products|Sign Fences||||||||,Farmhouse on Brown wood Fence,In Stock,,,1,"24""x12""x3/4""",1,9.00,,0.00,,0.00,1,LFNC03.jpg,
Long HSH Fence,LFNC01,(All) Knotty Products|Sign Fences||||||||,Home Sweet Home on Brown Wood Fence,In Stock,,,1,"24""x12""x3/4""",1,9.00,,0.00,,0.00,1,LFNC01.jpg,
Long LLL Fence,LFNC02,(All) Knotty Products|Sign Fences||||||||,LLL on Black Wood fence,In Stock,,,1,"24""x12""x3/4""",1,9.00,,0.00,,0.00,1,LFNC02.jpg,
Long Welcome Black,LFNC05,(All) Knotty Products|Sign Fences||||||||,Welcome on Black Wood Fence,In Stock,,,1,"24""x12""x3/4""",1,9.00,,0.00,,0.00,1,LFNC05.jpg,
Mason Jar Fence,8PKT01,(All) Knotty Products|Sign Fences||||||||,Mason Jar w/ Love Grows Here on White Wood Fence,In Stock,,,1,"12""x24""x3/4""",1,9.00,,0.00,,0.00,1,8PKT01.jpg,
Must Heart and star,SLTF02,(All) Knotty Products|Fences with Wreath||||||||,White Wood Fence w/ Wreath-Cream Pips-Mustard Heart and Star,In Stock,,,1,"12""x18""x3/4""",1,11.25,,0.00,,0.00,1,SLTF02.jpg,
Must and Blk Heart,SLTF06,(All) Knotty Products|Fences with Wreath||||||||,White Wood Fence w/ Wreath-Cream Pips-Mustard and Black Hearts,In Stock,,,1,"12""x18""x3/4""",1,11.25,,0.00,,0.00,1,SLTF06.jpg,
Mustard and Blk Star,SLTF05,(All) Knotty Products|Fences with Wreath||||||||,White Wood Fence w/ Wreath-Cream Pips-Mustard and Black Stars,In Stock,,,1,"12""x18""x3/4""",1,11.25,,0.00,,0.00,1,SLTF05.jpg,
Pallet Blk Be Strong,12PT02,(All) Knotty Products|Pallet Style||||||||,Black Wood Pallet Type Sign w/ Be Strong,In Stock,,,1,"12""x12""x3/4""",1,6.50,,0.00,,0.00,1,12PT02.jpg,
Pallet Blue Kindness,12PT01,(All) Knotty Products|Pallet Style||||||||,Blue Wood Pallet Type Sign w/ Scatter Kindness,In Stock,,,1,"12""x12""x3/4""",1,6.50,,0.00,,0.00,1,12PT01.jpg,
Pallet Lg Home,LGPT03,(All) Knotty Products|Pallet Style||||||||,Brown Wood Pallet Type Sign w/ Home is Where,In Stock,,,1,"18""x16""x3/4""",1,10.00,,0.00,,0.00,1,LGPT03.jpg,
Pallet Lg Humble,LGPT02,(All) Knotty Products|Pallet Style||||||||,Black Wood Pallet Type Sign w/ Always Stay Humble,In Stock,,,1,"16""x18""x3/4""",1,10.00,,0.00,,0.00,1,LGPT02.jpg,
Pallet Lg Live Simply,LGPT01,(All) Knotty Products|Pallet Style||||||||,Grey Wood Pallet type Sign w/ Live Simply,In Stock,,,1,"16""x18""x3/4""",1,10.00,,0.00,,0.00,1,LGPT01.jpg,
Pallet Long Family,36PT01,(All) Knotty Products|Pallet Style||||||||,Brown Wood Pallet Type Sign w/ Family grateful,In Stock,,,1,"12""x36""x3/4""",1,14.50,,0.00,,0.00,1,36PT01.jpg,
Pallet long Home,36PT02,(All) Knotty Products|Pallet Style||||||||,Black Wood Pallet Type Sign w/ HOME,In Stock,,,1,"12""x36""x3/4""",1,14.50,,0.00,,0.00,1,36PT02.jpg,
Pallet sm Family,12PT04,(All) Knotty Products|Pallet Style||||||||,Brown Wood Pallet Type Sign w/ Family grateful,In Stock,,,1,"12""x12""x3/4""",1,6.50,,0.00,,0.00,1,12PT04.jpg,
Pallet sm Welcome,12PT03,(All) Knotty Products|Pallet Style||||||||,Brown Wood Pallet Type Sign w/Welcome to our Home,In Stock,,,1,"12""x12""x3/4""",1,6.50,,0.00,,0.00,1,12PT03.jpg,
Plant Fence,8PKT12,(All) Knotty Products|Sign Fences||||||||,Plant Smiles on Brown Wood Fence,In Stock,,,1,"12""x24""x3/4""",1,9.00,,0.00,,0.00,1,8PKT12.jpg,
Red Heart and star,SLTF01,(All) Knotty Products|Fences with Wreath||||||||,White Wood Fence w/ Wreath- Cream Pips-Red Heart and Star,In Stock,,,1,"12""x18""x3/4""",1,11.25,,0.00,,0.00,1,SLTF01.jpg,
Red Welcome Fence,8PKT08,(All) Knotty Products|Sign Fences||||||||,Red Welcome to our Home on Wood Fence,In Stock,,,1,"12""x24""x3/4""",1,9.00,,0.00,,0.00,1,8PKT08.jpg,
Rooster Fence,8SPKT03,(All) Knotty Products|Sign Fences||||||||,Rooster w/ tracks fence,In Stock,,,1,"12""x18""x3/4""",1,8.00,,0.00,,0.00,1,8SPKT03.jpg,
Scatter Kindness,LFNC04,(All) Knotty Products|Sign Fences||||||||,Scatter Kindness on Light Wood Fence,In Stock,,,1,"24""x12""x3/4""",1,9.00,,0.00,,0.00,1,LFNC04.jpg,
Slat BOH,4SLTS01,(All) Knotty Products|Slat Signs||||||||,Slat Sign w/ Bless Our Home,In Stock,,,1,"10""x17""x3/4""",1,7.25,,0.00,,0.00,1,4SLTS01.jpg,
Slat Family,4SLTS02,(All) Knotty Products|Slat Signs||||||||,Slat Sign w/ Family First,In Stock,,,1,"10""x17""x3/4""",1,7.25,,0.00,,0.00,1,4SLTS02.jpg,
Slat Life,4SLTS04,(All) Knotty Products|Slat Signs||||||||,Slat Sign w/ Life is Better,In Stock,,,1,"10""x17""x3/4""",1,7.25,,0.00,,0.00,1,4SLTS04.jpg,
Slat Simply,4SLTS03,(All) Knotty Products|Slat Signs||||||||,Slat Sign w/ Simply Blessed,In Stock,,,1,"10""x17""x3/4""",1,7.25,,0.00,,0.00,1,4SLTS03.jpg,
Small B- Country Kit,SMSG15,(All) Knotty Products|Signs||||||||,Wood Framed Black Country Kitchen Sign,In Stock,,,1,"8""x20""",1,4.00,,0.00,,0.00,1,SMSG15.jpg,
Small B- Grateful,SMSG08,(All) Knotty Products|Signs||||||||,Wood Framed Black Grateful Sign,In Stock,,,1,"8""x20""",1,4.00,,0.00,,0.00,1,SMSG08.jpg,
Small B- Kiss Me,SMSG16,(All) Knotty Products|Signs||||||||,Wood Framed Black Always Kiss Me Sign,In Stock,,,1,"8""x20""",1,4.00,,0.00,,0.00,1,SMSG16.jpg,
Small B- Welcome,SMSG10,(All) Knotty Products|Signs||||||||,Wood framed Black Welcome Sign,In Stock,,,1,"8""x20""",1,4.00,,0.00,,0.00,1,SMSG10.jpg,
Small B-Blessed,SMSG13,(All) Knotty Products|Signs||||||||,Wood Framed Black Blessed Sign,In Stock,,,1,"8""x20""",1,4.00,,0.00,,0.00,1,SMSG13.jpg,
Small B-Family,SMSG05,(All) Knotty Products|Signs||||||||,Wood Framed Black Family Sign,In Stock,,,1,"8""x20""",1,4.00,,0.00,,0.00,1,SMSG05.jpg,
Small B-Laundry,SMSG02,(All) Knotty Products|Signs||||||||,Wood framed Black Laundry Sign,In Stock,,,1,"8""x20""",1,4.00,,0.00,,0.00,1,SMSG02.jpg,
Small B-Thankful,SMSG11,(All) Knotty Products|Signs||||||||,Wood Framed Black Thankful Sign,In Stock,,,1,"8""x20""",1,4.00,,0.00,,0.00,1,SMSG11.jpg,
Small B-Washroom,SMSG04,(All) Knotty Products|Signs||||||||,Wood Framed Black washroom Sign,In Stock,,,1,"8""x20""",1,4.00,,0.00,,0.00,1,SMSG04.jpg,
Small Black Star,SSTF01,(All) Knotty Products|Star Fences||||||||,"Brown Wood Fence w/ 8"" Black Star- Welcome",In Stock,,,1,"12""x 18""x3/4""",1,7.00,,0.00,,0.00,1,SSTF01.jpg,
Small Fence B/M,SSFR02,(All) Knotty Products|Small fence||||||||,"Wood fence w/ 8"" Black Star- Small Mustard Star and raffia",In Stock,,,1,"8""x18""",1,5.50,,0.00,,0.00,1,SSFR02.jpg,
Small Fence B/R,SSFR01,(All) Knotty Products|Small fence||||||||,"Wood Fence w/ 8"" Black Star - Small Red Star and Raffia",In Stock,,,1,"8""x18""",1,5.50,,0.00,,0.00,1,SSFR01.jpg,
Small Fence B/RM,SSF06,(All) Knotty Products|Small fence||||||||,"Wood Fence w/8"" Black Star -Small Red and Mustard Stars",In Stock,,,1,"8""x18""",1,5.00,,0.00,,0.00,1,SSF06.jpg,
Small Fence B/RR,SSF02,(All) Knotty Products|Small fence||||||||,"Wood fence w/ 8"" Black Star- Small Red Heart and Star",In Stock,,,1,"8""x18""",1,5.00,,0.00,,0.00,1,SSF02.jpg,
Small Fence BU/ BM,SSF12,(All) Knotty Products|Small fence||||||||,"Wood Fence w/ 8"" Burgundy Star- Small Black and Mustard Stars",In Stock,,,1,"8""x18""",1,5.00,,0.00,,0.00,1,SSF12.jpg,
Small Fence BU/BB,SSF08,(All) Knotty Products|Small fence||||||||,"Wood Fence w/ 8"" Burgundy Star-Black Heart and Star",In Stock,,,1,"8""x18""",1,5.00,,0.00,,0.00,1,SSF08.jpg,
