Large Natural Tube Feeder -Emerald,feed060113,Natural Tube Feeder|||||||||,,,,,1,"Length: 15""  Roof Diameter: 7.5""",1,22.00,,0.00,,0.00,1,feed060113.jpg,
Large Natural Tube Feeder -Firetruck,feed061011,Natural Tube Feeder|||||||||,,,,,1,"Length: 15""  Roof Diameter: 7.5""",1,22.00,,0.00,,0.00,1,feed061011.jpg,
Large Natural Tube Feeder -Frosty Blue,feed060717,Natural Tube Feeder|||||||||,,,,,1,"Length: 15""  Roof Diameter: 7.5""",1,22.00,,0.00,,0.00,1,feed060717.jpg,
Large Natural Tube Feeder -Fuzzy Peach,feed060311,Natural Tube Feeder|||||||||,,,,,1,"Length: 15""  Roof Diameter: 7.5""",1,22.00,,0.00,,0.00,1,feed060311.jpg,
Large Natural Tube Feeder -Grape Goodness,feed060410,Natural Tube Feeder|||||||||,,,,,1,"Length: 15""  Roof Diameter: 7.5""",1,22.00,,0.00,,0.00,1,feed060410.jpg,
Large Natural Tube Feeder -Grenadine,feed060816,Natural Tube Feeder|||||||||,,,,,1,"Length: 15""  Roof Diameter: 7.5""",1,22.00,,0.00,,0.00,1,feed060816.jpg,
Large Natural Tube Feeder -Lemon Lime,feed060519,Natural Tube Feeder|||||||||,,,,,1,"Length: 15""  Roof Diameter: 7.5""",1,22.00,,0.00,,0.00,1,feed060519.jpg,
Large Natural Tube Feeder -Plum,feed060915,Natural Tube Feeder|||||||||,,,,,1,"Length: 15""  Roof Diameter: 7.5""",1,22.00,,0.00,,0.00,1,feed060915.jpg,
Large Natural Tube Feeder Assorted Color 6 Pack,feed670015,Packs Feeders & Houses|||||||||,,,,,1,,6,22.00,,0.00,,0.00,6,feed670015.jpg,
Leaf Accents Large Assorted Color,leaf140013,Miscellaneous Products|||||||||,"JJ Potts Leaf Accents bring the outdoors in.  Add some rich, deep color to your home or garden with our authentic leaf creations.  Each piece was individually sculpted using real leaves gathered from native maple, walnut, mulberry and sycamore trees growing behind the family home along the banks of the Mill Creek.  We borrowed some of natures handy work by taking the green leafs and imprinting them into the original mold and now recreate these detailed leaf accents over an over again.  Ideal for use in the home as wall hangings, centerpieces and soap dishes.  Made from durable all weather stoneware, Leaf Accents are suited for birdbaths and fountains as well.",,,,1,"Width Across: 9""",5,9.00,,0.00,,0.00,5,leaf140013.jpg,
Leaf Accents Medium Assorted Color,leaf140020,Miscellaneous Products|||||||||,"JJ Potts Leaf Accents bring the outdoors in.  Add some rich, deep color to your home or garden with our authentic leaf creations.  Each piece was individually sculpted using real leaves gathered from native maple, walnut, mulberry and sycamore trees growing behind the family home along the banks of the Mill Creek.  We borrowed some of natures handy work by taking the green leafs and imprinting them into the original mold and now recreate these detailed leaf accents over an over again.  Ideal for use in the home as wall hangings, centerpieces and soap dishes.  Made from durable all weather stoneware, Leaf Accents are suited for birdbaths and fountains as well.",,,,1,"Width Across: 7""",5,7.00,,0.00,,0.00,5,leaf140020.jpg,
Leaf Accents Small Assorted Color,leaf140037,Miscellaneous Products|||||||||,"JJ Potts Leaf Accents bring the outdoors in.  Add some rich, deep color to your home or garden with our authentic leaf creations.  Each piece was individually sculpted using real leaves gathered from native maple, walnut, mulberry and sycamore trees growing behind the family home along the banks of the Mill Creek.  We borrowed some of natures handy work by taking the green leafs and imprinting them into the original mold and now recreate these detailed leaf accents over an over again.  Ideal for use in the home as wall hangings, centerpieces and soap dishes.  Made from durable all weather stoneware, Leaf Accents are suited for birdbaths and fountains as well.",,,,1,"Width Across: 5""",5,5.00,,0.00,,0.00,5,leaf140037.jpg,
Leaf Gourd Feeder Assorted Color 8 Pack,feed680007,Packs Feeders & Houses|||||||||,,,,,1,,8,14.50,,0.00,,0.00,8,feed680007.jpg,
Leaf Gourd Feeder-Assorted Color,feed710001,Leaf Gourd Feeder|||||||||,,,,,1,"Gourd Diameter: 5.5""  Roof Diameter: 7.5""",1,14.50,,0.00,,0.00,1,feed710001.jpg,
Leaf Gourd Feeder-Green,feed710100,Leaf Gourd Feeder|||||||||,,,,,1,"Gourd Diameter: 5.5""  Roof Diameter: 7.5""",1,14.50,,0.00,,0.00,1,feed710100.jpg,
Leaf Gourd Feeder-Yellow (Green color shown),feed710209,Leaf Gourd Feeder|||||||||,,,,,1,"Gourd Diameter: 5.5""  Roof Diameter: 7.5""",1,14.50,,0.00,,0.00,1,feed710209.jpg,
Leaf Gourd House Assorted  Color 8 Pack,feed690006,Packs Feeders & Houses|||||||||,,,,,1,,8,14.50,,0.00,,0.00,8,feed690006.jpg,
Leaf Gourd House-Assorted Color,feed810008,Leaf Gourd Feeder|||||||||,,,,,1,"Gourd Diameter: 5.5""  Roof Diameter: 7.5""",1,14.50,,0.00,,0.00,1,feed810008.jpg,
Leaf Gourd House-Green,feed810107,Leaf Gourd Feeder|||||||||,,,,,1,"Gourd Diameter: 5.5""  Roof Diameter: 7.5""",1,14.50,,0.00,,0.00,1,feed810107.jpg,
Leaf Gourd House-Yellow,feed810206,Leaf Gourd Feeder|||||||||,,,,,1,"Gourd Diameter: 5.5""  Roof Diameter: 7.5""",1,14.50,,0.00,,0.00,1,feed810206.jpg,
Leaf Large Natural Tube Feeder,feed610011,Leaf Gourd Feeder|||||||||,,,,,1,"Length: 15""  Roof Diameter: 7.5""",1,22.00,,0.00,,0.00,1,feed610011.jpg,
Leaf Large Natural Tube Feeder Assorted Color 6 Pack,feed700019,Packs Feeders & Houses|||||||||,,,,,1,,6,22.00,,0.00,,0.00,6,feed700019.jpg,
Leaf Large Natural Tube Feeder-Green,feed610110,Leaf Gourd Feeder|||||||||,,,,,1,"Length: 15""  Roof Diameter: 7.5""",1,22.00,,0.00,,0.00,1,feed610110.jpg,
Leaf Large Natural Tube Feeder-Yellow,feed610219,Leaf Gourd Feeder|||||||||,,,,,1,"Length: 15""  Roof Diameter: 7.5""",1,22.00,,0.00,,0.00,1,feed610219.jpg,
Micro Shroomyz Assorted Color,mic050008,Micro Shroomyz|||||||||,"Lenght: 7"" Cap Diameter: 2"" Price is per piece but the minimum is 25.",,,,1,,25,2.20,,0.00,,0.00,25,mic050008.jpg,
Pre-Displayed Micro Shroomyz (includes displayer - assorted colors),pre510007,Micro Shroomyz|||||||||,"Displayer- Diameter: 12"" Height: 4"" Price is per piece but the minimum is 35.",,,,1,,35,2.43,,0.00,,0.00,35,pre510007.jpg,
Small Glazed Tube Feeder Assorted Color 8 pack,feed640025,Packs Feeders & Houses|||||||||,,,,,1,,8,19.50,,0.00,,0.00,8,feed640025.jpg,
Small Glazed Tube Feeder-Assorted Color,feed100024,Gourd Glazed Tube Feeder|||||||||,,,,,1,"Length: 14"" Roof Diameter: 6""",1,19.50,,0.00,,0.00,1,feed100024.jpg,
Small Glazed Tube Feeder-Blueberry,feed100222,Gourd Glazed Tube Feeder|||||||||,,,,,1,"Length: 14"" Roof Diameter: 6""",1,19.50,,0.00,,0.00,1,feed100222.jpg,
Small Glazed Tube Feeder-Cherry Bomb,feed100628,Gourd Glazed Tube Feeder|||||||||,,,,,1,"Length: 14"" Roof Diameter: 6""",1,19.50,,0.00,,0.00,1,feed100628.jpg,
Small Glazed Tube Feeder-Emerald,feed100123,Gourd Glazed Tube Feeder|||||||||,,,,,1,"Length: 14"" Roof Diameter: 6""",1,19.50,,0.00,,0.00,1,feed100123.jpg,
Small Glazed Tube Feeder-Firetruck,feed101021,Gourd Glazed Tube Feeder|||||||||,,,,,1,"Length: 14"" Roof Diameter: 6""",1,19.50,,0.00,,0.00,1,feed101021.jpg,
Small Glazed Tube Feeder-Frosty Blue,feed100727,Gourd Glazed Tube Feeder|||||||||,,,,,1,"Length: 14"" Roof Diameter: 6""",1,19.50,,0.00,,0.00,1,feed100727.jpg,
Small Glazed Tube Feeder-Fuzzy Peach,feed100321,Gourd Glazed Tube Feeder|||||||||,,,,,1,"Length: 14"" Roof Diameter: 6""",1,19.50,,0.00,,0.00,1,feed100321.jpg,
Small Glazed Tube Feeder-Grape Goodness,feed100420,Gourd Glazed Tube Feeder|||||||||,,,,,1,"Length: 14"" Roof Diameter: 6""",1,19.50,,0.00,,0.00,1,feed100420.jpg,
Small Glazed Tube Feeder-Grenadine,feed100826,Gourd Glazed Tube Feeder|||||||||,,,,,1,"Length: 14"" Roof Diameter: 6""",1,19.50,,0.00,,0.00,1,feed100826.jpg,
Small Glazed Tube Feeder-Lemon Lime,feed100529,Gourd Glazed Tube Feeder|||||||||,,,,,1,"Length: 14"" Roof Diameter: 6""",1,19.50,,0.00,,0.00,1,feed100529.jpg,
Small Glazed Tube Feeder-Plum,feed100925,Gourd Glazed Tube Feeder|||||||||,,,,,1,"Length: 14"" Roof Diameter: 6""",1,19.50,,0.00,,0.00,1,feed100925.jpg,
Small Natural Tube Feeder Assorted Color 8 Pack,feed650024,Packs Feeders & Houses|||||||||,,,,,1,,8,19.50,,0.00,,0.00,8,feed650024.jpg,
Small Natural Tube Feeder-Assorted Color,feed060021,Natural Tube Feeder|||||||||,,,,,1,"Length: 14"" Roof Diameter: 6""",1,19.50,,0.00,,0.00,1,feed060113.jpg,
Small Natural Tube Feeder-Blueberry,feed060229,Natural Tube Feeder|||||||||,,,,,1,"Length: 14"" Roof Diameter: 6""",1,19.50,,0.00,,0.00,1,feed060229.jpg,
Small Natural Tube Feeder-Cherry Bomb,feed060625,Natural Tube Feeder|||||||||,,,,,1,"Length: 14"" Roof Diameter: 6""",1,19.50,,0.00,,0.00,1,feed060625.jpg,
Small Natural Tube Feeder-Emerald,feed060120,Natural Tube Feeder|||||||||,,,,,1,"Length: 14"" Roof Diameter: 6""",1,19.50,,0.00,,0.00,1,feed060120.jpg,
Small Natural Tube Feeder-Firetruck,feed061028,Natural Tube Feeder|||||||||,,,,,1,"Length: 14"" Roof Diameter: 6""",1,19.50,,0.00,,0.00,1,feed061028.jpg,
Small Natural Tube Feeder-Frosty Blue,feed060724,Natural Tube Feeder|||||||||,,,,,1,"Length: 14"" Roof Diameter: 6""",1,19.50,,0.00,,0.00,1,feed060724.jpg,
Small Natural Tube Feeder-Fuzzy Peach,feed060328,Natural Tube Feeder|||||||||,,,,,1,"Length: 14"" Roof Diameter: 6""",1,19.50,,0.00,,0.00,1,feed060328.jpg,
Small Natural Tube Feeder-Grape Goodness,feed060427,Natural Tube Feeder|||||||||,,,,,1,"Length: 14"" Roof Diameter: 6""",1,19.50,,0.00,,0.00,1,feed060427.jpg,
Small Natural Tube Feeder-Grenadine,feed060823,Natural Tube Feeder|||||||||,,,,,1,"Length: 14"" Roof Diameter: 6""",1,19.50,,0.00,,0.00,1,feed060823.jpg,
Small Natural Tube Feeder-Lemon Lime,feed060526,Natural Tube Feeder|||||||||,,,,,1,"Length: 14"" Roof Diameter: 6""",1,19.50,,0.00,,0.00,1,feed060526.jpg,
Small Natural Tube Feeder-Plum,feed060922,Natural Tube Feeder|||||||||,,,,,1,"Length: 14"" Roof Diameter: 6""",1,19.50,,0.00,,0.00,1,feed060922.jpg,
