Small Fence BU/MM,SSF11,(All) Knotty Products|Small fence||||||||,"Wood Fence w/ 8""Burgundy Star- Small Mustard Star and Heart",In Stock,,,1,"8""x18""",1,5.00,,0.00,,0.00,1,SSF11.jpg,
Small Fence Bu/B,SSFR04,(All) Knotty Products|Small fence||||||||,"Wood Fence w/ 8"" Burgundy Star-Small Black Star and Raffia",In Stock,,,1,"8""x18""",1,5.50,,0.00,,0.00,1,SSFR04.jpg,
Small Fence Bu/M,SSFR05,(All) Knotty Products|Small fence||||||||,"Wood Fence w/ 8"" Burgundy Star- Small Mustard Star and Raffia",In Stock,,,1,"8""x18""",1,5.50,,0.00,,0.00,1,SSFR05.jpg,
Small Fence Bu/R,SSFR06,(All) Knotty Products|Small fence||||||||,"Wood Fence w/ 8"" Burgundy Star- Small Red Star and Raffia",In Stock,,,1,"8""x18""",1,5.50,,0.00,,0.00,1,SSFR06.jpg,
Small FenceB/B,SSFR03,(All) Knotty Products|Small fence||||||||,"Wood Fence w/ 8"" Black Star-Small Black Star and raffia",In Stock,,,1,"8""x18""",1,5.50,,0.00,,0.00,1,SSFR03.jpg,
Small W- Grateful,SMSG07,(All) Knotty Products|Signs||||||||,Wood Framed White Grateful Sign,In Stock,,,1,"8""x20""",1,4.00,,0.00,,0.00,1,SMSG07.jpg,
Small W- Welcome,SMSG09,(All) Knotty Products|Signs||||||||,Wood Framed White Welcome Sign,In Stock,,,1,"8""x20""",1,4.00,,0.00,,0.00,1,SMSG09.jpg,
Small W-Blessed,SMSG14,(All) Knotty Products|Signs||||||||,Wood Framed White Blessed Sign,In Stock,,,1,"8""x20""",1,4.00,,0.00,,0.00,1,SMSG14.jpg,
Small W-Family,SMSG06,(All) Knotty Products|Signs||||||||,Wood Framed White Family Sign,In Stock,,,1,"8""x20""",1,4.00,,0.00,,0.00,1,SMSG06.jpg,
Small W-Laundry,SMSG01,(All) Knotty Products|Signs||||||||,Wood framed White Laundry Sign,In Stock,,,1,"8""x20""",1,4.00,,0.00,,0.00,1,SMSG01.jpg,
Small W-Thankful,SMSG12,(All) Knotty Products|Signs||||||||,Wood Framed White Thankful Sign,In Stock,,,1,"8""x20""",1,4.00,,0.00,,0.00,1,SMSG12.jpg,
Small W-Washroom,SMSG03,(All) Knotty Products|Signs||||||||,Wood Framed White Washroom Sign,In Stock,,,1,"8""x20""",1,4.00,,0.00,,0.00,1,SMSG03.jpg,
Small cream star,SSTF02,(All) Knotty Products|Star Fences||||||||,"Brown Wood Fence w/ 8"" Cream Star- Welcome",In Stock,,,1,"12""x18""x3/4""",1,7.00,,0.00,,0.00,1,SSTF02.jpg,
Small fence B/MM,SSF05,(All) Knotty Products|Small fence||||||||,"Wood Fence w/ 8"" Black Star - Small Mustard Star and Heart",In Stock,,,1,"8""x18""",1,5.00,,0.00,,0.00,1,SSF05.jpg,
Small fence B/RM,SSF01,(All) Knotty Products|Small fence||||||||,"Wood Fence w/ 8"" Black Star- Small Red and Mustard Small stars",In Stock,,,1,"8""x18""",1,5.00,,0.00,,0.00,1,SSF01.jpg,
Star Welcome Fence,8PKT04,(All) Knotty Products|Sign Fences||||||||,Black Star with Welcome on Wood Fence,In Stock,,,1,"12""x24""x3/4""",1,9.00,,0.00,,0.00,1,8PKT04.jpg,
Star w/ Bl BOH,HST06,(All) Knotty Products|Hanging Star||||||||,"Cream 12"" Star w/ Black BOH",In Stock,,,1,"12""",1,4.00,,0.00,,0.00,1,HST06.jpg,
Star w/ Bl FFF,HST08,(All) Knotty Products|Hanging Star||||||||,"Cream 12"" Star w/ Black FFF",In Stock,,,1,"12""",1,4.00,,0.00,,0.00,1,HST08.jpg,
Star w/ Bl LLL,HST07,(All) Knotty Products|Hanging Star||||||||,"Cream 12"" Star w/ Black LLL",In Stock,,,1,"12""",1,4.00,,0.00,,0.00,1,HST07.jpg,
Star w/ Bl Welcome,HST05,(All) Knotty Products|Hanging Star||||||||,"Cream 12"" Star w/ Black Welcome",In Stock,,,1,"12""",1,4.00,,0.00,,0.00,1,HST05.jpg,
Star w/ Cr FFF,HST03,(All) Knotty Products|Hanging Star||||||||,"Black 12"" Star w/ Cream FFF",In Stock,,,1,"12""",1,4.00,,0.00,,0.00,1,HST03.jpg,
Star w/ Cr LLL,HST01,(All) Knotty Products|Hanging Star||||||||,"Black 12"" Star w/ Cream LLL",In Stock,,,1,"12""",1,4.00,,0.00,,0.00,1,HST01.jpg,
Star w/ Cr welcome,HST02,(All) Knotty Products|Hanging Star||||||||,"Black 12"" Star w/ Cream welcome",In Stock,,,1,"12""",1,4.00,,0.00,,0.00,1,HST02.jpg,
Star w/ CrBOH,HST04,(All) Knotty Products|Hanging Star||||||||,"Black 12"" Star w/ Cream BOH",In Stock,,,1,"12""",1,4.00,,0.00,,0.00,1,HST04.jpg,
TGB Fence,8SPKT04,(All) Knotty Products|Sign Fences||||||||,TGB on Brown fence,In Stock,,,1,"12""x18""x3/4""",1,8.00,,0.00,,0.00,1,8SPKT04.jpg,
Tall Blk BOH,TSF04,(All) Knotty Products|Star Fences||||||||,"Wood Fence w/ Black 12"" BOH Star",In Stock,,,1,"12""x24""x3/4""",1,10.00,,0.00,,0.00,1,TSF04.jpg,
Tall Blk CYB,TSF01,(All) Knotty Products|Star Fences||||||||,"Wood Fence w/ Black 12"" CYB Star",In Stock,,,1,"12""x24""x3/4""",1,10.00,,0.00,,0.00,1,TSF01.jpg,
Tall Blk FHL,TSF03,(All) Knotty Products|Star Fences||||||||,"Wood fence w/ Black 12"" FHL Star",In Stock,,,1,"12""x24""x3/4""",1,10.00,,0.00,,0.00,1,TSF03.jpg,
Tall Blk HSH,TSF02,(All) Knotty Products|Star Fences||||||||,"Wood fence w/ Black 12"" HSH Star",In Stock,,,1,"12""x24""x3/4""",1,10.00,,0.00,,0.00,1,TSF02.jpg,
Tall Burg BOH,TSF05,(All) Knotty Products|Star Fences||||||||,"Wood fence w/ Burg 12"" BOH Star",In Stock,,,1,"12""x24""x3/4""",1,10.00,,0.00,,0.00,1,TSF05.jpg,
Tall Burg CYB,TSF07,(All) Knotty Products|Star Fences||||||||,"Wood Fence w/ Burg 12"" CYB Star",In Stock,,,1,"12""x24""x3/4""",1,10.00,,0.00,,0.00,1,TSF07.jpg,
Tall Burg FHL,TSF08,(All) Knotty Products|Star Fences||||||||,"Wood Fence w/ Burg 12"" FHL Star",In Stock,,,1,"12""x24""x3/4""",1,10.00,,0.00,,0.00,1,TSF08.jpg,
Tall Burg HSH,TSF06,(All) Knotty Products|Star Fences||||||||,"Wood Fence w/ Burg 12"" HSH Star",In Stock,,,1,"12""x24""x3/4""",1,10.00,,0.00,,0.00,1,TSF06.jpg,
Tall Cream BOH,TSF11,(All) Knotty Products|Star Fences||||||||,"Wood Fence w/ Cream 12"" BOH Star",In Stock,,,1,"12""x24""x3/4""",1,10.00,,0.00,,0.00,1,TSF11.jpg,
Tall Cream FHL,TSF09,(All) Knotty Products|Star Fences||||||||,"Wood Fence w/ Cream 12"" FHL Star",In Stock,,,1,"12""x24""x3/4""",1,10.00,,0.00,,0.00,1,TSF09.jpg,
Tall Cream HSH,TSF12,(All) Knotty Products|Star Fences||||||||,"Wood fence w/ Cream 12"" HSH Star",In Stock,,,1,"12""x24""x3/4""",1,10.00,,0.00,,0.00,1,TSF12.jpg,
Tall cream CYB,TSF10,(All) Knotty Products|Star Fences||||||||,"Wood Fence w/ Cream 12"" CYB Star",In Stock,,,1,"12""x24""x3/4""",1,10.00,,0.00,,0.00,1,TSF10.jpg,
Tan -Burg -Wel Sign,HSS02,(All) Knotty Products|Houses||||||||,Wood Tan and  Burgundy House w/ Welcome,In Stock,,,1,"6 1/2"" x13""",1,6.50,,0.00,,0.00,1,HSS02.jpg,
Tan BOH Star Stand,SST04,(All) Knotty Products|Standing Stars||||||||,"Wood Standing Star with 12"" Tan BOH Star",In Stock,,,1,"12""x28""",1,12.00,,0.00,,0.00,1,SST04.jpg,
Tan CYB Star Stand,SST01,(All) Knotty Products|Standing Stars||||||||,"Wood Standing Star w/ Tan Count Your Blessings 12"" Star",In Stock,,,1,"12""x28""",1,12.00,,0.00,,0.00,1,SST01.jpg,
Tan FHL Star Stand,SST02,(All) Knotty Products|Standing Stars||||||||,"Wood Standing Star w/ Tan FHL 12"" Star",In Stock,,,1,"12""x28""",1,12.00,,0.00,,0.00,1,SST02.jpg,
Tan HSH Star Stand,SST03,(All) Knotty Products|Standing Stars||||||||,"Wood Standing Star with 12"" HSH Star",In Stock,,,1,"12""x28""",1,12.00,,0.00,,0.00,1,SST03.jpg,
Tan w/ Blk  House Regular,HSE01,(All) Knotty Products|Houses||||||||,Wood Tan House with Black,In Stock,,,1,"6 1/2""x 13""",1,6.00,,0.00,,0.00,1,HSE01.jpg,
Tan w/ Burg House Regular,HSE03,(All) Knotty Products|Houses||||||||,Wood Tan House with Burgundy,In Stock,,,1,"6 1/2""x13""",1,6.00,,0.00,,0.00,1,HSE03.jpg,
Tan-Blk w/ Wreath,HSW02,(All) Knotty Products|Houses||||||||,Wood Tan and Black House with Wreath Accent,In Stock,,,1,"6 1/2""x13""",1,6.50,,0.00,,0.00,1,HSW02.jpg,
Tan-Burg w/ Wreath,HSW04,(All) Knotty Products|Houses||||||||,Wood Tan and Burgundy House with Wreath Accent,In Stock,,,1,"6 1/2""x13""",1,6.50,,0.00,,0.00,1,HSW04.jpg,
Tan-Burg- BOH Sign,HSS01,(All) Knotty Products|Houses||||||||,Wood Tan and Burgundy House w/ Bless Our Home Banner,In Stock,,,1,"6 1/2""x13""",1,6.50,,0.00,,0.00,1,HSS01.jpg,
Tan-Burg- LLL Sign,HSS03,(All) Knotty Products|Houses||||||||,Wood Tan and Burgundy House w/ LLL Banner,In Stock,,,1,"6 1/2""x13""",1,6.50,,0.00,,0.00,1,HSS03.jpg,
Tan-Burg-FFF Sign,HSS04,(All) Knotty Products|Houses||||||||,Wood Tan and Burgundy House w/ FFF Banner,In Stock,,,1,"6 1/2""x13""",1,6.50,,0.00,,0.00,1,HSS04.jpg,
Tan/BLK-Wel Sign,HSS10,(All) Knotty Products|Houses||||||||,Tan and Black House w/ Welcome Banner,In Stock,,,1,"6 1/2""x13""",1,6.50,,0.00,,0.00,1,HSS10.jpg,
Tan/Blk-BOH Sign,HSS09,(All) Knotty Products|Houses||||||||,Tan and Black House w/Bless Our Home Banner,In Stock,,,1,"6 1/2""x13""",1,6.50,,0.00,,0.00,1,HSS09.jpg,
Tan/Blk-FFF Sign,HSS12,(All) Knotty Products|Houses||||||||,Tan and Black House w/FFF Banner,In Stock,,,1,"6 1/2""x13""",1,6.50,,0.00,,0.00,1,HSS12.jpg,
Tan/Blk-LLL Sign,HSS11,(All) Knotty Products|Houses||||||||,Tan and Black House w/LLL Banner,In Stock,,,1,"6 1/2""x13""",1,6.50,,0.00,,0.00,1,HSS11.jpg,
White Weeds Fence,8PKT05,(All) Knotty Products|Sign Fences||||||||,Some See on White Wood Fence,In Stock,,,1,"12""x24""x3/4""",1,9.00,,0.00,,0.00,1,8PKT05.jpg,
White w/ BLK BOH,SLTF09,(All) Knotty Products|Fences with Wreath||||||||,White Wood Fence w/ Wreath-Cream Pips- Black BOH Banner,In Stock,,,1,"12""x18""x3/4""",1,11.25,,0.00,,0.00,1,SLTF09.jpg,
White w/ BLK FFF,SLTF07,(All) Knotty Products|Fences with Wreath||||||||,White Wood Fence w/ Wreath- Cream Pips - Black FFF Banner,In Stock,,,1,"12""x18""x3/4""",1,11.25,,0.00,,0.00,1,SLTF07.jpg,
White w/ Black,8SPKT07,(All) Knotty Products|Sign Fences||||||||,White Fence w/ Black Star,In Stock,,,1,"12""x18""x3/4""",1,8.00,,0.00,,0.00,1,8SPKT07.jpg,
White w/ Blk sm,SSTF04,(All) Knotty Products|Star Fences||||||||,"White Wood Fence w/ 8"" Black Star- Welcome",In Stock,,,1,"12""x18""x3/4""",1,7.00,,0.00,,0.00,1,SSTF04.jpg,
White w/ Burg small,SSTF03,(All) Knotty Products|Star Fences||||||||,"White Wood Fence w/ 8"" Burgundy Star- Welcome",In Stock,,,1,"12""x18""x3/4""",1,7.00,,0.00,,0.00,1,SSTF03.jpg,
White w/ Burgundy,8SPKT06,(All) Knotty Products|Sign Fences||||||||,White Fence w/ Burgundy Star,In Stock,,,1,"12""x18""x3/4""",1,8.00,,0.00,,0.00,1,8SPKT06.jpg,
White w/ CR BOH,SLTF11,(All) Knotty Products|Fences with Wreath||||||||,White Wood Fence w/ Wreath-Cream Pips- Cream BOH Banner,In Stock,,,1,"12""x18""x3/4""",1,11.25,,0.00,,0.00,1,SLTF11.jpg,
White w/ CR LLL,SLTF14,(All) Knotty Products|Fences with Wreath||||||||,White Wood Fencew/ Wreath- Cream Pips- Cream LLL Banner,In Stock,,,1,"12""x18""x3/4""",1,11.25,,0.00,,0.00,1,SLTF14.jpg,
White w/ CR WEL,SLTF13,(All) Knotty Products|Fences with Wreath||||||||,White Wood Fence w/ Wreath-Cream Pips- Cream Welcome Banner,In Stock,,,1,"12""x18""x3/4""",1,11.25,,0.00,,0.00,1,SLTF13.jpg,
White w/BLK LLL,SLTF08,(All) Knotty Products|Fences with Wreath||||||||,White Wood Fence w/ Wreath-Cream Pips-Black LLL Banner,In Stock,,,1,"12""x18""x3/4""",1,11.25,,0.00,,0.00,1,SLTF08.jpg,
White w/BLK WEL,SLTF10,(All) Knotty Products|Fences with Wreath||||||||,White Wood Fence w/ Wreath-Cream Pips- Black Welcome Banner,In Stock,,,1,"12""x18""x3/4""",1,11.25,,0.00,,0.00,1,SLTF10.jpg,
White w/CR FFF,SLTF12,(All) Knotty Products|Fences with Wreath||||||||,White Wood Fence w/ Wreath-Cream Pips- Cream FFF Banner,In Stock,,,1,"12""x18""x3/4""",1,11.25,,0.00,,0.00,1,SLTF12.jpg,
