Crystal Shroomyz Large-Emerald,cry010118,Crystal Shroomyz Large|||||||||,,,,,1,"Lenght: 16"" Cap Diameter: 6""",1,9.45,,0.00,,0.00,1,cry010118.jpg,
Crystal Shroomyz Large-Grenadine,cry010811,Crystal Shroomyz Large|||||||||,,,,,1,"Lenght: 16"" Cap Diameter: 6""",1,9.45,,0.00,,0.00,1,cry010811.jpg,
Crystal Shroomyz Large-Kiwi,cry011016,Crystal Shroomyz Large|||||||||,,,,,1,"Lenght: 16"" Cap Diameter: 6""",1,9.45,,0.00,,0.00,1,cry011016.jpg,
Crystal Shroomyz Large-Lagoon,cry010316,Crystal Shroomyz Large|||||||||,,,,,1,"Lenght: 16"" Cap Diameter: 6""",1,9.45,,0.00,,0.00,1,cry010316.jpg,
Crystal Shroomyz Large-Lemon Meringue,cry011115,Crystal Shroomyz Large|||||||||,,,,,1,"Lenght: 16"" Cap Diameter: 6""",1,9.45,,0.00,,0.00,1,cry011115.jpg,
Crystal Shroomyz Large-Orange Boquet,cry010613,Crystal Shroomyz Large|||||||||,,,,,1,"Lenght: 16"" Cap Diameter: 6""",1,9.45,,0.00,,0.00,1,cry010613.jpg,
Crystal Shroomyz Large-Plum Fantasy,cry010910,Crystal Shroomyz Large|||||||||,,,,,1,"Lenght: 16"" Cap Diameter: 6""",1,9.45,,0.00,,0.00,1,cry010910.jpg,
Crystal Shroomyz Large-Tropical Fire,cry010712,Crystal Shroomyz Large|||||||||,,,,,1,"Lenght: 16"" Cap Diameter: 6""",1,9.45,,0.00,,0.00,1,cry010712.jpg,
Crystal Shroomyz Large-Wildfire,cry010415,Crystal Shroomyz Large|||||||||,,,,,1,"Lenght: 16"" Cap Diameter: 6""",1,9.45,,0.00,,0.00,1,cry010415.jpg,
Crystal Shroomyz Medium Large-Assorted Color,cry010026,Crystal Shroomyz Medium Large|||||||||,,,,,1,"Lenght: 14"" Cap Diameter: 5.5""",1,7.95,,0.00,,0.00,1,cry010026.jpg,
Crystal Shroomyz Medium Large-Blueberry,cry010224,Crystal Shroomyz Medium Large|||||||||,,,,,1,"Lenght: 14"" Cap Diameter: 5.5""",1,7.95,,0.00,,0.00,1,cry010224.jpg,
Crystal Shroomyz Medium Large-Calypso,cry010521,Crystal Shroomyz Medium Large|||||||||,,,,,1,"Lenght: 14"" Cap Diameter: 5.5""",1,7.95,,0.00,,0.00,1,cry010521.jpg,
Crystal Shroomyz Medium Large-Emerald,cry010125,Crystal Shroomyz Medium Large|||||||||,,,,,1,"Lenght: 14"" Cap Diameter: 5.5""",1,7.95,,0.00,,0.00,1,cry010125.jpg,
Crystal Shroomyz Medium Large-Grenadine,cry010828,Crystal Shroomyz Medium Large|||||||||,,,,,1,"Lenght: 14"" Cap Diameter: 5.5""",1,7.95,,0.00,,0.00,1,cry010828.jpg,
Crystal Shroomyz Medium Large-Kiwi,cry011023,Crystal Shroomyz Medium Large|||||||||,,,,,1,"Lenght: 14"" Cap Diameter: 5.5""",1,7.95,,0.00,,0.00,1,cry011023.jpg,
Crystal Shroomyz Medium Large-Lagoon,cry010323,Crystal Shroomyz Medium Large|||||||||,,,,,1,"Lenght: 14"" Cap Diameter: 5.5""",1,7.95,,0.00,,0.00,1,cry010323.jpg,
Crystal Shroomyz Medium Large-Lemon Meringue,cry011122,Crystal Shroomyz Medium Large|||||||||,,,,,1,"Lenght: 14"" Cap Diameter: 5.5""",1,7.95,,0.00,,0.00,1,cry011122.jpg,
Crystal Shroomyz Medium Large-Orange Boquet,cry010620,Crystal Shroomyz Medium Large|||||||||,,,,,1,"Lenght: 14"" Cap Diameter: 5.5""",1,7.95,,0.00,,0.00,1,cry010620.jpg,
Crystal Shroomyz Medium Large-Plum Fantasy,cry010927,Crystal Shroomyz Medium Large|||||||||,,,,,1,"Lenght: 14"" Cap Diameter: 5.5""",1,7.95,,0.00,,0.00,1,cry010927.jpg,
Crystal Shroomyz Medium Large-Tropical Fire,cry010729,Crystal Shroomyz Medium Large|||||||||,,,,,1,"Lenght: 14"" Cap Diameter: 5.5""",1,7.95,,0.00,,0.00,1,cry010729.jpg,
Crystal Shroomyz Medium Large-Wildfire,cry010422,Crystal Shroomyz Medium Large|||||||||,,,,,1,"Lenght: 14"" Cap Diameter: 5.5""",1,7.95,,0.00,,0.00,1,cry010422.jpg,
Crystal Shroomyz Medium Small-Assorted Color,cry010033,Crystal Shroomyz Medium|||||||||,,,,,1,"Lenght: 12"" Cap Diameter: 4.5",1,5.60,,0.00,,0.00,1,cry010033.jpg,
Crystal Shroomyz Medium Small-Blueberry,cry010231,Crystal Shroomyz Medium|||||||||,,,,,1,"Lenght: 12"" Cap Diameter: 4.5",1,5.60,,0.00,,0.00,1,cry010231.jpg,
Crystal Shroomyz Medium Small-Calypso,cry010538,Crystal Shroomyz Medium|||||||||,,,,,1,"Lenght: 12"" Cap Diameter: 4.5",1,5.60,,0.00,,0.00,1,cry010538.jpg,
Crystal Shroomyz Medium Small-Emerald,cry010132,Crystal Shroomyz Medium|||||||||,,,,,1,"Lenght: 12"" Cap Diameter: 4.5",1,5.60,,0.00,,0.00,1,cry010132.jpg,
Crystal Shroomyz Medium Small-Grenadine,cry010835,Crystal Shroomyz Medium|||||||||,,,,,1,"Lenght: 12"" Cap Diameter: 4.5",1,5.60,,0.00,,0.00,1,cry010835.jpg,
Crystal Shroomyz Medium Small-Kiwi,cry011030,Crystal Shroomyz Medium|||||||||,,,,,1,"Lenght: 12"" Cap Diameter: 4.5",1,5.60,,0.00,,0.00,1,cry011030.jpg,
Crystal Shroomyz Medium Small-Lagoon,cry010330,Crystal Shroomyz Medium|||||||||,,,,,1,"Lenght: 12"" Cap Diameter: 4.5",1,5.60,,0.00,,0.00,1,cry010330.jpg,
Crystal Shroomyz Medium Small-Lemon Meringue,cry011139,Crystal Shroomyz Medium|||||||||,,,,,1,"Lenght: 12"" Cap Diameter: 4.5",1,5.60,,0.00,,0.00,1,cry011139.jpg,
Crystal Shroomyz Medium Small-Orange Boquet,cry010637,Crystal Shroomyz Medium|||||||||,,,,,1,"Lenght: 12"" Cap Diameter: 4.5",1,5.60,,0.00,,0.00,1,cry010637.jpg,
Crystal Shroomyz Medium Small-Plum Fantasy,cry010934,Crystal Shroomyz Medium|||||||||,,,,,1,"Lenght: 12"" Cap Diameter: 4.5",1,5.60,,0.00,,0.00,1,cry010934.jpg,
Crystal Shroomyz Medium Small-Tropical Fire,cry010736,Crystal Shroomyz Medium|||||||||,,,,,1,"Lenght: 12"" Cap Diameter: 4.5",1,5.60,,0.00,,0.00,1,cry010736.jpg,
Crystal Shroomyz Medium Small-Wildfire,cry010439,Crystal Shroomyz Medium|||||||||,,,,,1,"Lenght: 12"" Cap Diameter: 4.5",1,5.60,,0.00,,0.00,1,cry010439.jpg,
Crystal Shroomyz Mini-Assorted Color,cry010057,Crystal Shroomyz Mini|||||||||,,,,,1,"Lenght: 8"" Cap Diameter: 2.5""",1,2.90,,0.00,,0.00,1,cry010057.jpg,
Crystal Shroomyz Mini-Blueberry,cry010255,Crystal Shroomyz Mini|||||||||,,,,,1,"Lenght: 8"" Cap Diameter: 2.5""",1,2.90,,0.00,,0.00,1,cry010255.jpg,
Crystal Shroomyz Mini-Calypso,cry010552,Crystal Shroomyz Mini|||||||||,,,,,1,"Lenght: 8"" Cap Diameter: 2.5""",1,2.90,,0.00,,0.00,1,cry010552.jpg,
Crystal Shroomyz Mini-Emerald,cry010156,Crystal Shroomyz Mini|||||||||,,,,,1,"Lenght: 8"" Cap Diameter: 2.5""",1,2.90,,0.00,,0.00,1,cry010156.jpg,
Crystal Shroomyz Mini-Grenadine,cry010859,Crystal Shroomyz Mini|||||||||,,,,,1,"Lenght: 8"" Cap Diameter: 2.5""",1,2.90,,0.00,,0.00,1,cry010859.jpg,
Crystal Shroomyz Mini-Kiwi,cry011054,Crystal Shroomyz Mini|||||||||,,,,,1,"Lenght: 8"" Cap Diameter: 2.5""",1,2.90,,0.00,,0.00,1,cry011054.jpg,
Crystal Shroomyz Mini-Lagoon,cry010354,Crystal Shroomyz Mini|||||||||,,,,,1,"Lenght: 8"" Cap Diameter: 2.5""",1,2.90,,0.00,,0.00,1,cry010354.jpg,
Crystal Shroomyz Mini-Lemon Meringue,cry011153,Crystal Shroomyz Mini|||||||||,,,,,1,"Lenght: 8"" Cap Diameter: 2.5""",1,2.90,,0.00,,0.00,1,cry011153.jpg,
Crystal Shroomyz Mini-Orange Boquet,cry010651,Crystal Shroomyz Mini|||||||||,,,,,1,"Lenght: 8"" Cap Diameter: 2.5""",1,2.90,,0.00,,0.00,1,cry010651.jpg,
Crystal Shroomyz Mini-Plum Fantasy,cry010958,Crystal Shroomyz Mini|||||||||,,,,,1,"Lenght: 8"" Cap Diameter: 2.5""",1,2.90,,0.00,,0.00,1,cry010958.jpg,
Crystal Shroomyz Mini-Tropical Fire,cry010750,Crystal Shroomyz Mini|||||||||,,,,,1,"Lenght: 8"" Cap Diameter: 2.5""",1,2.90,,0.00,,0.00,1,cry010750.jpg,
Crystal Shroomyz Mini-Wildfire,cry010453,Crystal Shroomyz Mini|||||||||,,,,,1,"Lenght: 8"" Cap Diameter: 2.5""",1,2.90,,0.00,,0.00,1,cry010453.jpg,
Crystal Shroomyz Small-Assorted Color,cry010040,Crystal Shroomyz Small|||||||||,,,,,1,"Lenght: 10"" Cap Diameter: 3.5""",1,4.95,,0.00,,0.00,1,cry010040.jpg,
Crystal Shroomyz Small-Blueberry,cry010248,Crystal Shroomyz Small|||||||||,,,,,1,"Lenght: 10"" Cap Diameter: 3.5""",1,4.95,,0.00,,0.00,1,cry010248.jpg,
Crystal Shroomyz Small-Calypso,cry010545,Crystal Shroomyz Small|||||||||,,,,,1,"Lenght: 10"" Cap Diameter: 3.5""",1,4.95,,0.00,,0.00,1,cry010545.jpg,
Crystal Shroomyz Small-Emerald,cry010149,Crystal Shroomyz Small|||||||||,,,,,1,"Lenght: 10"" Cap Diameter: 3.5""",1,4.95,,0.00,,0.00,1,cry010149.jpg,
Crystal Shroomyz Small-Grenadine,cry010842,Crystal Shroomyz Small|||||||||,,,,,1,"Lenght: 10"" Cap Diameter: 3.5""",1,4.95,,0.00,,0.00,1,cry010842.jpg,
Crystal Shroomyz Small-Kiwi,cry011047,Crystal Shroomyz Small|||||||||,,,,,1,"Lenght: 10"" Cap Diameter: 3.5""",1,4.95,,0.00,,0.00,1,cry011047.jpg,
Crystal Shroomyz Small-Lagoon,cry010347,Crystal Shroomyz Small|||||||||,,,,,1,"Lenght: 10"" Cap Diameter: 3.5""",1,4.95,,0.00,,0.00,1,cry010347.jpg,
Crystal Shroomyz Small-Lemon Meringue,cry011146,Crystal Shroomyz Small|||||||||,,,,,1,"Lenght: 10"" Cap Diameter: 3.5""",1,4.95,,0.00,,0.00,1,cry011146.jpg,
Crystal Shroomyz Small-Orange Boquet,cry010644,Crystal Shroomyz Small|||||||||,,,,,1,"Lenght: 10"" Cap Diameter: 3.5""",1,4.95,,0.00,,0.00,1,cry010644.jpg,
Crystal Shroomyz Small-Plum Fantasy,cry010941,Crystal Shroomyz Small|||||||||,,,,,1,"Lenght: 10"" Cap Diameter: 3.5""",1,4.95,,0.00,,0.00,1,cry010941.jpg,
Crystal Shroomyz Small-Tropical Fire,cry010743,Crystal Shroomyz Small|||||||||,,,,,1,"Lenght: 10"" Cap Diameter: 3.5""",1,4.95,,0.00,,0.00,1,cry010743.jpg,
Crystal Shroomyz Small-Wildfire,cry010446,Crystal Shroomyz Small|||||||||,,,,,1,"Lenght: 10"" Cap Diameter: 3.5""",1,4.95,,0.00,,0.00,1,cry010446.jpg,
Crystal Shroomyz Spectacular Pack  (171 Piece - 1 price),spec310003,Starter Packs (Prepacks)|||||||||,"You get a large starter group of 21 Large, 30 Medium Large, 27 Medium Small, 51 Small, 42 Mini (171 pieces total). This is a perfect starter set of our best selling Crystal Shroomyz.",,,,1,,1,936.00,,0.00,,0.00,1,spec310003.jpg,
Crystal Shroomyz Splendor Pack  (114 Piece - 1 price),splen300004,Starter Packs (Prepacks)|||||||||,"You get a medium starter group of 14 Large, 20 Medium Large, 18 Medium Small, 34 Small, 28 Mini (114 pieces total). This is a perfect starter set of our best selling Crystal Shroomyz.",,,,1,,1,624.00,,0.00,,0.00,1,splen300004.jpg,
Crystal Shroomyz Starter Pack (57 Piece - 1 price),star110009,Starter Packs (Prepacks)|||||||||,"You get a small starter group of 7 Large, 10 Medium Large, 9 Medium Small, 17 Small, 14 Mini (57 pieces total). This is a perfect starter set of our best selling Crystal Shroomyz.",,,,1,,1,312.00,,0.00,,0.00,1,star110009.jpg,
Drifter L- Medium,drif090028,Miscellaneous Products|||||||||,"These rustic Drifters floated down the JJ Potts production line, now let them wash ashore in your backyard.  Drifters make great birdbath accents, planters, toad houses and display pieces.  Each drifter is hand cut and sculpted  from our durable earth toned stoneware clay and will be a timeless addition to your home or garden",,,,1,"Length: 14"" Diameter: 4""",1,10.00,,0.00,,0.00,1,drif090028.jpg,
Drifter L-Large,drif090011,Miscellaneous Products|||||||||,"These rustic Drifters floated down the JJ Potts production line, now let them wash ashore in your backyard.  Drifters make great birdbath accents, planters, toad houses and display pieces.  Each drifter is hand cut and sculpted  from our durable earth toned stoneware clay and will be a timeless addition to your home or garden",,,,1,"Length: 16"" Diameter: 4.5""",1,13.00,,0.00,,0.00,1,drif090011.jpg,
Drifter L-Small,drif090035,Miscellaneous Products|||||||||,"These rustic Drifters floated down the JJ Potts production line, now let them wash ashore in your backyard.  Drifters make great birdbath accents, planters, toad houses and display pieces.  Each drifter is hand cut and sculpted  from our durable earth toned stoneware clay and will be a timeless addition to your home or garden",,,,1,"Length: 12"" Diameter: 3.5""",1,7.50,,0.00,,0.00,1,drif090035.jpg,
Fantasy Shroomyz Large-Assorted Color,fan030017,Fantasy Shroomyz|||||||||,,,,,1,"Lenght: 16"" Cap Diameter: 6""",1,9.45,,0.00,,0.00,1,fan030017.jpg,
Fantasy Shroomyz Medium Large-Assorted Color,fan030024,Fantasy Shroomyz|||||||||,,,,,1,"Lenght: 14"" Cap Diameter: 5.5""",1,7.95,,0.00,,0.00,1,fan030024.jpg,
Fantasy Shroomyz Medium Small-Assorted Color,fan030031,Fantasy Shroomyz|||||||||,,,,,1,"Lenght: 12"" Cap Diameter: 4.5",1,5.60,,0.00,,0.00,1,fan030031.jpg,
Fantasy Shroomyz Mini-Assorted Color,fan030055,Fantasy Shroomyz|||||||||,,,,,1,"Lenght: 8"" Cap Diameter: 2.5""",1,2.90,,0.00,,0.00,1,fan030055.jpg,
Fantasy Shroomyz Small-Assorted Color,fan030048,Fantasy Shroomyz|||||||||,,,,,1,"Lenght: 10"" Cap Diameter: 3.5""",1,4.95,,0.00,,0.00,1,fan030048.jpg,
Fantasy Shroomyz Spectacular Pack  (171 Piece - 1 price),spec370007,Starter Packs (Prepacks)|||||||||,"You get a large starter group of 21 Large, 30 Medium Large, 27 Medium Small, 51 Small, 42 Mini (171 pieces total). This is a perfect starter set of our best selling Fantasy Shroomyz.",,,,1,,1,936.00,,0.00,,0.00,1,spec370007.jpg,
Fantasy Shroomyz Splendor Pack  (114 Piece - 1 price),splen360008,Starter Packs (Prepacks)|||||||||,"You get a medium starter group of 14 Large, 20 Medium Large, 18 Medium Small, 34 Small, 28 Mini (114 pieces total). This is a perfect starter set of our best selling Fantasy Shroomyz.",,,,1,,1,624.00,,0.00,,0.00,1,splen360008.jpg,
Fantasy Shroomyz Starter Pack (57 Piece - 1 price),star350009,Starter Packs (Prepacks)|||||||||,"You get a small starter group of 7 Large, 10 Medium Large, 9 Medium Small, 17 Small, 14 Mini (57 pieces total). This is a perfect starter set of our best selling Fantasy Shroomyz.",,,,1,,1,312.00,,0.00,,0.00,1,star350009.jpg,
Flutterby Mini Assorted Color,flut130045,Miscellaneous Products|||||||||,"From the mini pick to the large garden stake the Flutterbyz’ will add life to any garden.  The Flutterbyz collection is alive with color, boasting our brightest Funtasmic glazes.  Formed and then hand glazed each piece is truly unique.  Made from JJ Potts durable all weather stoneware, Flutterbyz will add color to your garden for years to come.  They won’t fade, rot, or weather.  Each piece has an embedded brass insert that threads onto the provided metal stake for an extra secure connection.  Feel at ease that your Flutterby won’t try to take flight in a sudden gust of wind",,,,1,"Wing Span: 3.5"" Stake Length: 18""",10,4.00,,0.00,,0.00,10,flut130045.jpg,
Flutterbyz Large Assorted Color,flut130014,Miscellaneous Products|||||||||,"From the mini pick to the large garden stake the Flutterbyz’ will add life to any garden.  The Flutterbyz collection is alive with color, boasting our brightest Funtasmic glazes.  Formed and then hand glazed each piece is truly unique.  Made from JJ Potts durable all weather stoneware, Flutterbyz will add color to your garden for years to come.  They won’t fade, rot, or weather.  Each piece has an embedded brass insert that threads onto the provided metal stake for an extra secure connection.  Feel at ease that your Flutterby won’t try to take flight in a sudden gust of wind",,,,1,"Wing Span: 11"" Stake Length: 36-42""",5,12.50,,0.00,,0.00,5,flut130014.jpg,
Flutterbyz Medium Assorted Color,flut130021,Miscellaneous Products|||||||||,"From the mini pick to the large garden stake the Flutterbyz’ will add life to any garden.  The Flutterbyz collection is alive with color, boasting our brightest Funtasmic glazes.  Formed and then hand glazed each piece is truly unique.  Made from JJ Potts durable all weather stoneware, Flutterbyz will add color to your garden for years to come.  They won’t fade, rot, or weather.  Each piece has an embedded brass insert that threads onto the provided metal stake for an extra secure connection.  Feel at ease that your Flutterby won’t try to take flight in a sudden gust of wind",,,,1,"Wing Span: 9.5"" Stake Length: 36-42""",5,10.50,,0.00,,0.00,5,flut130021.jpg,
Flutterbyz Small Assorted Color,flut130038,Miscellaneous Products|||||||||,"From the mini pick to the large garden stake the Flutterbyz’ will add life to any garden.  The Flutterbyz collection is alive with color, boasting our brightest Funtasmic glazes.  Formed and then hand glazed each piece is truly unique.  Made from JJ Potts durable all weather stoneware, Flutterbyz will add color to your garden for years to come.  They won’t fade, rot, or weather.  Each piece has an embedded brass insert that threads onto the provided metal stake for an extra secure connection.  Feel at ease that your Flutterby won’t try to take flight in a sudden gust of wind",,,,1,"Wing Span: 7"" Stake Length: 36-42""",5,8.50,,0.00,,0.00,5,flut130038.jpg,
Funtasmic  Shroomyz Spectacular Pack  (171 Piece - 1 price),spec340000,Starter Packs (Prepacks)|||||||||,"You get a large starter group of 21 Large, 30 Medium Large, 27 Medium Small, 51 Small, 42 Mini (171 pieces total). This is a perfect starter set of our best selling Funtasmic Shroomyz.",,,,1,,1,936.00,,0.00,,0.00,1,spec340000.jpg,
Funtasmic  Shroomyz Splendor Pack  (114 Piece - 1 price),splen330001,Starter Packs (Prepacks)|||||||||,"You get a medium starter group of 14 Large, 20 Medium Large, 18 Medium Small, 34 Small, 28 Mini (114 pieces total).  This is a perfect starter set of our best selling Funtasmic Shroomyz.",,,,1,,1,624.00,,0.00,,0.00,1,splen330001.jpg,
Funtasmic  Shroomyz Starter Pack  (57 Piece - 1 price),star320002,Starter Packs (Prepacks)|||||||||,"You get a small starter group of 7 Large, 10 Medium Large, 9 Medium Small, 17 Small, 14 Mini (57 pieces total). This is a perfect starter set of our best selling Funtasmic Shroomyz.",,,,1,,1,312.00,,0.00,,0.00,1,star320002.jpg,
Funtasmic Shroomyz Large-Assorted Color,fun020018,Funtasmic Shroomyz|||||||||,,,,,1,"Lenght: 16"" Cap Diameter: 6""",1,9.45,,0.00,,0.00,1,fun020018.jpg,
Funtasmic Shroomyz Medium Large-Assorted Color,fun020025,Funtasmic Shroomyz|||||||||,,,,,1,"Lenght: 14"" Cap Diameter: 5.5""",1,7.95,,0.00,,0.00,1,fun020025.jpg,
Funtasmic Shroomyz Medium Small-Assorted Color,fun020032,Funtasmic Shroomyz|||||||||,,,,,1,"Lenght: 12"" Cap Diameter: 4.5",1,5.60,,0.00,,0.00,1,fun020032.jpg,
Funtasmic Shroomyz Mini-Assorted Color,fun020056,Funtasmic Shroomyz|||||||||,,,,,1,"Lenght: 8"" Cap Diameter: 2.5""",1,2.90,,0.00,,0.00,1,fun020056.jpg,
Funtasmic Shroomyz Small-Assorted Color,fun020049,Funtasmic Shroomyz|||||||||,,,,,1,"Lenght: 10"" Cap Diameter: 3.5""",1,4.95,,0.00,,0.00,1,fun020049.jpg,
Garden House Large Assorted Color,gard200011,Miscellaneous Products|||||||||,"Hewn from the trunk of a grand old oak tree, or at least made to look so, the JJ Potts Garden House is sure to invite a host of welcome garden visitors.  From toads to fairies to other fanciful friends, it’s anyone’s guess who will call this Garden House “Home”.  Each house is crafted by artisans using our weather-proof, durable stoneware.  This garden house will withstand the harshest weather and is sure to be a welcome addition to your garden for years to come.",,,,1,"Height: 11"" Diameter: 11.5""",4,22.00,,0.00,,0.00,4,gard200011.jpg,
Garden House Large-Green,gard200113,Miscellaneous Products|||||||||,"Hewn from the trunk of a grand old oak tree, or at least made to look so, the JJ Potts Garden House is sure to invite a host of welcome garden visitors.  From toads to fairies to other fanciful friends, it’s anyone’s guess who will call this Garden House “Home”.  Each house is crafted by artisans using our weather-proof, durable stoneware.  This garden house will withstand the harshest weather and is sure to be a welcome addition to your garden for years to come.",,,,1,"Height: 11"" Diameter: 11.5""",4,22.00,,0.00,,0.00,4,gard200113.jpg,
Garden House Large-Yellow,gard200212,Miscellaneous Products|||||||||,"Hewn from the trunk of a grand old oak tree, or at least made to look so, the JJ Potts Garden House is sure to invite a host of welcome garden visitors.  From toads to fairies to other fanciful friends, it’s anyone’s guess who will call this Garden House “Home”.  Each house is crafted by artisans using our weather-proof, durable stoneware.  This garden house will withstand the harshest weather and is sure to be a welcome addition to your garden for years to come.",,,,1,"Height: 11"" Diameter: 11.5""",4,22.00,,0.00,,0.00,4,gard200212.jpg,
Garden House Small Assorted Color,gard200024,Miscellaneous Products|||||||||,"Hewn from the trunk of a grand old oak tree, or at least made to look so, the JJ Potts Garden House is sure to invite a host of welcome garden visitors.  From toads to fairies to other fanciful friends, it’s anyone’s guess who will call this Garden House “Home”.  Each house is crafted by artisans using our weather-proof, durable stoneware.  This garden house will withstand the harshest weather and is sure to be a welcome addition to your garden for years to come.",,,,1,"Height: 8"" Diameter: 8.5""",4,16.00,,0.00,,0.00,4,gard200024.jpg,
Garden House Small-Green,gard200120,Miscellaneous Products|||||||||,"Hewn from the trunk of a grand old oak tree, or at least made to look so, the JJ Potts Garden House is sure to invite a host of welcome garden visitors.  From toads to fairies to other fanciful friends, it’s anyone’s guess who will call this Garden House “Home”.  Each house is crafted by artisans using our weather-proof, durable stoneware.  This garden house will withstand the harshest weather and is sure to be a welcome addition to your garden for years to come.",,,,1,"Height: 8"" Diameter: 8.5""",4,16.00,,0.00,,0.00,4,gard200120.jpg,
Garden House Small-Yellow,gard200229,Miscellaneous Products|||||||||,"Hewn from the trunk of a grand old oak tree, or at least made to look so, the JJ Potts Garden House is sure to invite a host of welcome garden visitors.  From toads to fairies to other fanciful friends, it’s anyone’s guess who will call this Garden House “Home”.  Each house is crafted by artisans using our weather-proof, durable stoneware.  This garden house will withstand the harshest weather and is sure to be a welcome addition to your garden for years to come.",,,,1,"Height: 8"" Diameter: 8.5""",4,16.00,,0.00,,0.00,4,gard200229.jpg,
Gourd House (Assorted Color),feed630002,Packs Feeders & Houses|||||||||,,,,,1,,8,14.50,,0.00,,0.00,8,feed630002.jpg,
Gourd House-Assorted Color,feed080005,Gourd House|||||||||,,,,,1,"Gourd Diameter: 5.5""  Roof Diameter: 7.5""",1,14.50,,0.00,,0.00,1,feed080005.jpg,
Gourd House-Blueberry,feed080203,Gourd House|||||||||,,,,,1,"Gourd Diameter: 5.5""  Roof Diameter: 7.5""",1,14.50,,0.00,,0.00,1,feed080203.jpg,
Gourd House-Cherry Bomb,feed080609,Gourd House|||||||||,,,,,1,"Gourd Diameter: 5.5""  Roof Diameter: 7.5""",1,14.50,,0.00,,0.00,1,feed080609.jpg,
Gourd House-Emerald,feed080104,Gourd House|||||||||,,,,,1,"Gourd Diameter: 5.5""  Roof Diameter: 7.5""",1,14.50,,0.00,,0.00,1,feed080104.jpg,
Gourd House-Firetruck,feed081002,Gourd House|||||||||,,,,,1,"Gourd Diameter: 5.5""  Roof Diameter: 7.5""",1,14.50,,0.00,,0.00,1,feed081002.jpg,
Gourd House-Frosty Blue,feed080708,Gourd House|||||||||,,,,,1,"Gourd Diameter: 5.5""  Roof Diameter: 7.5""",1,14.50,,0.00,,0.00,1,feed080708.jpg,
Gourd House-Fuzzy Peach,feed080302,Gourd House|||||||||,,,,,1,"Gourd Diameter: 5.5""  Roof Diameter: 7.5""",1,14.50,,0.00,,0.00,1,feed080302.jpg,
Gourd House-Grape Goodness,feed080401,Gourd House|||||||||,,,,,1,"Gourd Diameter: 5.5""  Roof Diameter: 7.5""",1,14.50,,0.00,,0.00,1,feed080401.jpg,
Gourd House-Grenadine,feed080807,Gourd House|||||||||,,,,,1,"Gourd Diameter: 5.5""  Roof Diameter: 7.5""",1,14.50,,0.00,,0.00,1,feed080807.jpg,
Gourd House-Lemon Lime,feed080500,Gourd House|||||||||,,,,,1,"Gourd Diameter: 5.5""  Roof Diameter: 7.5""",1,14.50,,0.00,,0.00,1,feed080500.jpg,
Gourd House-Plum,feed080906,Gourd House|||||||||,,,,,1,"Gourd Diameter: 5.5""  Roof Diameter: 7.5""",1,14.50,,0.00,,0.00,1,feed080906.jpg,
Green Reindeer Moss,moss210204,Miscellaneous Products|||||||||,,,,,1,11 oz bag,1,10.50,,0.00,,0.00,1,moss210204.jpg,
Half Wine Barrel Display,disp210105,Miscellaneous Products|||||||||,,,,,1,"25"" Diameter 18"" Tall",1,60.00,,0.00,,0.00,1,disp210105.jpg,
Large Glazed Tube Feeder -Assorted Color,feed100017,Gourd Glazed Tube Feeder|||||||||,,,,,1,"Length: 15""  Roof Diameter: 7.5""",1,22.00,,0.00,,0.00,1,feed060113.jpg,
Large Glazed Tube Feeder -Blueberry,feed100215,Gourd Glazed Tube Feeder|||||||||,,,,,1,"Length: 15""  Roof Diameter: 7.5""",1,22.00,,0.00,,0.00,1,feed060212.jpg,
Large Glazed Tube Feeder -Cherry Bomb,feed100611,Gourd Glazed Tube Feeder|||||||||,,,,,1,"Length: 15""  Roof Diameter: 7.5""",1,22.00,,0.00,,0.00,1,feed060618.jpg,
Large Glazed Tube Feeder -Emerald,feed100116,Gourd Glazed Tube Feeder|||||||||,,,,,1,"Length: 15""  Roof Diameter: 7.5""",1,22.00,,0.00,,0.00,1,feed060113.jpg,
Large Glazed Tube Feeder -Firetruck,feed101014,Gourd Glazed Tube Feeder|||||||||,,,,,1,"Length: 15""  Roof Diameter: 7.5""",1,22.00,,0.00,,0.00,1,feed061011.jpg,
Large Glazed Tube Feeder -Frosty Blue,feed100710,Gourd Glazed Tube Feeder|||||||||,,,,,1,"Length: 15""  Roof Diameter: 7.5""",1,22.00,,0.00,,0.00,1,feed060717.jpg,
Large Glazed Tube Feeder -Fuzzy Peach,feed100314,Gourd Glazed Tube Feeder|||||||||,,,,,1,"Length: 15""  Roof Diameter: 7.5""",1,22.00,,0.00,,0.00,1,feed060311.jpg,
Large Glazed Tube Feeder -Grape Goodness,feed100413,Gourd Glazed Tube Feeder|||||||||,,,,,1,"Length: 15""  Roof Diameter: 7.5""",1,22.00,,0.00,,0.00,1,feed060410.jpg,
Large Glazed Tube Feeder -Grenadine,feed100819,Gourd Glazed Tube Feeder|||||||||,,,,,1,"Length: 15""  Roof Diameter: 7.5""",1,22.00,,0.00,,0.00,1,feed060816.jpg,
Large Glazed Tube Feeder -Lemon Lime,feed100512,Gourd Glazed Tube Feeder|||||||||,,,,,1,"Length: 15""  Roof Diameter: 7.5""",1,22.00,,0.00,,0.00,1,feed060519.jpg,
Large Glazed Tube Feeder -Plum,feed100918,Gourd Glazed Tube Feeder|||||||||,,,,,1,"Length: 15""  Roof Diameter: 7.5""",1,22.00,,0.00,,0.00,1,feed060915.jpg,
Large Glazed Tube Feeder Assorted Color 6 Pack,feed660016,Packs Feeders & Houses|||||||||,,,,,1,,6,22.00,,0.00,,0.00,6,feed660016.jpg,
Large Natural Tube Feeder -Assorted Color,feed060014,Natural Tube Feeder|||||||||,,,,,1,"Length: 15""  Roof Diameter: 7.5""",1,22.00,,0.00,,0.00,1,feed060113.jpg,
Large Natural Tube Feeder -Blueberry,feed060212,Natural Tube Feeder|||||||||,,,,,1,"Length: 15""  Roof Diameter: 7.5""",1,22.00,,0.00,,0.00,1,feed060212.jpg,
Large Natural Tube Feeder -Cherry Bomb,feed060618,Natural Tube Feeder|||||||||,,,,,1,"Length: 15""  Roof Diameter: 7.5""",1,22.00,,0.00,,0.00,1,feed060618.jpg,
