AUTUMN TRADITIONS ART COLLECTION,F701120089,,"“After a day of hunting, Dad has gathered up the children and is helping them fulfill their special autumn tradition; picking out pumpkins for Halloween. There are many stories in this romantic image: the shotgun in the old pickup’s back window, the extra gas tank and a red flag tied high on the antenna. The pole and tree signs tell us there are many people lucky enough to live in this idyllic setting. And, as the moon struggles through a hazy night sky, flights of ducks recognize it's time to head on home for the evening.”

Limited edition of 9,500 signed and numbered art prints made from the original oil painting. Image size, 18-1/2"" x 32"". Choose from 3 framing options. Artist proof edition of 950 signed and numbered prints. Image size, 18-1/2"" x 32"". Elite open edition print. Image size, 14"" x 24"". Choose from 5 framing options.",,,,,,,1,99,,,,,1,wildwings400,wildwings160,https://cdn.shopify.com/s/files/1/0165/1821/7782/products/autumn-traditions-framed-limited-edition-print-terry-redlin-F701120089_2000x.jpg?v=1623820185,autumn-traditions-framed-limited-edition-print-terry-redlin-F701120089_2000x.jpg?v=1623820185,,,wildwings800,autumn-traditions-framed-limited-edition-print-terry-redlin-F701120089_2000x.jpg?v=1623820185
SUMMER ON THE GREEN II STAINED GLASS ART,5386497728,,"Nature's splendor can be enjoyed by outdoorsmen of varied interests. After a day of fishing downstream, paddlers quietly head home on a river that snakes through a golf course of many water hazards. A golf ball drops on the nearby green as mallards fly overhead. Only the unseen flag's low hanging shadow informs us that light is fading fast.

Let the light shine! New stained glass art hangings show their true colors when back-lit with natural sunlight. Popular designs are printed on glass with fade resistant inks and framed with 3/4"" black-finished moulding. 9""H. Ready to hang with provided chain. Designed, printed, and assembled in USA.",,,,,,,1,99,,,,,1,wildwings400,wildwings160,https://cdn.shopify.com/s/files/1/0165/1821/7782/products/summer-on-the-greens-ii-9x8-frm-ovl-glsredli-5386497728_2000x.jpg?v=1623383138,summer-on-the-greens-ii-9x8-frm-ovl-glsredli-5386497728_2000x.jpg?v=1623383138,,,wildwings800,summer-on-the-greens-ii-9x8-frm-ovl-glsredli-5386497728_2000x.jpg?v=1623383138
JOSIE—HORSES ART COLLECTION,F195369081,,"“A friend of mine kept telling me how cute her neighbor’s foals were, and she was right. I had a hard time deciding which foal to paint, but in the end I couldn’t resist Josie and her mother.”

Limited edition of 450 signed and numbered art prints made from the original oil painting. Image size, 18"" x 24"". Published exclusively by Wild Wings.",,,,,,,1,99,,,,,1,wildwings400,wildwings160,https://cdn.shopify.com/s/files/1/0165/1821/7782/products/framed-horse-art-print-josie-by-chris-cummings-F195369081d_2000x.jpg?v=1623818900,framed-horse-art-print-josie-by-chris-cummings-F195369081d_2000x.jpg?v=1623818900,,,wildwings800,framed-horse-art-print-josie-by-chris-cummings-F195369081d_2000x.jpg?v=1623818900
SILENT FLIGHT HORIZON ART COLLECTION,F701483889,,"Considered by many to be a painter only of waterfowl and upland game birds, in reality Terry Redlin's interests extend well beyond the boundaries of redheads and ring-necks. This painting of the great horned owl offers a good example of, not only his subject versatility, but also his skillful handling of landscape detail, atmospheric mood and arresting composition. As darkness approaches the owl is preparing for an evening of good hunting. Its ability to maneuver in near perfect silence means trouble for all small nocturnal animals. Few people are privileged to see this largest of our eared owls, but you may have heard its soft and haunting 'hoo-hoo-hoooo' from deep in the night.

From the Horizon Collection of horizontal, open edition prints, excerpted from previous Redlin releases. Image size, 8-1/2"" x 27"". Choose from 5 framing options.",,,,,,,1,99,,,,,1,wildwings400,wildwings160,https://cdn.shopify.com/s/files/1/0165/1821/7782/products/silent-flight-horizon-framed-horizon-print-terry-redlin-F701483889_2000x.jpg?v=1623820216,silent-flight-horizon-framed-horizon-print-terry-redlin-F701483889_2000x.jpg?v=1623820216,,,wildwings800,silent-flight-horizon-framed-horizon-print-terry-redlin-F701483889_2000x.jpg?v=1623820216
SHORELINE PROCESSION ART COLLECTION,F771700092,,"The reflections and rocky shore set the pace for this painting, 'Shoreline Procession. ' I wanted to capture the size of an adult, along with the clone-knit bond between the mother and calf, which I have observed while researching these awesome animals.

Limited edition of 950 signed and numbered prints. Image size, 17"" x 28"". A Wild Wings exclusive.",,,,,,,1,99,,,,,1,wildwings400,wildwings160,https://cdn.shopify.com/s/files/1/0165/1821/7782/products/framed-orca-killer-whales-art-print-shoreline-procession-by-randall-scott-F771700092d_2000x.jpg?v=1623819025,framed-orca-killer-whales-art-print-shoreline-procession-by-randall-scott-F771700092d_2000x.jpg?v=1623819025,,,wildwings800,framed-orca-killer-whales-art-print-shoreline-procession-by-randall-scott-F771700092d_2000x.jpg?v=1623819025
COLORFUL DAYDREAM ART COLLECTION,1058187085,,"Open edition of 11"" x 14"" art prints are the perfect size to fill a smaller space in your home. Published exclusively by Art Brand Studios. Made in USA.",,,,,,,1,99,,,,,1,wildwings400,wildwings160,https://cdn.shopify.com/s/files/1/0165/1821/7782/products/colorful-daydream14x11-apbastin-1058187085_2000x.jpg?v=1638491793,colorful-daydream14x11-apbastin-1058187085_2000x.jpg?v=1638491793,,,wildwings800,colorful-daydream14x11-apbastin-1058187085_2000x.jpg?v=1638491793
SUMMERTIME ART COLLECTION,F701530089,,"“In this nostalgic image Redlin revisits the sunny days of his youth. It was an innocent time when the most important thing in the world was to grab a pail and pole and hike out to the nearest fishing hole. The nearby bait shop offered ample refreshments for young appetites, including Langenfeld ice cream. The artist's wife was a member of the Langenfeld family, and the authentic sign is one of the personal touches we sometimes find in Redlin’s work.”

Artist proof edition of 2,490 signed and numbered prints. Image size, 18-1/2"" x 32"". Choose from 2 frame options. Also available; Encore II open edition (image size, 10-1/2"" x 18""; choose from 4 frame options). Museum Canvas unsigned, open edition (image size, 23"" x 39-1/2""; choose from 2 frame options). Open edition mini framed prints on linen. Choose from 2 frame options.",,,,,,,1,99,,,,,1,wildwings400,wildwings160,https://cdn.shopify.com/s/files/1/0165/1821/7782/products/framed-kids-fishing-summertime-art-print-by-terry-redlin-F701530089d_2000x.jpg?v=1623820168,framed-kids-fishing-summertime-art-print-by-terry-redlin-F701530089d_2000x.jpg?v=1623820168,,,wildwings800,framed-kids-fishing-summertime-art-print-by-terry-redlin-F701530089d_2000x.jpg?v=1623820168
PREPARED FOR THE SEASON ART COLLECTION,F701435089,,"We see that hunting and fishing activities have been a tradition with this farm family. Three deer racks decorate the barn wall. Beneath, the fishing boat and canoe patiently wait for spring. But today attention is on the opening of duck season. Equipment reclaimed from annual hibernation has been checked, cleaned and rechecked. The Dodge pickup is loaded with a homemade duck boat and wooden decoys. Two favorite shotguns stand guard at the cab door. Last minute plans are reviewed in the nearby shed. Then, as if to officially signal both the beginning of an annual ritual and the end of a truce, three mallards break the still air in a final flyby.

Open edition art print made from the original oil painting. Part of the Encore Prints Collection featuring smaller versions of previous Redlin limited edition print releases. Image size, 10-1/2"" x 18"". Choose from 7 framing options.",,,,,,,1,99,,,,,1,wildwings400,wildwings160,https://cdn.shopify.com/s/files/1/0165/1821/7782/products/prepared-for-the-season-by-terry-redlin-F701435089d_2000x.jpg?v=1623820193,prepared-for-the-season-by-terry-redlin-F701435089d_2000x.jpg?v=1623820193,,,wildwings800,prepared-for-the-season-by-terry-redlin-F701435089d_2000x.jpg?v=1623820193
CHICKADEES & LILACS ART COLLECTION,EGN1169OAK,,"“I was amazed at the subtle shades of blue and lavender found in a lilac bloom and as it turned out, those colors complemented the subdued chickadee colors of buff, grays, black and white.”

Open editions available in both the Great Northern Art Deluxe and Mini Print Collections. Deluxe print image size, 8"" x 10-1/4"". Mini print image size, 5"" x 7"". Also available; open edition wrapped canvas. Arrives ready to hang, this unframed canvas bears a clean, contemporary presentation. No frame needed because the image wraps around the edge of the canvas for a finished look. Size; 13""W x 18""H x 1-1/8""D. Oval, open edition framed canvas print. Framed size, 14""W x 11""H. PERSONALIZED open edition framed canvas print. Image size, 13-1/2"" x 17-1/2"". Click on title below for details. Published exclusively by Wild Wings.",,,,,,,1,99,,,,,1,wildwings400,wildwings160,https://cdn.shopify.com/s/files/1/0165/1821/7782/products/chickadees-and-lilacs-by-rosemary-millette-small-framed-art-print-EGN1169OAKd_49c43a18-cae5-4155-9b18-acfc3de8948c_2000x.jpg?v=1623818734,chickadees-and-lilacs-by-rosemary-millette-small-framed-art-print-EGN1169OAKd_49c43a18-cae5-4155-9b18-acfc3de8948c_2000x.jpg?v=1623818734,,,wildwings800,chickadees-and-lilacs-by-rosemary-millette-small-framed-art-print-EGN1169OAKd_49c43a18-cae5-4155-9b18-acfc3de8948c_2000x.jpg?v=1623818734
SUNNY AFTERNOON—DEER ART COLLECTION,F701539689,,"The deer have found an ideal location to spend a few peaceful hours. The exposed grass offers some protection from the wet snow, the warm sun is unobstructed, the river bottom is nearby and there is no sign of man's presence. They will rest for a while more, then move on in their continuing quest for browse.

Open edition art print made from the original oil painting. Part of the Horizons Collection of horizontal, open edition art prints, excerpted from previous Redlin print releases. Image size, 8-1/2"" x 27"". Choose from 5 framing options.",,,,,,,1,99,,,,,1,wildwings400,wildwings160,https://cdn.shopify.com/s/files/1/0165/1821/7782/products/sunny-afternoon-deer-framed-horizon-print-terry-redlin-F701539689_2000x.jpg?v=1623820169,sunny-afternoon-deer-framed-horizon-print-terry-redlin-F701539689_2000x.jpg?v=1623820169,,,wildwings800,sunny-afternoon-deer-framed-horizon-print-terry-redlin-F701539689_2000x.jpg?v=1623820169
SHORELINE NEIGHBORS ART COLLECTION,F701480289,,"“The human inhabitants who live in this location have taken special efforts to welcome the arriving wildlife. The gentle, meandering stream offers a natural haven for visiting waterfowl, but these two Canadian honkers have discovered an unusual and ideal nesting spot. Conservationists have placed a tightly rolled hay bale at water's edge. The bale was donated by a local farmer and was carefully spotted on the ice during the previous winter. As spring arrived and the ice melted, the bale dropped into its appointed place. Such innovative thinking is a beautiful example of how man and nature are working together to become good 'Shoreline Neighbors.'”

The limited edition of 29,500 signed and numbered prints has sold out. However, an artist proof edition of 2,950 signed and numbered art prints remains. Image size, 14"" x 24"". Also available; open edition mini art print on linen. Image size, 5-1/4"" x 9-1/4"". Only available framed.",,,,,,,1,99,,,,,1,wildwings400,wildwings160,https://cdn.shopify.com/s/files/1/0165/1821/7782/products/shoreline-neighbors-framed-print-terry-redlin-F701480289_2000x.jpg?v=1623820215,shoreline-neighbors-framed-print-terry-redlin-F701480289_2000x.jpg?v=1623820215,,,wildwings800,shoreline-neighbors-framed-print-terry-redlin-F701480289_2000x.jpg?v=1623820215
TALES WE TELL—CAMPING ART COLLECTION,F913758087,,"As a blanket of darkness covers the sky, the air around the camp is still, but the memories of the hunt cannot be contained. Warmed by the fire, the hunters stoke the flames with ample wood and tall tales. As this moment and these stories become etched in their minds, the true legacy of hunting unfolds. . . the memories!

Available in limited edition of 2,500 signed and numbered art prints or premier giclee canvas edition of 95 signed and numbered canvas prints. Paper print image size, 16"" x 29-1/2"". Canvas image size, 21"" x 38-1/2"". Published exclusively by Wild Wings.",,,,,,,1,99,,,,,1,wildwings400,wildwings160,https://cdn.shopify.com/s/files/1/0165/1821/7782/products/framed-camping-art-print-the-tales-we-tell-by-ron-van-gilder-F913758087d_2000x.jpg?v=1623819077,framed-camping-art-print-the-tales-we-tell-by-ron-van-gilder-F913758087d_2000x.jpg?v=1623819077,,,wildwings800,framed-camping-art-print-the-tales-we-tell-by-ron-van-gilder-F913758087d_2000x.jpg?v=1623819077
SNOWBALL SNACK ART COLLECTION,F083715098,,"“When you’re not quite old enough to care about ice fishing with the guys, you ‘carve out’ your own fun and, on a warm, slushy winter day, it doesn’t take long to completely soak your mittens, and need a spare pair from Dad. It also doesn’t take long to work up a thirst; any excuse to eat snow!”

Limited edition of 750 signed and numbered prints made from the original acrylic painting. Image size, 20"" x 16-1/2"". Framed size 31"" x 27-1/2"" with 2-1/2"" black-finished moulding. Double matting with midnight blue outer mat and brass nameplate. Published exclusively by Wild Wings.",,,,,,,1,99,,,,,1,wildwings400,wildwings160,https://cdn.shopify.com/s/files/1/0165/1821/7782/products/F083715098_2000x.jpg?v=1623818845,F083715098_2000x.jpg?v=1623818845,,,wildwings800,F083715098_2000x.jpg?v=1623818845
REBUILDING AMERICA—BALD EAGLE ART COLLECTION,F925620032,,"The tragedy in September, 2001 touched us all profoundly. This painting was inspired by the images of courage and patriotic pride I saw in the people who were either casualties or rescuers in the attacks, and all those who gave what they could in support and aid.

Limited edition of 2,001 signed and numbered prints. Image size, 18"" x 22-1/2"". A signature edition of prints is also available. Image size, 9-1/2"" x 12"". A Wild Wings exclusive.",,,,,,,1,99,,,,,1,wildwings400,wildwings160,https://cdn.shopify.com/s/files/1/0165/1821/7782/products/framed-bald-eagle-art-print-by-persis-clayton-weirs-F925620032d_2000x.jpg?v=1623819059,framed-bald-eagle-art-print-by-persis-clayton-weirs-F925620032d_2000x.jpg?v=1623819059,,,wildwings800,framed-bald-eagle-art-print-by-persis-clayton-weirs-F925620032d_2000x.jpg?v=1623819059
SUMMER SUNRISE ART COLLECTION,F925728789M,,"Applying a less is more approach, beautiful artwork is presented as the distinctive focal point in our Contempo Square Art Collection. Open edition print by Persis Clayton Weirs. Image size, 12""H x 12""W. Framed size, 24""H x 24""W with 2"" moulding and single white mat. Published by Wild Wings a division of Art Brand Studios, LLC.",,,,,,,1,99,,,,,1,wildwings400,wildwings160,https://cdn.shopify.com/s/files/1/0165/1821/7782/products/fd-summer-sunrise-12x12-mapleweirs-F925728789M_2000x.jpg?v=1638491773,fd-summer-sunrise-12x12-mapleweirs-F925728789M_2000x.jpg?v=1638491773,,,wildwings800,fd-summer-sunrise-12x12-mapleweirs-F925728789M_2000x.jpg?v=1638491773
SUMMER SUNRISE ART COLLECTION,F925728789M,,"Applying a less is more approach, beautiful artwork is presented as the distinctive focal point in our Contempo Square Art Collection. Open edition print by Persis Clayton Weirs. Image size, 12""H x 12""W. Framed size, 24""H x 24""W with 2"" moulding and single white mat. Published by Wild Wings a division of Art Brand Studios, LLC.",,,,,,,1,99,,,,,1,wildwings400,wildwings160,https://cdn.shopify.com/s/files/1/0165/1821/7782/products/fd-summer-sunrise-12x12-mapleweirs-F925728789M_2000x.jpg?v=1638491773,fd-summer-sunrise-12x12-mapleweirs-F925728789M_2000x.jpg?v=1638491773,,,wildwings800,fd-summer-sunrise-12x12-mapleweirs-F925728789M_2000x.jpg?v=1638491773
SPIRIT BEAR ART COLLECTION,F830755475,,"Kermode bears or 'spirit bears' are not albino, but rather a subspecies of the black bear. They have an advantage over their darker brothers when catching fish. Their lighter color is less visible from the perspective of the fish.

Premier giclee canvas edition of 50 signed and numbered canvas art prints made from the original oil painting. Image size, 36"" x 24"". Published exclusively by Wild Wings.",,,,,,,1,99,,,,,1,wildwings400,wildwings160,https://cdn.shopify.com/s/files/1/0165/1821/7782/products/framed-black-bears-wildlife-art-print-spirit-bear-by-scot-storm-F830755475d_11e7a8b0-46de-4f76-a837-ddba0dd49326_2000x.jpg?v=1623818834,framed-black-bears-wildlife-art-print-spirit-bear-by-scot-storm-F830755475d_11e7a8b0-46de-4f76-a837-ddba0dd49326_2000x.jpg?v=1623818834,,,wildwings800,framed-black-bears-wildlife-art-print-spirit-bear-by-scot-storm-F830755475d_11e7a8b0-46de-4f76-a837-ddba0dd49326_2000x.jpg?v=1623818834
SUMMER SUNRISE FRAMED PRINT,F925728789B,,"Applying a less is more approach, beautiful artwork is presented as the distinctive focal point in our Contempo Square Art Collection. Open edition print by Persis Clayton Weirs. Image size, 12""H x 12""W. Framed size, 24""H x 24""W with 2"" burl wood moulding and single white mat. Published by Wild Wings™ a division of Art Brand Studios, LLC.",,,,,,,1,99,,,,,1,wildwings400,wildwings160,https://cdn.shopify.com/s/files/1/0165/1821/7782/products/fd-summer-sunrise-12x12-burlweirs-F925728789B_2000x.jpg?v=1631179547,fd-summer-sunrise-12x12-burlweirs-F925728789B_2000x.jpg?v=1631179547,,,wildwings800,fd-summer-sunrise-12x12-burlweirs-F925728789B_2000x.jpg?v=1631179547
COUNTRY GARDEN—WREN ART COLLECTION,F085100047,,"“Each summer my garden comes to life in a riot of vivid colors, sweet fragrances and bird song. A house wren hunts among the petunias for insects to feed her hungry brood.”

Limited edition of 750 signed and numbered prints. Image size, 18"" x 14"". A Wild Wings exclusive.",,,,,,,1,99,,,,,1,wildwings400,wildwings160,https://cdn.shopify.com/s/files/1/0165/1821/7782/products/country-garden-wren-by-susan-bourdet-F085100047d_f14502cb-780b-498d-b0a4-1422b7fd3db3_2000x.jpg?v=1623818858,country-garden-wren-by-susan-bourdet-F085100047d_f14502cb-780b-498d-b0a4-1422b7fd3db3_2000x.jpg?v=1623818858,,,wildwings800,country-garden-wren-by-susan-bourdet-F085100047d_f14502cb-780b-498d-b0a4-1422b7fd3db3_2000x.jpg?v=1623818858
OLD MOSSY HORNS—DEER ART COLLECTION,F913505065,,"In the fall of 1958, Al Dawson missed a shot at the deer with whom he would begin a five-year game of hide and seek. The huge non-typical had a massive array of brow points and two long drop tines that reminded him of moss hanging from the rack, thus Dawson named the great buck, 'Old Mossy Horns. ' This game of cat and mouse was taking place in the Platte River bottoms near Shelton, Nebraska. A tough place to hunt, but a great place for a buck to hide. In 1962, Dawson's hope of taking the buck ran out. Late one afternoon, another hunter named Del Austin, saw a huge deer ghosting through the twilight. His arrow flew true, but until the downed deer was recovered next morning, he did not know for certain he had ended the five-year challenge. In the end, only persistence and luck would place the buck in the record books as the best non-typical whitetail by bow.

Pope & Young Non-Typical World Record, Score: 279-7/8. Limited edition of 9,500 signed and numbered prints. Image size, 15"" x 27"".",,,,,,,1,99,,,,,1,wildwings400,wildwings160,https://cdn.shopify.com/s/files/1/0165/1821/7782/products/framed-deer-art-print-old-mossy-horns-by-ron-van-gilder-F913505065d_2000x.jpg?v=1623819063,framed-deer-art-print-old-mossy-horns-by-ron-van-gilder-F913505065d_2000x.jpg?v=1623819063,,,wildwings800,framed-deer-art-print-old-mossy-horns-by-ron-van-gilder-F913505065d_2000x.jpg?v=1623819063
CORN ON THE CURB—KIDS ART COLLECTION,F083106098,,"“When a parade comes to town, your whole neighborhood is transformed into an outdoor party, and it’s fun to choose what to eat from the colorful, tempting assortment of food vendors. Grandpa says, ‘There’s nothing like biting into an ear of roasted, buttered sweet corn, but don’t waste time with napkins or eating in nice neat rows like your sister does!’”

Limited edition of 750 signed and numbered prints. Image size, 18-1/2"" x 16"". A Wild Wings exclusive.",,,,,,,1,99,,,,,1,wildwings400,wildwings160,https://cdn.shopify.com/s/files/1/0165/1821/7782/products/framed-corn-on-the-curb-kids-art-print-by-rollie-brandt-f083106098d_31040273-548d-4d16-be6c-9480a2c519a8_2000x.jpg?v=1623818863,framed-corn-on-the-curb-kids-art-print-by-rollie-brandt-f083106098d_31040273-548d-4d16-be6c-9480a2c519a8_2000x.jpg?v=1623818863,,,wildwings800,framed-corn-on-the-curb-kids-art-print-by-rollie-brandt-f083106098d_31040273-548d-4d16-be6c-9480a2c519a8_2000x.jpg?v=1623818863
WINTER PERCH—BALD EAGLE GNA MINI FRAMED PRINT,EMI7248732,,"""I have always had a love for bald eagles. We have a few that fly over our property and sometimes land atop some of our trees.""

Open edition. Great Northern Art Mini Framed Prints Collection. Image size, 7"" x 5"". Framed size 12-1/2"" x 10-1/2"" with 1-1/2"" light oak-finished moulding. Double matting with charcoal gray outer mat. A Wild Wings exclusive.",,,,,,,1,99,,,,,1,wildwings400,wildwings160,https://cdn.shopify.com/s/files/1/0165/1821/7782/products/bald-eagle-miniature-framed-art-print-winter-perch-by-jon-ren-EMI7248732d_29123ee1-1734-42d4-b4af-3ef0b597394c_2000x.jpg?v=1623819467,bald-eagle-miniature-framed-art-print-winter-perch-by-jon-ren-EMI7248732d_29123ee1-1734-42d4-b4af-3ef0b597394c_2000x.jpg?v=1623819467,,,wildwings800,bald-eagle-miniature-framed-art-print-winter-perch-by-jon-ren-EMI7248732d_29123ee1-1734-42d4-b4af-3ef0b597394c_2000x.jpg?v=1623819467
BALANCE ROCK—COUGAR GALLERY WRAPPED CANVAS,F476047173CGW,,"Our new and improved Gallery Wrapped Canvases are printed with more vibrant inks on a premium canvas substrate. The canvas is wrapped around thicker, 1-1/2"" stretcher bar and finished with a splined back for an elegant look and feel.

Showcasing our art in a beautiful full-wrap frameless presentation, each premier cotton canvas piece is printed with UV cured inks and hand stretched over a deep 1-1/2"" kiln dried wood stretcher bar. Ready to hang individually or as an ensemble, there's no wonder why this versatile art format is a customer favorite. 24""H x 36""W",,,,,,,1,99,,,,,1,wildwings400,wildwings160,https://cdn.shopify.com/s/files/1/0165/1821/7782/products/balance-rock-cougarwc7kromschroeder-F476047173CGW_6282592c-7cbd-40eb-b8a2-5199baa4f852_2000x.jpg?v=1623819813,balance-rock-cougarwc7kromschroeder-F476047173CGW_6282592c-7cbd-40eb-b8a2-5199baa4f852_2000x.jpg?v=1623819813,,,wildwings800,balance-rock-cougarwc7kromschroeder-F476047173CGW_6282592c-7cbd-40eb-b8a2-5199baa4f852_2000x.jpg?v=1623819813
COMPANY OF WOLVES—PART 2 ART COLLECTION,1403125571,,Limited edition of 100 signed and numbered art prints and 100 signed and numbered canvas prints by Guy Hobbs. Published exclusively by Wild Wings.,,,,,,,1,99,,,,,1,wildwings400,wildwings160,https://cdn.shopify.com/s/files/1/0165/1821/7782/products/fd-company-of-wolves-part-2hobbs-F403125571_ee3d04a7-0723-4a9d-9f25-d2636f2f1e3e_2000x.jpg?v=1623820125,fd-company-of-wolves-part-2hobbs-F403125571_ee3d04a7-0723-4a9d-9f25-d2636f2f1e3e_2000x.jpg?v=1623820125,,,wildwings800,fd-company-of-wolves-part-2hobbs-F403125571_ee3d04a7-0723-4a9d-9f25-d2636f2f1e3e_2000x.jpg?v=1623820125
OVER THE BLOWDOWN ART COLLECTION,F701410589,,"“During high water years shoreline trees often succumb to the undercutting of waves. This blowdown position makes an interesting composition as the trees, like the geese, strain into the wind.”

Open edition art print made from the original oil painting. From the Encore Collection which features smaller image sizes than previous Redlin limited edition print releases. Image size, 8-3/4"" x 14"".",,,,,,,1,99,,,,,1,wildwings400,wildwings160,https://cdn.shopify.com/s/files/1/0165/1821/7782/products/over-the-blowdown-by-terry-redlin-F701410589d_2000x.jpg?v=1623820184,over-the-blowdown-by-terry-redlin-F701410589d_2000x.jpg?v=1623820184,,,wildwings800,over-the-blowdown-by-terry-redlin-F701410589d_2000x.jpg?v=1623820184
NIBBLE & JIG—ICE FISHING ART COLLECTION,EPR0835098,,"“For a 7-year-old boy who loves to fish, it's hard to beat a day out on the ice with Dad. Sandwiches and hot cocoa from Mom taste extra good outside on a brisk sunny winter day! Hey, maybe Mom will fry up our catch for supper!”

Open edition from the Great Northern Art Premium Framed Prints Collection. Image size, 17"" x 23"". Choose from two framing options, regular premium framing or premium plus framing. A Wild Wings exclusive. Great Northern Art images may be available in various print lines.",,,,,,,1,99,,,,,1,wildwings400,wildwings160,https://cdn.shopify.com/s/files/1/0165/1821/7782/products/framed-boy-ice-fishing-art-print-by-rollie-brandt-EPR0835098d_ed0fd184-4eaf-4f4f-9881-c17049782763_2000x.jpg?v=1623818775,framed-boy-ice-fishing-art-print-by-rollie-brandt-EPR0835098d_ed0fd184-4eaf-4f4f-9881-c17049782763_2000x.jpg?v=1623818775,,,wildwings800,framed-boy-ice-fishing-art-print-by-rollie-brandt-EPR0835098d_ed0fd184-4eaf-4f4f-9881-c17049782763_2000x.jpg?v=1623818775
